record id,save datetime,author list,journal,title,abstract,pmid,doi,url,version,epost date,publish date,dateaffiliations list,all affiliations,pdf url,article_source,record change number,match result,match id
114,8/8/2022,Jamin Liu;Kristeene A Knopp;Elze Rackaityte;Chung Yu Wang;Matthew T Laurie;Sara Sunshine;Andreas S Puschnik;Joseph L DeRisi,mBio,Genome-Wide Knockout Screen Identifies Human Sialomucin CD164 as an Essential Entry Factor for Lymphocytic Choriomeningitis Virus,"Lymphocytic choriomeningitis virus (LCMV) is a well-studied mammarenavirus that can be fatal in congenital infections. However, our understanding of LCMV and its interactions with human host factors remains incomplete. Here, host determinants affecting LCMV infection were investigated through a genome-wide CRISPR knockout screen in A549 cells, a human lung adenocarcinoma line. We identified and validated a variety of novel host factors that play a functional role in LCMV infection. Among these, knockout of the sialomucin CD164, a heavily glycosylated transmembrane protein, was found to ablate infection with multiple LCMV strains but not other hemorrhagic mammarenaviruses in several cell types. Further characterization revealed a dependency of LCMV entry on the cysteine-rich domain of CD164, including an N-linked glycosylation site at residue 104 in that region. Given the documented role of LCMV with respect to transplacental human infections, CD164 expression was investigated in human placental tissue and placental cell lines. CD164 was found to be highly expressed in the cytotrophoblast cells, an initial contact site for pathogens within the placenta, and LCMV infection in placental cells was effectively blocked using a monoclonal antibody specific to the cysteine-rich domain of CD164. Together, this study identifies novel factors associated with LCMV infection of human tissues and highlights the importance of CD164, a sialomucin that previously had not been associated with viral infection. IMPORTANCE Lymphocytic choriomeningitis virus (LCMV) is a human-pathogenic mammarenavirus that can be fatal in congenital infections. Although frequently used in the study of persistent infections in the field of immunology, aspects of this virus's life cycle remain incomplete. For example, while viral entry has been shown to depend on a cell adhesion molecule, DAG1, genetic knockout of this gene allows for residual viral infection, implying that additional receptors can mediate cell entry. The significance of our study is the identification of host factors important for successful infection, including the sialomucin CD164, which had not been previously associated with viral infection. We demonstrated that CD164 is essential for LCMV entry into human cells and can serve as a possible therapeutic target for treatment of congenital infection.              Keywords:                    CD164; CRISPR screen; lymphocytic choriomeningitis virus; viral entry.",35502904,10.1128/mbio.00205-22.,http://www.ncbi.nlm.nih.gov/pmc/articles/pmc9239079/,,5/3/2022,6/28/2022,,,,2022 Jun 28;13(3):e0020522.,0,,
115,8/8/2022,"Mohamed Ameen, Laksshman Sundaram, Abhimanyu Banerjee, Mengcheng Shen, Soumya Kundu, Surag Nair, Anna Shcherbina, Mingxia Gu, Kitchener D. Wilson, Avyay Varadarajan, Nirmal Vadgama, Akshay Balsubramani, Joseph C. Wu, Jesse Engreitz, Kyle Farh, Ioannis Karakikes, Kevin C Wang, Thomas Quertermous, William Greenleaf, Anshul Kundaje",biorxiv,Integrative single-cell analysis of cardiogenesis identifies developmental trajectories and non-coding mutations in congenital heart disease,"SummaryCongenital heart defects, the most common birth disorders, are the clinical manifestation of anomalies in fetal heart development - a complex process involving dynamic spatiotemporal coordination among various precursor cell lineages. This complexity underlies the incomplete understanding of the genetic architecture of congenital heart diseases (CHDs). To define the multi-cellular epigenomic and transcriptional landscape of cardiac cellular development, we generated single-cell chromatin accessibility maps of human fetal heart tissues. We identified eight major differentiation trajectories involving primary cardiac cell types, each associated with dynamic transcription factor (TF) activity signatures. We identified similarities and differences of regulatory landscapes of iPSC-derived cardiac cell types and their in vivo counterparts. We interpreted deep learning models that predict cell-type resolved, base-resolution chromatin accessibility profiles from DNA sequence to decipher underlying TF motif lexicons and infer the regulatory impact of non-coding variants. De novo mutations predicted to affect chromatin accessibility in arterial endothelium were enriched in CHD cases versus controls. We used CRISPR-based perturbations to validate an enhancer harboring a nominated regulatory CHD mutation, linking it to effects on the expression of a known CHD gene JARID2. Together, this work defines the cell-type resolved cis-regulatory sequence determinants of heart development and identifies disruption of cell type-specific regulatory elements as a component of the genetic etiology of CHD.",,10.1101/2022.06.29.498132,http://www.biorxiv.org/content/10.1101/2022.06.29.498132v1,2022.06.29.498132,6/29/2022,,,"Department of Cancer Biology, Stanford University; Department of Computer Science, Stanford University; Department of Physics, Stanford University; Cardiovascular Institute, Stanford University; Department of Computer Science, Stanford University; Department of Computer Science, Stanford University; Department of Biomedical Informatics, Stanford University; Center for Stem Cell and Organoid Medicine, CuSTOM, Division of Developmental Biology, Cincinnati Children’s Hospital Medical Center; Cardiovascular Institute, Stanford University; Department of Computer science, California Institute of Technology; Department of Cardiothoracic Surgery, Stanford University; Department of Genetics, Stanford University; Cardiovascular Institute, Stanford University; Department of Genetics, Stanford University; Illumina Artificial Intelligence Laboratory, Illumina Inc; Department of Cardiothoracic Surgery, Stanford University; Department of Cancer Biology, Stanford University; Department of Dermatology, Stanford University School of Medicine; Division of Cardiovascular Medicine, Stanford University School of Medicine; Department of Genetics, Stanford University; Department of Applied Physics, Stanford University; Department of Computer Science, Stanford University; Department of Genetics, Stanford University",,,0,,
116,8/8/2022,"Ella T. Sieradzki, Alex Greenlon, Alexa M. Nicolas, Mary K. Firestone, Jennifer Pett-Ridge, Steven J. Blazewicz, Jillian F. Banfield",biorxiv,Functional succession of actively growing soil microorganisms during rewetting is shaped by precipitation history,"Background Rewetting of seasonally dry soils induces a burst of microbial activity and carbon mineralization that changes nutrient availability and leads to taxonomic succession. Yet the microbial functions that underpin succession are not well described. Further, how previous precipitation regimes frame microbial functional capacities after rewetting and the length of time that these effects persist remain unknown. To address these questions, we performed rewetting of seasonally dry grassland soil that experienced either mean annual or reduced precipitation during the growing season using isotopically labeled water, and sampled at five time points. We used quantitative stable isotope probing (qSIP)-informed genome-resolved metagenomics to identify actively growing bacteria and archaea, to predict their traits and analyze how these traits differ over time and between precipitation treatments.Results We reconstructed 503 genomes representing bacteria and archaea from 11 phyla and 23 classes, of which 77 were from active organisms (15% of organisms). Actively growing organisms at any time point and in any treatment were primarily Actinobacteria, Alphaproteobacteria and Gammaproteobacteria. Growing organisms were significantly more abundant than non-growing organisms prior to the wet-up, suggesting that the traits that initiate succession are pre-defined at the end of the growing season or by survival over the dry season. Fast growing organisms had a relatively low number of carbohydrate active enzymes per genome compared to slower growing organisms. This suggests that although they are capable of degrading complex C sources such as plant material, they do not specialize in this process. Differential abundance of carbohydrate active enzymes in growing organisms throughout the succession implies variation in substrates over time. However, nitrogen cycling pathways differed between precipitation treatments, but in growing organisms there was no change in the abundance of genes involved over time following wetup. Comparison of gene inventories prior to wet-up revealed that many genes were significantly differentially abundant between the precipitation treatments. Surprisingly, this legacy effect waned after just one week, indicating that microbial community functions likely converge early in the growing season.Conclusions Use of isotopic labeling of genomes of soil microorganisms during the first week after wetup revealed differences in the abundance and functional traits of actively growing organisms under two precipitation regimes. Although the legacy effect due to different rainfall inputs was short lived, it is important, given the extent of soil organic matter breakdown that occurs immediately after the first rain event in Mediterranean climates. Changes in the potential to degrade complex organic matter during the succession imply that the current paradigm that succession relies solely on labile carbon sources needs to be revisited.",,10.1101/2022.06.28.498032,http://www.biorxiv.org/content/10.1101/2022.06.28.498032v1,2022.06.28.498032,6/29/2022,,,"University of California Berkeley, Department of Environmental Science, Policy and Management; University of California Berkeley, Department of Environmental Science, Policy and Management; University of California Berkeley, Department of plant and microbial biology; University of California Berkeley, Department of Environmental Science, Policy and Management; Physical and Life Sciences Directorate, Lawrence Livermore National Laboratory, Livermore; Life & Environmental Sciences Department, University of California Merced; Physical and Life Sciences Directorate, Lawrence Livermore National Laboratory, Livermore; University of California Berkeley, Department of Environmental Science, Policy and Management; Department of Earth and Planetary Science, University of California; Earth Sciences Division, Lawrence Berkeley National Laboratory; Chan Zuckerberg Biohub, San Francisco",,,0,,
117,8/8/2022,"Vladimir Kesler, Kaiyu Fu, Yihang Chen, Chan Ho Park, Michael Eisenstein, Boris Murmann, H. Tom Soh",biorxiv,Tailoring electrode surface charge to achieve discrimination and quantification of chemically similar small molecules with electrochemical aptamers,"Electrochemical biosensors based on structure-switching aptamers offer many advantages because they can operate directly in complex samples and offer the potential to integrate with miniaturized electronics. Unfortunately, these biosensors often suffer from cross-reactivity problems when measuring a target in samples containing other chemically similar molecules, such as precursors or metabolites. While some progress has been made in selecting highly specific aptamers, the discovery of these reagents remains slow and costly. In this work, we demonstrate a novel strategy to distinguish molecules with miniscule difference in chemical composition (such as a single hydroxyl group) – with cross reactive aptamer probes - by tuning the charge state of the surface on which the aptamer probes are immobilized. As an exemplar, we show that our strategy can distinguish between DOX and many structurally similar analytes, including its primary metabolite doxorubicinol (DOXol). We then demonstrate the ability to accurately quantify mixtures of these two molecules based on their differential response to sensors with different surface-charge properties. We believe this methodology is general and can be extended to a broad range of applications.",,10.1101/2022.06.25.497619,http://www.biorxiv.org/content/10.1101/2022.06.25.497619v1,2022.06.25.497619,6/29/2022,,,"Department of Electrical Engineering, Stanford University; Department of Radiology, Stanford University; Department of Electrical Engineering, Stanford University; Department of Radiology, Stanford University; Department of Materials Science and Engineering, Stanford University; Department of Electrical Engineering, Stanford University; Department of Radiology, Stanford University; Department of Electrical Engineering, Stanford University; Department of Electrical Engineering, Stanford University; Department of Radiology, Stanford University; Chan Zuckerberg Biohub",,,0,,
118,8/8/2022,Leslie Magtanong;Grace D Mueller;Kevin J Williams;Maximilian Billmann;Katherine Chan;David A Armenta;Jason Moffat;Charles Boone;Chad L Myers;James A Olzmann;Steven J Bensinger;Scott J Dixon,Cell Chem Biol,Context-dependent regulation of ferroptosis sensitivity,"Ferroptosis is an important mediator of pathophysiological cell death and an emerging target for cancer therapy. Whether ferroptosis sensitivity is governed by a single regulatory mechanism is unclear. Here, based on the integration of 24 published chemical genetic screens combined with targeted follow-up experimentation, we find that the genetic regulation of ferroptosis sensitivity is highly variable and context-dependent. For example, the lipid metabolic gene acyl-coenzyme A (CoA) synthetase long chain family member 4 (ACSL4) appears far more essential for ferroptosis triggered by direct inhibition of the lipid hydroperoxidase glutathione peroxidase 4 (GPX4) than by cystine deprivation. Despite this, distinct pro-ferroptotic stimuli converge upon a common lethal effector mechanism: accumulation of lipid peroxides at the plasma membrane. These results indicate that distinct genetic mechanisms regulate ferroptosis sensitivity, with implications for the initiation and analysis of this process in vivo.              Keywords:                    ACSL4; PUFA; ROS; cancer; ether lipid; ferroptosis; iron.",35809566,10.1016/j.chembiol.2022.06.004.,https://doi.org/10.1016/j.chembiol.2022.06.004,,,6/29/2022,,,,2022 Jun 29;S2451-9456(22)00236-7.,0,,
119,8/8/2022,"Zhiying Zhu, Weixin Liang, James Zou",arxiv,GSCLIP : A Framework for Explaining Distribution Shifts in Natural Language,"Helping end users comprehend the abstract distribution shifts can greatlyfacilitate AI deployment. Motivated by this, we propose a novel task, datasetexplanation. Given two image data sets, dataset explanation aims toautomatically point out their dataset-level distribution shifts with naturallanguage. Current techniques for monitoring distribution shifts provideinadequate information to understand datasets with the goal of improving dataquality. Therefore, we introduce GSCLIP, a training-free framework to solve thedataset explanation task. In GSCLIP, we propose the selector as the firstquantitative evaluation method to identify explanations that are proper tosummarize dataset shifts. Furthermore, we leverage this selector to demonstratethe superiority of a generator based on language model generation. Systematicevaluation on natural data shift verifies that GSCLIP, a combined system of ahybrid generator group and an efficient selector is not only easy-to-use butalso powerful for dataset explanation at scale.",,10.48550/arXiv.2206.15007,https://arxiv.org/abs/2206.15007,arXiv:2206.15007v1,6/30/2022,,,,https://arxiv.org/pdf/2206.15007,,0,,
120,8/8/2022,David Flood;Pascal Geldsetzer;Kokou Agoudavi;Krishna K Aryal;Luisa Campos Caldeira Brant;Garry Brian;Maria Dorobantu;Farshad Farzadfar;Oana Gheorghe-Fronea;Mongal Singh Gurung;David Guwatudde;Corine Houehanou;Jutta M Adelin Jorgensen;Dimple Kondal;Demetre Labadarios;Maja E Marcus;Mary Mayige;Mana Moghimi;Bolormaa Norov;Gastón Perman;Sarah Quesnel-Crooks;Mohammad-Mahdi Rashidi;Sahar Saeedi Moghaddam;Jacqueline A Seiglie;Silver K Bahendeka Karaireho;Eric Steinbrook;Michaela Theilmann;Lisa J Ware;Sebastian Vollmer;Rifat Atun;Justine I Davies;Mohammed K Ali;Peter Rohloff;Jennifer Manne-Goehler,Diabetes Care,Rural-Urban Differences in Diabetes Care and Control in 42 Low- and Middle-Income Countries: A Cross-sectional Study of Nationally Representative Individual-Level Data,"Objective:                    Diabetes prevalence is increasing rapidly in rural areas of low- and middle-income countries (LMICs), but there are limited data on the performance of health systems in delivering equitable and effective care to rural populations. We therefore assessed rural-urban differences in diabetes care and control in LMICs.              Research design and methods:                    We pooled individual-level data from nationally representative health surveys in 42 countries. We used Poisson regression models to estimate age-adjusted differences in the proportion of individuals with diabetes in rural versus urban areas achieving performance measures for the diagnosis, treatment, and control of diabetes and associated cardiovascular risk factors. We examined differences across the pooled sample, by sex, and by country.              Results:                    The pooled sample from 42 countries included 840,110 individuals (35,404 with diabetes). Compared with urban populations with diabetes, rural populations had ∼15-30% lower relative risk of achieving performance measures for diabetes diagnosis and treatment. Rural populations with diagnosed diabetes had a 14% (95% CI 5-22%) lower relative risk of glycemic control, 6% (95% CI -5 to 16%) lower relative risk of blood pressure control, and 23% (95% CI 2-39%) lower relative risk of cholesterol control. Rural women with diabetes had lower achievement of performance measures relating to control than urban women, whereas among men, differences were small.              Conclusions:                    Rural populations with diabetes experience substantial inequities in the achievement of diabetes performance measures in LMICs. Programs and policies aiming to strengthen global diabetes care must consider the unique challenges experienced by rural populations.",35771765,10.2337/dc21-2342.,https://doi.org/10.2337/dc21-2342,,,6/30/2022,,,,2022 Jun 30;dc212342.,0,,
121,8/8/2022,"Matthew P. Swaffer, Georgi K. Marinov, Huan Zheng, Crystal Yee Tsui, Andrew W. Jones, Jessica Greenwood, Anshul Kundaje, William J. Greenleaf, Rodrigo Reyes-Lamothe, Jan M. Skotheim",biorxiv,RNA polymerase II dynamics and mRNA stability feedback scale mRNA in proportion to cell size,"A fundamental feature of cellular growth is that protein and RNA amounts scale with cell size so that concentrations remain constant. A key component to this is that global transcription rates increase in larger cells, but the underlying mechanism has remained unknown. Here, we identify RNAPII as the major limiting factor increasing transcription with cell size in budding yeast as transcription is highly sensitive to the dosage of RNAPII but not to other components of the general transcriptional machinery. Our experiments support a dynamic equilibrium model where global transcription at a given size is set by the mass-action recruitment kinetics of unengaged nucleoplasmic RNAPII, and DNA content. This drives a sub-linear increase in transcription with size, which is precisely compensated for by a decrease in mRNA decay rates as cells enlarge. Thus, limiting RNAPII and feedback on mRNA stability work in concert to ensure mRNA concentration homeostasis in growing cells.",,10.1101/2021.09.20.461005,http://www.biorxiv.org/content/10.1101/2021.09.20.461005v2,2021.09.20.461005,7/1/2022,,,"Department of Biology, Stanford University; Department of Genetics, Stanford University; Department of Biology, McGill University; Department of Biology, Stanford University; The Francis Crick Institute; The Francis Crick Institute; Department of Genetics, Stanford University; Department of Genetics, Stanford University; Department of Biology, McGill University; Department of Biology, Stanford University; Chan Zuckerberg Biohub",,,0,,
122,8/8/2022,Paige E Solomon;Lisa L Kirkemo;Gary M Wilson;Kevin K Leung;Mark H Almond;Leanne C Sayles;E Alejandro Sweet-Cordero;Oren S Rosenberg;Joshua J Coon;James A Wells,Mol Cell Proteomics,Discovery Proteomics Analysis Determines That Driver Oncogenes Suppress Antiviral Defense Pathways Through Reduction in Interferon-β Autocrine Stimulation,"Since the discovery of oncogenes, there has been tremendous interest to understand their mechanistic basis and to develop broadly actionable therapeutics. Some of the most frequently activated oncogenes driving diverse cancers are c-MYC, EGFR, HER2, AKT, KRAS, BRAF, and MEK. Using a reductionist approach, we explored how cellular proteomes are remodeled in isogenic cell lines engineered with or without these driver oncogenes. The most striking discovery for all oncogenic models was the systematic downregulation of scores of antiviral proteins regulated by type 1 interferon. These findings extended to cancer cell lines and patient-derived xenograft models of highly refractory pancreatic cancer and osteosarcoma driven by KRAS and MYC oncogenes. The oncogenes reduced basal expression of and autocrine stimulation by type 1 interferon causing remarkable convergence on common phenotypic and functional profiles. In particular, there was dramatically lower expression of dsRNA sensors including DDX58 (RIG-I) and OAS proteins, which resulted in attenuated functional responses when the oncogenic cells were treated with the dsRNA mimetic, polyI:C, and increased susceptibility to infection with an RNA virus shown using SARS-CoV-2. Our reductionist approach provides molecular and functional insights connected to immune evasion hallmarks in cancers and suggests therapeutic opportunities.              Keywords:                    AKT; BRAF; EGFR; HER2; KRAS; MEK; MYC; double-stranded RNA; interferon; oncogenes.",35594991,10.1016/j.mcpro.2022.100247.,http://www.ncbi.nlm.nih.gov/pmc/articles/pmc9212846/,,5/18/2022,Jul-22,,,,2022 Jul;21(7):100247.,0,,
123,8/8/2022,Melanie I Worley;Nicholas J Everetts;Riku Yasutomi;Rebecca J Chang;Shrey Saretha;Nir Yosef;Iswar K Hariharan,Curr Biol,Ets21C sustains a pro-regenerative transcriptional program in blastema cells of Drosophila imaginal discs,"An important unanswered question in regenerative biology is to what extent regeneration is accomplished by the reactivation of gene regulatory networks used during development versus the activation of regeneration-specific transcriptional programs. Following damage, Drosophila imaginal discs, the larval precursors of adult structures, can regenerate missing portions by localized proliferation of damage-adjacent tissue. Using single-cell transcriptomics in regenerating wing discs, we have obtained a comprehensive view of the transcriptome of regenerating discs and identified two regeneration-specific cell populations within the blastema, Blastema1 and Blastema2. Collectively, these cells upregulate multiple genes encoding secreted proteins that promote regeneration including Pvf1, upd3, asperous, Mmp1, and the maturation delaying factor Ilp8. Expression of the transcription factor Ets21C is restricted to this regenerative secretory zone; it is not expressed in undamaged discs. Ets21C expression is activated by the JNK/AP-1 pathway, and it can function in a type 1 coherent feedforward loop with AP-1 to sustain expression of downstream genes. Without Ets21C function, the blastema cells fail to maintain the expression of a number of genes, which leads to premature differentiation and severely compromised regeneration. As Ets21C is dispensable for normal development, these observations indicate that Ets21C orchestrates a regeneration-specific gene regulatory network. We have also identified cells resembling both Blastema1 and Blastema2 in scribble tumorous discs. They express the Ets21C-dependent gene regulatory network, and eliminating Ets21C function reduces tumorous growth. Thus, mechanisms that function during regeneration can be co-opted by tumors to promote aberrant growth.              Keywords:                    Ets; Ets21C; blastema; gene regulatory network; imaginal disc; regeneration; scRNA-seq; tissue damage; transcription factor; tumors.",35820420,10.1016/j.cub.2022.06.040.,https://doi.org/10.1016/j.cub.2022.06.040,,,7/1/2022,,,,2022 Jul 1;S0960-9822(22)01002-8.,0,,
