record id,save datetime,author list,journal,title,abstract,pmid,doi,url,version,epost date,publish date,dateaffiliations list,all affiliations,pdf url,article_source,record change number,match result,match id
66,8/8/2022,"Cara E. Brook, Yimei Li, Christina Yek, Graham R. Northrup, Sreyngim Lay, Sophana Chea, Vida Ahyong, Daniel M. Parker, Somnang Man, Andrea R. Pacheco, Oum Mengheng, Fabiano Oliveira, Liz Fahsbender, Rithea Leang, Rekol Huy, Chea Huch, Chanthap Lon, Cristina M. Tato, Joseph L. DeRisi, Michael Boots, Jennifer A. Bohl, Jessica E. Manning",medrxiv,The Perfect Storm of 2019: An immunological and phylodynamic analysis of Cambodia’s unprecedented dengue outbreak,"The year 2019 witnessed the highest number of dengue cases ever reported globally. We analyzed epidemiological, serological, and phylogenomic data to investigate the drivers of the 2019 epidemic in Cambodia. Using epidemiological models fit to a 19-year national dataset, we identified an overall trend of declining annual force of infection (FOI) for dengue virus (DENV) in Cambodia, interspersed with FOI spikes corresponding to epidemic year caseloads that exceeded demographic predictions. We constructed time-resolved phylogenetic trees with 105 DENV genomes sequenced from the 2019 Cambodian epidemic, paired with historical Southeast Asian data, to document the first-recorded introduction of DENV-2 Cosmopolitan genotype into Cambodia. This introduction yielded highly localized transmission and decreased genomic diversity when compared to endemic DENV-1, supporting the hypothesis of epidemic invasion. Introduction of this genetically distinct lineage into a population with limited prior immunity—paired with a spike in FOI—was a key driver of the 2019 Cambodian epidemic.These studies were registered at clinicaltrials.gov under NCT04034264 and NCT03534245.",,10.1101/2022.06.08.22276171,http://medrxiv.org/content/early/2022/06/09/2022.06.08.22276171,2022.06.08.22276171,6/9/2022,,,"Department of Ecology and Evolution, University of Chicago; Department of Ecology and Evolution, University of Chicago; Laboratory of Malaria and Vector Research, National Institute of Allergy and Infectious Diseases, National Institutes of Health; Center for Computational Biology, University of California; International Center of Excellence in Research, National Institute of Allergy and Infectious Diseases, National Institutes of Health; National Center for Parasitology, Entomology, and Malaria Control; International Center of Excellence in Research, National Institute of Allergy and Infectious Diseases, National Institutes of Health; National Center for Parasitology, Entomology, and Malaria Control; Chan Zuckerberg Biohub; Department of Population Health and Disease Prevention, University of California; International Center of Excellence in Research, National Institute of Allergy and Infectious Diseases, National Institutes of Health; National Center for Parasitology, Entomology, and Malaria Control; International Center of Excellence in Research, National Institute of Allergy and Infectious Diseases, National Institutes of Health; International Center of Excellence in Research, National Institute of Allergy and Infectious Diseases, National Institutes of Health; National Center for Parasitology, Entomology, and Malaria Control; Laboratory of Malaria and Vector Research, National Institute of Allergy and Infectious Diseases, National Institutes of Health; Chan Zuckerberg Initiative; National Center for Parasitology, Entomology, and Malaria Control; National Center for Parasitology, Entomology, and Malaria Control; National Center for Parasitology, Entomology, and Malaria Control; International Center of Excellence in Research, National Institute of Allergy and Infectious Diseases, National Institutes of Health; National Center for Parasitology, Entomology, and Malaria Control; Chan Zuckerberg Biohub; Chan Zuckerberg Biohub; Integrative Biology, University of California; Laboratory of Malaria and Vector Research, National Institute of Allergy and Infectious Diseases, National Institutes of Health; Laboratory of Malaria and Vector Research, National Institute of Allergy and Infectious Diseases, National Institutes of Health; International Center of Excellence in Research, National Institute of Allergy and Infectious Diseases, National Institutes of Health",,,0,,
67,8/8/2022,Thi D Nguyen;Melissa E Truong;Jeremy F Reiter,Front Cell Dev Biol,The Intimate Connection Between Lipids and Hedgehog Signaling,"Hedgehog (HH) signaling is an intercellular communication pathway involved in directing the development and homeostasis of metazoans. HH signaling depends on lipids that covalently modify HH proteins and participate in signal transduction downstream. In many animals, the HH pathway requires the primary cilium, an organelle with a specialized protein and lipid composition. Here, we review the intimate connection between HH signaling and lipids. We highlight how lipids in the primary cilium can create a specialized microenvironment to facilitate signaling, and how HH and components of the HH signal transduction pathway use lipids to communicate between cells.              Keywords:                    cholesterolyation; cilia; development; intercellular signaling; sterols.",35757007,10.3389/fcell.2022.876815.,http://www.ncbi.nlm.nih.gov/pmc/articles/pmc9222137/,,2022,6/9/2022,,,,2022 Jun 9;10:876815.,0,,
68,8/8/2022,"Christina L. Hueschen, Li-av Segev Zarko, Jian-Hua Chen, Mark A. LeGros, Carolyn A. Larabell, John C. Boothroyd, Rob Phillips, Alexander R. Dunn",biorxiv,Emergent Actin Flows Explain Diverse Parasite Gliding Modes,"SummaryDuring host infection, single-celled apicomplexan parasites like Plasmodium and Toxoplasma use a motility mechanism called gliding, which differs fundamentally from other known mechanisms of eukaryotic cell motility. Gliding is thought to be powered by a thin layer of flowing filamentous (F)-actin1– 3 sandwiched between the plasma membrane and a myosin-coated4,5 inner membrane complex. How this surface actin layer drives the diverse apicomplexan gliding modes observed experimentally - helical, circular, and twirling6,7, and patch8, pendulum9, or rolling2 – presents a rich biophysical puzzle. Here, we use single-molecule imaging to track individual actin filaments and myosin complexes in live Toxoplasma gondii. Based on these data, we hypothesize that F-actin flows arise by self-organization, rather than following a microtubule-based template as previously believed. We develop a continuum model of emergent F-actin flow within the unusual confines provided by parasite geometry. In the presence of F-actin turnover, our model predicts the emergence of a steady-state mode in which actin transport is largely rearward. Removing actin turnover leads to actin patches that recirculate up and down the cell, a “cyclosis” that we observe experimentally for drug-stabilized actin bundles in live parasites. These findings provide a mechanism by which actin turnover governs a transition between distinct self-organized F-actin states, whose properties can account for the diverse gliding modes known to occur. More broadly, we illustrate how different forms of gliding motility can emerge as an intrinsic consequence of the self-organizing properties of F-actin flow in a confined geometry.",,10.1101/2022.06.08.495399,http://www.biorxiv.org/content/10.1101/2022.06.08.495399v1,2022.06.08.495399,6/9/2022,,,"Dept. of Chemical Engineering, Stanford University; Dept. of Microbiology and Immunology, Stanford University; Dept. of Anatomy, University of California San Francisco; National Center for X-ray Tomography, Lawrence Berkeley National Laboratory; Dept. of Anatomy, University of California San Francisco; National Center for X-ray Tomography, Lawrence Berkeley National Laboratory; Molecular Biophysics and Integrated Bioimaging Division, Lawrence Berkeley National Laboratory; Dept. of Anatomy, University of California San Francisco; National Center for X-ray Tomography, Lawrence Berkeley National Laboratory; Molecular Biophysics and Integrated Bioimaging Division, Lawrence Berkeley National Laboratory; Dept. of Microbiology and Immunology, Stanford University; Dept. of Physics, California Institute of Technology; Div. of Biology and Biological Engineering, California Institute of Technology; Dept. of Chemical Engineering, Stanford University",,,0,,
69,8/8/2022,Matthew R Olm#;Dylan Dahan#;Matthew M Carter;Bryan D Merrill;Feiqiao B Yu;Sunit Jain;Xiandong Meng;Surya Tripathi;Hannah Wastyk;Norma Neff;Susan Holmes;Erica D Sonnenburg;Aashish R Jha;Justin L Sonnenburg,Science,Robust variation in infant gut microbiome assembly across a spectrum of lifestyles,"Infant microbiome assembly has been intensely studied in infants from industrialized nations, but little is known about this process in nonindustrialized populations. We deeply sequenced infant stool samples from the Hadza hunter-gatherers of Tanzania and analyzed them in a global meta-analysis. Infant microbiomes develop along lifestyle-associated trajectories, with more than 20% of genomes detected in the Hadza infant gut representing novel species. Industrialized infants-even those who are breastfed-have microbiomes characterized by a paucity of Bifidobacterium infantis and gene cassettes involved in human milk utilization. Strains within lifestyle-associated taxonomic groups are shared between mother-infant dyads, consistent with early life inheritance of lifestyle-shaped microbiomes. The population-specific differences in infant microbiome composition and function underscore the importance of studying microbiomes from people outside of wealthy, industrialized nations.",35679413,10.1126/science.abj2972.,https://doi.org/10.1126/science.abj2972,,6/9/2022,6/10/2022,,,,2022 Jun 10;376(6598):1220-1223.,0,,
70,8/8/2022,"Shuyuan Zhang, Evgeny Zatulovskiy, Julia Arand, Julien Sage, Jan M. Skotheim",biorxiv,The cell cycle inhibitor RB is diluted in G1 and contributes to controlling cell size in the mouse liver,"Every type of cell in an animal maintains a specific size, which likely contributes to its ability to perform its physiological functions. While some cell size control mechanisms are beginning to be elucidated through studies of cultured cells, it is unclear if and how such mechanisms control cell size in an animal. For example, it was recently shown that RB, the retinoblastoma protein, was diluted by cell growth in G1 to promote size-dependence of the G1/S transition. However, it remains unclear to what extent the RB-dilution mechanism controls cell size in an animal. We therefore examined the contribution of RB-dilution to cell size control in the mouse liver. The RB-dilution model has two requirements. First, manipulations changing RB concentration drive corresponding changes in cell size, and second, the endogenous RB concentration decreases with cell size in G1. We found that both these requirements were met. Genetic perturbations decreasing RB protein concentrations through inducible shRNA expression or through liverspecific Rb1 knockout reduced hepatocyte size, while perturbations increasing RB protein concentrations in an Fah−/− mouse model increased hepatocyte size. Moreover, RB concentration decreased in larger G1 hepatocytes while the concentrations of the cell cycle activators Cyclin D1 and E2f1 remained relatively constant. Lastly, we tested how Rb1 manipulations affected G1/S cell size control in primary hepatocytes using live cell imaging. Loss of Rb1 weakened cell size control, i.e., reduced the inverse correlation between how much cells grew in G1 and how large they were at birth. Taken together, our results show that an RB- dilution mechanism contributes to cell size control in the mouse liver by linking cell growth to the G1/S transition.",,10.1101/2022.06.08.495371,http://www.biorxiv.org/content/10.1101/2022.06.08.495371v1,2022.06.08.495371,6/10/2022,,,"Department of Biology, Stanford University; Department of Biology, Stanford University; Departments of Pediatrics and Genetics, School of Medicine, Stanford University; Departments of Pediatrics and Genetics, School of Medicine, Stanford University; Department of Biology, Stanford University; Chan Zuckerberg Biohub",,,0,,
71,8/8/2022,"Shaogeng Tang, Yonggang Lu, Will M. Skinner, Mrinmoy Sanyal, Polina V. Lishko, Masahito Ikawa, Peter S. Kim",biorxiv,Human sperm TMEM95 binds eggs and facilitates membrane fusion,"Tmem95 encodes a sperm acrosomal membrane protein, whose knockout has a male-specific sterility phenotype in mice. How TMEM95 plays a role in membrane fusion of sperm and eggs has remained elusive. Here, we utilize a sperm penetration assay as a model system to investigate the function of human TMEM95. We show that human TMEM95 binds to hamster egg membranes, providing evidence for a TMEM95 receptor on eggs. Using X-ray crystallography, we reveal an evolutionarily conserved, positively charged region of TMEM95 as a putative receptor-binding surface. Amino-acid substitutions within this region of TMEM95 ablate egg-binding activity. We identify monoclonal antibodies against TMEM95 that reduce the number of human sperm fused with hamster eggs in sperm penetration assays. Strikingly, these antibodies do not block binding of sperm to eggs. Taken together, these results provide strong evidence for a specific, receptor-mediated interaction of sperm TMEM95 with eggs and suggest that this interaction may have a role in facilitating membrane fusion.Significance statement Membrane fusion of sperm and eggs is pivotal in sexual reproduction. Tmem95 knockout mice show male-specific sterility, but it was unknown how sperm TMEM95 facilitates membrane fusion with eggs. We show here that human TMEM95 binds eggs. Our crystal structure of TMEM95 suggests a region where this binding may occur. We develop monoclonal antibodies against TMEM95 that impair sperm-egg fusion but do not block sperm-egg binding. Thus, we propose that there is a receptor-mediated interaction of sperm TMEM95 with eggs, and that this interaction may have a direct role in membrane fusion. Our work suggests avenues for the identification of the TMEM95 egg receptor and may enable the development of infertility treatments and contraceptives for humans.",,10.1101/2022.06.10.495573,http://www.biorxiv.org/content/10.1101/2022.06.10.495573v1,2022.06.10.495573,6/10/2022,,,"Department of Biochemistry, Stanford University School of Medicine; Sarafan ChEM-H, Stanford University; Immunology Frontier Research Center, Osaka University; Department of Experimental Genome Research, Research Institute for Microbial Diseases, Osaka University; Endocrinology Graduate Group, University of California; Department of Biochemistry, Stanford University School of Medicine; Sarafan ChEM-H, Stanford University; Department of Molecular and Cell Biology, University of California; Center for Reproductive Longevity and Equality, Buck Institute for Research on Aging; Immunology Frontier Research Center, Osaka University; Department of Experimental Genome Research, Research Institute for Microbial Diseases, Osaka University; Center for Infectious Disease Education and Research, Osaka University; Laboratory of Reproductive Systems Biology, Institute of Medical Science, The University of Tokyo; Department of Biochemistry, Stanford University School of Medicine; Sarafan ChEM-H, Stanford University; Chan Zuckerberg Biohub",,,0,,
72,8/8/2022,Antonio Del Rio Flores;Colin C Barber;Maanasa Narayanamoorthy;Di Gu;Yuanbo Shen;Wenjun Zhang,Annu Rev Chem Biomol Eng,Biosynthesis of Isonitrile- and Alkyne-Containing Natural Products,"Natural products are a diverse class of biologically produced compounds that participate in fundamental biological processes such as cell signaling, nutrient acquisition, and interference competition. Unique triple-bond functionalities like isonitriles and alkynes often drive bioactivity and may serve as indicators of novel chemical logic and enzymatic machinery. Yet, the biosynthetic underpinnings of these groups remain only partially understood, constraining the opportunity to rationally engineer biomolecules with these functionalities for applications in pharmaceuticals, bioorthogonal chemistry, and other value-added chemical processes. Here, we focus our review on characterized biosynthetic pathways for isonitrile and alkyne functionalities, their bioorthogonal transformations, and prospects for engineering their biosynthetic machinery for biotechnological applications.              Keywords:                    bioorthogonal chemistry; biosynthesis; enzymology; natural products.",35236086,10.1146/annurev-chembioeng-092120-025140.,https://doi.org/10.1146/annurev-chembioeng-092120-025140,,3/2/2022,6/10/2022,,,,2022 Jun 10;13:1-24.,0,,
