record id,save datetime,author list,journal,title,abstract,pmid,doi,url,version,epost date,publish date,dateaffiliations list,all affiliations,pdf url,article_source,record change number,match result,match id
169,8/8/2022,"Alexander L. Jaffe, Corinne Bardot, Anne-Hélène Le Jeune, Jett Liu, Jonathan Colombet, Fanny Perrière, Hermine Billard, Cindy J. Castelle, Anne-Catherine Lehours, Jillian F. Banfield",biorxiv,"Variable impact of geochemical gradients on the functional potential of bacteria, archaea, and phages from the permanently stratified Lac Pavin","Permanently stratified lakes contain diverse microbial communities that vary with depth, and so serve as useful models for studying the relationships between microbial community structure and geochemistry. Recent work has shown that these lakes can also harbor numerous bacteria and archaea from novel lineages, including those from the Candidate Phyla Radiation (CPR). However, the extent to which geochemical stratification differentially impacts carbon metabolism and overall genetic potential in CPR bacteria compared to other organisms is not well defined. Here, we determine the distribution of microbial lineages along an oxygen gradient in Lac Pavin, a deep, stratified lake in central France, and examine the influence of this gradient on their metabolism. Genome-based analyses revealed an enrichment of distinct C1 and CO2 fixation pathways in the oxic lake interface and anoxic zone/sediments, suggesting that oxygen likely plays a role in structuring metabolic strategies in non-CPR bacteria and archaea. Notably, we find that oxidation of methane and its byproducts is largely spatially separated from methane production, which is mediated by diverse communities of sediment methanogens that vary on the centimeter scale. In contrast, we detected evidence for RuBisCO throughout the water column and sediments, including form II/III and form III-related enzymes encoded by CPR bacteria in the water column and DPANN archaea in the sediments. Overall, CPR bacteria and phages did not show strong signals of gene content differentiation by depth, despite the fact that distinct species groups populate different lake and sediment compartments. Thus, environmental gradients in Lac Pavin probably select for the capacities of CPR bacteria and phages to a lesser extent than other bacteria and archaea, possibly because selection on the former groups is indirect and depends on host characteristics.",,10.1101/2022.07.18.500538,http://www.biorxiv.org/content/10.1101/2022.07.18.500538v1,2022.07.18.500538,7/19/2022,,,"Department of Plant and Microbial Biology, University of California; Laboratoire Microorganismes: Génome et Environnement (LMGE), UMR CNRS 6023, Université Clermont-Auvergne; Laboratoire Microorganismes: Génome et Environnement (LMGE), UMR CNRS 6023, Université Clermont-Auvergne; Department of Plant and Microbial Biology, University of California; Laboratoire Microorganismes: Génome et Environnement (LMGE), UMR CNRS 6023, Université Clermont-Auvergne; Laboratoire Microorganismes: Génome et Environnement (LMGE), UMR CNRS 6023, Université Clermont-Auvergne; Laboratoire Microorganismes: Génome et Environnement (LMGE), UMR CNRS 6023, Université Clermont-Auvergne; Innovative Genomics Institute, University of California; Laboratoire Microorganismes: Génome et Environnement (LMGE), UMR CNRS 6023, Université Clermont-Auvergne; Innovative Genomics Institute, University of California; Department of Earth and Planetary Science, University of California; Department of Environmental Science, Policy, and Management, University of California; Chan Zuckerberg Biohub",,,0,,
170,8/8/2022,Qijing Xie;Jiefu Li;Hongjie Li;Namrata D Udeshi;Tanya Svinkina;Daniel Orlin;Sayeh Kohani;Ricardo Guajardo;D R Mani;Chuanyun Xu;Tongchao Li;Shuo Han;Wei Wei;S Andrew Shuster;David J Luginbuhl;Stephen R Quake;Swetha E Murthy;Alice Y Ting;Steven A Carr;Liqun Luo,Neuron,Transcription factor Acj6 controls dendrite targeting via a combinatorial cell-surface code,"Transcription factors specify the fate and connectivity of developing neurons. We investigate how a lineage-specific transcription factor, Acj6, controls the precise dendrite targeting of Drosophila olfactory projection neurons (PNs) by regulating the expression of cell-surface proteins. Quantitative cell-surface proteomic profiling of wild-type and acj6 mutant PNs in intact developing brains, and a proteome-informed genetic screen identified PN surface proteins that execute Acj6-regulated wiring decisions. These include canonical cell adhesion molecules and proteins previously not associated with wiring, such as Piezo, whose mechanosensitive ion channel activity is dispensable for its function in PN dendrite targeting. Comprehensive genetic analyses revealed that Acj6 employs unique sets of cell-surface proteins in different PN types for dendrite targeting. Combined expression of Acj6 wiring executors rescued acj6 mutant phenotypes with higher efficacy and breadth than expression of individual executors. Thus, Acj6 controls wiring specificity of different neuron types by specifying distinct combinatorial expression of cell-surface executors.              Keywords:                    Drosophila; Piezo; antennal lobe; cell-surface protein; combinatorial code; dendrite targeting; olfactory circuit; proteome; transcription factor; wiring specificity.",35613619,10.1016/j.neuron.2022.04.026.,https://doi.org/10.1016/j.neuron.2022.04.026,,5/24/2022,7/20/2022,,,,2022 Jul 20;110(14):2299-2314.e8.,0,,
171,8/8/2022,Lauren E Beck;Jasmine Lee;Christopher Coté;Margaret C Dunagin;Ilya Lukonin;Nikkita Salla;Marcello K Chang;Alex J Hughes;Joseph D Mornin;Zev J Gartner;Prisca Liberali;Arjun Raj,Cell Syst,Systematically quantifying morphological features reveals constraints on organoid phenotypes,"Organoids recapitulate complex 3D organ structures and represent a unique opportunity to probe the principles of self-organization. While we can alter an organoid's morphology by manipulating the culture conditions, the morphology of an organoid often resembles that of its original organ, suggesting that organoid morphologies are governed by a set of tissue-specific constraints. Here, we establish a framework to identify constraints on an organoid's morphological features by quantifying them from microscopy images of organoids exposed to a range of perturbations. We apply this framework to Madin-Darby canine kidney cysts and show that they obey a number of constraints taking the form of scaling relationships or caps on certain parameters. For example, we found that the number, but not size, of cells increases with increasing cyst size. We also find that these constraints vary with cyst age and can be altered by varying the culture conditions. We observed similar sets of constraints in intestinal organoids. This quantitative framework for identifying constraints on organoid morphologies may inform future efforts to engineer organoids.              Keywords:                    design principles; morphology; organoids.",35705097,10.1016/j.cels.2022.05.008.,https://doi.org/10.1016/j.cels.2022.05.008,,6/14/2022,7/20/2022,,,,2022 Jul 20;13(7):547-560.e3.,0,,
172,8/8/2022,Carlos F Buen Abad Najar;Prakruthi Burra;Nir Yosef;Liana F Lareau,Genome Res,Identifying cell state-associated alternative splicing events and their coregulation,"Alternative splicing shapes the transcriptome and contributes to each cell's unique identity, but single-cell RNA sequencing (scRNA-seq) has struggled to capture the impact of alternative splicing. We previously showed that low recovery of mRNAs from single cells led to erroneous conclusions about the cell-to-cell variability of alternative splicing. Here, we present a method, Psix, to confidently identify splicing that changes across a landscape of single cells, using a probabilistic model that is robust against the data limitations of scRNA-seq. Its autocorrelation-inspired approach finds patterns of alternative splicing that correspond to patterns of cell identity, such as cell type or developmental stage, without the need for explicit cell clustering, labeling, or trajectory inference. Applying Psix to data that follow the trajectory of mouse brain development, we identify exons whose alternative splicing patterns cluster into modules of coregulation. We show that the exons in these modules are enriched for binding by distinct neuronal splicing factors and that their changes in splicing correspond to changes in expression of these splicing factors. Thus, Psix reveals cell type-dependent splicing patterns and the wiring of the splicing regulatory networks that control them. Our new method will enable scRNA-seq analysis to go beyond transcription to understand the roles of post-transcriptional regulation in determining cell identity.",35858747,10.1101/gr.276109.121.,https://doi.org/10.1101/gr.276109.121,,,7/20/2022,,,,2022 Jul 20.,0,,
173,8/8/2022,Jeffrey R Moffitt;Emma Lundberg;Holger Heyn,Nat Rev Genet,The emerging landscape of spatial profiling technologies,"Improved scale, multiplexing and resolution are establishing spatial nucleic acid and protein profiling methods as a major pillar for cellular atlas building of complex samples, from tissues to full organisms. Emerging methods yield omics measurements at resolutions covering the nano- to microscale, enabling the charting of cellular heterogeneity, complex tissue architectures and dynamic changes during development and disease. We present an overview of the developing landscape of in situ spatial genome, transcriptome and proteome technologies, exemplify their impact on cell biology and translational research, and discuss current challenges for their community-wide adoption. Among many transformative applications, we envision that spatial methods will map entire organs and enable next-generation pathology.",35859028,10.1038/s41576-022-00515-3.,https://doi.org/10.1038/s41576-022-00515-3,,,7/20/2022,,,,2022 Jul 20.,0,,
174,8/8/2022,"I. Paga, Q. Zhai, M.Baity-Jesi, E. Calore, A. Cruz, C. Cummings, L. A. Fernandez, J. M. Gil-Narvion, I. Gonzalez-Adalid Pemartin, A. Gordillo-Guerrero, D. Iñiguez, G. G. Kenning, A. Maiorano, E. Marinari, V. Martin-Mayor, J. Moreno-Gordo, A. Muñoz-Sudupe, D. Navarro, R. L. Orbach, G. Parisi, S. Perez-Gaviro, F. Ricci-Tersenghi, J. J. Ruiz-Lorenzo, S. F. Schifano, D. L. Schlagel, B. Seoane, A.Tarancon, D. Yllanes",arxiv,Magnetic-field symmetry breaking in spin glasses,"Time-reversal symmetry is spontaneously broken in spin glasses below theirglass temperature. Under such conditions, the standard assumption about theequivalence of the most standard protocols (i.e.,\it{no big difference betweenswitching the field on or off}, as it is sometimes said) is not reallyjustified. In fact, we show here that the spin-glass coherence length behavesdifferently in the zero-field-cooled (ZFC, magnetic field is turned on) andthermoremanent-magnetization (TRM, magnetic field is turned off) protocols.This conclusion is reached through experiments, carried out on two CuMnsingle-crystal samples, and through massive simulations on the Janus~IIdedicated supercomputer. In agreement with the predictions of a simpledynamical model that assumes that the ultrametric tree of states survives theswitching-on of the magnetic field, we conclude that (all parameters being keptequal) the spin-glass coherence length is larger in the ZFC protocol. This hasimplications for the extended principle of superposition, which, while holdingat $H = 0$, breaks down for finite magnetic fields. Preliminary simulationresults support this observation.",,10.48550/arXiv.2207.10640,https://arxiv.org/abs/2207.10640,arXiv:2207.10640v1,7/21/2022,,,,https://arxiv.org/pdf/2207.10640,,0,,
175,8/8/2022,"Blake E. Downing, Dinesh Gupta, Dipti D. Nayak",biorxiv,The dual role of a multi-heme cytochrome in methanogenesis: MmcA is important for energy conservation and carbon metabolism in Methanosarcina acetivorans,"Methanogenic archaea belonging to the Order Methanosarcinales conserve energy using an electron transport chain (ETC). In the genetically tractable strain Methanosarcina acetivorans, ferredoxin donates electrons to the ETC via the Rnf (Rhodobacter nitrogen fixation) complex. The Rnf complex in M. acetivorans, unlike its counterpart in Bacteria, contains a multiheme c-type cytochrome (MHC) subunit called MmcA. Early studies hypothesized MmcA is a critical component of Rnf, however recent work posits that the primary role of MmcA is facilitating extracellular electron transport. To explore the physiological role of MmcA, we characterized M. acetivorans mutants lacking either the entire Rnf complex (Δrnf) or just the MmcA subunit (ΔmmcA). Our data show that MmcA is essential for growth during acetoclastic methanogenesis but neither Rnf nor MmcA are required for methanogenic growth on methylated compounds. On methylated compounds, the absence of MmcA alone leads to a more severe growth defect compared to a Rnf deletion likely due to different strategies for ferredoxin regeneration that arise in each strain. Transcriptomic data suggest that the ΔmmcA mutant might regenerate ferredoxin by upregulating the cytosolic Wood-Ljundahl pathway for acetyl-CoA synthesis, whereas the Δrnf mutant may repurpose the F420 dehydrogenase complex (Fpo) to regenerate ferredoxin coupled to proton translocation. Beyond energy conservation, the deletion of Rnf or MmcA leads to some shared and some unique transcriptional changes in methyltransferase genes and regulatory proteins. Overall, our study provides systems-level insights into the non-overlapping roles of the Rnf bioenergetic complex and the associated MHC, MmcA.Importance Methane is a greenhouse gas that is ten times more potent than carbon dioxide and efforts to curb emissions are crucial to meet climate goals. Methane emissions primarily stem from the metabolic activity of microorganisms called methanogenic archaea (methanogens). The electron transport chain (ETC) in methanogens that belong to the Order Methanosarcinales has been the focus of many in vitro studies to date, but the endogenous functions of the bioenergetic complexes that comprise the ETC have rarely been investigated. In this study, we use genetic techniques to functionally characterize the Rnf bioenergetic complex and the associated multi-heme c-type cytochrome MmcA in the model methanogen, Methanosarcina acetivorans. Our results show that MmcA and Rnf have shared and unique roles in the cell, and that, contrary to current knowledge, M. acetivorans has the capacity to induce at least two alternative pathways for ferredoxin regeneration in the absence of a functional Rnf complex.",,10.1101/2022.07.20.500911,http://www.biorxiv.org/content/10.1101/2022.07.20.500911v1,2022.07.20.500911,7/21/2022,,,"Department of Plant and Microbial Biology, University of California; Department of Molecular and Cell Biology, University of California; Department of Molecular and Cell Biology, University of California",,,0,,
176,8/8/2022,"Georgi K. Marinov, S. Tansu Bagdatli, Tong Wu, Chuan He, Anshul Kundaje, William J. Greenleaf",biorxiv,The chromatin landscape of the euryarchaeon Haloferax volcanii,"Archaea, together with Bacteria, represent the two main divisions of life on Earth, with many of the defining characteristics of the more complex eukaryotes tracing their origin to evolutionary innovations first made in their archaeal ancestors. One of the most notable such features is nucleosomal chromatin, although archaeal histones and chromatin differ significantly from those of eukaryotes. Despite increased interest in archaeal histones in recent years, the properties of archaeal chromatin have been little studied using genomic tools. Here, we adapt the ATAC-seq assay to archaea and use it to map the accessible landscape of the genome of the euryarchaeote Haloferax volcanii. We integrate the resulting datasets with genome-wide maps of active transcription and single-stranded DNA (ssDNA) and find that while H. volcanii promoters exist in a preferentially accessible state, modulation of transcriptional activity is not associated with changes in promoter accessibility, unlike the typical situation in eukaryotes. Applying orthogonal single-molecule footprinting methods, we quantify the absolute levels of physical protection of H. volcanii, and find that archaeal nucleosomal chromatin is similarly or only slightly more accessible, in aggregate, than that of eukaryotes. We also evaluate the degree of coordination of transcription within archaeal operons and make the unexpected observation that some CRISPR arrays are associated with highly prevalent ssDNA structures. These results provide a foundation for the future functional studies of archaeal chromatin.",,10.1101/2022.07.22.501187,http://www.biorxiv.org/content/10.1101/2022.07.22.501187v1,2022.07.22.501187,7/22/2022,,,"Department of Genetics, Stanford University; Department of Genetics, Stanford University; Department of Chemistry and Institute for Biophysical Dynamics, The University of Chicago; Department of Chemistry and Institute for Biophysical Dynamics, The University of Chicago; Department of Biochemistry and Molecular Biology and Institute for Biophysical Dynamics, The University of Chicago; Howard Hughes Medical Institute, The University of Chicago; Department of Genetics, Stanford University; Department of Computer Science, Stanford University; Department of Genetics, Stanford University; Center for Personal Dynamic Regulomes, Stanford University; Department of Applied Physics, Stanford University; Chan Zuckerberg Biohub",,,0,,
177,8/8/2022,"Michael Turner, Antonio Belli, Rudolph J. Castellani, Paul McCrory",medrxiv,"Changes in brain structure and function in a multisport cohort of retired female and male athletes, many years after suffering a concussion. The ICHIRF-BRAIN Study","Mild traumatic brain injury is widely regarded as a misnomer: it is globally a major cause of disability and is hypothesized as a potential causal factor in subsequent neurodegeneration. Commonly arising in sport, mounting evidence of varying degrees of cognitive impairment in retired athletes exposed to repeated concussions motivates close examination of its cumulative effects on the brain. Studying a cohort of 125 retired athletes with a mean of 11 reported concussions and 36 matched controls with none, here we evaluated whole-brain volumetric and subcortical morphological effects with Bayesian regression models and functional connectivity effects with network-based statistics. Estimates of potential cognitive impact were derived from meta-analytic functional mapping based on 13,459 imaging studies. Across the array of brain structural and functional effects identified, regions significantly lower in volume in the concussed group included, in order of greatest effect size, the middle frontal gyrus, hippocampus, supramarginal gyrus, temporal pole, and inferior frontal gyrus. Conversely, brain regions significantly larger within the athlete group included, in order of greatest effect size, the hippocampal and collateral sulcus, middle occipital gyrus, medial orbital gyrus, caudate nucleus, lateral orbital gyrus, and medial segment to the postcentral gyrus (all significant with 95% Bayesian credible interval). Subcortical morphology analysis corroborated these findings, revealing a significant, age-independent relationship between inward deformation of the hippocampus and the number of concussions sustained (corrected- p<0.0001). Functional connectivity analyses revealed a distinct brain network with significantly increased edge strength in the athlete cohort comprising 150 nodes and 400 edges (corrected-p=0.02), with the highest degree nodes including the pre-central and post-central gyri and right insula. The functional communities of the greatest eigenvector centralities corresponded to motor domains. Numerous edges of this network strengthened in athletes were significantly weakened with increasing bouts of concussion, which included disengagement of the frontal pole, superior frontal, and middle frontal gyri (p=0.04). Aligned to meta-analytic neuroimaging data, the observed changes suggest possible functional enhancement within the motor, sensory, coordination, balance, and visual processing domains in athletes, attenuated by concussive head injury with a negative impact on memory and language. That such changes are observed many years after retirement from impact sport suggests strong repetition effects and/or underpinning genetic selection factors. These findings suggest that engagement in sport may benefit the brain across numerous domains, but also highlights the potentially damaging effects of concussive head injury.",,10.1101/2022.07.21.22277627,http://medrxiv.org/content/early/2022/07/22/2022.07.21.22277627.1,2022.07.21.22277627,7/22/2022,,,"The International Concussion and Head Injury Research Foundation (ICHIRF); The Institute of Sport, Exercise and Health, University College London; Neurotrauma and Ophthalmology Research Group, Institute of Inflammation & Ageing, University of Birmingham; NIHR Surgical Reconstruction and Microbiology Research Centre, University Hospitals Birmingham NHS Foundation Trust; Marker Diagnostics UK Limited, the BioHub, Birmingham research park, Birmingham UK College of Medical and Dental Sciences, Institute of Cancer and Genomic Sciences, Centre for Computational Biology, University of Birmingham; Northwestern University, Feinberg School of Medicine; The International Concussion and Head Injury Research Foundation (ICHIRF); The Institute of Sport, Exercise and Health, University College London",,,0,,
178,8/8/2022,"Alexander Derry, Russ B. Altman",biorxiv,COLLAPSE: A representation learning framework for identification and characterization of protein structural sites,"The identification and characterization of the structural sites which contribute to protein function are crucial for understanding biological mechanisms, evaluating disease risk, and developing targeted therapies. However, the quantity of known protein structures is rapidly outpacing our ability to functionally annotate them. Existing methods for function prediction either do not operate on local sites, suffer from high false positive or false negative rates, or require large site-specific training datasets, necessitating the development of new computational methods for annotating functional sites at scale. We present COLLAPSE (Compressed Latents Learned from Aligned Protein Structural Environments), a framework for learning deep representations of protein sites. COLLAPSE operates directly on the 3D positions of atoms surrounding a site and uses evolutionary relationships between homologous proteins as a self-supervision signal, enabling learned embeddings to implicitly capture structure-function relationships within each site. Our representations generalize across disparate tasks in a transfer learning context, achieving state-of-the-art performance on standardized benchmarks (protein-protein interactions and mutation stability) and on the prediction of functional sites from the PROSITE database. We use COLLAPSE to search for similar sites across large protein datasets and to annotate proteins based on a database of known functional sites. These methods demonstrate that COLLAPSE is computationally efficient, tunable, and interpretable, providing a general-purpose platform for computational protein analysis.",,10.1101/2022.07.20.500713,http://www.biorxiv.org/content/10.1101/2022.07.20.500713v1,2022.07.20.500713,7/22/2022,,,"Department of Biomedical Data Science, Stanford University; Department of Biomedical Data Science, Stanford University; Departments of Bioengineering, Genetics, and Medicine, Stanford University",,,0,,
