record id,save datetime,biohub author,corresponding author,corresponding author institution,journal,doi,pmid,title,url,abstract,keyword,pdf url,version,version number,type,date,epost date,publish date,authors,authors2,affiliations list,author - affiliations,version,published or not,published_doi,confirm preprint doi,match result,match id,record change number,Match biohub author
17,2022-08-12,Polly Fordyce,David McIntyreDouglas Densmore,"Biomedical Engineering Department, Boston University, MA, USA.; Biological Design Center, Boston University, Boston, MA, USA. dougd@bu.edu.Biological Design Center, Boston University, Boston, MA, USA. dougd@bu.edu.; Electrical & Computer Engineering Department, Boston University, Boston, MA, USA.",Lab on a chip,10.1039/d2lc00254j,35904162,Machine learning for microfluidic design and control.,https://pubmed.ncbi.nlm.nih.gov/35904162,"Microfluidics has developed into a mature field with applications across science and engineering, having particular commercial success in molecular diagnostics, next-generation sequencing, and bench-top analysis. Despite its ubiquity, the complexity of designing and controlling custom microfluidic devices present major barriers to adoption, requiring intuitive knowledge gained from years of experience. If these barriers were overcome, microfluidics could miniaturize biological and chemical research for non-experts through fully-automated platform development and operation. The intuition of microfluidic experts can be captured through machine learning, where complex statistical models are trained for pattern recognition and subsequently used for event prediction. Integration of machine learning with microfluidics could significantly expand its adoption and impact. Here, we present the current state of machine learning for the design and control of microfluidic devices, its possible applications, and current limitations.",,,,,,2022/7/30/6/0,2022/08/09,2022/7/30/6/0,David McIntyre ; Ali Lashkaripour ; Polly Fordyce ; Douglas Densmore,,"Biological Design Center, Boston University, Boston, MA, USA. dougd@bu.edu.; Electrical & Computer Engineering Department, Boston University, Boston, MA, USA.;Biomedical Engineering Department, Boston University, MA, USA.; Biological Design Center, Boston University, Boston, MA, USA. dougd@bu.edu.;Department of Bioengineering, Stanford University, Stanford, CA, USA.; Department of Genetics, Stanford University, Stanford, CA, USA.;Department of Bioengineering, Stanford University, Stanford, CA, USA.; Department of Genetics, Stanford University, Stanford, CA, USA.; Chan-Zuckerberg Biohub, San Francisco, CA, USA.","David McIntyre: Biomedical Engineering Department, Boston University, MA, USA.; Biological Design Center, Boston University, Boston, MA, USA. dougd@bu.edu.Ali Lashkaripour: Department of Bioengineering, Stanford University, Stanford, CA, USA.; Department of Genetics, Stanford University, Stanford, CA, USA.Polly Fordyce: Department of Bioengineering, Stanford University, Stanford, CA, USA.; Department of Genetics, Stanford University, Stanford, CA, USA.; Chan-Zuckerberg Biohub, San Francisco, CA, USA.Douglas Densmore: Biological Design Center, Boston University, Boston, MA, USA. dougd@bu.edu.; Electrical & Computer Engineering Department, Boston University, Boston, MA, USA.",,,,,,,0,"Smolke, Christina"
18,2022-08-12,Helen S Bateup,Helen S Bateup,"Department of Molecular and Cell Biology, University of California, Berkeley, Berkeley, CA, 94720, USA. bateup@berkeley.edu.; Helen Wills Neuroscience Institute, University of California, Berkeley, Berkeley, CA, 94720, USA. bateup@berkeley.edu.; Chan Zuckerberg Biohub, San Francisco, CA, 94158, USA. bateup@berkeley.edu.",Nature communications,10.1038/s41467-022-31961-6,35945201,Raptor downregulation rescues neuronal phenotypes in mouse models of Tuberous Sclerosis Complex.,https://pubmed.ncbi.nlm.nih.gov/35945201,"Tuberous Sclerosis Complex (TSC) is a neurodevelopmental disorder caused by mutations in the TSC1 or TSC2 genes, which encode proteins that negatively regulate mTOR complex 1 (mTORC1) signaling. Current treatment strategies focus on mTOR inhibition with rapamycin and its derivatives. While effective at improving some aspects of TSC, chronic rapamycin inhibits both mTORC1 and mTORC2 and is associated with systemic side-effects. It is currently unknown which mTOR complex is most relevant for TSC-related brain phenotypes. Here we used genetic strategies to selectively reduce neuronal mTORC1 or mTORC2 activity in mouse models of TSC. We find that reduction of the mTORC1 component Raptor, but not the mTORC2 component Rictor, rebalanced mTOR signaling in Tsc1 knock-out neurons. Raptor reduction was sufficient to improve several TSC-related phenotypes including neuronal hypertrophy, macrocephaly, impaired myelination, network hyperactivity, and premature mortality. Raptor downregulation represents a promising potential therapeutic intervention for the neurological manifestations of TSC.",,,,,,2022/8/10/6/0,2022/08/09,2022/8/10/6/0,Vasiliki Karalis ; Franklin Caval-Holme ; Helen S Bateup,,"Department of Molecular and Cell Biology, University of California, Berkeley, Berkeley, CA, 94720, USA.;Department of Molecular and Cell Biology, University of California, Berkeley, Berkeley, CA, 94720, USA. bateup@berkeley.edu.; Helen Wills Neuroscience Institute, University of California, Berkeley, Berkeley, CA, 94720, USA. bateup@berkeley.edu.; Chan Zuckerberg Biohub, San Francisco, CA, 94158, USA. bateup@berkeley.edu.;Helen Wills Neuroscience Institute, University of California, Berkeley, Berkeley, CA, 94720, USA.","Vasiliki Karalis: Department of Molecular and Cell Biology, University of California, Berkeley, Berkeley, CA, 94720, USA.Franklin Caval-Holme: Helen Wills Neuroscience Institute, University of California, Berkeley, Berkeley, CA, 94720, USA.Helen S Bateup: Department of Molecular and Cell Biology, University of California, Berkeley, Berkeley, CA, 94720, USA. bateup@berkeley.edu.; Helen Wills Neuroscience Institute, University of California, Berkeley, Berkeley, CA, 94720, USA. bateup@berkeley.edu.; Chan Zuckerberg Biohub, San Francisco, CA, 94158, USA. bateup@berkeley.edu.",,,,10.1101/2021.07.21.453275,,,0,
19,2022-08-12,Alice Y Ting,,,Open biology,10.1098/rsob.220149,35946312,A genetic model for ,https://pubmed.ncbi.nlm.nih.gov/35946312,"Organ functions are highly specialized and interdependent. Secreted factors regulate organ development and mediate homeostasis through serum trafficking and inter-organ communication. Enzyme-catalysed proximity labelling enables the identification of proteins within a specific cellular compartment. Here, we report a ",BirA ; TurboID ; inter-organ communication ; proximity-labelling ; secretome ; serum proteins,,,,,2022/8/11/6/0,2022/08/10,2022/8/11/6/0,Rui Yang ; Amanda S Meyer ; Ilia A Droujinine ; Namrata D Udeshi ; Yanhui Hu ; Jinjin Guo ; Jill A McMahon ; Dominique K Carey ; Charles Xu ; Qiao Fang ; Jihui Sha ; Shishang Qin ; David Rocco ; James Wohlschlegel ; Alice Y Ting ; Steven A Carr ; Norbert Perrimon ; Andrew P McMahon,,"BIOPIC, Beijing Advanced Innovation Center for Genomics, School of Life Sciences, Peking University, Beijing, People's Republic of China.;Broad Institute of Harvard and MIT, Cambridge, MA, USA.;Chan Zuckerberg Biohub, San Francisco, CA, USA.; Departments of Genetics, Biology, and Chemistry, Stanford University, Stanford, CA, USA.;Department of Biological Chemistry, Geffen School of Medicine at UCLA, University of California, Los Angeles, Los Angeles, CA, USA.;Department of Genetics, Blavatnik Institute, Harvard Medical School, Boston, MA, USA.;Department of Genetics, Blavatnik Institute, Harvard Medical School, Boston, MA, USA.; Howard Hughes Medical Institute, Boston, MA, USA.;Department of Molecular Genetics, University of Toronto, Toronto, ON Canada, M5S 3E1.;Department of Molecular Medicine, Scripps Research, La Jolla, CA, USA.;Department of Stem Cell Biology and Regenerative Medicine, University of Southern California, Los Angeles, CA, USA.; Eli and Edythe Broad Center for Regenerative Medicine and Stem Cell Research, University of Southern California, Los Angeles, CA, USA.","Rui Yang: Department of Stem Cell Biology and Regenerative Medicine, University of Southern California, Los Angeles, CA, USA.; Eli and Edythe Broad Center for Regenerative Medicine and Stem Cell Research, University of Southern California, Los Angeles, CA, USA.Amanda S Meyer: Department of Stem Cell Biology and Regenerative Medicine, University of Southern California, Los Angeles, CA, USA.; Eli and Edythe Broad Center for Regenerative Medicine and Stem Cell Research, University of Southern California, Los Angeles, CA, USA.Ilia A Droujinine: Department of Molecular Medicine, Scripps Research, La Jolla, CA, USA.Namrata D Udeshi: Broad Institute of Harvard and MIT, Cambridge, MA, USA.Yanhui Hu: Department of Genetics, Blavatnik Institute, Harvard Medical School, Boston, MA, USA.Jinjin Guo: Department of Stem Cell Biology and Regenerative Medicine, University of Southern California, Los Angeles, CA, USA.; Eli and Edythe Broad Center for Regenerative Medicine and Stem Cell Research, University of Southern California, Los Angeles, CA, USA.Jill A McMahon: Department of Stem Cell Biology and Regenerative Medicine, University of Southern California, Los Angeles, CA, USA.; Eli and Edythe Broad Center for Regenerative Medicine and Stem Cell Research, University of Southern California, Los Angeles, CA, USA.Dominique K Carey: Broad Institute of Harvard and MIT, Cambridge, MA, USA.Charles Xu: Broad Institute of Harvard and MIT, Cambridge, MA, USA.Qiao Fang: Department of Molecular Genetics, University of Toronto, Toronto, ON Canada, M5S 3E1.Jihui Sha: Department of Biological Chemistry, Geffen School of Medicine at UCLA, University of California, Los Angeles, Los Angeles, CA, USA.Shishang Qin: BIOPIC, Beijing Advanced Innovation Center for Genomics, School of Life Sciences, Peking University, Beijing, People's Republic of China.David Rocco: Department of Genetics, Blavatnik Institute, Harvard Medical School, Boston, MA, USA.James Wohlschlegel: Department of Biological Chemistry, Geffen School of Medicine at UCLA, University of California, Los Angeles, Los Angeles, CA, USA.Alice Y Ting: Chan Zuckerberg Biohub, San Francisco, CA, USA.; Departments of Genetics, Biology, and Chemistry, Stanford University, Stanford, CA, USA.Steven A Carr: Broad Institute of Harvard and MIT, Cambridge, MA, USA.Norbert Perrimon: Department of Genetics, Blavatnik Institute, Harvard Medical School, Boston, MA, USA.; Howard Hughes Medical Institute, Boston, MA, USA.Andrew P McMahon: Department of Stem Cell Biology and Regenerative Medicine, University of Southern California, Los Angeles, CA, USA.; Eli and Edythe Broad Center for Regenerative Medicine and Stem Cell Research, University of Southern California, Los Angeles, CA, USA.",,,,10.1101/2022.04.13.488228,,,0,"Ting, Alice"
20,2022-08-12,Pascal Geldsetzer,,,JMIR research protocols,10.2196/35249,35947440,The Effect of Particulate Matter Exposure During Pregnancy on Pregnancy and Child Health Outcomes in South Asia: Protocol for an Instrumental Variable Analysis.,https://pubmed.ncbi.nlm.nih.gov/35947440,"Determining the longer-term health effects of air pollution has been difficult owing to the multitude of potential confounding variables in the relationship between air pollution and health. Air pollution in many areas of South Asia is seasonal, with large spikes in particulate matter (PM) concentration occurring in the winter months. This study exploits this seasonal variation in PM concentration through a natural experiment.",Bangladesh ; India ; Indo-Gangetic Plain ; Nepal ; PM2.5 ; Pakistan ; air pollution ; birth weight ; child and maternal health ; fine particulate matter ; still birth,,,,,2022/8/11/6/0,2022/08/10,2022/8/11/6/0,Fabian Reitzug ; Stephen P Luby ; Hemant K Pullabhotla ; Pascal Geldsetzer,,"Big Data Institute, Nuffield Department of Population Health, University of Oxford, Oxford, United Kingdom.;Center on Food Security and the Environment, Stanford University, Palo Alto, CA, United States.;Division of Primary Care and Population Health, Department of Medicine, Stanford University, Palo Alto, CA, United States.; Chan Zuckerberg Biohub, San Francisco, CA, United States.;Woods Institute for the Environment, Stanford University, Palo Alto, CA, United States.","Fabian Reitzug: Big Data Institute, Nuffield Department of Population Health, University of Oxford, Oxford, United Kingdom.Stephen P Luby: Woods Institute for the Environment, Stanford University, Palo Alto, CA, United States.Hemant K Pullabhotla: Center on Food Security and the Environment, Stanford University, Palo Alto, CA, United States.Pascal Geldsetzer: Division of Primary Care and Population Health, Department of Medicine, Stanford University, Palo Alto, CA, United States.; Chan Zuckerberg Biohub, San Francisco, CA, United States.",,,,,,,0,"Bateup, Helen"
21,2022-08-12,,,,"Science (New York, N.Y.)",10.1126/science.abk3512,35951677,Nested epistasis enhancer networks for robust genome regulation.,https://pubmed.ncbi.nlm.nih.gov/35951677,"Mammalian genomes have multiple enhancers spanning an ultralong distance (>megabases) to modulate important genes, but it is unclear how these enhancers coordinate to achieve this task. We combine multiplexed CRISPRi screening with machine learning to define quantitative enhancer-enhancer interactions. We find that the ultralong distance enhancer network has a nested multilayer architecture that confers functional robustness of gene expression. Experimental characterization reveals that enhancer epistasis is maintained by three-dimensional chromosomal interactions and BRD4 condensation. Machine learning prediction of synergistic enhancers provides an effective strategy to identify noncoding variant pairs associated with pathogenic genes in diseases beyond genome-wide association studies analysis. Our work unveils nested epistasis enhancer networks, which can better explain enhancer functions within cells and in diseases.",,,,,,2022/8/12/6/0,2022/08/11,2022/8/12/6/0,Xueqiu Lin ; Yanxia Liu ; Shuai Liu ; Xiang Zhu ; Lingling Wu ; Yanyu Zhu ; Dehua Zhao ; Xiaoshu Xu ; Augustine Chemparathy ; Haifeng Wang ; Yaqiang Cao ; Muneaki Nakamura ; Jasprina N Noordermeer ; Marie La Russa ; Wing Hung Wong ; Keji Zhao ; Lei S Qi,,"Department of Bioengineering, Stanford University, Stanford, CA 94305, USA.;Department of Bioengineering, Stanford University, Stanford, CA 94305, USA.; Sarafan ChEM-H, Stanford University, Stanford, CA 94305, USA.; Chan Zuckerberg BioHub, San Francisco, CA 94158, USA.;Department of Statistics, Stanford University, Stanford, CA 94305, USA.; Department of Biomedical Data Science, Stanford University, Stanford, CA 94305, USA.;Department of Statistics, Stanford University, Stanford, CA 94305, USA.; Department of Statistics, The Pennsylvania State University, University Park, PA 16802, USA.; Huck Institutes of the Life Sciences, The Pennsylvania State University, University Park, PA 16802, USA.;Laboratory of Epigenome Biology, Systems Biology Center, National Heart, Lung and Blood Institute NIH, Bethesda, MD 20892, USA.;School of Medicine, Stanford University, Stanford, CA 94305, USA.","Xueqiu Lin: Department of Bioengineering, Stanford University, Stanford, CA 94305, USA.Yanxia Liu: Department of Bioengineering, Stanford University, Stanford, CA 94305, USA.Shuai Liu: Laboratory of Epigenome Biology, Systems Biology Center, National Heart, Lung and Blood Institute NIH, Bethesda, MD 20892, USA.Xiang Zhu: Department of Statistics, Stanford University, Stanford, CA 94305, USA.; Department of Statistics, The Pennsylvania State University, University Park, PA 16802, USA.; Huck Institutes of the Life Sciences, The Pennsylvania State University, University Park, PA 16802, USA.Lingling Wu: Department of Bioengineering, Stanford University, Stanford, CA 94305, USA.Yanyu Zhu: Department of Bioengineering, Stanford University, Stanford, CA 94305, USA.Dehua Zhao: Department of Bioengineering, Stanford University, Stanford, CA 94305, USA.Xiaoshu Xu: Department of Bioengineering, Stanford University, Stanford, CA 94305, USA.Augustine Chemparathy: School of Medicine, Stanford University, Stanford, CA 94305, USA.Haifeng Wang: Department of Bioengineering, Stanford University, Stanford, CA 94305, USA.Yaqiang Cao: Laboratory of Epigenome Biology, Systems Biology Center, National Heart, Lung and Blood Institute NIH, Bethesda, MD 20892, USA.Muneaki Nakamura: Department of Bioengineering, Stanford University, Stanford, CA 94305, USA.Jasprina N Noordermeer: Department of Bioengineering, Stanford University, Stanford, CA 94305, USA.Marie La Russa: Department of Bioengineering, Stanford University, Stanford, CA 94305, USA.Wing Hung Wong: Department of Statistics, Stanford University, Stanford, CA 94305, USA.; Department of Biomedical Data Science, Stanford University, Stanford, CA 94305, USA.Keji Zhao: Laboratory of Epigenome Biology, Systems Biology Center, National Heart, Lung and Blood Institute NIH, Bethesda, MD 20892, USA.Lei S Qi: Department of Bioengineering, Stanford University, Stanford, CA 94305, USA.; Sarafan ChEM-H, Stanford University, Stanford, CA 94305, USA.; Chan Zuckerberg BioHub, San Francisco, CA 94158, USA.",,,,,,,0,"Fordyce, Polly"
22,2022-08-12,Peter S Kim,,,Biochemistry,10.1021/acs.biochem.2c00241,35960597,Simplified Purification of Glycoprotein-Modified Ferritin Nanoparticles for Vaccine Development.,https://pubmed.ncbi.nlm.nih.gov/35960597,"Ferritin-based, self-assembling protein nanoparticle vaccines are being developed against a range of viral pathogens, including SARS-CoV-2, influenza, HIV-1, and Epstein-Barr virus. However, purification of these nanoparticles is often laborious and requires customization for each potential nanoparticle vaccine. We propose that the simple insertion of a polyhistidine tag into exposed flexible loops on the ferritin surface (His-Fer) can mitigate the need for complex purifications and enable facile metal-chelate-based purification, thereby allowing for optimization of early stage vaccine candidates. Using sequence homology and computational modeling, we identify four sites that can accommodate insertion of a polyhistidine tag and demonstrate purification of both hemagglutinin-modified and SARS-CoV-2 spike-modified ferritins, highlighting the generality of the approach. A site at the 4-fold axis of symmetry enables optimal purification of both protein nanoparticles. We demonstrate improved purification through modulating the polyhistidine length and optimizing both the metal cation and the resin type. Finally, we show that purified His-Fer proteins remain multimeric and elicit robust immune responses similar to those of their wild-type counterparts. Collectively, this work provides a simplified purification scheme for ferritin-based vaccines.",,,,,,2022/8/13/6/0,2022/08/12,2022/8/13/6/0,Payton Weidenbacher ; Sriharshita Musunuri ; Abigail E Powell ; Shaogeng Tang ; Jonathan Do ; Mrinmoy Sanyal ; Peter S Kim,,"Stanford ChEM-H, Stanford University, Stanford, California 94305, United States.; Department of Biochemistry, School of Medicine, Stanford University, Stanford, California 94305, United States.;Stanford ChEM-H, Stanford University, Stanford, California 94305, United States.; Department of Biochemistry, School of Medicine, Stanford University, Stanford, California 94305, United States.; Chan Zuckerberg Biohub, San Francisco, California 94158, United States.;Stanford ChEM-H, Stanford University, Stanford, California 94305, United States.; Department of Chemistry, Stanford University, Stanford, California 94305, United States.","Payton Weidenbacher: Stanford ChEM-H, Stanford University, Stanford, California 94305, United States.; Department of Chemistry, Stanford University, Stanford, California 94305, United States.Sriharshita Musunuri: Stanford ChEM-H, Stanford University, Stanford, California 94305, United States.; Department of Biochemistry, School of Medicine, Stanford University, Stanford, California 94305, United States.Abigail E Powell: Stanford ChEM-H, Stanford University, Stanford, California 94305, United States.; Department of Biochemistry, School of Medicine, Stanford University, Stanford, California 94305, United States.Shaogeng Tang: Stanford ChEM-H, Stanford University, Stanford, California 94305, United States.; Department of Biochemistry, School of Medicine, Stanford University, Stanford, California 94305, United States.Jonathan Do: Stanford ChEM-H, Stanford University, Stanford, California 94305, United States.; Department of Biochemistry, School of Medicine, Stanford University, Stanford, California 94305, United States.Mrinmoy Sanyal: Stanford ChEM-H, Stanford University, Stanford, California 94305, United States.; Department of Biochemistry, School of Medicine, Stanford University, Stanford, California 94305, United States.Peter S Kim: Stanford ChEM-H, Stanford University, Stanford, California 94305, United States.; Department of Biochemistry, School of Medicine, Stanford University, Stanford, California 94305, United States.; Chan Zuckerberg Biohub, San Francisco, California 94158, United States.",,,,,,,0,"Yosef, Nir"
