record id,save datetime,biohub author,corresponding author,corresponding author institution,journal,doi,pmid,title,url,abstract,keyword,pdf url,version,version number,type,date,epost date,publish date,authors,authors2,affiliations list,author - affiliations,version,published or not,published_doi,confirm preprint doi,match result,match id,record change number,Match biohub author
38,2022-08-10,Polly Fordyce,David McIntyreDouglas Densmore,"Biomedical Engineering Department, Boston University, MA, USA.; Biological Design Center, Boston University, Boston, MA, USA. dougd@bu.edu.Biological Design Center, Boston University, Boston, MA, USA. dougd@bu.edu.; Electrical & Computer Engineering Department, Boston University, Boston, MA, USA.",Lab on a chip,10.1039/d2lc00254j,35904162,Machine learning for microfluidic design and control.,https://pubmed.ncbi.nlm.nih.gov/35904162,"Microfluidics has developed into a mature field with applications across science and engineering, having particular commercial success in molecular diagnostics, next-generation sequencing, and bench-top analysis. Despite its ubiquity, the complexity of designing and controlling custom microfluidic devices present major barriers to adoption, requiring intuitive knowledge gained from years of experience. If these barriers were overcome, microfluidics could miniaturize biological and chemical research for non-experts through fully-automated platform development and operation. The intuition of microfluidic experts can be captured through machine learning, where complex statistical models are trained for pattern recognition and subsequently used for event prediction. Integration of machine learning with microfluidics could significantly expand its adoption and impact. Here, we present the current state of machine learning for the design and control of microfluidic devices, its possible applications, and current limitations.",,,,,,2022/7/30/6/0,2022/08/09,2022/7/30/6/0,David McIntyre ; Ali Lashkaripour ; Polly Fordyce ; Douglas Densmore,,"Biological Design Center, Boston University, Boston, MA, USA. dougd@bu.edu.; Electrical & Computer Engineering Department, Boston University, Boston, MA, USA.;Biomedical Engineering Department, Boston University, MA, USA.; Biological Design Center, Boston University, Boston, MA, USA. dougd@bu.edu.;Department of Bioengineering, Stanford University, Stanford, CA, USA.; Department of Genetics, Stanford University, Stanford, CA, USA.;Department of Bioengineering, Stanford University, Stanford, CA, USA.; Department of Genetics, Stanford University, Stanford, CA, USA.; Chan-Zuckerberg Biohub, San Francisco, CA, USA.","David McIntyre: Biomedical Engineering Department, Boston University, MA, USA.; Biological Design Center, Boston University, Boston, MA, USA. dougd@bu.edu.Ali Lashkaripour: Department of Bioengineering, Stanford University, Stanford, CA, USA.; Department of Genetics, Stanford University, Stanford, CA, USA.Polly Fordyce: Department of Bioengineering, Stanford University, Stanford, CA, USA.; Department of Genetics, Stanford University, Stanford, CA, USA.; Chan-Zuckerberg Biohub, San Francisco, CA, USA.Douglas Densmore: Biological Design Center, Boston University, Boston, MA, USA. dougd@bu.edu.; Electrical & Computer Engineering Department, Boston University, Boston, MA, USA.",,,,,,,0,"Madhani, Hiten"
39,2022-08-10,Helen S Bateup,Helen S Bateup,"Department of Molecular and Cell Biology, University of California, Berkeley, Berkeley, CA, 94720, USA. bateup@berkeley.edu.; Helen Wills Neuroscience Institute, University of California, Berkeley, Berkeley, CA, 94720, USA. bateup@berkeley.edu.; Chan Zuckerberg Biohub, San Francisco, CA, 94158, USA. bateup@berkeley.edu.",Nature communications,10.1038/s41467-022-31961-6,35945201,Raptor downregulation rescues neuronal phenotypes in mouse models of Tuberous Sclerosis Complex.,https://pubmed.ncbi.nlm.nih.gov/35945201,"Tuberous Sclerosis Complex (TSC) is a neurodevelopmental disorder caused by mutations in the TSC1 or TSC2 genes, which encode proteins that negatively regulate mTOR complex 1 (mTORC1) signaling. Current treatment strategies focus on mTOR inhibition with rapamycin and its derivatives. While effective at improving some aspects of TSC, chronic rapamycin inhibits both mTORC1 and mTORC2 and is associated with systemic side-effects. It is currently unknown which mTOR complex is most relevant for TSC-related brain phenotypes. Here we used genetic strategies to selectively reduce neuronal mTORC1 or mTORC2 activity in mouse models of TSC. We find that reduction of the mTORC1 component Raptor, but not the mTORC2 component Rictor, rebalanced mTOR signaling in Tsc1 knock-out neurons. Raptor reduction was sufficient to improve several TSC-related phenotypes including neuronal hypertrophy, macrocephaly, impaired myelination, network hyperactivity, and premature mortality. Raptor downregulation represents a promising potential therapeutic intervention for the neurological manifestations of TSC.",,,,,,2022/8/10/6/0,2022/08/09,2022/8/10/6/0,Vasiliki Karalis ; Franklin Caval-Holme ; Helen S Bateup,,"Department of Molecular and Cell Biology, University of California, Berkeley, Berkeley, CA, 94720, USA.;Department of Molecular and Cell Biology, University of California, Berkeley, Berkeley, CA, 94720, USA. bateup@berkeley.edu.; Helen Wills Neuroscience Institute, University of California, Berkeley, Berkeley, CA, 94720, USA. bateup@berkeley.edu.; Chan Zuckerberg Biohub, San Francisco, CA, 94158, USA. bateup@berkeley.edu.;Helen Wills Neuroscience Institute, University of California, Berkeley, Berkeley, CA, 94720, USA.","Vasiliki Karalis: Department of Molecular and Cell Biology, University of California, Berkeley, Berkeley, CA, 94720, USA.Franklin Caval-Holme: Helen Wills Neuroscience Institute, University of California, Berkeley, Berkeley, CA, 94720, USA.Helen S Bateup: Department of Molecular and Cell Biology, University of California, Berkeley, Berkeley, CA, 94720, USA. bateup@berkeley.edu.; Helen Wills Neuroscience Institute, University of California, Berkeley, Berkeley, CA, 94720, USA. bateup@berkeley.edu.; Chan Zuckerberg Biohub, San Francisco, CA, 94158, USA. bateup@berkeley.edu.",,,,10.1101/2021.07.21.453275,,,0,"Ye, Jimmie"
40,2022-08-10,Alice Y Ting,,,Open biology,10.1098/rsob.220149,35946312,A genetic model for ,https://pubmed.ncbi.nlm.nih.gov/35946312,"Organ functions are highly specialized and interdependent. Secreted factors regulate organ development and mediate homeostasis through serum trafficking and inter-organ communication. Enzyme-catalysed proximity labelling enables the identification of proteins within a specific cellular compartment. Here, we report a ",BirA ; TurboID ; inter-organ communication ; proximity-labelling ; secretome ; serum proteins,,,,,2022/8/11/6/0,2022/08/10,2022/8/11/6/0,Rui Yang ; Amanda S Meyer ; Ilia A Droujinine ; Namrata D Udeshi ; Yanhui Hu ; Jinjin Guo ; Jill A McMahon ; Dominique K Carey ; Charles Xu ; Qiao Fang ; Jihui Sha ; Shishang Qin ; David Rocco ; James Wohlschlegel ; Alice Y Ting ; Steven A Carr ; Norbert Perrimon ; Andrew P McMahon,,"BIOPIC, Beijing Advanced Innovation Center for Genomics, School of Life Sciences, Peking University, Beijing, People's Republic of China.;Broad Institute of Harvard and MIT, Cambridge, MA, USA.;Chan Zuckerberg Biohub, San Francisco, CA, USA.; Departments of Genetics, Biology, and Chemistry, Stanford University, Stanford, CA, USA.;Department of Biological Chemistry, Geffen School of Medicine at UCLA, University of California, Los Angeles, Los Angeles, CA, USA.;Department of Genetics, Blavatnik Institute, Harvard Medical School, Boston, MA, USA.;Department of Genetics, Blavatnik Institute, Harvard Medical School, Boston, MA, USA.; Howard Hughes Medical Institute, Boston, MA, USA.;Department of Molecular Genetics, University of Toronto, Toronto, ON Canada, M5S 3E1.;Department of Molecular Medicine, Scripps Research, La Jolla, CA, USA.;Department of Stem Cell Biology and Regenerative Medicine, University of Southern California, Los Angeles, CA, USA.; Eli and Edythe Broad Center for Regenerative Medicine and Stem Cell Research, University of Southern California, Los Angeles, CA, USA.","Rui Yang: Department of Stem Cell Biology and Regenerative Medicine, University of Southern California, Los Angeles, CA, USA.; Eli and Edythe Broad Center for Regenerative Medicine and Stem Cell Research, University of Southern California, Los Angeles, CA, USA.Amanda S Meyer: Department of Stem Cell Biology and Regenerative Medicine, University of Southern California, Los Angeles, CA, USA.; Eli and Edythe Broad Center for Regenerative Medicine and Stem Cell Research, University of Southern California, Los Angeles, CA, USA.Ilia A Droujinine: Department of Molecular Medicine, Scripps Research, La Jolla, CA, USA.Namrata D Udeshi: Broad Institute of Harvard and MIT, Cambridge, MA, USA.Yanhui Hu: Department of Genetics, Blavatnik Institute, Harvard Medical School, Boston, MA, USA.Jinjin Guo: Department of Stem Cell Biology and Regenerative Medicine, University of Southern California, Los Angeles, CA, USA.; Eli and Edythe Broad Center for Regenerative Medicine and Stem Cell Research, University of Southern California, Los Angeles, CA, USA.Jill A McMahon: Department of Stem Cell Biology and Regenerative Medicine, University of Southern California, Los Angeles, CA, USA.; Eli and Edythe Broad Center for Regenerative Medicine and Stem Cell Research, University of Southern California, Los Angeles, CA, USA.Dominique K Carey: Broad Institute of Harvard and MIT, Cambridge, MA, USA.Charles Xu: Broad Institute of Harvard and MIT, Cambridge, MA, USA.Qiao Fang: Department of Molecular Genetics, University of Toronto, Toronto, ON Canada, M5S 3E1.Jihui Sha: Department of Biological Chemistry, Geffen School of Medicine at UCLA, University of California, Los Angeles, Los Angeles, CA, USA.Shishang Qin: BIOPIC, Beijing Advanced Innovation Center for Genomics, School of Life Sciences, Peking University, Beijing, People's Republic of China.David Rocco: Department of Genetics, Blavatnik Institute, Harvard Medical School, Boston, MA, USA.James Wohlschlegel: Department of Biological Chemistry, Geffen School of Medicine at UCLA, University of California, Los Angeles, Los Angeles, CA, USA.Alice Y Ting: Chan Zuckerberg Biohub, San Francisco, CA, USA.; Departments of Genetics, Biology, and Chemistry, Stanford University, Stanford, CA, USA.Steven A Carr: Broad Institute of Harvard and MIT, Cambridge, MA, USA.Norbert Perrimon: Department of Genetics, Blavatnik Institute, Harvard Medical School, Boston, MA, USA.; Howard Hughes Medical Institute, Boston, MA, USA.Andrew P McMahon: Department of Stem Cell Biology and Regenerative Medicine, University of Southern California, Los Angeles, CA, USA.; Eli and Edythe Broad Center for Regenerative Medicine and Stem Cell Research, University of Southern California, Los Angeles, CA, USA.",,,,10.1101/2022.04.13.488228,,,0,
41,2022-08-10,Pascal Geldsetzer,,,JMIR research protocols,10.2196/35249,35947440,The Effect of Particulate Matter Exposure During Pregnancy on Pregnancy and Child Health Outcomes in South Asia: Protocol for an Instrumental Variable Analysis.,https://pubmed.ncbi.nlm.nih.gov/35947440,"Determining the longer-term health effects of air pollution has been difficult owing to the multitude of potential confounding variables in the relationship between air pollution and health. Air pollution in many areas of South Asia is seasonal, with large spikes in particulate matter (PM) concentration occurring in the winter months. This study exploits this seasonal variation in PM concentration through a natural experiment.",Bangladesh ; India ; Indo-Gangetic Plain ; Nepal ; PM2.5 ; Pakistan ; air pollution ; birth weight ; child and maternal health ; fine particulate matter ; still birth,,,,,2022/8/11/6/0,2022/08/10,2022/8/11/6/0,Fabian Reitzug ; Stephen P Luby ; Hemant K Pullabhotla ; Pascal Geldsetzer,,"Big Data Institute, Nuffield Department of Population Health, University of Oxford, Oxford, United Kingdom.;Center on Food Security and the Environment, Stanford University, Palo Alto, CA, United States.;Division of Primary Care and Population Health, Department of Medicine, Stanford University, Palo Alto, CA, United States.; Chan Zuckerberg Biohub, San Francisco, CA, United States.;Woods Institute for the Environment, Stanford University, Palo Alto, CA, United States.","Fabian Reitzug: Big Data Institute, Nuffield Department of Population Health, University of Oxford, Oxford, United Kingdom.Stephen P Luby: Woods Institute for the Environment, Stanford University, Palo Alto, CA, United States.Hemant K Pullabhotla: Center on Food Security and the Environment, Stanford University, Palo Alto, CA, United States.Pascal Geldsetzer: Division of Primary Care and Population Health, Department of Medicine, Stanford University, Palo Alto, CA, United States.; Chan Zuckerberg Biohub, San Francisco, CA, United States.",,,,,,,0,
42,2022-08-10,,,,PLoS pathogens,10.1371/journal.ppat.1010543,35969644,Nonlytic cellular release of hepatitis A virus requires dual capsid recruitment of the ESCRT-associated Bro1 domain proteins HD-PTP and ALIX.,https://pubmed.ncbi.nlm.nih.gov/35969644,"Although picornaviruses are conventionally considered 'nonenveloped', members of multiple picornaviral genera are released nonlytically from infected cells in extracellular vesicles. The mechanisms underlying this process are poorly understood. Here, we describe interactions of the hepatitis A virus (HAV) capsid with components of host endosomal sorting complexes required for transport (ESCRT) that play an essential role in release. We show release of quasi-enveloped virus (eHAV) in exosome-like vesicles requires a conserved export signal located within the 8 kDa C-terminal VP1 pX extension that functions in a manner analogous to late domains of canonical enveloped viruses. Fusing pX to a self-assembling engineered protein nanocage (EPN-pX) resulted in its ESCRT-dependent release in extracellular vesicles. Mutational analysis identified a 24 amino acid peptide sequence located within the center of pX that was both necessary and sufficient for nanocage release. Deleting a YxxL motif within this sequence ablated eHAV release, resulting in virus accumulating intracellularly. The pX export signal is conserved in non-human hepatoviruses from a wide range of mammalian species, and functional in pX sequences from bat hepatoviruses when fused to the nanocage protein, suggesting these viruses are released as quasi-enveloped virions. Quantitative proteomics identified multiple ESCRT-related proteins associating with EPN-pX, including ALG2-interacting protein X (ALIX), and its paralog, tyrosine-protein phosphatase non-receptor type 23 (HD-PTP), a second Bro1 domain protein linked to sorting of ubiquitylated cargo into multivesicular endosomes. RNAi-mediated depletion of either Bro1 domain protein impeded eHAV release. Super-resolution fluorescence microscopy demonstrated colocalization of viral capsids with endogenous ALIX and HD-PTP. Co-immunoprecipitation assays using biotin-tagged peptides and recombinant proteins revealed pX interacts directly through the export signal with N-terminal Bro1 domains of both HD-PTP and ALIX. Our study identifies an exceptionally potent viral export signal mediating extracellular release of virus-sized protein assemblies and shows release requires non-redundant activities of both HD-PTP and ALIX.",,,,,,2022/8/16/6/0,2022/08/15,2022/8/16/6/0,Takayoshi Shirasaki ; Hui Feng ; Helen M E Duyvesteyn ; William G Fusco ; Kevin L McKnight ; Ling Xie ; Mark Boyce ; Sathish Kumar ; Rina Barouch-Bentov ; Olga González-López ; Ryan McNamara ; Li Wang ; Adriana Hertel-Wulff ; Xian Chen ; Shirit Einav ; Joseph A Duncan ; Maryna Kapustina ; Elizabeth E Fry ; David I Stuart ; Stanley M Lemon,,"Department of Cell Biology & Physiology, The University of North Carolina at Chapel Hill, Chapel Hill, North Carolina, United States of America.;Department of Medicine, The University of North Carolina at Chapel Hill, Chapel Hill, North Carolina, United States of America.;Division of Infectious Diseases and Geographic Medicine, Department of Medicine, Stanford University School of Medicine, Stanford, California, United States of America.; Department of Microbiology and Immunology, Stanford University School of Medicine, Stanford, California, United States of America.;Division of Infectious Diseases and Geographic Medicine, Department of Medicine, Stanford University School of Medicine, Stanford, California, United States of America.; Department of Microbiology and Immunology, Stanford University School of Medicine, Stanford, California, United States of America.; Chan-Zuckerberg BioHub, San Francisco, California, United States of America.;Division of Structural Biology, The Wellcome Trust Centre for Human Genetics, University of Oxford, Oxford, United Kingdom.;Division of Structural Biology, The Wellcome Trust Centre for Human Genetics, University of Oxford, Oxford, United Kingdom.; Diamond Light Source, Didcot, United Kingdom.;Lineberger Comprehensive Cancer Center, The University of North Carolina at Chapel Hill, Chapel Hill, North Carolina, United States of America.;Lineberger Comprehensive Cancer Center, The University of North Carolina at Chapel Hill, Chapel Hill, North Carolina, United States of America.; Department of Biochemistry and Biophysics, The University of North Carolina at Chapel Hill, Chapel Hill, North Carolina, United States of America.;Lineberger Comprehensive Cancer Center, The University of North Carolina at Chapel Hill, Chapel Hill, North Carolina, United States of America.; Department of Medicine, The University of North Carolina at Chapel Hill, Chapel Hill, North Carolina, United States of America.; Department of Microbiology & Immunology, The University of North Carolina at Chapel Hill, Chapel Hill, North Carolina, United States of America.;Lineberger Comprehensive Cancer Center, The University of North Carolina at Chapel Hill, Chapel Hill, North Carolina, United States of America.; Department of Medicine, The University of North Carolina at Chapel Hill, Chapel Hill, North Carolina, United States of America.; Department of Pharmacology, The University of North Carolina at Chapel Hill, Chapel Hill, North Carolina, United States of America.","Takayoshi Shirasaki: Lineberger Comprehensive Cancer Center, The University of North Carolina at Chapel Hill, Chapel Hill, North Carolina, United States of America.Hui Feng: Lineberger Comprehensive Cancer Center, The University of North Carolina at Chapel Hill, Chapel Hill, North Carolina, United States of America.Helen M E Duyvesteyn: Division of Structural Biology, The Wellcome Trust Centre for Human Genetics, University of Oxford, Oxford, United Kingdom.; Diamond Light Source, Didcot, United Kingdom.William G Fusco: Department of Medicine, The University of North Carolina at Chapel Hill, Chapel Hill, North Carolina, United States of America.Kevin L McKnight: Lineberger Comprehensive Cancer Center, The University of North Carolina at Chapel Hill, Chapel Hill, North Carolina, United States of America.Ling Xie: Lineberger Comprehensive Cancer Center, The University of North Carolina at Chapel Hill, Chapel Hill, North Carolina, United States of America.; Department of Biochemistry and Biophysics, The University of North Carolina at Chapel Hill, Chapel Hill, North Carolina, United States of America.Mark Boyce: Division of Structural Biology, The Wellcome Trust Centre for Human Genetics, University of Oxford, Oxford, United Kingdom.Sathish Kumar: Division of Infectious Diseases and Geographic Medicine, Department of Medicine, Stanford University School of Medicine, Stanford, California, United States of America.; Department of Microbiology and Immunology, Stanford University School of Medicine, Stanford, California, United States of America.Rina Barouch-Bentov: Division of Infectious Diseases and Geographic Medicine, Department of Medicine, Stanford University School of Medicine, Stanford, California, United States of America.; Department of Microbiology and Immunology, Stanford University School of Medicine, Stanford, California, United States of America.Olga González-López: Lineberger Comprehensive Cancer Center, The University of North Carolina at Chapel Hill, Chapel Hill, North Carolina, United States of America.Ryan McNamara: Lineberger Comprehensive Cancer Center, The University of North Carolina at Chapel Hill, Chapel Hill, North Carolina, United States of America.Li Wang: Lineberger Comprehensive Cancer Center, The University of North Carolina at Chapel Hill, Chapel Hill, North Carolina, United States of America.; Department of Biochemistry and Biophysics, The University of North Carolina at Chapel Hill, Chapel Hill, North Carolina, United States of America.Adriana Hertel-Wulff: Lineberger Comprehensive Cancer Center, The University of North Carolina at Chapel Hill, Chapel Hill, North Carolina, United States of America.Xian Chen: Lineberger Comprehensive Cancer Center, The University of North Carolina at Chapel Hill, Chapel Hill, North Carolina, United States of America.; Department of Biochemistry and Biophysics, The University of North Carolina at Chapel Hill, Chapel Hill, North Carolina, United States of America.Shirit Einav: Division of Infectious Diseases and Geographic Medicine, Department of Medicine, Stanford University School of Medicine, Stanford, California, United States of America.; Department of Microbiology and Immunology, Stanford University School of Medicine, Stanford, California, United States of America.; Chan-Zuckerberg BioHub, San Francisco, California, United States of America.Joseph A Duncan: Lineberger Comprehensive Cancer Center, The University of North Carolina at Chapel Hill, Chapel Hill, North Carolina, United States of America.; Department of Medicine, The University of North Carolina at Chapel Hill, Chapel Hill, North Carolina, United States of America.; Department of Pharmacology, The University of North Carolina at Chapel Hill, Chapel Hill, North Carolina, United States of America.Maryna Kapustina: Department of Cell Biology & Physiology, The University of North Carolina at Chapel Hill, Chapel Hill, North Carolina, United States of America.Elizabeth E Fry: Division of Structural Biology, The Wellcome Trust Centre for Human Genetics, University of Oxford, Oxford, United Kingdom.David I Stuart: Division of Structural Biology, The Wellcome Trust Centre for Human Genetics, University of Oxford, Oxford, United Kingdom.; Diamond Light Source, Didcot, United Kingdom.Stanley M Lemon: Lineberger Comprehensive Cancer Center, The University of North Carolina at Chapel Hill, Chapel Hill, North Carolina, United States of America.; Department of Medicine, The University of North Carolina at Chapel Hill, Chapel Hill, North Carolina, United States of America.; Department of Microbiology & Immunology, The University of North Carolina at Chapel Hill, Chapel Hill, North Carolina, United States of America.",,,,10.1101/2022.04.26.489493,,,0,"Elias, Josh; DeRisi, Joe"
