record id,save datetime,biohub author,corresponding author,corresponding author institution,journal,doi,pmid,title,url,abstract,keyword,pdf url,version,version number,type,date,epost date,publish date,authors,authors2,affiliations list,author - affiliations,version,published or not,published_doi,confirm preprint doi,match result,match id,record change number,Match biohub author
1,2022-08-10,Melanie Ott,Melanie Ott,Gladstone Institute of Virology,bioRxiv,10.1101/2022.08.02.502100,,NF-κB inhibitor alpha has a cross-variant role during SARS-CoV-2 infection in ACE2-overexpressing human airway organoids,http://www.biorxiv.org/content/10.1101/2022.08.02.502100v1,"As SARS-CoV-2 continues to spread worldwide, tractable primary airway cell models that accurately recapitulate the cell-intrinsic response to arising viral variants are needed. Here we describe an adult stem cell-derived human airway organoid model overexpressing the ACE2 receptor that supports robust viral replication while maintaining 3D architecture and cellular diversity of the airway epithelium. ACE2-OE organoids were infected with SARS-CoV-2 variants and subjected to single-cell RNA-sequencing. NF-{kappa}B inhibitor alpha was consistently upregulated in infected epithelial cells, and its mRNA expression positively correlated with infection levels. Confocal microscopy showed more I{kappa}B expression in infected than bystander cells, but found concurrent nuclear translocation of NF-{kappa}B that I{kappa}B usually prevents. Overexpressing a nondegradable I{kappa}B mutant reduced NF-{kappa}B translocation and increased viral infection. These data demonstrate the functionality of ACE2-OE organoids in SARS-CoV-2 research and identify an incomplete NF-{kappa}B feedback loop as a rheostat of viral infection that may promote inflammation and severe disease.",,,biorxiv;2022.08.02.502100,1,new results,01/02/2022,01/02/2022,,"Simoneau, C. R.; Chen, P.-Y.; Xing, G. X.; Khalid, M. M.; Meyers, N. L.; Hayashi, J. M.; Taha, T. Y.; Leon, K. E.; Ashuach, T.; Fontaine, K. A.; Rodriguez, L.; Joehnk, B.; Walcott, K.; Vasudevan, S.; Fang, X.; Maishan, M.; Schultz, S.; Roose, J.; Matthay, M. A.; Sil, A.; Arjomandi, M.; Yosef, N.; Ott, M.",Camille R. Simoneau; Pei-Yi Chen; Galen K. Xing; Mir M. Khalid; Nathan L. Meyers; Jennifer M. Hayashi; Taha Y. Taha; Kristoffer E. Leon; Tal Ashuach; Krystal A. Fontaine; Lauren Rodriguez; Bastian Joehnk; Keith Walcott; Sreelakshmi Vasudevan; Xiaohui Fang; Mazharul Maishan; Shawn Schultz; Jeroen Roose; Michael A. Matthay; Anita Sil; Mehrdad Arjomandi; Nir Yosef; Melanie Ott,"Gladstone Institute of Virology; Biomedical Sciences Graduate Program, University of California San Francisco; Gladstone Institute of Virology; Chan-Zuckerberg Biohub; Center for Computational Biology, University of California; Gladstone Institute of Virology; Gladstone Institute of Virology; Gladstone Institute of Virology; Gladstone Institute of Virology; Gladstone Institute of Virology; Medical Scientist Training Program, University of California San Francisco; Center for Computational Biology, University of California; Gladstone Institute of Virology; ImmunoX CoLabs, University of California San Francisco; Department of Microbiology and Immunology, University of California San Francisco; Department of Microbiology and Immunology, University of California San Francisco; Medical Service, San Francisco VA Healthcare System; Department of Medicine and Department of Anesthesia, Cardiovascular Research Institute, University of California San Francisco; Department of Medicine and Department of Anesthesia, Cardiovascular Research Institute, University of California San Francisco; Center for Computational Biology, University of California; Department of Anatomy, University of California San Francisco; Department of Medicine and Department of Anesthesia, Cardiovascular Research Institute, University of California San Francisco; Department of Microbiology and Immunology, University of California San Francisco; Medical Service, San Francisco VA Healthcare System; Division of Pulmonary and Critical Care, Department of Medicine, University of California San Francisco; Center for Computational Biology, University of California; Department of Systems Immunology, Weizmann Institute of Science; Gladstone Institute of Virology; Chan-Zuckerberg Biohub; Department of Medicine, University of California, San Francisco","[['Camille R. Simoneau', 'Gladstone Institute of Virology', 'Biomedical Sciences Graduate Program, University of California San Francisco'], ['Pei-Yi Chen', 'Gladstone Institute of Virology'], ['Galen K. Xing', 'Chan-Zuckerberg Biohub', 'Center for Computational Biology, University of California'], ['Mir M. Khalid', 'Gladstone Institute of Virology'], ['Nathan L. Meyers', 'Gladstone Institute of Virology'], ['Jennifer M. Hayashi', 'Gladstone Institute of Virology'], ['Taha Y. Taha', 'Gladstone Institute of Virology'], ['Kristoffer E. Leon', 'Gladstone Institute of Virology', 'Medical Scientist Training Program, University of California San Francisco'], ['Tal Ashuach', 'Center for Computational Biology, University of California'], ['Krystal A. Fontaine', 'Gladstone Institute of Virology'], ['Lauren Rodriguez', 'ImmunoX CoLabs, University of California San Francisco'], ['Bastian Joehnk', 'Department of Microbiology and Immunology, University of California San Francisco'], ['Keith Walcott', 'Department of Microbiology and Immunology, University of California San Francisco'], ['Sreelakshmi Vasudevan', 'Medical Service, San Francisco VA Healthcare System'], ['Xiaohui Fang', 'Department of Medicine and Department of Anesthesia, Cardiovascular Research Institute, University of California San Francisco'], ['Mazharul Maishan', 'Department of Medicine and Department of Anesthesia, Cardiovascular Research Institute, University of California San Francisco'], ['Shawn Schultz', 'Center for Computational Biology, University of California'], ['Jeroen Roose', 'Department of Anatomy, University of California San Francisco'], ['Michael A. Matthay', 'Department of Medicine and Department of Anesthesia, Cardiovascular Research Institute, University of California San Francisco'], ['Anita Sil', 'Department of Microbiology and Immunology, University of California San Francisco'], ['Mehrdad Arjomandi', 'Medical Service, San Francisco VA Healthcare System', 'Division of Pulmonary and Critical Care, Department of Medicine, University of California San Francisco'], ['Nir Yosef', 'Center for Computational Biology, University of California', 'Department of Systems Immunology, Weizmann Institute of Science'], ['Melanie Ott', 'Gladstone Institute of Virology', 'Chan-Zuckerberg Biohub', 'Department of Medicine, University of California, San Francisco']]",biorxiv;2022.08.02.502100,NA,No yet.,,,,0,
2,2022-08-10,Zev Gartner,Olivier Harismendy,UCSD,bioRxiv,10.1101/2022.07.30.502150,,Differential Analysis of Stromal-Epithelial Interactions between In Situ and Invasive Breast Cancer using Gene Expression Profiling,http://www.biorxiv.org/content/10.1101/2022.07.30.502150v1,"BackgroundChanges in microenvironment cell-cell interactions (CCI) during the progression from ductal carcinoma in situ (DCIS) to invasive ductal carcinoma (IDC) are poorly understood. Gene expression studies are confounded by cellular heterogeneity and few separate stromal and epithelial contributions, resulting in a lack of reliable prognostic biomarker to guide treatment decisions.

MethodsThe gene expression of 293 microdissected regions from DCIS (92 epithelial, 31 stromal) and IDC (78 epithelial, 30 stromal) cases was aggregated from 6 datasets. Expression signatures of 6 cell lineages extracted from normal breast single-cell profiling were used to correct for differences in cell abundance. Subtype-specific functional differences between DCIS and IDC were measured for each region type using Gene Set Enrichment Analysis (GSEA). DCIS-IDC stromal-epithelial interactions were compared using the expression product of 139 ligand-receptor (LR) pairs permuting the DCIS-IDC labels to assess significance.

ResultsVariation in cell-lineage abundance separated epithelial regions into 4 clusters, including one enriched for DCIS (Myoepi-Enriched) and two for IDC (Infiltrated, Vascularized). GSEA on cell lineage normalized expression data identified subtype-independent changes in epithelial regions (induction of Extracellular Matrix maintenance genes, reduction of Tp53 signaling in IDC), as well as subtype-specific changes (proliferation in ER- and Her2-IDC, reduction in Nucleotide Excision Repair in ER+ IDC). In the stroma, Notch and Rho-GTPase signaling were induced in IDC irrespective of subtype. The stromal-epithelial interaction level of 6 and 4 LR pairs were significantly enriched in DCIS and IDC, respectively. Five of the 6 DCIS-enriched LR pairs involved ephrin interactions, with interaction level progressively decreasing from normal to DCIS to IDC. In contrast, 2 IDC-enriched LR pairs involved T-cell activity likely regulating Treg proliferation (CD28-CD86) or T and NK cells stimulation (CD226-PVR). Notably, the bulk expression product of one identified LR pair (EPHB4-EFNB1) was associated with poor survival in IDC (HR=1.47, p=0.04) suggesting that early remodeling of this stromal-epithelial interaction may have long-lasting impact on disease severity.

ConclusionsThe observed changes in cell states and stromal-epithelial interactions, beyond those driven by difference in cell abundance, may lead to new biomarkers for prognosis and targets for secondary prevention.",,,biorxiv;2022.07.30.502150,1,new results,01/02/2022,01/02/2022,,"Officer, A.; Dempsey, A. M.; Murrow, L. M.; Gartner, Z.; Tamayo, P.; Yau, C.; Harismendy, O.",Adam Officer; Andre M. Dempsey; Lyndsay M. Murrow; Zev Gartner; Pablo Tamayo; Christina Yau; Olivier Harismendy,"Moores Cancer Center, UC San Diego School of Medicine; Division of Biomedical Informatics, Department of Medicine, UC San Diego School of Medicine; Harvard Medical School, Harvard University; Department of Pharmaceutical Chemistry, University of California; Department of Pharmaceutical Chemistry, University of California; Chan Zuckerberg Biohub; Moores Cancer Center, UC San Diego School of Medicine; Center for Novel Therapeutics and Division of Medical Genetics, Department of Medicine, UC San Diego School of Medicine; Department of Pharmaceutical Chemistry, University of California; Moores Cancer Center, UC San Diego School of Medicine; Division of Biomedical Informatics, Department of Medicine, UC San Diego School of Medicine","[['Adam Officer', 'Moores Cancer Center, UC San Diego School of Medicine', 'Division of Biomedical Informatics, Department of Medicine, UC San Diego School of Medicine'], ['Andre M. Dempsey', 'Harvard Medical School, Harvard University'], ['Lyndsay M. Murrow', 'Department of Pharmaceutical Chemistry, University of California'], ['Zev Gartner', 'Department of Pharmaceutical Chemistry, University of California', 'Chan Zuckerberg Biohub'], ['Pablo Tamayo', 'Moores Cancer Center, UC San Diego School of Medicine', 'Center for Novel Therapeutics and Division of Medical Genetics, Department of Medicine, UC San Diego School of Medicine'], ['Christina Yau', 'Department of Pharmaceutical Chemistry, University of California'], ['Olivier Harismendy', 'Moores Cancer Center, UC San Diego School of Medicine', 'Division of Biomedical Informatics, Department of Medicine, UC San Diego School of Medicine']]",biorxiv;2022.07.30.502150,NA,No yet.,,,,0,
3,2022-08-10,Norma Neff,Roeland  Nusse,"Howard Hughes Medical Institute, Department of Developmental Biology, Institute for Stem Cell Biology and Regenerative Medicine, Stanford University School of M",bioRxiv,10.1101/2021.10.16.464650,,Intermittent fasting induces rapid hepatocyte proliferation to restore the hepatostat in the mouse liver.,http://www.biorxiv.org/content/10.1101/2021.10.16.464650v2,"Nutrient availability fluctuates in most natural populations, forcing organisms to undergo periods of fasting and re-feeding. It is unknown how dietary changes influence liver homeostasis. Here, we show that a switch from ad libitum feeding to intermittent fasting, IF, promotes rapid hepatocyte proliferation. Mechanistically, IF-induced hepatocyte proliferation is driven by the combined action of intestinally produced, systemic endocrine FGF15 and localized WNT signaling. Hepatocyte proliferation during periods of fasting and re-feeding re-establishes a constant liver-to-body-mass ratio, thus maintaining the hepatostat. This study provides the first example of dietary influence on adult hepatocyte proliferation and challenges the widely held view that liver tissue is mostly quiescent unless chemically or mechanically injured.",,,biorxiv;2021.10.16.464650,2,new results,01/03/2022,01/03/2022,,"Sarkar, A.; Jin, Y.; DeFelice, B. C.; Logan, C. Y.; Yang, Y.; Anbarchian, T.; Wu, P.; Morri, M.; Neff, N.; Nguyen, H.; Rulifson, E.; Fish, M.; Martinez Jaimes, A. M.; Nusse, R.",Abby Sarkar; Yinhua Jin; Brian C. DeFelice; Catriona Logan; Yan Yang; Teni Anbarchian; Peng Wu; Maurizio Morri; Norma Neff; Huy Nguyen; Eric Rulifson; Matt Fish; Azalia M. Martínez Jaimes; Roel Nusse,"Howard Hughes Medical Institute, Department of Developmental Biology, Institute for Stem Cell Biology and Regenerative Medicine, Stanford University School of Medicine; Howard Hughes Medical Institute, Department of Developmental Biology, Institute for Stem Cell Biology and Regenerative Medicine, Stanford University School of Medicine; Chan-Zuckerberg Biohub; Howard Hughes Medical Institute, Department of Developmental Biology, Institute for Stem Cell Biology and Regenerative Medicine, Stanford University School of Medicine; Stanford Center for Genomics & Personalized Medicine, Stanford University School of Medicine; Howard Hughes Medical Institute, Department of Developmental Biology, Institute for Stem Cell Biology and Regenerative Medicine, Stanford University School of Medicine; Howard Hughes Medical Institute, Department of Developmental Biology, Institute for Stem Cell Biology and Regenerative Medicine, Stanford University School of Medicine; Department of Pediatrics, Stanford University School of Medicine; Chan-Zuckerberg Biohub; Chan-Zuckerberg Biohub; Department of Neurology and Neurological Sciences, Stanford University School of Medicine; Howard Hughes Medical Institute, Department of Developmental Biology, Institute for Stem Cell Biology and Regenerative Medicine, Stanford University School of Medicine; Howard Hughes Medical Institute, Department of Developmental Biology, Institute for Stem Cell Biology and Regenerative Medicine, Stanford University School of Medicine; Howard Hughes Medical Institute, Department of Developmental Biology, Institute for Stem Cell Biology and Regenerative Medicine, Stanford University School of Medicine; Howard Hughes Medical Institute, Department of Developmental Biology, Institute for Stem Cell Biology and Regenerative Medicine, Stanford University School of Medicine","[['Abby Sarkar', 'Howard Hughes Medical Institute, Department of Developmental Biology, Institute for Stem Cell Biology and Regenerative Medicine, Stanford University School of Medicine'], ['Yinhua Jin', 'Howard Hughes Medical Institute, Department of Developmental Biology, Institute for Stem Cell Biology and Regenerative Medicine, Stanford University School of Medicine'], ['Brian C. DeFelice', 'Chan-Zuckerberg Biohub'], ['Catriona Logan', 'Howard Hughes Medical Institute, Department of Developmental Biology, Institute for Stem Cell Biology and Regenerative Medicine, Stanford University School of Medicine'], ['Yan Yang', 'Stanford Center for Genomics & Personalized Medicine, Stanford University School of Medicine'], ['Teni Anbarchian', 'Howard Hughes Medical Institute, Department of Developmental Biology, Institute for Stem Cell Biology and Regenerative Medicine, Stanford University School of Medicine'], ['Peng Wu', 'Howard Hughes Medical Institute, Department of Developmental Biology, Institute for Stem Cell Biology and Regenerative Medicine, Stanford University School of Medicine', 'Department of Pediatrics, Stanford University School of Medicine'], ['Maurizio Morri', 'Chan-Zuckerberg Biohub'], ['Norma Neff', 'Chan-Zuckerberg Biohub'], ['Huy Nguyen', 'Department of Neurology and Neurological Sciences, Stanford University School of Medicine'], ['Eric Rulifson', 'Howard Hughes Medical Institute, Department of Developmental Biology, Institute for Stem Cell Biology and Regenerative Medicine, Stanford University School of Medicine'], ['Matt Fish', 'Howard Hughes Medical Institute, Department of Developmental Biology, Institute for Stem Cell Biology and Regenerative Medicine, Stanford University School of Medicine'], ['Azalia M. Martínez Jaimes', 'Howard Hughes Medical Institute, Department of Developmental Biology, Institute for Stem Cell Biology and Regenerative Medicine, Stanford University School of Medicine'], ['Roel Nusse', 'Howard Hughes Medical Institute, Department of Developmental Biology, Institute for Stem Cell Biology and Regenerative Medicine, Stanford University School of Medicine']]",biorxiv;2021.10.16.464650,NA,No yet.,,,,0,
4,2022-08-10,Franklin W. Huang,Elad Ziv,"University of California, San Francisco",bioRxiv,10.1101/2022.08.01.502349,,Profile of the somatic mutational landscape in breast tumors from Hispanic/Latina women,http://www.biorxiv.org/content/10.1101/2022.08.01.502349v1,"Breast cancer causes the most cancer deaths among Hispanic/Latinas (H/L). However, limited tumor-sequencing data from H/L are available to guide treatment. To address this gap, we performed whole-exome sequencing of DNA from 140 HL germline and 146 matched breast tumors and RNA-seq for the tumors. We generated somatic-mutation profiles, identified copy-number alterations (CNAs), and compared results to non-Hispanic White (White) women in The Cancer Genome Atlas. Similar to Whites, PIK3CA and TP53 were the most commonly mutated genes in breast tumors from H/L. We found 4 common COSMIC mutation signatures (1, 2, 3, 13) and signature 16 not previously reported in other breast-cancer datasets. We observed recurrent amplifications in breast-cancer drivers including MYC, FGFR1, CCND1, and ERBB2, and a recurrent amplification on 17q11.2 associated with high KIAA0100 gene expression, implicated in breast-cancer aggressiveness. Expanded research is required to determine how these characteristics of H/L tumors impact treatment response and survival.",,,biorxiv;2022.08.01.502349,1,new results,01/03/2022,01/03/2022,,"Ding, Y. C.; Song, H.; Adamson, A.; Schmolze, D.; Hu, D.; Huntsman, S.; Steele, L.; Patrick, C.; Hernandez, N.; Adams, C. D.; Fejerman, L.; Gardner, K. L.; Napoles, A. M.; Perez-Stable, E. J.; Weitzel, J. N.; Bengtsson, H.; Huang, F. W.; Neuhausen, S. L.; Ziv, E.",Yuan C Ding; Hanbing Song; Aaron Adamson; Daniel Schmolze; Donglei Hu; Scott Huntsman; Linda Steele; Carmina Patrick; Natalie Hernandez; Charleen D Adams; Laura Fejerman; Kevin L. Gardner; Anna María Nápoles; Eliseo J. Pérez-Stable; Jeffrey N. Weitzel; Henrik. Bengtsson; Franklin W. Huang; Susan L. Neuhausen; Elad Ziv,"Department of Population Sciences, Beckman Research Institute of City of Hope; Division of Hematology/Oncology, Department of Medicine, University of California; Department of Population Sciences, Beckman Research Institute of City of Hope; Department of Pathology, City of Hope Medical Center; Division of General Internal Medicine, Department of Medicine, University of California; Division of General Internal Medicine, Department of Medicine, University of California; Department of Population Sciences, Beckman Research Institute of City of Hope; Department of Population Sciences, Beckman Research Institute of City of Hope; Western University of Health Sciences College of Graduate Nursing; Harvard T.H. Chan School of Public Health; Department of Public Health Sciences and Comprehensive Cancer Center, University of California Davis; Department of Pathology and Cell Biology, Columbia University Irvine Medical Center; Division of Intramural Research, National Institute on Minority and Health Disparities, National Institutes of Health; National Institute on Minority and Health Disparities, National Institutes of Health; Latin American School of Oncology; Department of Epidemiology and Biostatistics, University of California; Helen Diller Family Comprehensive Cancer Center, University of California; Division of Hematology/Oncology, Department of Medicine, University of California; Helen Diller Family Comprehensive Cancer Center, University of California; Bakar Computational Health Sciences Institute, University of California; Institute for Human Genetics, University of California, San Francisco; Chan Zuckerberg Biohub; Department of Medicine, San Francisco Veterans Affairs Medical Center; Department of Population Sciences, Beckman Research Institute of City of Hope; Division of General Internal Medicine, Department of Medicine, University of California; Helen Diller Family Comprehensive Cancer Center, University of California; Institute for Human Genetics, University of California, San Francisco","[['Yuan C Ding', 'Department of Population Sciences, Beckman Research Institute of City of Hope'], ['Hanbing Song', 'Division of Hematology/Oncology, Department of Medicine, University of California'], ['Aaron Adamson', 'Department of Population Sciences, Beckman Research Institute of City of Hope'], ['Daniel Schmolze', 'Department of Pathology, City of Hope Medical Center'], ['Donglei Hu', 'Division of General Internal Medicine, Department of Medicine, University of California'], ['Scott Huntsman', 'Division of General Internal Medicine, Department of Medicine, University of California'], ['Linda Steele', 'Department of Population Sciences, Beckman Research Institute of City of Hope'], ['Carmina Patrick', 'Department of Population Sciences, Beckman Research Institute of City of Hope'], ['Natalie Hernandez', 'Western University of Health Sciences College of Graduate Nursing'], ['Charleen D Adams', 'Harvard T.H. Chan School of Public Health'], ['Laura Fejerman', 'Department of Public Health Sciences and Comprehensive Cancer Center, University of California Davis'], ['Kevin L. Gardner', 'Department of Pathology and Cell Biology, Columbia University Irvine Medical Center'], ['Anna María Nápoles', 'Division of Intramural Research, National Institute on Minority and Health Disparities, National Institutes of Health'], ['Eliseo J. Pérez-Stable', 'National Institute on Minority and Health Disparities, National Institutes of Health'], ['Jeffrey N. Weitzel', 'Latin American School of Oncology'], ['Henrik. Bengtsson', 'Department of Epidemiology and Biostatistics, University of California', 'Helen Diller Family Comprehensive Cancer Center, University of California'], ['Franklin W. Huang', 'Division of Hematology/Oncology, Department of Medicine, University of California', 'Helen Diller Family Comprehensive Cancer Center, University of California', 'Bakar Computational Health Sciences Institute, University of California', 'Institute for Human Genetics, University of California, San Francisco', 'Chan Zuckerberg Biohub', 'Department of Medicine, San Francisco Veterans Affairs Medical Center'], ['Susan L. Neuhausen', 'Department of Population Sciences, Beckman Research Institute of City of Hope'], ['Elad Ziv', 'Division of General Internal Medicine, Department of Medicine, University of California', 'Helen Diller Family Comprehensive Cancer Center, University of California', 'Institute for Human Genetics, University of California, San Francisco']]",biorxiv;2022.08.01.502349,NA,No yet.,,,,0,
