record id,save datetime,biohub author,corresponding author,corresponding author institution,journal,doi,pmid,title,url,abstract,keyword,pdf url,version,version number,type,date,epost date,publish date,authors,authors2,affiliations list,author - affiliations,version,published or not,published_doi,confirm preprint doi,match result,match id,record change number,Match biohub author
23,2022-08-12,James Zou,,,Science advances,10.1126/sciadv.abq6147,35960806,"Disparities in dermatology AI performance on a diverse, curated clinical image set.",https://pubmed.ncbi.nlm.nih.gov/35960806,"An estimated 3 billion people lack access to dermatological care globally. Artificial intelligence (AI) may aid in triaging skin diseases and identifying malignancies. However, most AI models have not been assessed on images of diverse skin tones or uncommon diseases. Thus, we created the Diverse Dermatology Images (DDI) dataset-the first publicly available, expertly curated, and pathologically confirmed image dataset with diverse skin tones. We show that state-of-the-art dermatology AI models exhibit substantial limitations on the DDI dataset, particularly on dark skin tones and uncommon diseases. We find that dermatologists, who often label AI datasets, also perform worse on images of dark skin tones and uncommon diseases. Fine-tuning AI models on the DDI images closes the performance gap between light and dark skin tones. These findings identify important weaknesses and biases in dermatology AI that should be addressed for reliable application to diverse patients and diseases.",,,,,,2022/8/13/6/0,2022/08/12,2022/8/13/6/0,Roxana Daneshjou ; Kailas Vodrahalli ; Roberto A Novoa ; Melissa Jenkins ; Weixin Liang ; Veronica Rotemberg ; Justin Ko ; Susan M Swetter ; Elizabeth E Bailey ; Olivier Gevaert ; Pritam Mukherjee ; Michelle Phung ; Kiana Yekrang ; Bradley Fong ; Rachna Sahasrabudhe ; Johan A C Allerup ; Utako Okata-Karigane ; James Zou ; Albert S Chiou,,"Department of Biomedical Data Science, Stanford School of Medicine, Stanford, CA, USA.;Department of Biomedical Data Science, Stanford School of Medicine, Stanford, CA, USA.; Department of Electrical Engineering, Stanford University, Stanford, CA, USA.; Department of Computer Science, Stanford University, Stanford, CA, USA.; Chan-Zuckerberg Biohub, San Francisco, CA, USA.;Department of Computer Science, Stanford University, Stanford, CA, USA.;Department of Dermatology, Keio University School of Medicine, Tokyo, Japan.;Department of Dermatology, Stanford School of Medicine, Redwood City, CA, USA.;Department of Dermatology, Stanford School of Medicine, Redwood City, CA, USA.; Department of Biomedical Data Science, Stanford School of Medicine, Stanford, CA, USA.;Department of Dermatology, Stanford School of Medicine, Redwood City, CA, USA.; Department of Pathology, Stanford School of Medicine, Stanford, CA, USA.;Department of Electrical Engineering, Stanford University, Stanford, CA, USA.;Dermatology Service, Memorial Sloan Kettering Cancer Center, New York, NY, USA.","Roxana Daneshjou: Department of Dermatology, Stanford School of Medicine, Redwood City, CA, USA.; Department of Biomedical Data Science, Stanford School of Medicine, Stanford, CA, USA.Kailas Vodrahalli: Department of Electrical Engineering, Stanford University, Stanford, CA, USA.Roberto A Novoa: Department of Dermatology, Stanford School of Medicine, Redwood City, CA, USA.; Department of Pathology, Stanford School of Medicine, Stanford, CA, USA.Melissa Jenkins: Department of Dermatology, Stanford School of Medicine, Redwood City, CA, USA.Weixin Liang: Department of Computer Science, Stanford University, Stanford, CA, USA.Veronica Rotemberg: Dermatology Service, Memorial Sloan Kettering Cancer Center, New York, NY, USA.Justin Ko: Department of Dermatology, Stanford School of Medicine, Redwood City, CA, USA.Susan M Swetter: Department of Dermatology, Stanford School of Medicine, Redwood City, CA, USA.Elizabeth E Bailey: Department of Dermatology, Stanford School of Medicine, Redwood City, CA, USA.Olivier Gevaert: Department of Biomedical Data Science, Stanford School of Medicine, Stanford, CA, USA.Pritam Mukherjee: Department of Biomedical Data Science, Stanford School of Medicine, Stanford, CA, USA.Michelle Phung: Department of Dermatology, Stanford School of Medicine, Redwood City, CA, USA.Kiana Yekrang: Department of Dermatology, Stanford School of Medicine, Redwood City, CA, USA.Bradley Fong: Department of Dermatology, Stanford School of Medicine, Redwood City, CA, USA.Rachna Sahasrabudhe: Department of Dermatology, Stanford School of Medicine, Redwood City, CA, USA.Johan A C Allerup: Department of Dermatology, Stanford School of Medicine, Redwood City, CA, USA.Utako Okata-Karigane: Department of Dermatology, Keio University School of Medicine, Tokyo, Japan.James Zou: Department of Biomedical Data Science, Stanford School of Medicine, Stanford, CA, USA.; Department of Electrical Engineering, Stanford University, Stanford, CA, USA.; Department of Computer Science, Stanford University, Stanford, CA, USA.; Chan-Zuckerberg Biohub, San Francisco, CA, USA.Albert S Chiou: Department of Dermatology, Stanford School of Medicine, Redwood City, CA, USA.",,,,,,,0,"Hockemeyer, Dirk"
24,2022-08-12,Ana Paula Arruda,,,Cold Spring Harbor perspectives in biology,10.1101/cshperspect.a041261,35940911,Endoplasmic Reticulum Architecture and Inter-Organelle Communication in Metabolic Health and Disease.,https://pubmed.ncbi.nlm.nih.gov/35940911,"The endoplasmic reticulum (ER) is a key organelle involved in the regulation of lipid and glucose metabolism, proteostasis, Ca",,,,,,2022/8/9/6/0,2022/08/08,2022/8/9/6/0,Ana Paula Arruda ; Güneş Parlakgül,,"Department of Nutritional Sciences and Toxicology, University of California Berkeley, Berkeley, California 94720, USA.; Chan Zuckerberg Biohub, San Francisco, California 94158, USA.;Department of Nutritional Sciences and Toxicology, University of California Berkeley, Berkeley, California 94720, USA.; Sabri Ülker Center for Metabolic Research and Department of Molecular Metabolism, Harvard T.H. Chan School of Public Health, Boston, Massachusetts 02115, USA.","Ana Paula Arruda: Department of Nutritional Sciences and Toxicology, University of California Berkeley, Berkeley, California 94720, USA.; Chan Zuckerberg Biohub, San Francisco, California 94158, USA.Güneş Parlakgül: Department of Nutritional Sciences and Toxicology, University of California Berkeley, Berkeley, California 94720, USA.; Sabri Ülker Center for Metabolic Research and Department of Molecular Metabolism, Harvard T.H. Chan School of Public Health, Boston, Massachusetts 02115, USA.",,,,,,,0,"Wang, Taia"
25,2022-08-12,Aashish Manglik,Yifan ChengAashish Manglik,"Department of Biochemistry and Biophysics, University of California, San Francisco, CA, USA. Yifan.Cheng@ucsf.edu.; Biophysics Graduate Program, University of California, San Francisco, CA, USA. Yifan.Cheng@ucsf.edu.; Howard Hughes Medical Institute, University of California, San Francisco, CA, USA. Yifan.Cheng@ucsf.edu.Department of Pharmaceutical Chemistry, University of California, San Francisco, CA, USA. Aashish.Manglik@ucsf.edu.; Biophysics Graduate Program, University of California, San Francisco, CA, USA. Aashish.Manglik@ucsf.edu.; Department of Anesthesia and Perioperative Care, University of California, San Francisco, CA, USA. Aashish.Manglik@ucsf.edu.; Chan Zuckerberg Biohub, San Francisco, CA, USA. Aashish.Manglik@ucsf.edu.",Nature,10.1038/s41586-022-05159-1,35940205,Autoantibody mimicry of hormone action at the thyrotropin receptor.,https://pubmed.ncbi.nlm.nih.gov/35940205,"Thyroid hormones are vital in metabolism, growth and development",,,,,,2022/8/9/6/0,2022/08/08,2022/8/9/6/0,Bryan Faust ; Christian B Billesbølle ; Carl-Mikael Suomivuori ; Isha Singh ; Kaihua Zhang ; Nicholas Hoppe ; Antonio F M Pinto ; Jolene K Diedrich ; Yagmur Muftuoglu ; Mariusz W Szkudlinski ; Alan Saghatelian ; Ron O Dror ; Yifan Cheng ; Aashish Manglik,,"Clayton Foundation Laboratory for Peptide Biology Lab, Salk Institute for Biological Studies, La Jolla, CA, USA.;Department of Biochemistry and Biophysics, University of California, San Francisco, CA, USA.;Department of Biochemistry and Biophysics, University of California, San Francisco, CA, USA. Yifan.Cheng@ucsf.edu.; Biophysics Graduate Program, University of California, San Francisco, CA, USA. Yifan.Cheng@ucsf.edu.; Howard Hughes Medical Institute, University of California, San Francisco, CA, USA. Yifan.Cheng@ucsf.edu.;Department of Computer Science, Stanford University, Stanford, CA, USA.; Department of Molecular and Cellular Physiology, Stanford University School of Medicine, Stanford, CA, USA.; Department of Structural Biology, Stanford University School of Medicine, Stanford, CA, USA.; Institute for Computational and Mathematical Engineering, Stanford University, Stanford, CA, USA.;Department of Pharmaceutical Chemistry, University of California, San Francisco, CA, USA.;Department of Pharmaceutical Chemistry, University of California, San Francisco, CA, USA. Aashish.Manglik@ucsf.edu.; Biophysics Graduate Program, University of California, San Francisco, CA, USA. Aashish.Manglik@ucsf.edu.; Department of Anesthesia and Perioperative Care, University of California, San Francisco, CA, USA. Aashish.Manglik@ucsf.edu.; Chan Zuckerberg Biohub, San Francisco, CA, USA. Aashish.Manglik@ucsf.edu.;Department of Pharmaceutical Chemistry, University of California, San Francisco, CA, USA.; Biophysics Graduate Program, University of California, San Francisco, CA, USA.;Department of Pharmaceutical Chemistry, University of California, San Francisco, CA, USA.; Department of Biochemistry and Biophysics, University of California, San Francisco, CA, USA.; Biophysics Graduate Program, University of California, San Francisco, CA, USA.;Mass Spectrometry Core for Proteomics and Metabolomics, Salk Institute for Biological Studies, La Jolla, CA, USA.;Stanford University School of Medicine, Stanford, CA, USA.;Trophogen, Rockville, MD, USA.","Bryan Faust: Department of Pharmaceutical Chemistry, University of California, San Francisco, CA, USA.; Department of Biochemistry and Biophysics, University of California, San Francisco, CA, USA.; Biophysics Graduate Program, University of California, San Francisco, CA, USA.Christian B Billesbølle: Department of Pharmaceutical Chemistry, University of California, San Francisco, CA, USA.Carl-Mikael Suomivuori: Department of Computer Science, Stanford University, Stanford, CA, USA.; Department of Molecular and Cellular Physiology, Stanford University School of Medicine, Stanford, CA, USA.; Department of Structural Biology, Stanford University School of Medicine, Stanford, CA, USA.; Institute for Computational and Mathematical Engineering, Stanford University, Stanford, CA, USA.Isha Singh: Department of Pharmaceutical Chemistry, University of California, San Francisco, CA, USA.Kaihua Zhang: Department of Biochemistry and Biophysics, University of California, San Francisco, CA, USA.Nicholas Hoppe: Department of Pharmaceutical Chemistry, University of California, San Francisco, CA, USA.; Biophysics Graduate Program, University of California, San Francisco, CA, USA.Antonio F M Pinto: Mass Spectrometry Core for Proteomics and Metabolomics, Salk Institute for Biological Studies, La Jolla, CA, USA.Jolene K Diedrich: Mass Spectrometry Core for Proteomics and Metabolomics, Salk Institute for Biological Studies, La Jolla, CA, USA.Yagmur Muftuoglu: Stanford University School of Medicine, Stanford, CA, USA.Mariusz W Szkudlinski: Trophogen, Rockville, MD, USA.Alan Saghatelian: Clayton Foundation Laboratory for Peptide Biology Lab, Salk Institute for Biological Studies, La Jolla, CA, USA.Ron O Dror: Department of Computer Science, Stanford University, Stanford, CA, USA.; Department of Molecular and Cellular Physiology, Stanford University School of Medicine, Stanford, CA, USA.; Department of Structural Biology, Stanford University School of Medicine, Stanford, CA, USA.; Institute for Computational and Mathematical Engineering, Stanford University, Stanford, CA, USA.Yifan Cheng: Department of Biochemistry and Biophysics, University of California, San Francisco, CA, USA. Yifan.Cheng@ucsf.edu.; Biophysics Graduate Program, University of California, San Francisco, CA, USA. Yifan.Cheng@ucsf.edu.; Howard Hughes Medical Institute, University of California, San Francisco, CA, USA. Yifan.Cheng@ucsf.edu.Aashish Manglik: Department of Pharmaceutical Chemistry, University of California, San Francisco, CA, USA. Aashish.Manglik@ucsf.edu.; Biophysics Graduate Program, University of California, San Francisco, CA, USA. Aashish.Manglik@ucsf.edu.; Department of Anesthesia and Perioperative Care, University of California, San Francisco, CA, USA. Aashish.Manglik@ucsf.edu.; Chan Zuckerberg Biohub, San Francisco, CA, USA. Aashish.Manglik@ucsf.edu.",,,,,,,0,"Kim, Peter"
26,2022-08-12,Christina D Smolke,,,Proceedings of the National Academy of Sciences of the United States of America,10.1073/pnas.2205848119,35939674,Biosynthesis of tetrahydropapaverine and semisynthesis of papaverine in yeast.,https://pubmed.ncbi.nlm.nih.gov/35939674,"Tetrahydropapaverine (THP) and papaverine are plant natural products with clinically significant roles. THP is a precursor in the production of the drugs atracurium and cisatracurium, and papaverine is used as an antispasmodic during vascular surgery. In recent years, metabolic engineering advances have enabled the production of natural products through heterologous expression of pathway enzymes in yeast. Heterologous biosynthesis of THP and papaverine could play a role in ensuring a stable supply of these clinically significant products. Biosynthesis of THP and papaverine has not been achieved to date, in part because multiple pathway enzymes have not been elucidated. Here, we describe the development of an engineered yeast strain for de novo biosynthesis of THP. The production of THP is achieved through heterologous expression of two enzyme variants with activity on nonnative substrates. Through protein engineering, we developed a variant of ",metabolic engineering ; papaverine ; plant natural products ; protein engineering ; tetrahydropapaverine,,,,,2022/8/9/6/0,2022/08/08,2022/8/9/6/0,Osman K Jamil ; Aaron Cravens ; James T Payne ; Colin Y Kim ; Christina D Smolke,,"Department of Bioengineering, Stanford University, Stanford, CA 94305.;Department of Bioengineering, Stanford University, Stanford, CA 94305.; Chan Zuckerberg Biohub, San Francisco, CA 94158.;Department of Chemical Engineering, Stanford University, Stanford, CA 94305.","Osman K Jamil: Department of Chemical Engineering, Stanford University, Stanford, CA 94305.Aaron Cravens: Department of Bioengineering, Stanford University, Stanford, CA 94305.James T Payne: Department of Bioengineering, Stanford University, Stanford, CA 94305.Colin Y Kim: Department of Bioengineering, Stanford University, Stanford, CA 94305.Christina D Smolke: Department of Bioengineering, Stanford University, Stanford, CA 94305.; Chan Zuckerberg Biohub, San Francisco, CA 94158.",,,,,,,0,"Zou, James"
27,2022-08-12,Amy KistlerKalani Ratnasiri,,,PloS one,10.1371/journal.pone.0252498,35939507,Quantitative reverse transcription PCR assay to detect a genetic marker of pyrethroid resistance in Culex mosquitoes.,https://pubmed.ncbi.nlm.nih.gov/35939507,"Pyrethroid insecticides are widely used to control mosquitoes that transmit pathogens such as West Nile virus (WNV) to people. Single nucleotide polymorphisms (SNP) in the knockdown resistance locus (kdr) of the voltage gated sodium channel (Vgsc) gene in Culex mosquitoes are associated with knockdown resistance to pyrethroids. RNAseq was used to sequence the coding region of Vgsc for Culex tarsalis Coquillett and Culex erythrothorax Dyar, two WNV vectors. The cDNA sequences were used to develop a quantitative reverse transcriptase PCR assay that detects the L1014F kdr mutation in the Vgsc. Because this locus is conserved, the assay was used successfully in six Culex spp. The resulting Culex RTkdr assay was validated using quantitative PCR and sequencing of PCR products. The accuracy of the Culex RTkdr assay was 99%. The L1014F kdr mutation associated with pyrethroid resistance was more common among Cx. pipiens than other Culex spp. and was more prevalent in mosquitoes collected near farmland. The Culex RTkdr assay takes advantage of the RNA that vector control agencies routinely isolate to assess arbovirus prevalence in mosquitoes. We anticipate that public health and vector control agencies may employ the Culex RTkdr assay to define the geographic distribution of the L1014F kdr mutation in Culex species and improve the monitoring of insecticide resistance that will ultimately contribute to effective control of Culex mosquitoes.",,,,,,2022/8/9/6/0,2022/08/08,2022/8/9/6/0,Kelli M Hager ; Erick Gaona ; Amy Kistler ; Kalani Ratnasiri ; Hanna Retallack ; Miguel Barretto ; Sarah S Wheeler ; Christopher M Hoover ; Eric J Haas-Stapleton,,"Alameda County Mosquito Abatement District, Hayward, CA, United States of America.;Alameda County Mosquito Abatement District, Hayward, CA, United States of America.; School of Public Health, University of California, Berkeley, Berkeley, CA, United States of America.;Chan Zuckerberg Biohub, San Francisco, CA, United States of America.;Sacramento-Yolo County Mosquito and Vector Control District, Elk Grove, CA, United States of America.;School of Public Health, University of California, Berkeley, Berkeley, CA, United States of America.;University of California, San Francisco, CA, United States of America.","Kelli M Hager: Alameda County Mosquito Abatement District, Hayward, CA, United States of America.; School of Public Health, University of California, Berkeley, Berkeley, CA, United States of America.Erick Gaona: Alameda County Mosquito Abatement District, Hayward, CA, United States of America.Amy Kistler: Chan Zuckerberg Biohub, San Francisco, CA, United States of America.Kalani Ratnasiri: Chan Zuckerberg Biohub, San Francisco, CA, United States of America.Hanna Retallack: University of California, San Francisco, CA, United States of America.Miguel Barretto: Alameda County Mosquito Abatement District, Hayward, CA, United States of America.Sarah S Wheeler: Sacramento-Yolo County Mosquito and Vector Control District, Elk Grove, CA, United States of America.Christopher M Hoover: School of Public Health, University of California, Berkeley, Berkeley, CA, United States of America.Eric J Haas-Stapleton: Alameda County Mosquito Abatement District, Hayward, CA, United States of America.",,,,,,,0,
