record id,save datetime,biohub author,corresponding author,corresponding author institution,journal,doi,pmid,title,url,abstract,keyword,pdf url,version,version number,type,date,epost date,publish date,authors,authors2,affiliations list,author - affiliations,version,published or not,published_doi,confirm preprint doi,match result,match id,record change number,Match biohub author
6,2022-08-12,,,,arxiv,10.48550/arXiv.2208.11223,,"POPDx: An Automated Framework for Patient Phenotyping across 392,246 Individuals in the UK Biobank Study",https://arxiv.org/abs/2208.11223,"Objective For the UK Biobank standardized phenotype codes are associated withpatients who have been hospitalized but are missing for many patients who havebeen treated exclusively in an outpatient setting. We describe a method forphenotype recognition that imputes phenotype codes for all UK Biobankparticipants. Materials and Methods POPDx (Population-based ObjectivePhenotyping by Deep Extrapolation) is a bilinear machine learning framework forsimultaneously estimating the probabilities of 1,538 phenotype codes. Weextracted phenotypic and health-related information of 392,246 individuals fromthe UK Biobank for POPDx development and evaluation. A total of 12,803 ICD-10diagnosis codes of the patients were converted to 1,538 Phecodes as goldstandard labels. The POPDx framework was evaluated and compared to otheravailable methods on automated multi-phenotype recognition. Results POPDx canpredict phenotypes that are rare or even unobserved in training. We demonstratesubstantial improvement of automated multi-phenotype recognition across 22disease categories, and its application in identifying key epidemiologicalfeatures associated with each phenotype. Conclusions POPDx helps providewell-defined cohorts for downstream studies. It is a general purpose methodthat can be applied to other biobanks with diverse but incomplete data.",,https://arxiv.org/pdf/2208.11223,arXiv:2208.11223v1,,,08/23/2022,08/23/2022,,,"Lu Yang, Sheng Wang, Russ B. Altman",,,arXiv:2208.11223v1,,,,,,0,
7,2022-08-12,,,,arxiv,10.48550/arXiv.2208.10661,,Therapeutic algebra of immunomodulatory drug responses at single-cell resolution,https://arxiv.org/abs/2208.10661,"Therapeutic modulation of immune states is central to the treatment of humandisease. However, how drugs and drug combinations impact the diverse cell typesin the human immune system remains poorly understood at the transcriptomescale. Here, we apply single-cell mRNA-seq to profile the response of humanimmune cells to 502 immunomodulatory drugs alone and in combination. We developa unified mathematical model that quantitatively describes the transcriptomescale response of myeloid and lymphoid cell types to individual drugs and drugcombinations through a single inferred regulatory network. The mathematicalmodel reveals how drug combinations generate novel, macrophage and T-cellstates by recruiting combinations of gene expression programs through bothadditive and non-additive drug interactions. A simplified drug response algebraallows us to predict the continuous modulation of immune cell populationsbetween activated, resting and hyper-inhibited states through combinatorialdrug dose titrations. Our results suggest that transcriptome-scale mathematicalmodels could enable the design of therapeutic strategies for programming thehuman immune system using combinations of therapeutics.",,https://arxiv.org/pdf/2208.10661,arXiv:2208.10661v1,,,08/23/2022,08/23/2022,,,"Jialong Jiang, Sisi Chen, Tiffany Tsou, Christopher S. McGinnis, Tahmineh Khazaei, Qin Zhu, Jong H. Park, Paul Rivaud, Inna-Marie Strazhnik, Eric D. Chow, David A. Sivak, Zev J. Gartner, Matt Thomson",,,arXiv:2208.10661v1,,,,,,0,
8,2022-08-12,,,,arxiv,10.48550/arXiv.2209.09105,,Development and Clinical Evaluation of an AI Support Tool for Improving Telemedicine Photo Quality,https://arxiv.org/abs/2209.09105,"Telemedicine utilization was accelerated during the COVID-19 pandemic, andskin conditions were a common use case. However, the quality of photographssent by patients remains a major limitation. To address this issue, wedeveloped TrueImage 2.0, an artificial intelligence (AI) model for assessingpatient photo quality for telemedicine and providing real-time feedback topatients for photo quality improvement. TrueImage 2.0 was trained on 1700telemedicine images annotated by clinicians for photo quality. On aretrospective dataset of 357 telemedicine images, TrueImage 2.0 effectivelyidentified poor quality images (Receiver operator curve area under the curve(ROC-AUC) =0.78) and the reason for poor quality (Blurry ROC-AUC=0.84, Lightingissues ROC-AUC=0.70). The performance is consistent across age, gender, andskin tone. Next, we assessed whether patient-TrueImage 2.0 interaction led toan improvement in submitted photo quality through a prospective clinical pilotstudy with 98 patients. TrueImage 2.0 reduced the number of patients with apoor-quality image by 68.0%.",,https://arxiv.org/pdf/2209.09105,arXiv:2209.09105v1,,,09/12/2022,09/12/2022,,,"Kailas Vodrahalli, Justin Ko, Albert S. Chiou, Roberto Novoa, Abubakar Abid, Michelle Phung, Kiana Yekrang, Paige Petrone, James Zou, Roxana Daneshjou",,,arXiv:2209.09105v1,,,,,,0,
9,2022-08-12,,,,arxiv,10.48550/arXiv.2209.15458,,Towards General-Purpose Representation Learning of Polygonal Geometries,https://arxiv.org/abs/2209.15458,"Neural network representation learning for spatial data is a common need forgeographic artificial intelligence (GeoAI) problems. In recent years, manyadvancements have been made in representation learning for points, polylines,and networks, whereas little progress has been made for polygons, especiallycomplex polygonal geometries. In this work, we focus on developing ageneral-purpose polygon encoding model, which can encode a polygonal geometry(with or without holes, single or multipolygons) into an embedding space. Theresult embeddings can be leveraged directly (or finetuned) for downstream taskssuch as shape classification, spatial relation prediction, and so on. Toachieve model generalizability guarantees, we identify a few desirableproperties: loop origin invariance, trivial vertex invariance, part permutationinvariance, and topology awareness. We explore two different designs for theencoder: one derives all representations in the spatial domain; the otherleverages spectral domain representations. For the spatial domain approach, wepropose ResNet1D, a 1D CNN-based polygon encoder, which uses circular paddingto achieve loop origin invariance on simple polygons. For the spectral domainapproach, we develop NUFTspec based on Non-Uniform Fourier Transformation(NUFT), which naturally satisfies all the desired properties. We conductexperiments on two tasks: 1) shape classification based on MNIST; 2) spatialrelation prediction based on two new datasets - DBSR-46K and DBSR-cplx46K. Ourresults show that NUFTspec and ResNet1D outperform multiple existing baselineswith significant margins. While ResNet1D suffers from model performancedegradation after shape-invariance geometry modifications, NUFTspec is veryrobust to these modifications due to the nature of the NUFT.",,https://arxiv.org/pdf/2209.15458,arXiv:2209.15458v1,,,09/29/2022,09/29/2022,,,"Gengchen Mai, Chiyu Jiang, Weiwei Sun, Rui Zhu, Yao Xuan, Ling Cai, Krzysztof Janowicz, Stefano Ermon, Ni Lao",,,arXiv:2209.15458v1,,,,,,0,
10,2022-08-12,,,,arxiv,10.48550/arXiv.2210.01383,,Generalizing Bayesian Optimization with Decision-theoretic Entropies,https://arxiv.org/abs/2210.01383,"Bayesian optimization (BO) is a popular method for efficiently inferringoptima of an expensive black-box function via a sequence of queries. Existinginformation-theoretic BO procedures aim to make queries that most reduce theuncertainty about optima, where the uncertainty is captured by Shannon entropy.However, an optimal measure of uncertainty would, ideally, factor in how weintend to use the inferred quantity in some downstream procedure. In thispaper, we instead consider a generalization of Shannon entropy from work instatistical decision theory (DeGroot 1962, Rao 1984), which contains a broadclass of uncertainty measures parameterized by a problem-specific loss functioncorresponding to a downstream task. We first show that special cases of thisentropy lead to popular acquisition functions used in BO procedures such asknowledge gradient, expected improvement, and entropy search. We then show howalternative choices for the loss yield a flexible family of acquisitionfunctions that can be customized for use in novel optimization settings.Additionally, we develop gradient-based methods to efficiently optimize ourproposed family of acquisition functions, and demonstrate strong empiricalperformance on a diverse set of sequential decision making tasks, includingvariants of top-$k$ optimization, multi-level set estimation, and sequencesearch.",,https://arxiv.org/pdf/2210.01383,arXiv:2210.01383v1,,,10/04/2022,10/04/2022,,,"Willie Neiswanger, Lantao Yu, Shengjia Zhao, Chenlin Meng, Stefano Ermon",,,arXiv:2210.01383v1,,,,,,0,
11,2022-08-12,,,,arxiv,10.48550/arXiv.2210.04642,,Exploration via Planning for Information about the Optimal Trajectory,https://arxiv.org/abs/2210.04642,"Many potential applications of reinforcement learning (RL) are stymied by thelarge numbers of samples required to learn an effective policy. This isespecially true when applying RL to real-world control tasks, e.g. in thesciences or robotics, where executing a policy in the environment is costly. Inpopular RL algorithms, agents typically explore either by adding stochasticityto a reward-maximizing policy or by attempting to gather maximal informationabout environment dynamics without taking the given task into account. In thiswork, we develop a method that allows us to plan for exploration while takingboth the task and the current knowledge about the dynamics into account. Thekey insight to our approach is to plan an action sequence that maximizes theexpected information gain about the optimal trajectory for the task at hand. Wedemonstrate that our method learns strong policies with 2x fewer samples thanstrong exploration baselines and 200x fewer samples than model free methods ona diverse set of low-to-medium dimensional control tasks in both the open-loopand closed-loop control settings.",,https://arxiv.org/pdf/2210.04642,arXiv:2210.04642v1,,,10/06/2022,10/06/2022,,,"Viraj Mehta, Ian Char, Joseph Abbate, Rory Conlin, Mark D. Boyer, Stefano Ermon, Jeff Schneider, Willie Neiswanger",,,arXiv:2210.04642v1,,,,,,0,
12,2022-08-12,,,,arxiv,10.48550/arXiv.2210.03324,,AutoML for Climate Change: A Call to Action,https://arxiv.org/abs/2210.03324,"The challenge that climate change poses to humanity has spurred a rapidlydeveloping field of artificial intelligence research focused on climate changeapplications. The climate change AI (CCAI) community works on a diverse,challenging set of problems which often involve physics-constrained ML orheterogeneous spatiotemporal data. It would be desirable to use automatedmachine learning (AutoML) techniques to automatically find high-performingarchitectures and hyperparameters for a given dataset. In this work, webenchmark popular AutoML libraries on three high-leverage CCAI applications:climate modeling, wind power forecasting, and catalyst discovery. We find thatout-of-the-box AutoML libraries currently fail to meaningfully surpass theperformance of human-designed CCAI models. However, we also identify a few keyweaknesses, which stem from the fact that most AutoML techniques are tailoredto computer vision and NLP applications. For example, while dozens of searchspaces have been designed for image and language data, none have been designedfor spatiotemporal data. Addressing these key weaknesses can lead to thediscovery of novel architectures that yield substantial performance gainsacross numerous CCAI applications. Therefore, we present a call to action tothe AutoML community, since there are a number of concrete, promisingdirections for future work in the space of AutoML for CCAI. We release our codeand a list of resources athttps://github.com/climate-change-automl/climate-change-automl.",,https://arxiv.org/pdf/2210.03324,arXiv:2210.03324v1,,,10/07/2022,10/07/2022,,,"Renbo Tu, Nicholas Roberts, Vishak Prasad, Sibasis Nayak, Paarth Jain, Frederic Sala, Ganesh Ramakrishnan, Ameet Talwalkar, Willie Neiswanger, Colin White",,,arXiv:2210.03324v1,,,,,,0,
13,2022-08-12,,,,arxiv,10.48550/arXiv.2210.04979,,Label-free segmentation from cardiac ultrasound using self-supervised learning,https://arxiv.org/abs/2210.04979,"Background: Segmentation and measurement of cardiac chambers is critical inechocardiography but is also laborious and poorly reproducible. Neural networkscan assist, but supervised approaches require the same laborious manualannotations, while unsupervised approaches have fared poorly in ultrasound todate. Objectives: We built a pipeline for self-supervised (no manual labelsrequired) segmentation of cardiac chambers, combining computer vision, clinicaldomain knowledge, and deep learning. Methods: We trained on 450 echocardiograms(145,000 images) and tested on 8,393 echocardiograms (4,476,266 images; meanage 61 years, 51% female), using the resulting segmentations to calculatestructural and functional measurements. We also tested our pipeline againstexternal images from an additional 10,030 patients (20,060 images) withavailable manual tracings of the left ventricle. Results: r2 between clinicallymeasured and pipeline-predicted measurements were similar to reportedinter-clinician variation for LVESV and LVEDV (pipeline vs. clinical r2= 0.74and r2=0.65, respectively), LVEF and LV mass (r2= 0.46 and r2=0.54), left andright atrium volumes (r2=0.7 and r2=0.6), and right ventricle area (r2=0.47).When binarized into normal vs. abnormal categories, average accuracy was 0.81(range 0.71-0.95). A subset of the test echocardiograms (n=553) hadcorresponding cardiac MRI; correlation between pipeline and CMR measurementswas similar to that between clinical echocardiogram and CMR. Finally, in theexternal dataset, our pipeline accurately segments the left ventricle with anaverage Dice score of 0.83 (95% CI 0.83). Conclusions: Our results demonstratea human-label-free, valid, and scalable method for segmentation fromultrasound, a noisy but globally important imaging modality.",,https://arxiv.org/pdf/2210.04979,arXiv:2210.04979v1,,,10/10/2022,10/10/2022,,,"Danielle L. Ferreira, Zaynaf Salaymang, Rima Arnaout",,,arXiv:2210.04979v1,,,,,,0,
14,2022-08-12,,,,arxiv,10.48550/arXiv.2210.04977,,Domain-guided data augmentation for deep learning on medical imaging,https://arxiv.org/abs/2210.04977,"While domain-specific data augmentation can be useful in training neuralnetworks for medical imaging tasks, such techniques have not been widely usedto date. Here, we test whether domain-specific data augmentation is useful formedical imaging using a well-benchmarked task: view classification on fetalultrasound FETAL-125 and OB-125 datasets. We found that using acontext-preserving cut-paste strategy, we could create valid training data asmeasured by performance of the resulting trained model on the benchmark testdataset. When used in an online fashion, models trained on this data performedsimilarly to those trained using traditional data augmentation (FETAL-125F-score 85.33+/-0.24 vs 86.89+/-0.60, p-value 0.0139; OB-125 F-score74.60+/-0.11 vs 72.43+/-0.62, p-value 0.0039). Furthermore, the ability toperform augmentations during training time, as well as the ability to applychosen augmentations equally across data classes, are important considerationsin designing a bespoke data augmentation. Finally, we provide open-source codeto facilitate running bespoke data augmentations in an online fashion. Takentogether, this work expands the ability to design and apply domain-guided dataaugmentations for medical imaging tasks.",,https://arxiv.org/pdf/2210.04977,arXiv:2210.04977v1,,,10/10/2022,10/10/2022,,,"Chinmayee Athalye, Rima Arnaout",,,arXiv:2210.04977v1,,,,,,0,
15,2022-08-12,Dirk Hockemeyer,,,Blood,10.1182/blood.2021013750,35421215,Editing TINF2 as a potential therapeutic approach to restore telomere length in dyskeratosis congenita.,https://pubmed.ncbi.nlm.nih.gov/35421215,"Mutations in the TINF2 gene, encoding the shelterin protein TIN2, cause telomere shortening and the inherited bone marrow (BM) failure syndrome dyskeratosis congenita (DC). A lack of suitable model systems limits the mechanistic understanding of telomere shortening in the stem cells and thus hinders the development of treatment options for BM failure. Here, we endogenously introduced TIN2-DC mutations in human embryonic stem cells (hESCs) and human hematopoietic stem and progenitor cells (HSPCs) to dissect the disease mechanism and identify a gene-editing strategy that rescued the disease phenotypes. The hESCs with the T284R disease mutation exhibited the short telomere phenotype observed in DC patients. Yet, telomeres in mutant hESCs did not trigger DNA damage responses at telomeres or show exacerbated telomere shortening when differentiated into telomerase-negative cells. Disruption of the mutant TINF2 allele by introducing a frameshift mutation in exon 2 restored telomere length in stem cells and the replicative potential of differentiated cells. Similarly, we introduced TIN2-DC disease variants in human HSPCs to assess the changes in telomere length and proliferative capacity. Lastly, we showed that editing at exon 2 of TINF2 that restored telomere length in hESCs could be generated in TINF2-DC patient HSPCs. Our study demonstrates a simple genetic intervention that rescues the TIN2-DC disease phenotype in stem cells and provides a versatile platform to assess the efficacy of potential therapeutic approaches in vivo.",,,,,,2022/4/15/6/0,,2022/4/15/6/0,Seunga Choo ; Franziska K Lorbeer ; Samuel G Regalado ; Sarah B Short ; Shannon Wu ; Gabrielle Rieser ; Alison A Bertuch ; Dirk Hockemeyer,,"Department of Molecular and Cell Biology, University of California, Berkeley, Berkeley, CA.;Department of Molecular and Cell Biology, University of California, Berkeley, Berkeley, CA.; Chan Zuckerberg Biohub, San Francisco, CA; and.; Innovative Genomics Institute, University of California, Berkeley, Berkeley, CA.;Department of Pediatrics, Baylor College of Medicine, Houston, TX.; Department of Molecular and Human Genetics, Baylor College of Medicine, Houston, TX.","Seunga Choo: Department of Molecular and Cell Biology, University of California, Berkeley, Berkeley, CA.Franziska K Lorbeer: Department of Molecular and Cell Biology, University of California, Berkeley, Berkeley, CA.Samuel G Regalado: Department of Molecular and Cell Biology, University of California, Berkeley, Berkeley, CA.Sarah B Short: Department of Molecular and Cell Biology, University of California, Berkeley, Berkeley, CA.Shannon Wu: Department of Molecular and Cell Biology, University of California, Berkeley, Berkeley, CA.Gabrielle Rieser: Department of Molecular and Cell Biology, University of California, Berkeley, Berkeley, CA.Alison A Bertuch: Department of Pediatrics, Baylor College of Medicine, Houston, TX.; Department of Molecular and Human Genetics, Baylor College of Medicine, Houston, TX.Dirk Hockemeyer: Department of Molecular and Cell Biology, University of California, Berkeley, Berkeley, CA.; Chan Zuckerberg Biohub, San Francisco, CA; and.; Innovative Genomics Institute, University of California, Berkeley, Berkeley, CA.",,,,,,,0,"Pollard, Katie; Srivastava, Deepak"
16,2022-08-12,Nir Yosef,Melanie I WorleyNir YosefIswar K Hariharan,"Department of Molecular and Cell Biology, University of California, Berkeley, Berkeley, CA, USA. Electronic address: mworley@berkeley.edu.Department of Electrical Engineering and Computer Science, Center for Computational Biology, University of California, Berkeley, Berkeley, CA, USA; Chan Zuckerberg Biohub, San Francisco, CA, USA. Electronic address: niryosef@berkeley.edu.Department of Molecular and Cell Biology, University of California, Berkeley, Berkeley, CA, USA. Electronic address: ikh@berkeley.edu.",Current biology : CB,10.1016/j.cub.2022.06.040,35820420,Ets21C sustains a pro-regenerative transcriptional program in blastema cells of Drosophila imaginal discs.,https://pubmed.ncbi.nlm.nih.gov/35820420,"An important unanswered question in regenerative biology is to what extent regeneration is accomplished by the reactivation of gene regulatory networks used during development versus the activation of regeneration-specific transcriptional programs. Following damage, Drosophila imaginal discs, the larval precursors of adult structures, can regenerate missing portions by localized proliferation of damage-adjacent tissue. Using single-cell transcriptomics in regenerating wing discs, we have obtained a comprehensive view of the transcriptome of regenerating discs and identified two regeneration-specific cell populations within the blastema, Blastema1 and Blastema2. Collectively, these cells upregulate multiple genes encoding secreted proteins that promote regeneration including Pvf1, upd3, asperous, Mmp1, and the maturation delaying factor Ilp8. Expression of the transcription factor Ets21C is restricted to this regenerative secretory zone; it is not expressed in undamaged discs. Ets21C expression is activated by the JNK/AP-1 pathway, and it can function in a type 1 coherent feedforward loop with AP-1 to sustain expression of downstream genes. Without Ets21C function, the blastema cells fail to maintain the expression of a number of genes, which leads to premature differentiation and severely compromised regeneration. As Ets21C is dispensable for normal development, these observations indicate that Ets21C orchestrates a regeneration-specific gene regulatory network. We have also identified cells resembling both Blastema1 and Blastema2 in scribble tumorous discs. They express the Ets21C-dependent gene regulatory network, and eliminating Ets21C function reduces tumorous growth. Thus, mechanisms that function during regeneration can be co-opted by tumors to promote aberrant growth.",Ets ; Ets21C ; blastema ; gene regulatory network ; imaginal disc ; regeneration ; scRNA-seq ; tissue damage ; transcription factor ; tumors,,,,,2022/7/13/6/0,2022/07/11,2022/7/13/6/0,Melanie I Worley ; Nicholas J Everetts ; Riku Yasutomi ; Rebecca J Chang ; Shrey Saretha ; Nir Yosef ; Iswar K Hariharan,,"Department of Electrical Engineering and Computer Science, Center for Computational Biology, University of California, Berkeley, Berkeley, CA, USA; Chan Zuckerberg Biohub, San Francisco, CA, USA. Electronic address: niryosef@berkeley.edu.;Department of Molecular and Cell Biology, University of California, Berkeley, Berkeley, CA, USA.;Department of Molecular and Cell Biology, University of California, Berkeley, Berkeley, CA, USA. Electronic address: ikh@berkeley.edu.;Department of Molecular and Cell Biology, University of California, Berkeley, Berkeley, CA, USA. Electronic address: mworley@berkeley.edu.;Department of Molecular and Cell Biology, University of California, Berkeley, Berkeley, CA, USA; Department of Electrical Engineering and Computer Science, Center for Computational Biology, University of California, Berkeley, Berkeley, CA, USA.","Melanie I Worley: Department of Molecular and Cell Biology, University of California, Berkeley, Berkeley, CA, USA. Electronic address: mworley@berkeley.edu.Nicholas J Everetts: Department of Molecular and Cell Biology, University of California, Berkeley, Berkeley, CA, USA; Department of Electrical Engineering and Computer Science, Center for Computational Biology, University of California, Berkeley, Berkeley, CA, USA.Riku Yasutomi: Department of Molecular and Cell Biology, University of California, Berkeley, Berkeley, CA, USA.Rebecca J Chang: Department of Molecular and Cell Biology, University of California, Berkeley, Berkeley, CA, USA.Shrey Saretha: Department of Molecular and Cell Biology, University of California, Berkeley, Berkeley, CA, USA.Nir Yosef: Department of Electrical Engineering and Computer Science, Center for Computational Biology, University of California, Berkeley, Berkeley, CA, USA; Chan Zuckerberg Biohub, San Francisco, CA, USA. Electronic address: niryosef@berkeley.edu.Iswar K Hariharan: Department of Molecular and Cell Biology, University of California, Berkeley, Berkeley, CA, USA. Electronic address: ikh@berkeley.edu.",,,,,,,0,"Kistler, Amy"
