record id,save datetime,biohub author,corresponding author,corresponding author institution,journal,doi,pmid,title,url,abstract,keyword,pdf url,version,version number,type,date,epost date,publish date,authors,authors2,affiliations list,author - affiliations,version,published or not,published_doi,confirm preprint doi,match result,match id,record change number,Match biohub author
11,2022-08-10,James A. Wells,Kliment A Verba,"University of California, San Francisco",bioRxiv,10.1101/2022.08.09.503400,,Computational pipeline provides mechanistic understanding of Omicron variant of concern neutralizing engineered ACE2 receptor traps,http://www.biorxiv.org/content/10.1101/2022.08.09.503400v1,"The SARS-CoV-2 Omicron variant, with 15 mutations in Spike receptor binding domain (Spike-RBD), renders virtually all clinical monoclonal antibodies against WT SARS-CoV-2 ineffective. We recently engineered the SARS-CoV-2 host entry receptor, ACE2, to tightly bind WT-Spike-RBD and prevent viral entry into host cells (""receptor traps""). Here we determine cryo-EM structures of our receptor traps in complex with full length Spike. We develop a multi-model pipeline combining Rosetta protein modeling software and cryo-EM to allow interface energy calculations even at limited resolution and identify interface side chains that allow for high affinity interactions between our ACE2 receptor traps and Spike-RBD. Our structural analysis provides a mechanistic rationale for the high affinity (0.53 - 4.2nM) binding of our ACE2 receptor traps to Omicron-RBD confirmed with biolayer interferometry measurements. Finally, we show that ACE2 receptor traps potently neutralize Omicron- and Delta-pseudotyped viruses, providing alternative therapeutic routes to combat this evolving virus.",,,biorxiv;2022.08.09.503400,1,new results,01/10/2022,01/10/2022,,"Remesh, S. G.; Merz, G. E.; Britol, A. F.; Chio, U. S.; Rizo, A. N.; Pospiech, T. H.; Lui, I.; Laurie, M. T.; Glasgow, J.; Le, C. Q.; Zhang, Y.; Diwanji, D.; Hernandez, E.; Lopez, J.; Pawar, K. I.; Pourmal, S.; Smith, A. M.; Zhou, F.; QBI Coronavirus Research Group Structural Biology Consortium,  ; DeRisi, J.; Kortemme, T.; Rosenberg, O. S.; Glasgow, A.; Leung, K. K.; Wells, J. A.; Verba, K. A.",Soumya G. Remesh; Gregory E. Merz; Axel F. Brilot; Un Seng Chio; Alexandrea N. Rizo; Thomas H. Pospiech; Irene Lui; Mathew T. Laurie; Jeff Glasgow; Chau Q. Le; Yun Zhang; Devan Diwanji; Evelyn Hernandez; Jocelyne Lopez; Komal Ishwar Pawar; Sergei Pourmal; Amber M. Smith; Fengbo Zhou; QCRG Structural Biology Consortium; Joseph DeRisi; Tanja Kortemme; Oren S. Rosenberg; Anum Glasgow; Kevin K. Leung; James A. Wells; Kliment A. Verba,"Department of Pharmaceutical Chemistry, University of California; QBI Coronavirus Research Group Structural Biology Consortium, University of California; QBI Coronavirus Research Group Structural Biology Consortium, University of California; QBI Coronavirus Research Group Structural Biology Consortium, University of California; QBI Coronavirus Research Group Structural Biology Consortium, University of California; QBI Coronavirus Research Group Structural Biology Consortium, University of California; QBI Coronavirus Research Group Structural Biology Consortium, University of California; Department of Pharmaceutical Chemistry, University of California; Department of Biochemistry and Biophysics, University of California San Francisco; Department of Pharmaceutical Chemistry, University of California; Department of Pharmaceutical Chemistry, University of California; Department of Pharmaceutical Chemistry, University of California; QBI Coronavirus Research Group Structural Biology Consortium, University of California; QBI Coronavirus Research Group Structural Biology Consortium, University of California; QBI Coronavirus Research Group Structural Biology Consortium, University of California; QBI Coronavirus Research Group Structural Biology Consortium, University of California; QBI Coronavirus Research Group Structural Biology Consortium, University of California; QBI Coronavirus Research Group Structural Biology Consortium, University of California; QBI Coronavirus Research Group Structural Biology Consortium, University of California; Department of Biochemistry and Biophysics, University of California San Francisco; Chan Zuckerberg Biohub; QBI Coronavirus Research Group Structural Biology Consortium, University of California; QBI, University of California; Department of Bioengineering and Therapeutic Sciences, University of California; The University of California, Berkeley–University of California, San Francisco Graduate Program in Bioengineering, University of California; QBI Coronavirus Research Group Structural Biology Consortium, University of California; Department of Biochemistry and Molecular Biophysics, Columbia University; Department of Pharmaceutical Chemistry, University of California; Department of Pharmaceutical Chemistry, University of California; Chan Zuckerberg Biohub; Department of Cellular & Molecular Pharmacology, University of California San Francisco; Department of Pharmaceutical Chemistry, University of California; QBI Coronavirus Research Group Structural Biology Consortium, University of California; QBI, University of California","[['Soumya G. Remesh', 'Department of Pharmaceutical Chemistry, University of California', 'QBI Coronavirus Research Group Structural Biology Consortium, University of California'], ['Gregory E. Merz', 'QBI Coronavirus Research Group Structural Biology Consortium, University of California'], ['Axel F. Brilot', 'QBI Coronavirus Research Group Structural Biology Consortium, University of California'], ['Un Seng Chio', 'QBI Coronavirus Research Group Structural Biology Consortium, University of California'], ['Alexandrea N. Rizo', 'QBI Coronavirus Research Group Structural Biology Consortium, University of California'], ['Thomas H. Pospiech', 'QBI Coronavirus Research Group Structural Biology Consortium, University of California'], ['Irene Lui', 'Department of Pharmaceutical Chemistry, University of California'], ['Mathew T. Laurie', 'Department of Biochemistry and Biophysics, University of California San Francisco'], ['Jeff Glasgow', 'Department of Pharmaceutical Chemistry, University of California'], ['Chau Q. Le', 'Department of Pharmaceutical Chemistry, University of California'], ['Yun Zhang', 'Department of Pharmaceutical Chemistry, University of California'], ['Devan Diwanji', 'QBI Coronavirus Research Group Structural Biology Consortium, University of California'], ['Evelyn Hernandez', 'QBI Coronavirus Research Group Structural Biology Consortium, University of California'], ['Jocelyne Lopez', 'QBI Coronavirus Research Group Structural Biology Consortium, University of California'], ['Komal Ishwar Pawar', 'QBI Coronavirus Research Group Structural Biology Consortium, University of California'], ['Sergei Pourmal', 'QBI Coronavirus Research Group Structural Biology Consortium, University of California'], ['Amber M. Smith', 'QBI Coronavirus Research Group Structural Biology Consortium, University of California'], ['Fengbo Zhou', 'QBI Coronavirus Research Group Structural Biology Consortium, University of California'], ['QCRG Structural Biology Consortium'], ['Joseph DeRisi', 'Department of Biochemistry and Biophysics, University of California San Francisco', 'Chan Zuckerberg Biohub'], ['Tanja Kortemme', 'QBI Coronavirus Research Group Structural Biology Consortium, University of California', 'QBI, University of California', 'Department of Bioengineering and Therapeutic Sciences, University of California', 'The University of California, Berkeley–University of California, San Francisco Graduate Program in Bioengineering, University of California'], ['Oren S. Rosenberg', 'QBI Coronavirus Research Group Structural Biology Consortium, University of California'], ['Anum Glasgow', 'Department of Biochemistry and Molecular Biophysics, Columbia University'], ['Kevin K. Leung', 'Department of Pharmaceutical Chemistry, University of California'], ['James A. Wells', 'Department of Pharmaceutical Chemistry, University of California', 'Chan Zuckerberg Biohub', 'Department of Cellular & Molecular Pharmacology, University of California San Francisco'], ['Kliment A. Verba', 'Department of Pharmaceutical Chemistry, University of California', 'QBI Coronavirus Research Group Structural Biology Consortium, University of California', 'QBI, University of California']]",biorxiv;2022.08.09.503400,NA,No yet.,,,,0,
12,2022-08-10,,,,arxiv,10.48550/arXiv.2208.11223,,"POPDx: An Automated Framework for Patient Phenotyping across 392,246 Individuals in the UK Biobank Study",https://arxiv.org/abs/2208.11223,"Objective For the UK Biobank standardized phenotype codes are associated withpatients who have been hospitalized but are missing for many patients who havebeen treated exclusively in an outpatient setting. We describe a method forphenotype recognition that imputes phenotype codes for all UK Biobankparticipants. Materials and Methods POPDx (Population-based ObjectivePhenotyping by Deep Extrapolation) is a bilinear machine learning framework forsimultaneously estimating the probabilities of 1,538 phenotype codes. Weextracted phenotypic and health-related information of 392,246 individuals fromthe UK Biobank for POPDx development and evaluation. A total of 12,803 ICD-10diagnosis codes of the patients were converted to 1,538 Phecodes as goldstandard labels. The POPDx framework was evaluated and compared to otheravailable methods on automated multi-phenotype recognition. Results POPDx canpredict phenotypes that are rare or even unobserved in training. We demonstratesubstantial improvement of automated multi-phenotype recognition across 22disease categories, and its application in identifying key epidemiologicalfeatures associated with each phenotype. Conclusions POPDx helps providewell-defined cohorts for downstream studies. It is a general purpose methodthat can be applied to other biobanks with diverse but incomplete data.",,https://arxiv.org/pdf/2208.11223,arXiv:2208.11223v1,,,08/23/2022,08/23/2022,,,"Lu Yang, Sheng Wang, Russ B. Altman",,,arXiv:2208.11223v1,,,,,,0,
13,2022-08-10,,,,arxiv,10.48550/arXiv.2208.10661,,Therapeutic algebra of immunomodulatory drug responses at single-cell resolution,https://arxiv.org/abs/2208.10661,"Therapeutic modulation of immune states is central to the treatment of humandisease. However, how drugs and drug combinations impact the diverse cell typesin the human immune system remains poorly understood at the transcriptomescale. Here, we apply single-cell mRNA-seq to profile the response of humanimmune cells to 502 immunomodulatory drugs alone and in combination. We developa unified mathematical model that quantitatively describes the transcriptomescale response of myeloid and lymphoid cell types to individual drugs and drugcombinations through a single inferred regulatory network. The mathematicalmodel reveals how drug combinations generate novel, macrophage and T-cellstates by recruiting combinations of gene expression programs through bothadditive and non-additive drug interactions. A simplified drug response algebraallows us to predict the continuous modulation of immune cell populationsbetween activated, resting and hyper-inhibited states through combinatorialdrug dose titrations. Our results suggest that transcriptome-scale mathematicalmodels could enable the design of therapeutic strategies for programming thehuman immune system using combinations of therapeutics.",,https://arxiv.org/pdf/2208.10661,arXiv:2208.10661v1,,,08/23/2022,08/23/2022,,,"Jialong Jiang, Sisi Chen, Tiffany Tsou, Christopher S. McGinnis, Tahmineh Khazaei, Qin Zhu, Jong H. Park, Paul Rivaud, Inna-Marie Strazhnik, Eric D. Chow, David A. Sivak, Zev J. Gartner, Matt Thomson",,,arXiv:2208.10661v1,,,,,,0,
14,2022-08-10,,,,arxiv,10.48550/arXiv.2209.09105,,Development and Clinical Evaluation of an AI Support Tool for Improving Telemedicine Photo Quality,https://arxiv.org/abs/2209.09105,"Telemedicine utilization was accelerated during the COVID-19 pandemic, andskin conditions were a common use case. However, the quality of photographssent by patients remains a major limitation. To address this issue, wedeveloped TrueImage 2.0, an artificial intelligence (AI) model for assessingpatient photo quality for telemedicine and providing real-time feedback topatients for photo quality improvement. TrueImage 2.0 was trained on 1700telemedicine images annotated by clinicians for photo quality. On aretrospective dataset of 357 telemedicine images, TrueImage 2.0 effectivelyidentified poor quality images (Receiver operator curve area under the curve(ROC-AUC) =0.78) and the reason for poor quality (Blurry ROC-AUC=0.84, Lightingissues ROC-AUC=0.70). The performance is consistent across age, gender, andskin tone. Next, we assessed whether patient-TrueImage 2.0 interaction led toan improvement in submitted photo quality through a prospective clinical pilotstudy with 98 patients. TrueImage 2.0 reduced the number of patients with apoor-quality image by 68.0%.",,https://arxiv.org/pdf/2209.09105,arXiv:2209.09105v1,,,09/12/2022,09/12/2022,,,"Kailas Vodrahalli, Justin Ko, Albert S. Chiou, Roberto Novoa, Abubakar Abid, Michelle Phung, Kiana Yekrang, Paige Petrone, James Zou, Roxana Daneshjou",,,arXiv:2209.09105v1,,,,,,0,
15,2022-08-10,,,,arxiv,10.48550/arXiv.2209.15458,,Towards General-Purpose Representation Learning of Polygonal Geometries,https://arxiv.org/abs/2209.15458,"Neural network representation learning for spatial data is a common need forgeographic artificial intelligence (GeoAI) problems. In recent years, manyadvancements have been made in representation learning for points, polylines,and networks, whereas little progress has been made for polygons, especiallycomplex polygonal geometries. In this work, we focus on developing ageneral-purpose polygon encoding model, which can encode a polygonal geometry(with or without holes, single or multipolygons) into an embedding space. Theresult embeddings can be leveraged directly (or finetuned) for downstream taskssuch as shape classification, spatial relation prediction, and so on. Toachieve model generalizability guarantees, we identify a few desirableproperties: loop origin invariance, trivial vertex invariance, part permutationinvariance, and topology awareness. We explore two different designs for theencoder: one derives all representations in the spatial domain; the otherleverages spectral domain representations. For the spatial domain approach, wepropose ResNet1D, a 1D CNN-based polygon encoder, which uses circular paddingto achieve loop origin invariance on simple polygons. For the spectral domainapproach, we develop NUFTspec based on Non-Uniform Fourier Transformation(NUFT), which naturally satisfies all the desired properties. We conductexperiments on two tasks: 1) shape classification based on MNIST; 2) spatialrelation prediction based on two new datasets - DBSR-46K and DBSR-cplx46K. Ourresults show that NUFTspec and ResNet1D outperform multiple existing baselineswith significant margins. While ResNet1D suffers from model performancedegradation after shape-invariance geometry modifications, NUFTspec is veryrobust to these modifications due to the nature of the NUFT.",,https://arxiv.org/pdf/2209.15458,arXiv:2209.15458v1,,,09/29/2022,09/29/2022,,,"Gengchen Mai, Chiyu Jiang, Weiwei Sun, Rui Zhu, Yao Xuan, Ling Cai, Krzysztof Janowicz, Stefano Ermon, Ni Lao",,,arXiv:2209.15458v1,,,,,,0,
16,2022-08-10,,,,arxiv,10.48550/arXiv.2210.01383,,Generalizing Bayesian Optimization with Decision-theoretic Entropies,https://arxiv.org/abs/2210.01383,"Bayesian optimization (BO) is a popular method for efficiently inferringoptima of an expensive black-box function via a sequence of queries. Existinginformation-theoretic BO procedures aim to make queries that most reduce theuncertainty about optima, where the uncertainty is captured by Shannon entropy.However, an optimal measure of uncertainty would, ideally, factor in how weintend to use the inferred quantity in some downstream procedure. In thispaper, we instead consider a generalization of Shannon entropy from work instatistical decision theory (DeGroot 1962, Rao 1984), which contains a broadclass of uncertainty measures parameterized by a problem-specific loss functioncorresponding to a downstream task. We first show that special cases of thisentropy lead to popular acquisition functions used in BO procedures such asknowledge gradient, expected improvement, and entropy search. We then show howalternative choices for the loss yield a flexible family of acquisitionfunctions that can be customized for use in novel optimization settings.Additionally, we develop gradient-based methods to efficiently optimize ourproposed family of acquisition functions, and demonstrate strong empiricalperformance on a diverse set of sequential decision making tasks, includingvariants of top-$k$ optimization, multi-level set estimation, and sequencesearch.",,https://arxiv.org/pdf/2210.01383,arXiv:2210.01383v1,,,10/04/2022,10/04/2022,,,"Willie Neiswanger, Lantao Yu, Shengjia Zhao, Chenlin Meng, Stefano Ermon",,,arXiv:2210.01383v1,,,,,,0,
17,2022-08-10,,,,arxiv,10.48550/arXiv.2210.04642,,Exploration via Planning for Information about the Optimal Trajectory,https://arxiv.org/abs/2210.04642,"Many potential applications of reinforcement learning (RL) are stymied by thelarge numbers of samples required to learn an effective policy. This isespecially true when applying RL to real-world control tasks, e.g. in thesciences or robotics, where executing a policy in the environment is costly. Inpopular RL algorithms, agents typically explore either by adding stochasticityto a reward-maximizing policy or by attempting to gather maximal informationabout environment dynamics without taking the given task into account. In thiswork, we develop a method that allows us to plan for exploration while takingboth the task and the current knowledge about the dynamics into account. Thekey insight to our approach is to plan an action sequence that maximizes theexpected information gain about the optimal trajectory for the task at hand. Wedemonstrate that our method learns strong policies with 2x fewer samples thanstrong exploration baselines and 200x fewer samples than model free methods ona diverse set of low-to-medium dimensional control tasks in both the open-loopand closed-loop control settings.",,https://arxiv.org/pdf/2210.04642,arXiv:2210.04642v1,,,10/06/2022,10/06/2022,,,"Viraj Mehta, Ian Char, Joseph Abbate, Rory Conlin, Mark D. Boyer, Stefano Ermon, Jeff Schneider, Willie Neiswanger",,,arXiv:2210.04642v1,,,,,,0,
18,2022-08-10,,,,arxiv,10.48550/arXiv.2210.03324,,AutoML for Climate Change: A Call to Action,https://arxiv.org/abs/2210.03324,"The challenge that climate change poses to humanity has spurred a rapidlydeveloping field of artificial intelligence research focused on climate changeapplications. The climate change AI (CCAI) community works on a diverse,challenging set of problems which often involve physics-constrained ML orheterogeneous spatiotemporal data. It would be desirable to use automatedmachine learning (AutoML) techniques to automatically find high-performingarchitectures and hyperparameters for a given dataset. In this work, webenchmark popular AutoML libraries on three high-leverage CCAI applications:climate modeling, wind power forecasting, and catalyst discovery. We find thatout-of-the-box AutoML libraries currently fail to meaningfully surpass theperformance of human-designed CCAI models. However, we also identify a few keyweaknesses, which stem from the fact that most AutoML techniques are tailoredto computer vision and NLP applications. For example, while dozens of searchspaces have been designed for image and language data, none have been designedfor spatiotemporal data. Addressing these key weaknesses can lead to thediscovery of novel architectures that yield substantial performance gainsacross numerous CCAI applications. Therefore, we present a call to action tothe AutoML community, since there are a number of concrete, promisingdirections for future work in the space of AutoML for CCAI. We release our codeand a list of resources athttps://github.com/climate-change-automl/climate-change-automl.",,https://arxiv.org/pdf/2210.03324,arXiv:2210.03324v1,,,10/07/2022,10/07/2022,,,"Renbo Tu, Nicholas Roberts, Vishak Prasad, Sibasis Nayak, Paarth Jain, Frederic Sala, Ganesh Ramakrishnan, Ameet Talwalkar, Willie Neiswanger, Colin White",,,arXiv:2210.03324v1,,,,,,0,
19,2022-08-10,,,,arxiv,10.48550/arXiv.2210.04979,,Label-free segmentation from cardiac ultrasound using self-supervised learning,https://arxiv.org/abs/2210.04979,"Background: Segmentation and measurement of cardiac chambers is critical inechocardiography but is also laborious and poorly reproducible. Neural networkscan assist, but supervised approaches require the same laborious manualannotations, while unsupervised approaches have fared poorly in ultrasound todate. Objectives: We built a pipeline for self-supervised (no manual labelsrequired) segmentation of cardiac chambers, combining computer vision, clinicaldomain knowledge, and deep learning. Methods: We trained on 450 echocardiograms(145,000 images) and tested on 8,393 echocardiograms (4,476,266 images; meanage 61 years, 51% female), using the resulting segmentations to calculatestructural and functional measurements. We also tested our pipeline againstexternal images from an additional 10,030 patients (20,060 images) withavailable manual tracings of the left ventricle. Results: r2 between clinicallymeasured and pipeline-predicted measurements were similar to reportedinter-clinician variation for LVESV and LVEDV (pipeline vs. clinical r2= 0.74and r2=0.65, respectively), LVEF and LV mass (r2= 0.46 and r2=0.54), left andright atrium volumes (r2=0.7 and r2=0.6), and right ventricle area (r2=0.47).When binarized into normal vs. abnormal categories, average accuracy was 0.81(range 0.71-0.95). A subset of the test echocardiograms (n=553) hadcorresponding cardiac MRI; correlation between pipeline and CMR measurementswas similar to that between clinical echocardiogram and CMR. Finally, in theexternal dataset, our pipeline accurately segments the left ventricle with anaverage Dice score of 0.83 (95% CI 0.83). Conclusions: Our results demonstratea human-label-free, valid, and scalable method for segmentation fromultrasound, a noisy but globally important imaging modality.",,https://arxiv.org/pdf/2210.04979,arXiv:2210.04979v1,,,10/10/2022,10/10/2022,,,"Danielle L. Ferreira, Zaynaf Salaymang, Rima Arnaout",,,arXiv:2210.04979v1,,,,,,0,
20,2022-08-10,,,,arxiv,10.48550/arXiv.2210.04977,,Domain-guided data augmentation for deep learning on medical imaging,https://arxiv.org/abs/2210.04977,"While domain-specific data augmentation can be useful in training neuralnetworks for medical imaging tasks, such techniques have not been widely usedto date. Here, we test whether domain-specific data augmentation is useful formedical imaging using a well-benchmarked task: view classification on fetalultrasound FETAL-125 and OB-125 datasets. We found that using acontext-preserving cut-paste strategy, we could create valid training data asmeasured by performance of the resulting trained model on the benchmark testdataset. When used in an online fashion, models trained on this data performedsimilarly to those trained using traditional data augmentation (FETAL-125F-score 85.33+/-0.24 vs 86.89+/-0.60, p-value 0.0139; OB-125 F-score74.60+/-0.11 vs 72.43+/-0.62, p-value 0.0039). Furthermore, the ability toperform augmentations during training time, as well as the ability to applychosen augmentations equally across data classes, are important considerationsin designing a bespoke data augmentation. Finally, we provide open-source codeto facilitate running bespoke data augmentations in an online fashion. Takentogether, this work expands the ability to design and apply domain-guided dataaugmentations for medical imaging tasks.",,https://arxiv.org/pdf/2210.04977,arXiv:2210.04977v1,,,10/10/2022,10/10/2022,,,"Chinmayee Athalye, Rima Arnaout",,,arXiv:2210.04977v1,,,,,,0,
21,2022-08-10,Stephen R Quake,Stephen R Quake,"Stanford University and Chan Zuckerberg Biohub, 318 Campus Dr., Stanford, CA 94305, USA. Electronic address: steve@quake-lab.org.",Trends in genetics : TIG,10.1016/j.tig.2022.01.004,35105475,A decade of molecular cell atlases.,https://pubmed.ncbi.nlm.nih.gov/35105475,"In recent years there has been tremendous progress towards deep molecular characterization of cell types using single-cell transcriptome sequencing, creating so-called 'cell atlases'. These atlases provide a basic understanding of how different cell types of the same organism - which all share the genome - make distinct use of subsets of genes from the genome to create a variety of distinct cell types across tissues with specialized functions. In this opinion article I discuss some of the history and technological innovations that led to the development of whole-organism atlases.",,,,,,2022/2/3/6/0,2022/01/31,2022/2/3/6/0,Stephen R Quake,,"Stanford University and Chan Zuckerberg Biohub, 318 Campus Dr., Stanford, CA 94305, USA. Electronic address: steve@quake-lab.org.","Stephen R Quake: Stanford University and Chan Zuckerberg Biohub, 318 Campus Dr., Stanford, CA 94305, USA. Electronic address: steve@quake-lab.org.",,,,,,,0,
