record id,save datetime,biohub author,possible biohub author,format biohub author,corresponding author,corresponding author institution,journal,doi,pmid,title,url,abstract,keyword,pdf url,version,version number,type,date,epost date,publish date,authors,authors2,affiliations list,author - affiliations,published or not,confirm published doi,confirm preprint doi,possible match result,match id,record change number
1,2023-02-10,"Brown, J[ames]",,,,,Journal of clinical oncology : official journal of the American Society of Clinical Oncology,10.1200/JCO.22.00269,36315919.0,Rare Germline ,https://pubmed.ncbi.nlm.nih.gov/36315919,Germline missense variants of unknown significance in cancer-related genes are increasingly being identified with the expanding use of next-generation sequencing. The ataxia telangiectasia-mutated (,,,,,,2022-11-01,2022/10/31,2022/11/1,Benjamin L Lampson; Aditi Gupta; Svitlana Tyekucheva; Kiyomi Mashima; Anna Petráčková; Zixu Wang; Natalia Wojciechowska; Conner J Shaughnessy; Peter O Baker; Stacey M Fernandes; Samantha Shupe; John-Hanson Machado; Rayan Fardoun; Annette S Kim; Jennifer R Brown,,"Department of Data Science, Dana-Farber Cancer Institute, Boston, MA.; Department of Immunology, Palacký University, Olomouc, Czech Republic.; Department of Pathology, Brigham and Women's Hospital, Boston, MA.; Department of Pathology, Brigham and Women's Hospital, Boston, MA.; Current Address: Wrocław Medical University, Wrocław, Poland.; Division of Hematologic Malignancies and Department of Medical Oncology, Dana-Farber Cancer Institute, Boston, MA.","Benjamin L Lampson: Division of Hematologic Malignancies and Department of Medical Oncology, Dana-Farber Cancer Institute, Boston, MA.Aditi Gupta: Division of Hematologic Malignancies and Department of Medical Oncology, Dana-Farber Cancer Institute, Boston, MA.Svitlana Tyekucheva: Department of Data Science, Dana-Farber Cancer Institute, Boston, MA.Kiyomi Mashima: Division of Hematologic Malignancies and Department of Medical Oncology, Dana-Farber Cancer Institute, Boston, MA.Anna Petráčková: Department of Immunology, Palacký University, Olomouc, Czech Republic.Zixu Wang: Department of Data Science, Dana-Farber Cancer Institute, Boston, MA.Natalia Wojciechowska: Department of Pathology, Brigham and Women's Hospital, Boston, MA.; Current Address: Wrocław Medical University, Wrocław, Poland.Conner J Shaughnessy: Division of Hematologic Malignancies and Department of Medical Oncology, Dana-Farber Cancer Institute, Boston, MA.Peter O Baker: Division of Hematologic Malignancies and Department of Medical Oncology, Dana-Farber Cancer Institute, Boston, MA.Stacey M Fernandes: Division of Hematologic Malignancies and Department of Medical Oncology, Dana-Farber Cancer Institute, Boston, MA.Samantha Shupe: Division of Hematologic Malignancies and Department of Medical Oncology, Dana-Farber Cancer Institute, Boston, MA.John-Hanson Machado: Division of Hematologic Malignancies and Department of Medical Oncology, Dana-Farber Cancer Institute, Boston, MA.Rayan Fardoun: Division of Hematologic Malignancies and Department of Medical Oncology, Dana-Farber Cancer Institute, Boston, MA.Annette S Kim: Department of Pathology, Brigham and Women's Hospital, Boston, MA.Jennifer R Brown: Division of Hematologic Malignancies and Department of Medical Oncology, Dana-Farber Cancer Institute, Boston, MA.",,,,,,0
2,2023-02-10,"Brown, J[ames]",,,,,Journal of clinical oncology : official journal of the American Society of Clinical Oncology,10.1200/JCO.22.00510,36395435.0,Zanubrutinib Versus Ibrutinib in Relapsed/Refractory Chronic Lymphocytic Leukemia and Small Lymphocytic Lymphoma: Interim Analysis of a Randomized Phase III Trial.,https://pubmed.ncbi.nlm.nih.gov/36395435,"Zanubrutinib is a potent, irreversible next-generation Bruton tyrosine kinase (BTK) inhibitor designed to maximize BTK occupancy and minimize off-target kinase inhibition. We hypothesized that complete/sustained BTK occupancy may improve efficacy outcomes and increased BTK specificity may minimize off-target inhibition-related toxicities.",,,,,,2022-11-18,2022/11/17,2022/11/18,Peter Hillmen; Barbara Eichhorst; Jennifer R Brown; Nicole Lamanna; Susan M O'Brien; Constantine S Tam; Lugui Qiu; Maciej Kazmierczak; Keshu Zhou; Martin Šimkovič; Jiří Mayer; Amanda Gillespie-Twardy; Mazyar Shadman; Alessandra Ferrajoli; Peter S Ganly; Robert Weinkove; Sebastian Grosicki; Andrzej Mital; Tadeusz Robak; Anders Österborg; Habte A Yimer; Tommi Salmi; Meng Ji; Jessica Yecies; Adam Idoine; Kenneth Wu; Jane Huang; Wojciech Jurczak,,"4th Department of Internal Medicine-Hematology, University Hospital, Hradec Kralove, Czech Republic.; Faculty of Medicine, Charles University, Prague, Czech Republic.; Affiliated Cancer Hospital of Zhengzhou University, Henan Cancer Hospital, Zhengzhou, China.; BeiGene (Beijing) Co, Ltd, Beijing, China.; BeiGene USA, Inc, San Mateo, CA.; Blue Ridge Cancer Care, Roanoke, VA.; Chao Family Comprehensive Cancer Center, University of California, Irvine, CA.; Department I of Internal Medicine, Center for Integrated Oncology Aachen, University of Cologne, Bonn, Cologne, Düsseldorf, Germany.; Department of Haematology, Christchurch Hospital, Christchurch, New Zealand.; Department of Hematology and Bone Marrow Transplantation, Poznan University of Medical Sciences, Poznan, Poland.; Department of Hematology and Cancer Prevention, Health Sciences Faculty, Medical University of Silesia, Katowice, Poland.; Department of Hematology and Transplantology, Medical University of Gdańsk, Gdańsk, Poland.; Department of Internal Medicine-Hematology and Oncology, Masaryk University and University Hospital, Brno, Czech Republic.; Department of Leukemia, The University of Texas MD Anderson Cancer Center, Houston, TX.; Department of Medical Oncology, Dana-Farber Cancer Institute, Boston, MA.; Department of Oncology-Pathology, Karolinska Institutet, Stockholm, Sweden.; Department of Hematology, Karolinska University Hospital, Stockholm, Sweden.; Fred Hutchinson Cancer Research Center, Seattle, WA.; Department of Medicine, University of Washington, Seattle, WA.; Herbert Irving Comprehensive Cancer Center, Columbia University, New York, NY.; Maria Sklodowska-Curie National Research Institute of Oncology, Krakow, Poland.; Medical University of Lodz, Lodz, Poland.; Peter MacCallum Cancer Centre, Melbourne, Victoria, Australia.; University of Melbourne, Parkville, Victoria, Australia.; St Vincent's Hospital Melbourne, Fitzroy, Victoria, Australia.; Royal Melbourne Hospital, Parkville, Victoria, Australia.; St James's University Hospital, Leeds, United Kingdom.; State Key Laboratory of Experimental Hematology, National Clinical Research Center for Hematological Disorders, Institute of Hematology and Blood Diseases Hospital, Chinese Academy of Medical Sciences and Peking Union Medical College, Tianjin, China.; Texas Oncology-Tyler/US Oncology Research, Tyler, TX.; Wellington Blood and Cancer Centre, Capital and Coast District Health Board, Wellington, New Zealand.; Cancer Immunotherapy Programme, Malaghan Institute of Medical Research, Wellington, New Zealand.","Peter Hillmen: St James's University Hospital, Leeds, United Kingdom.Barbara Eichhorst: Department I of Internal Medicine, Center for Integrated Oncology Aachen, University of Cologne, Bonn, Cologne, Düsseldorf, Germany.Jennifer R Brown: Department of Medical Oncology, Dana-Farber Cancer Institute, Boston, MA.Nicole Lamanna: Herbert Irving Comprehensive Cancer Center, Columbia University, New York, NY.Susan M O'Brien: Chao Family Comprehensive Cancer Center, University of California, Irvine, CA.Constantine S Tam: Peter MacCallum Cancer Centre, Melbourne, Victoria, Australia.; University of Melbourne, Parkville, Victoria, Australia.; St Vincent's Hospital Melbourne, Fitzroy, Victoria, Australia.; Royal Melbourne Hospital, Parkville, Victoria, Australia.Lugui Qiu: State Key Laboratory of Experimental Hematology, National Clinical Research Center for Hematological Disorders, Institute of Hematology and Blood Diseases Hospital, Chinese Academy of Medical Sciences and Peking Union Medical College, Tianjin, China.Maciej Kazmierczak: Department of Hematology and Bone Marrow Transplantation, Poznan University of Medical Sciences, Poznan, Poland.Keshu Zhou: Affiliated Cancer Hospital of Zhengzhou University, Henan Cancer Hospital, Zhengzhou, China.Martin Šimkovič: 4th Department of Internal Medicine-Hematology, University Hospital, Hradec Kralove, Czech Republic.; Faculty of Medicine, Charles University, Prague, Czech Republic.Jiří Mayer: Department of Internal Medicine-Hematology and Oncology, Masaryk University and University Hospital, Brno, Czech Republic.Amanda Gillespie-Twardy: Blue Ridge Cancer Care, Roanoke, VA.Mazyar Shadman: Fred Hutchinson Cancer Research Center, Seattle, WA.; Department of Medicine, University of Washington, Seattle, WA.Alessandra Ferrajoli: Department of Leukemia, The University of Texas MD Anderson Cancer Center, Houston, TX.Peter S Ganly: Department of Haematology, Christchurch Hospital, Christchurch, New Zealand.Robert Weinkove: Wellington Blood and Cancer Centre, Capital and Coast District Health Board, Wellington, New Zealand.; Cancer Immunotherapy Programme, Malaghan Institute of Medical Research, Wellington, New Zealand.Sebastian Grosicki: Department of Hematology and Cancer Prevention, Health Sciences Faculty, Medical University of Silesia, Katowice, Poland.Andrzej Mital: Department of Hematology and Transplantology, Medical University of Gdańsk, Gdańsk, Poland.Tadeusz Robak: Medical University of Lodz, Lodz, Poland.Anders Österborg: Department of Oncology-Pathology, Karolinska Institutet, Stockholm, Sweden.; Department of Hematology, Karolinska University Hospital, Stockholm, Sweden.Habte A Yimer: Texas Oncology-Tyler/US Oncology Research, Tyler, TX.Tommi Salmi: BeiGene USA, Inc, San Mateo, CA.Meng Ji: BeiGene (Beijing) Co, Ltd, Beijing, China.Jessica Yecies: BeiGene USA, Inc, San Mateo, CA.Adam Idoine: BeiGene USA, Inc, San Mateo, CA.Kenneth Wu: BeiGene USA, Inc, San Mateo, CA.Jane Huang: BeiGene USA, Inc, San Mateo, CA.Wojciech Jurczak: Maria Sklodowska-Curie National Research Institute of Oncology, Krakow, Poland.",,,,,,0
3,2023-02-10,Andrew P May,,"May, Andy; May, Andy; May, Andy; May, Andy",Aida Rodrigo Albors; Kate G Storey,"Division of Molecular, Cell and Developmental Biology, School of Life Sciences, University of Dundee, Dundee DD1 5EH, UK. Electronic address: a.rodrigoalbors@dundee.ac.uk.Division of Molecular, Cell and Developmental Biology, School of Life Sciences, University of Dundee, Dundee DD1 5EH, UK. Electronic address: k.g.storey@dundee.ac.uk.",Developmental cell,10.1016/j.devcel.2023.01.003,36706756.0,An ependymal cell census identifies heterogeneous and ongoing cell maturation in the adult mouse spinal cord that changes dynamically on injury.,https://pubmed.ncbi.nlm.nih.gov/36706756,"The adult spinal cord stem cell potential resides within the ependymal cell population and declines with age. Ependymal cells are, however, heterogeneous, and the biological diversity this represents and how it changes with age remain unknown. Here, we present a single-cell transcriptomic census of spinal cord ependymal cells from adult and aged mice, identifying not only all known ependymal cell subtypes but also immature as well as mature cell states. By comparing transcriptomes of spinal cord and brain ependymal cells, which lack stem cell abilities, we identify immature cells as potential spinal cord stem cells. Following spinal cord injury, these cells re-enter the cell cycle, which is accompanied by a short-lived reversal of ependymal cell maturation. We further analyze ependymal cells in the human spinal cord and identify widespread cell maturation and altered cell identities. This in-depth characterization of spinal cord ependymal cells provides insight into their biology and informs strategies for spinal cord repair.",adult neural stem cell; cell maturation; ependymal cell; human; mouse; scRNA-seq; spinal cord; spinal cord injury,,,,,2023-01-28,2023/01/26,2023/1/28,Aida Rodrigo Albors; Gail A Singer; Enric Llorens-Bobadilla; Jonas Frisén; Andrew P May; Chris P Ponting; Kate G Storey,,"Chan Zuckerberg Biohub, San Francisco, CA 94158, USA; Tornado Bio, Inc., South San Francisco, CA 94080, USA.; Department of Cell and Molecular Biology, Karolinska Institutet, 171 77 Stockholm, Sweden.; Division of Molecular, Cell and Developmental Biology, School of Life Sciences, University of Dundee, Dundee DD1 5EH, UK.; Division of Molecular, Cell and Developmental Biology, School of Life Sciences, University of Dundee, Dundee DD1 5EH, UK. Electronic address: a.rodrigoalbors@dundee.ac.uk.; Division of Molecular, Cell and Developmental Biology, School of Life Sciences, University of Dundee, Dundee DD1 5EH, UK. Electronic address: k.g.storey@dundee.ac.uk.; Medical Research Council Human Genetics Unit, Institute of Genetics and Cancer, University of Edinburgh, Edinburgh EH4 2XU, UK.","Aida Rodrigo Albors: Division of Molecular, Cell and Developmental Biology, School of Life Sciences, University of Dundee, Dundee DD1 5EH, UK. Electronic address: a.rodrigoalbors@dundee.ac.uk.Gail A Singer: Division of Molecular, Cell and Developmental Biology, School of Life Sciences, University of Dundee, Dundee DD1 5EH, UK.Enric Llorens-Bobadilla: Department of Cell and Molecular Biology, Karolinska Institutet, 171 77 Stockholm, Sweden.Jonas Frisén: Department of Cell and Molecular Biology, Karolinska Institutet, 171 77 Stockholm, Sweden.Andrew P May: Chan Zuckerberg Biohub, San Francisco, CA 94158, USA; Tornado Bio, Inc., South San Francisco, CA 94080, USA.Chris P Ponting: Medical Research Council Human Genetics Unit, Institute of Genetics and Cancer, University of Edinburgh, Edinburgh EH4 2XU, UK.Kate G Storey: Division of Molecular, Cell and Developmental Biology, School of Life Sciences, University of Dundee, Dundee DD1 5EH, UK. Electronic address: k.g.storey@dundee.ac.uk.",,,,,,0
4,2023-02-10,Adam de la Zerda,,"de la Zerda, Adam; de la Zerda, Adam; de la Zerda, Adam; de la Zerda, Adam; de la Zerda, Adam; de la Zerda, Adam",,,ACS nano,10.1021/acsnano.2c09542,36745734.0,Rapid Cellular-Resolution Skin Imaging with Optical Coherence Tomography Using All-Glass Multifocal Metasurfaces.,https://pubmed.ncbi.nlm.nih.gov/36745734,"Cellular-resolution optical coherence tomography (OCT) is a powerful tool offering noninvasive histology-like imaging. However, like other optical microscopy tools, a high numerical aperture (N.A.) lens is required to generate a tight focus, generating a narrow depth of field, which necessitates dynamic focusing and limiting the imaging speed. To overcome this limitation, we developed a metasurface platform that generates multiple axial foci, which multiplies the volumetric OCT imaging speed by offering several focal planes. This platform offers accurate and flexible control over the number, positions, and intensities of axial foci generated. All-glass metasurface optical elements 8 mm in diameter are fabricated from fused-silica wafers and implemented into our scanning OCT system. With a constant lateral resolution of 1.1 μm over all depths, the multifocal OCT triples the volumetric acquisition speed for dermatological imaging, while still clearly revealing features of stratum corneum, epidermal cells, and dermal-epidermal junctions and offering morphological information as diagnostic criteria for basal cell carcinoma. The imaging speed can be further improved in a sparse sample, e.g., 7-fold with a seven-foci beam. In summary, this work demonstrates the concept of metasurface-based multifocal OCT for rapid virtual biopsy, further providing insights for developing rapid volumetric imaging systems with high resolution and compact volume.",all-glass metasurface; cellular resolution; multifocal beam; noninvasive imaging; optical coherence tomography; phase change materials; virtual biopsy,,,,,2023-02-07,2023/02/06,2023/2/7,Jingjing Zhao; Aidan Van Vleck; Yonatan Winetraub; Lin Du; Yong Han; Sumaira Aasi; Kavita Yang Sarin; Adam de la Zerda,,"Department of Dermatology, Stanford University School of Medicine, Stanford, California94305, United States.; Department of Electrical Engineering and Computer Sciences, University of California, Berkeley, 94720, United States.; Department of Precision Instrument, Tsinghua University, Beijing100084, China.; Department of Structural Biology, Stanford University School of Medicine, Stanford, California94305, United States.; Department of Structural Biology, Stanford University School of Medicine, Stanford, California94305, United States.; Biophysics Program at Stanford, Stanford University, Stanford, California94305, United States.; Molecular Imaging Program at Stanford, Stanford University, Stanford, California94305, United States.; The Bio-X Program, Stanford University, Stanford, California94305, United States.; Department of Structural Biology, Stanford University School of Medicine, Stanford, California94305, United States.; Biophysics Program at Stanford, Stanford University, Stanford, California94305, United States.; Molecular Imaging Program at Stanford, Stanford University, Stanford, California94305, United States.; The Bio-X Program, Stanford University, Stanford, California94305, United States.; The Chan Zuckerberg Biohub, San Francisco, California94158, United States.","Jingjing Zhao: Department of Structural Biology, Stanford University School of Medicine, Stanford, California94305, United States.Aidan Van Vleck: Department of Structural Biology, Stanford University School of Medicine, Stanford, California94305, United States.Yonatan Winetraub: Department of Structural Biology, Stanford University School of Medicine, Stanford, California94305, United States.; Biophysics Program at Stanford, Stanford University, Stanford, California94305, United States.; Molecular Imaging Program at Stanford, Stanford University, Stanford, California94305, United States.; The Bio-X Program, Stanford University, Stanford, California94305, United States.Lin Du: Department of Electrical Engineering and Computer Sciences, University of California, Berkeley, 94720, United States.Yong Han: Department of Precision Instrument, Tsinghua University, Beijing100084, China.Sumaira Aasi: Department of Dermatology, Stanford University School of Medicine, Stanford, California94305, United States.Kavita Yang Sarin: Department of Dermatology, Stanford University School of Medicine, Stanford, California94305, United States.Adam de la Zerda: Department of Structural Biology, Stanford University School of Medicine, Stanford, California94305, United States.; Biophysics Program at Stanford, Stanford University, Stanford, California94305, United States.; Molecular Imaging Program at Stanford, Stanford University, Stanford, California94305, United States.; The Bio-X Program, Stanford University, Stanford, California94305, United States.; The Chan Zuckerberg Biohub, San Francisco, California94158, United States.",,,,,,0
5,2023-02-10,,,,Hyongsok Tom Soh,Stanford University,bioRxiv,10.1101/2023.02.07.527534,,Extending the dynamic range of biomarker quantification through molecular equalization,http://www.biorxiv.org/content/10.1101/2023.02.07.527534v1,"Precision medicine requires highly scalable methods of multiplexed biomarker quantification that can accurately describe patient physiology. Unfortunately, contemporary molecular detection methods are generally limited to a dynamic range of sensitivity spanning just 3-4 orders of magnitude, whereas the actual physiological dynamic range of the human plasma proteome spans more than 10 orders of magnitude. Current methods rely on sample splitting and differential dilution to compensate for this mismatch, but such measures greatly limit the reproducibility and scalability that can be achieved. In particular, the effects of non-linear dilution can greatly confound the analysis of multiplexed assays. We describe here a two-pronged strategy for equalizing the signal generated by each analyte in a multiplexed panel, thereby enabling simultaneous quantification of targets spanning a wide range of concentrations. We apply our 'EVROS' strategy to a proximity ligation assay and demonstrate simultaneous quantification of four analytes present at concentrations spanning from low femtomolar to mid-nanomolar levels. In this initial demonstration, we achieve a dynamic range spanning seven orders of magnitude in a single 5 l sample of undiluted human serum, highlighting the opportunity to achieve sensitive, accurate detection of diverse analytes in a highly multiplexed fashion.",,,biorxiv;2023.02.07.527534,1,new results,2023-02-08,02/08/2023,,Sharon S Newman; Brandon Wilson; Daniel Mamerow; Benjamin Wollant; Hnin Nyein; Yael Rosenberg-Hasson; Holden Maecker; Michael Eisenstein; Hyongsok Tom Soh,"Newman, S. S.; Wilson, B.; Mamerow, D.; Wollant, B.; Nyein, H.; Rosenberg-Hasson, Y.; Maecker, H.; Eisenstein, M.; Soh, H. T.",Stanford University; Stanford University; Stanford University; Stanford University; Stanford University; Stanford University; Stanford University; Stanford University; Stanford University,"Sharon S Newman, Stanford University], [Brandon Wilson, Stanford University], [Daniel Mamerow, Stanford University], [Benjamin Wollant, Stanford University], [Hnin Nyein, Stanford University], [Yael Rosenberg-Hasson, Stanford University], [Holden Maecker, Stanford University], [Michael Eisenstein, Stanford University], [Hyongsok Tom Soh, Stanford University",NA,,,,,0
6,2023-02-10,Alice Y. Ting,,,Alice Y Ting,"Departments of Biology, Genetics, and Chemistry, Stanford University, Stanford, CA, USA; Chan Zuckerberg Biohub, San Francisco, CA, USA",bioRxiv,10.1101/2023.02.07.527548,,Dynamic mapping of proteome trafficking within and between living cells by TransitID,http://www.biorxiv.org/content/10.1101/2023.02.07.527548v1,"The ability to map trafficking for thousands of endogenous proteins at once in living cells would reveal biology currently invisible to both microscopy and mass spectrometry. Here we report TransitID, a method for unbiased mapping of endogenous proteome trafficking with nanometer spatial resolution in living cells. Two proximity labeling (PL) enzymes, TurboID and APEX, are targeted to source and destination compartments, and PL with each enzyme is performed in tandem via sequential addition of their small-molecule substrates. Mass spectrometry identifies the proteins tagged by both enzymes. Using TransitID, we mapped proteome trafficking between cytosol and mitochondria, cytosol and nucleus, and nucleolus and stress granules, uncovering a role for stress granules in protecting the transcription factor JUN from oxidative stress. TransitID also identifies proteins that signal intercellularly between macrophages and cancer cells. TransitID introduces a powerful approach for distinguishing protein populations based on compartment or cell type of origin.",,,biorxiv;2023.02.07.527548,1,new results,2023-02-08,02/08/2023,,Wei Qin Xu; Joleen S. Cheah; Charles Xu; James Messing; Brian D. Freibaum; Steven Boeynaems; J. Paul Taylor; Namrata D. Udeshi; Steven A. Carr; Alice Y. Ting,"Qin, W.; Cheah, J. S.; Xu, C.; Messing, J.; Freibaum, B. D.; Boeynaems, S.; Taylor, J. P.; Udeshi, N. D.; Carr, S. A.; Ting, A. Y.","Departments of Biology, Genetics, and Chemistry, Stanford University; School of Pharmaceutical Sciences, Tsinghua-Peking Center for Life Sciences, Tsinghua University; Departments of Biology, Genetics, and Chemistry, Stanford University; The Broad Institute of MIT and Harvard; Department of Cell and Molecular Biology, St. Jude Children’s Research Hospital; Department of Cell and Molecular Biology, St. Jude Children’s Research Hospital; Department of Molecular and Human Genetics, Therapeutic Innovation Center, Center for Alzheimer’s and Neurodegenerative Diseases, and Dan L. Duncan Comprehensive Cancer Center, Baylor College of Medicine; Jan and Dan Duncan Neurological Research Institute, Texas Children’s Hospital; Department of Cell and Molecular Biology, St. Jude Children’s Research Hospital; The Broad Institute of MIT and Harvard; The Broad Institute of MIT and Harvard; Departments of Biology, Genetics, and Chemistry, Stanford University; Chan Zuckerberg Biohub","Wei Qin Xu, Departments of Biology, Genetics, and Chemistry, Stanford University, School of Pharmaceutical Sciences, Tsinghua-Peking Center for Life Sciences, Tsinghua University], [Joleen S. Cheah, Departments of Biology, Genetics, and Chemistry, Stanford University], [Charles Xu, The Broad Institute of MIT and Harvard], [James Messing, Department of Cell and Molecular Biology, St. Jude Children’s Research Hospital], [Brian D. Freibaum, Department of Cell and Molecular Biology, St. Jude Children’s Research Hospital], [Steven Boeynaems, Department of Molecular and Human Genetics, Therapeutic Innovation Center, Center for Alzheimer’s and Neurodegenerative Diseases, and Dan L. Duncan Comprehensive Cancer Center, Baylor College of Medicine, Jan and Dan Duncan Neurological Research Institute, Texas Children’s Hospital], [J. Paul Taylor, Department of Cell and Molecular Biology, St. Jude Children’s Research Hospital], [Namrata D. Udeshi, The Broad Institute of MIT and Harvard], [Steven A. Carr, The Broad Institute of MIT and Harvard], [Alice Y. Ting, Departments of Biology, Genetics, and Chemistry, Stanford University, Chan Zuckerberg Biohub",NA,,,,,0
