record id,save datetime,biohub author,possible biohub author,format biohub author,corresponding author,corresponding author institution,journal,doi,pmid,title,url,abstract,keyword,pdf url,version,version number,type,date,epost date,publish date,authors,authors2,affiliations list,author - affiliations,published or not,confirm published doi,confirm preprint doi,possible match result,match id,record change number
7,2023-02-04,Alanna Schepartz,,,Jamie H. D. Cate,"University of California, Berkeley",bioRxiv,10.1101/2023.01.25.525534,,Aminobenzoic acid derivatives obstruct induced fit in the catalytic center of the ribosome,http://www.biorxiv.org/content/10.1101/2023.01.25.525534v2,"The Escherichia coli ribosome can incorporate a variety of non-O_SCPLOWLC_SCPLOW--amino acid monomers into polypeptide chains, but with poor efficiency. Although these monomers span a diverse set of compounds, there exists no high-resolution structural information regarding their positioning within the catalytic center of the ribosome, the peptidyl transferase center (PTC). Thus, details regarding the mechanism of amide bond formation and the structural basis for differences and defects in incorporation efficiency remain unknown. Within a set of three aminobenzoic acid derivatives-3-aminopyridine-4-carboxylic acid (Apy), ortho-aminobenzoic acid (oABZ), and meta-aminobenzoic acid (mABZ)-the ribosome incorporates Apy into polypeptide chains with the highest efficiency, followed by oABZ and then mABZ, a trend that does not track with the nucleophilicity of the reactive amines. Here, we report high resolution cryo-EM structures of the ribosome with these three aminobenzoic acid derivatives charged on tRNA bound in the aminoacyl-tRNA site (A site). These structures reveal how the aromatic ring of each monomer sterically blocks positioning of nucleotide U2506, thereby preventing rearrangement of nucleotide U2585 and the resulting induced fit in the PTC required for efficient amide bond formation. They also reveal disruptions to the ""proton wire"" responsible for facilitating formation and breakdown of the tetrahedral intermediate. Together, the cryo-EM structures reported here provide a clear rationale for differences in reactivity of aminobenzoic acid derivatives relative to O_SCPLOWLC_SCPLOW--amino acids and each other, and point to stereochemical constraints on the size and geometry of non-proteinogenic monomers that can be accepted efficiently by wild-type ribosomes.",,,biorxiv;2023.01.25.525534,2,new results,2023-01-31,01/31/2023,,Chandrima Majumdar; Joshua A. Walker; Matthew B. Francis; Alanna Schepartz; Jamie H. D. Cate,"Majumdar, C.; Walker, J. A.; Francis, M. B.; Schepartz, A.; Cate, J. H. D.","Department of Molecular and Cell Biology, University of California; Department of Chemistry, University of California; Department of Chemistry, University of California; Molecular Biophysics and Integrated Bioimaging Division, Lawrence Berkeley National Laboratory; Department of Molecular and Cell Biology, University of California; Department of Chemistry, University of California; Molecular Biophysics and Integrated Bioimaging Division, Lawrence Berkeley National Laboratory; Chan Zuckerberg Biohub; Department of Molecular and Cell Biology, University of California; Department of Chemistry, University of California; Molecular Biophysics and Integrated Bioimaging Division, Lawrence Berkeley National Laboratory; Innovative Genomics Institute, University of California","Chandrima Majumdar, Department of Molecular and Cell Biology, University of California], [Joshua A. Walker, Department of Chemistry, University of California], [Matthew B. Francis, Department of Chemistry, University of California, Molecular Biophysics and Integrated Bioimaging Division, Lawrence Berkeley National Laboratory], [Alanna Schepartz, Department of Molecular and Cell Biology, University of California, Department of Chemistry, University of California, Molecular Biophysics and Integrated Bioimaging Division, Lawrence Berkeley National Laboratory, Chan Zuckerberg Biohub], [Jamie H. D. Cate, Department of Molecular and Cell Biology, University of California, Department of Chemistry, University of California, Molecular Biophysics and Integrated Bioimaging Division, Lawrence Berkeley National Laboratory, Innovative Genomics Institute, University of California",NA,,,,,0
8,2023-02-04,,,,Simon Kretschmer,"University of California, San Francisco",bioRxiv,10.1101/2023.02.01.526549,,Multi-input drug-controlled switches of mammalian gene expression based on engineered nuclear hormone receptors,http://www.biorxiv.org/content/10.1101/2023.02.01.526549v1,"Protein-based switches that respond to different inputs to regulate cellular outputs, such as gene expression, are central to synthetic biology. For increased controllability, multi-input switches that integrate several cooperating and competing signals for the regulation of a shared output are of particular interest. The nuclear hormone receptor (NHR) superfamily offers promising starting points for engineering multi-input-controlled responses to clinically approved drugs. Starting from the VgEcR/RXR pair, we demonstrate that novel (multi-)drug regulation can be achieved by exchange of the ecdysone receptor (EcR) ligand binding domain (LBD) for other human NHR-derived LBDs. For responses activated to saturation by an agonist for the first LBD, we show that outputs can be boosted by an agonist targeting the second LBD. In combination with an antagonist, output levels are tunable by up to three simultaneously present small-molecule drugs. Such high-level control validates NHRs as a versatile, engineerable platform for programming multi-drug-controlled responses.",,,biorxiv;2023.02.01.526549,1,new results,2023-02-01,02/01/2023,,Simon Kretschmer; Nicholas Perry; Yang Zhang; Tanja Kortemme,"Kretschmer, S.; Perry, N.; Zhang, Y.; Kortemme, T.","Department of Bioengineering and Therapeutic Sciences, University of California; California Quantitative Biosciences Institute (QBI) at UCSF; Department of Bioengineering and Therapeutic Sciences, University of California; California Quantitative Biosciences Institute (QBI) at UCSF; University of California, Berkeley—University of California, San Francisco Joint Graduate Program in Bioengineering; Department of Bioengineering and Therapeutic Sciences, University of California; California Quantitative Biosciences Institute (QBI) at UCSF; Department of Bioengineering and Therapeutic Sciences, University of California; California Quantitative Biosciences Institute (QBI) at UCSF; University of California, Berkeley—University of California, San Francisco Joint Graduate Program in Bioengineering","Simon Kretschmer, Department of Bioengineering and Therapeutic Sciences, University of California, California Quantitative Biosciences Institute (QBI) at UCSF], [Nicholas Perry, Department of Bioengineering and Therapeutic Sciences, University of California, California Quantitative Biosciences Institute (QBI) at UCSF, University of California, Berkeley—University of California, San Francisco Joint Graduate Program in Bioengineering], [Yang Zhang, Department of Bioengineering and Therapeutic Sciences, University of California, California Quantitative Biosciences Institute (QBI) at UCSF], [Tanja Kortemme, Department of Bioengineering and Therapeutic Sciences, University of California, California Quantitative Biosciences Institute (QBI) at UCSF, University of California, Berkeley—University of California, San Francisco Joint Graduate Program in Bioengineering",NA,,,,,0
9,2023-02-04,Amy J. Pickering,,,Amy Pickering,"University of California, Berkeley",medRxiv,10.1101/2022.07.11.22277510,,Hands are frequently contaminated with fecal bacteria and enteric pathogens globally: A systematic review and meta-analysis,http://medrxiv.org/content/early/2023/02/01/2022.07.11.22277510,"Enteric pathogen infections are a leading cause of morbidity and mortality globally, with the highest disease burden in low-income countries. Hands act as intermediaries in enteric pathogen transmission, transferring enteric pathogens between people and the environment through contact with fomites, food, water, and soil. In this study, we conducted a systematic review of prevalence and concentrations of fecal indicator microorganisms (i.e., E. coli, fecal coliform) and enteric pathogens on hands. We identified eighty-four studies, reporting 35,440 observations of hand contamination of people in community or household settings. The studies investigated 44 unique microorganisms, of which the most commonly reported indicators were E. coli and fecal coliforms. Hand contamination with 12 unique enteric pathogens was reported, with adenovirus and norovirus as the most frequent. Mean E. coli prevalence on hands was 62% [95% CI 40%-82%] and mean fecal coliform prevalence was 66% [95% CI 22%-100%]. Hands were more likely to be contaminated with E. coli in low/lower-middle-income countries (prevalence: 69% [95% CI 48% - 88%]) than in upper-middle/high-income countries (6% [95% CI 2% - 12%]). The review also highlighted the importance of standardizing hand sampling methods, as hand rinsing was associated with greater fecal contamination compared to other sampling methods.",,,medrxiv;2022.07.11.22277510,2,PUBLISHAHEADOFPRINT,2023-02-01,02/01/2023,,Molly E. Cantrell; Émile Sylvestre; Hannah Wharton; Rahel Scheidegger; Lou Curchod; David M. Gute; Jeffrey Griffiths; Timothy R Julian; Amy J. Pickering,"Cantrell, M. E.; Sylvestre, E.; Wharton, H.; Scheidegger, R.; Curchod, L.; Gute, D.; Griffiths, J.; Julian, T. R.; Pickering, A.","Department of Civil and Environmental Engineering, Tufts University; Eawag, Swiss Federal Institute of Aquatic Science and Technology; Department of Civil and Environmental Engineering, University of California; ETH Zurich, Swiss Federal Institute of Technology; ETH Zurich, Swiss Federal Institute of Technology; Department of Civil and Environmental Engineering, Tufts University; Department of Civil and Environmental Engineering, Tufts University; Department of Public Health and Family Medicine, Tufts Medical School, Tufts University; Friedman School of Nutrition Science and Policy, Tufts University; Eawag, Swiss Federal Institute of Aquatic Science and Technology; Swiss Tropical and Public Health Institute; University of Basel; Department of Civil and Environmental Engineering, Tufts University; Department of Civil and Environmental Engineering, University of California; Chan Zuckerberg Biohub","Molly E. Cantrell, Department of Civil and Environmental Engineering, Tufts University], [Émile Sylvestre, Eawag, Swiss Federal Institute of Aquatic Science and Technology], [Hannah Wharton, Department of Civil and Environmental Engineering, University of California], [Rahel Scheidegger, ETH Zurich, Swiss Federal Institute of Technology], [Lou Curchod, ETH Zurich, Swiss Federal Institute of Technology], [David M. Gute, Department of Civil and Environmental Engineering, Tufts University], [Jeffrey Griffiths, Department of Civil and Environmental Engineering, Tufts University, Department of Public Health and Family Medicine, Tufts Medical School, Tufts University, Friedman School of Nutrition Science and Policy, Tufts University], [Timothy R Julian, Eawag, Swiss Federal Institute of Aquatic Science and Technology, Swiss Tropical and Public Health Institute, University of Basel], [Amy J. Pickering, Department of Civil and Environmental Engineering, Tufts University, Department of Civil and Environmental Engineering, University of California, Chan Zuckerberg Biohub",NA,,,,,0
10,2023-02-04,Michael A Fischbach; Justin L Sonnenburg,,"Fischbach, Michael; Sonnenburg, Justin; Fischbach, Michael; Sonnenburg, Justin; Fischbach, Michael; Sonnenburg, Justin; Fischbach, Michael; Sonnenburg, Justin; Fischbach, Michael; Sonnenburg, Justin",Dylan Dodd,"Department of Microbiology and Immunology, Stanford University School of Medicine, Stanford, CA, USA. ddodd2@stanford.edu.; Department of Pathology Stanford University School of Medicine, Stanford, CA, USA. ddodd2@stanford.edu.",Nature communications,10.1038/s41467-023-36138-3,36720857.0,Host-microbe co-metabolism via MCAD generates circulating metabolites including hippuric acid.,https://pubmed.ncbi.nlm.nih.gov/36720857,"The human gut microbiota produces dozens of small molecules that circulate in blood, accumulate to comparable levels as pharmaceutical drugs, and influence host physiology. Despite the importance of these metabolites to human health and disease, the origin of most microbially-produced molecules and their fate in the host remains largely unknown. Here, we uncover a host-microbe co-metabolic pathway for generation of hippuric acid, one of the most abundant organic acids in mammalian urine. Combining stable isotope tracing with bacterial and host genetics, we demonstrate reduction of phenylalanine to phenylpropionic acid by gut bacteria; the host re-oxidizes phenylpropionic acid involving medium-chain acyl-CoA dehydrogenase (MCAD). Generation of germ-free male and female MCAD",,,,,,2023-02-01,2023/01/31,2023/2/1,Kali M Pruss; Haoqing Chen; Yuanyuan Liu; William Van Treuren; Steven K Higginbottom; John B Jarman; Curt R Fischer; Justin Mak; Beverly Wong; Tina M Cowan; Michael A Fischbach; Justin L Sonnenburg; Dylan Dodd,,"ChEM-H, Stanford University, Stanford, CA, USA.; Octant Bio, Emeryville, CA, USA.; Department of Microbiology and Immunology, Stanford University School of Medicine, Stanford, CA, USA.; Department of Microbiology and Immunology, Stanford University School of Medicine, Stanford, CA, USA. ddodd2@stanford.edu.; Department of Pathology Stanford University School of Medicine, Stanford, CA, USA. ddodd2@stanford.edu.; Department of Microbiology and Immunology, Stanford University School of Medicine, Stanford, CA, USA.; ChEM-H, Stanford University, Stanford, CA, USA.; Department of Bioengineering, Stanford University, Stanford, CA, USA.; Chan Zuckerberg Biohub, San Francisco, CA, USA.; Department of Microbiology and Immunology, Stanford University School of Medicine, Stanford, CA, USA.; Chan Zuckerberg Biohub, San Francisco, CA, USA.; Center for Human Microbiome Studies, Stanford, CA, USA.; Department of Pathology Stanford University School of Medicine, Stanford, CA, USA.; Stanford Healthcare, Palo Alto, CA, USA.","Kali M Pruss: Department of Microbiology and Immunology, Stanford University School of Medicine, Stanford, CA, USA.Haoqing Chen: Department of Pathology Stanford University School of Medicine, Stanford, CA, USA.Yuanyuan Liu: Department of Pathology Stanford University School of Medicine, Stanford, CA, USA.William Van Treuren: Department of Microbiology and Immunology, Stanford University School of Medicine, Stanford, CA, USA.Steven K Higginbottom: Department of Microbiology and Immunology, Stanford University School of Medicine, Stanford, CA, USA.John B Jarman: Department of Pathology Stanford University School of Medicine, Stanford, CA, USA.Curt R Fischer: ChEM-H, Stanford University, Stanford, CA, USA.; Octant Bio, Emeryville, CA, USA.Justin Mak: Stanford Healthcare, Palo Alto, CA, USA.Beverly Wong: Stanford Healthcare, Palo Alto, CA, USA.Tina M Cowan: Department of Pathology Stanford University School of Medicine, Stanford, CA, USA.Michael A Fischbach: Department of Microbiology and Immunology, Stanford University School of Medicine, Stanford, CA, USA.; ChEM-H, Stanford University, Stanford, CA, USA.; Department of Bioengineering, Stanford University, Stanford, CA, USA.; Chan Zuckerberg Biohub, San Francisco, CA, USA.Justin L Sonnenburg: Department of Microbiology and Immunology, Stanford University School of Medicine, Stanford, CA, USA.; Chan Zuckerberg Biohub, San Francisco, CA, USA.; Center for Human Microbiome Studies, Stanford, CA, USA.Dylan Dodd: Department of Microbiology and Immunology, Stanford University School of Medicine, Stanford, CA, USA. ddodd2@stanford.edu.; Department of Pathology Stanford University School of Medicine, Stanford, CA, USA. ddodd2@stanford.edu.",,,,,,0
11,2023-02-04,Brian C DeFelice; Maurizio Morri; Norma F Neff,,"Morri, Maurizio; Neff, Norma; Morri, Maurizio; Neff, Norma; Morri, Maurizio; Neff, Norma; Morri, Maurizio; Neff, Norma; Morri, Maurizio; Neff, Norma; Morri, Maurizio; Neff, Norma",,,eLife,10.7554/eLife.82311,36719070.0,Intermittent fasting induces rapid hepatocyte proliferation to restore the hepatostat in the mouse liver.,https://pubmed.ncbi.nlm.nih.gov/36719070,"Nutrient availability fluctuates in most natural populations, forcing organisms to undergo periods of fasting and re-feeding. It is unknown how dietary changes influence liver homeostasis. Here, we show that a switch from ad libitum feeding to intermittent fasting (IF) promotes rapid hepatocyte proliferation. Mechanistically, IF-induced hepatocyte proliferation is driven by the combined action of systemic FGF15 and localized WNT signaling. Hepatocyte proliferation during periods of fasting and re-feeding re-establishes a constant liver-to-body mass ratio, thus maintaining the hepatostat. This study provides the first example of dietary influence on adult hepatocyte proliferation and challenges the widely held view that liver tissue is mostly quiescent unless chemically or mechanically injured.",intermittent fasting; liver; mouse; regeneration; regenerative medicine; stem cells,,,,,2023-02-01,2023/01/31,2023/2/1,Abby Sarkar; Yinhua Jin; Brian C DeFelice; Catriona Y Logan; Yan Yang; Teni Anbarchian; Peng Wu; Maurizio Morri; Norma F Neff; Huy Nguyen; Eric Rulifson; Matthew Fish; Avi Gurion Kaye; Azalia M Martínez Jaimes; Roel Nusse,,"Chan-Zuckerberg Biohub, San Francisco, United States.; Department of Neurology and Neurological Sciences, Stanford University School of Medicine, Stanford, United States.; Howard Hughes Medical Institute, Department of Developmental Biology, Institute for Stem Cell Biology and Regenerative Medicine, Stanford University School of Medicine, Stanford, United States.; Howard Hughes Medical Institute, Department of Developmental Biology, Institute for Stem Cell Biology and Regenerative Medicine, Stanford University School of Medicine, Stanford, United States.; Department of Pediatrics, Stanford University School of Medicine, Stanford, United States.; Stanford Center for Genomics & Personalized Medicine, Stanford University School of Medicine, Stanford, United States.","Abby Sarkar: Howard Hughes Medical Institute, Department of Developmental Biology, Institute for Stem Cell Biology and Regenerative Medicine, Stanford University School of Medicine, Stanford, United States.Yinhua Jin: Howard Hughes Medical Institute, Department of Developmental Biology, Institute for Stem Cell Biology and Regenerative Medicine, Stanford University School of Medicine, Stanford, United States.Brian C DeFelice: Chan-Zuckerberg Biohub, San Francisco, United States.Catriona Y Logan: Howard Hughes Medical Institute, Department of Developmental Biology, Institute for Stem Cell Biology and Regenerative Medicine, Stanford University School of Medicine, Stanford, United States.Yan Yang: Stanford Center for Genomics & Personalized Medicine, Stanford University School of Medicine, Stanford, United States.Teni Anbarchian: Howard Hughes Medical Institute, Department of Developmental Biology, Institute for Stem Cell Biology and Regenerative Medicine, Stanford University School of Medicine, Stanford, United States.Peng Wu: Howard Hughes Medical Institute, Department of Developmental Biology, Institute for Stem Cell Biology and Regenerative Medicine, Stanford University School of Medicine, Stanford, United States.; Department of Pediatrics, Stanford University School of Medicine, Stanford, United States.Maurizio Morri: Chan-Zuckerberg Biohub, San Francisco, United States.Norma F Neff: Chan-Zuckerberg Biohub, San Francisco, United States.Huy Nguyen: Department of Neurology and Neurological Sciences, Stanford University School of Medicine, Stanford, United States.Eric Rulifson: Howard Hughes Medical Institute, Department of Developmental Biology, Institute for Stem Cell Biology and Regenerative Medicine, Stanford University School of Medicine, Stanford, United States.Matthew Fish: Howard Hughes Medical Institute, Department of Developmental Biology, Institute for Stem Cell Biology and Regenerative Medicine, Stanford University School of Medicine, Stanford, United States.Avi Gurion Kaye: Howard Hughes Medical Institute, Department of Developmental Biology, Institute for Stem Cell Biology and Regenerative Medicine, Stanford University School of Medicine, Stanford, United States.Azalia M Martínez Jaimes: Howard Hughes Medical Institute, Department of Developmental Biology, Institute for Stem Cell Biology and Regenerative Medicine, Stanford University School of Medicine, Stanford, United States.Roel Nusse: Howard Hughes Medical Institute, Department of Developmental Biology, Institute for Stem Cell Biology and Regenerative Medicine, Stanford University School of Medicine, Stanford, United States.",,,,,,0
12,2023-02-04,Ana Paula Arruda,,,,,Cold Spring Harbor perspectives in biology,10.1101/cshperspect.a041261,35940911.0,Endoplasmic Reticulum Architecture and Inter-Organelle Communication in Metabolic Health and Disease.,https://pubmed.ncbi.nlm.nih.gov/35940911,"The endoplasmic reticulum (ER) is a key organelle involved in the regulation of lipid and glucose metabolism, proteostasis, Ca",,,,,,2023-02-01,2023/02/01,2022/8/9,Ana Paula Arruda; Güneş Parlakgül,,"Department of Nutritional Sciences and Toxicology, University of California Berkeley, Berkeley, California 94720, USA.; Chan Zuckerberg Biohub, San Francisco, California 94158, USA.; Department of Nutritional Sciences and Toxicology, University of California Berkeley, Berkeley, California 94720, USA.; Sabri Ülker Center for Metabolic Research and Department of Molecular Metabolism, Harvard T.H. Chan School of Public Health, Boston, Massachusetts 02115, USA.","Ana Paula Arruda: Department of Nutritional Sciences and Toxicology, University of California Berkeley, Berkeley, California 94720, USA.; Chan Zuckerberg Biohub, San Francisco, California 94158, USA.Güneş Parlakgül: Department of Nutritional Sciences and Toxicology, University of California Berkeley, Berkeley, California 94720, USA.; Sabri Ülker Center for Metabolic Research and Department of Molecular Metabolism, Harvard T.H. Chan School of Public Health, Boston, Massachusetts 02115, USA.",,,,,,0
13,2023-02-04,,,,Dmitri A Petrov,Stanford University,bioRxiv,10.1101/2023.02.02.526885,,Antigenic diversity in malaria parasites is maintained on extrachromosomal DNA,http://www.biorxiv.org/content/10.1101/2023.02.02.526885v1,"Sequence variation among antigenic var genes enables Plasmodium falciparum malaria parasites to evade host immunity. Using long sequence reads from haploid clones from a mutation accumulation experiment, we detect var diversity inconsistent with simple chromosomal inheritance. We discover putatively circular DNA that is strongly enriched for var genes, which exist in multiple alleles per locus separated by recombination and indel events. Extrachromosomal DNA likely contributes to rapid antigenic diversification in P. falciparum.",,,biorxiv;2023.02.02.526885,1,new results,2023-02-02,02/02/2023,,Emily R Ebel; Bernard Y Kim; Marina McDew-White; Elizabeth S Egan; Tim JC Anderson; Dmitri A Petrov,"Ebel, E. R.; Kim, B. Y.; McDew-White, M.; Egan, E. S.; Anderson, T. J.; Petrov, D. A.",Stanford University School of Medicine;; Stanford University;; Texas Biomedical Research Institute; Stanford University School of Medicine;; Texas Biomedical Research Institute; Stanford University;,"Emily R Ebel, Stanford University School of Medicine;], [Bernard Y Kim, Stanford University;], [Marina McDew-White, Texas Biomedical Research Institute], [Elizabeth S Egan, Stanford University School of Medicine;], [Tim JC Anderson, Texas Biomedical Research Institute], [Dmitri A Petrov, Stanford University;",NA,,,,,0
