record id,save datetime,biohub author,possible biohub author,format biohub author,corresponding author,corresponding author institution,journal,doi,pmid,title,url,abstract,keyword,pdf url,version,version number,type,date,epost date,publish date,authors,authors2,affiliations list,author - affiliations,published or not,confirm published doi,confirm preprint doi,possible match result,match id,record change number
1,2023-01-10,"Brown, J[ames]",,,,,Journal of clinical oncology : official journal of the American Society of Clinical Oncology,10.1200/JCO.22.00171,35944235.0,Physical Activity in Stage III Colon Cancer: CALGB/SWOG 80702 (Alliance).,https://pubmed.ncbi.nlm.nih.gov/35944235,"To determine the specific types, durations, and intensities of recreational physical activity associated with the greatest improvements in disease-free survival (DFS) of patients with colon cancer.",,,,,,2022-08-10,2022/08/09,2022/8/10,Justin C Brown; Chao Ma; Qian Shi; Charles S Fuchs; Jeffrey Meyer; Donna Niedzwiecki; Tyler Zemla; Felix Couture; Philip Kuebler; Pankaj Kumar; DeQuincy Lewis; Benjamin Tan; Smitha Krishnamurthi; Eileen M O'Reilly; Anthony F Shields; Jeffrey A Meyerhardt,,"Alliance Statistics and Data Management Center, Mayo Clinic, Rochester, MN.; Cleveland Clinic, Cleveland, OH.; Columbus NCI Community Oncology Research Program, Columbus, OH.; Cone Health Medical Group, Asheboro, NC.; Dana-Farber/Partners CancerCare, Boston, MA.; Duke University Medical Center, Durham, NC.; Genentech, Inc, South San Francisco, CA.; Hôtel-Dieu de Québec, Québec, QC, Canada.; Illinois CancerCare PC, Peoria, IL.; Karmanos Cancer Institute, Wayne State University, Detroit, MI.; Memorial Sloan Kettering Cancer Center, Weill Cornell Medical Center, New York, NY.; Pennington Biomedical Research Center, Baton Rouge, LA.; LSU Health Sciences Center New Orleans School of Medicine, New Orleans, LA.; Stanley S. Scott Cancer Center, Louisiana State University Health Sciences Center, New Orleans, LA.; Siteman Cancer Center, Washington University School of Medicine in St Louis, Saint Louis, MO.","Justin C Brown: Pennington Biomedical Research Center, Baton Rouge, LA.; LSU Health Sciences Center New Orleans School of Medicine, New Orleans, LA.; Stanley S. Scott Cancer Center, Louisiana State University Health Sciences Center, New Orleans, LA.Chao Ma: Dana-Farber/Partners CancerCare, Boston, MA.Qian Shi: Alliance Statistics and Data Management Center, Mayo Clinic, Rochester, MN.Charles S Fuchs: Genentech, Inc, South San Francisco, CA.Jeffrey Meyer: Dana-Farber/Partners CancerCare, Boston, MA.Donna Niedzwiecki: Duke University Medical Center, Durham, NC.Tyler Zemla: Alliance Statistics and Data Management Center, Mayo Clinic, Rochester, MN.Felix Couture: Hôtel-Dieu de Québec, Québec, QC, Canada.Philip Kuebler: Columbus NCI Community Oncology Research Program, Columbus, OH.Pankaj Kumar: Illinois CancerCare PC, Peoria, IL.DeQuincy Lewis: Cone Health Medical Group, Asheboro, NC.Benjamin Tan: Siteman Cancer Center, Washington University School of Medicine in St Louis, Saint Louis, MO.Smitha Krishnamurthi: Cleveland Clinic, Cleveland, OH.Eileen M O'Reilly: Memorial Sloan Kettering Cancer Center, Weill Cornell Medical Center, New York, NY.Anthony F Shields: Karmanos Cancer Institute, Wayne State University, Detroit, MI.Jeffrey A Meyerhardt: Dana-Farber/Partners CancerCare, Boston, MA.",,,,,,0
2,2023-01-10,"Xu, Ke",,"Xu, Ke",Jiliang Fang; Jie Lu,"Guang'anmen Hospital, China Academy of Chinese Medical Sciences, 100053 Beijing, China. Electronic address: Fangmgh@163.com.Xuanwu Hospital, Capital Medical University, 100053 Beijing, China. Electronic address: imaginglu@hotmail.com.",Progress in neuro-psychopharmacology & biological psychiatry,10.1016/j.pnpbp.2022.110621,36031163.0,Distinct patterns of functional brain network integration between treatment-resistant depression and non treatment-resistant depression: A resting-state functional magnetic resonance imaging study.,https://pubmed.ncbi.nlm.nih.gov/36031163,"Previous neuroimaging has paid little attention to the differences in brain network integration between patients with treatment-resistant depression(TRD) and non-TRD (nTRD), and the relationship between their impaired brain network integration and clinical symptoms has not been elucidated.",Functional connectivity; Functional networks; Resting-state fMRI; Treatment-resistant depression,,,,,2022-08-29,2022/08/27,2022/8/29,Jifei Sun; Yue Ma; Chunlei Guo; Zhongming Du; Limei Chen; Zhi Wang; Xiaojiao Li; Ke Xu; Yi Luo; Yang Hong; Xue Yu; Xue Xiao; Jiliang Fang; Jie Lu,,"Beijing First Hospital of Integrated Chinese and Western Medicine, 100026 Beijing, China.; Dongzhimen Hospital, Beijing University of Chinese Medicine, 100700 Beijing, China.; Guang'anmen Hospital, China Academy of Chinese Medical Sciences, 100053 Beijing, China.; Guang'anmen Hospital, China Academy of Chinese Medical Sciences, 100053 Beijing, China. Electronic address: Fangmgh@163.com.; Xuanwu Hospital, Capital Medical University, 100053 Beijing, China. Electronic address: imaginglu@hotmail.com.","Jifei Sun: Guang'anmen Hospital, China Academy of Chinese Medical Sciences, 100053 Beijing, China.Yue Ma: Guang'anmen Hospital, China Academy of Chinese Medical Sciences, 100053 Beijing, China.Chunlei Guo: Guang'anmen Hospital, China Academy of Chinese Medical Sciences, 100053 Beijing, China.Zhongming Du: Dongzhimen Hospital, Beijing University of Chinese Medicine, 100700 Beijing, China.Limei Chen: Guang'anmen Hospital, China Academy of Chinese Medical Sciences, 100053 Beijing, China.Zhi Wang: Guang'anmen Hospital, China Academy of Chinese Medical Sciences, 100053 Beijing, China.Xiaojiao Li: Guang'anmen Hospital, China Academy of Chinese Medical Sciences, 100053 Beijing, China.Ke Xu: Guang'anmen Hospital, China Academy of Chinese Medical Sciences, 100053 Beijing, China.Yi Luo: Guang'anmen Hospital, China Academy of Chinese Medical Sciences, 100053 Beijing, China.Yang Hong: Guang'anmen Hospital, China Academy of Chinese Medical Sciences, 100053 Beijing, China.Xue Yu: Beijing First Hospital of Integrated Chinese and Western Medicine, 100026 Beijing, China.Xue Xiao: Beijing First Hospital of Integrated Chinese and Western Medicine, 100026 Beijing, China.Jiliang Fang: Guang'anmen Hospital, China Academy of Chinese Medical Sciences, 100053 Beijing, China. Electronic address: Fangmgh@163.com.Jie Lu: Xuanwu Hospital, Capital Medical University, 100053 Beijing, China. Electronic address: imaginglu@hotmail.com.",,,,,,0
3,2023-01-10,"Brown, J[ames]",,,,,Environmental science & technology,10.1021/acs.est.2c06864,36516327.0,"Urban Onsite Sanitation Upgrades and Synanthropic Flies in Maputo, Mozambique: Effects on Enteric Pathogen Infection Risks.",https://pubmed.ncbi.nlm.nih.gov/36516327,"Synanthropic filth flies transport enteric pathogens from feces to food, which upon consumption poses an infection risk. We evaluated the effect of an onsite sanitation intervention─including fly control measures─in Maputo, Mozambique, on the risk of infection from consuming fly-contaminated food. After enumerating flies at intervention and control sites, we cultured fecal indicator bacteria, quantified gene copies for 22 enteric pathogens via reverse transcription quantitative polymerase chain reaction (RT-qPCR), and developed quantitative microbial risk assessment (QMRA) models to estimate annual risks of infection attributable to fly-contaminated foods. We found that the intervention reduced fly counts at latrine entrances by 69% (aRR = 0.31, [0.13, 0.75]) but not at food preparation areas (aRR = 0.92, [0.33, 2.6]). Half of (23/46) of individual flies were positive for culturable ",PCR; QMRA; enteric pathogens; flies; infection; onsite sanitation,,,,,2022-12-15,2022/12/14,2022/12/15,Drew Capone; Zaida Adriano; Oliver Cumming; Seth R Irish; Jackie Knee; Rassul Nala; Joe Brown,,"Department of Disease Control, London School of Hygiene and Tropical Medicine, LondonWC1E 7HT, United Kingdom.; Department of Environmental Sciences and Engineering, Gillings School of Public Health, University of North Carolina at Chapel Hill, Chapel Hill, North Carolina27599, United States.; Department of Environmental and Occupational Health, School of Public Health, Indiana University, 2719 E 10th St, Bloomington, Indiana47401, United States.; Epidemiology and Public Health Department, Swiss Tropical and Public Health Institute, Kreuzstrasse 2, Allschwil4123, Switzerland.; Ministério da Saúde, Instituto Nacional de Saúde Maputo, Maputo1102, Mozambique.; WE Consult ltd, 177 Rua Tomas Ribeiro, Maputo1102, Mozambique.","Drew Capone: Department of Environmental and Occupational Health, School of Public Health, Indiana University, 2719 E 10th St, Bloomington, Indiana47401, United States.Zaida Adriano: WE Consult ltd, 177 Rua Tomas Ribeiro, Maputo1102, Mozambique.Oliver Cumming: Department of Disease Control, London School of Hygiene and Tropical Medicine, LondonWC1E 7HT, United Kingdom.Seth R Irish: Epidemiology and Public Health Department, Swiss Tropical and Public Health Institute, Kreuzstrasse 2, Allschwil4123, Switzerland.Jackie Knee: Department of Disease Control, London School of Hygiene and Tropical Medicine, LondonWC1E 7HT, United Kingdom.Rassul Nala: Ministério da Saúde, Instituto Nacional de Saúde Maputo, Maputo1102, Mozambique.Joe Brown: Department of Environmental Sciences and Engineering, Gillings School of Public Health, University of North Carolina at Chapel Hill, Chapel Hill, North Carolina27599, United States.",,,,,,0
4,2023-01-10,"Landry, Markita",,"Landry, Markita; Landry, Markita",,,ACS nano,10.1021/acsnano.2c09249,36573831.0,The Issue of Reliability and Repeatability of Analytical Measurement in Industrial and Academic Nanomedicine.,https://pubmed.ncbi.nlm.nih.gov/36573831,The issue of reliability and repeatability of data in the nanomedicine literature is a growing concern among stakeholders. This perspective discusses the key differences between academia and industry in the reproducibility of data acquisition and protocols in the field of nanomedicine. We also discuss what academic researchers can learn from systems implemented in industry to standardize data acquisition and in which ways these can be efficiently adopted by the academic community.,"nanomedicine; repeatability, medical devices, quality control, good manufacturing practice; reproducibility; standards",,,,,2022-12-28,2022/12/27,2022/12/28,Shahriar Sharifi; Nigel Reuel; Nathaniel Kallmyer; Ethan Sun; Markita P Landry; Morteza Mahmoudi,,"Department of Chemical and Biological Engineering, Iowa State University, Ames, Iowa 50011, United States.; Zymosense Inc., Ames, Iowa 50010, United States.; Department of Chemical and Biomolecular Engineering, University of California, Berkeley, Berkeley, California 94720, United States.; Department of Chemical and Biomolecular Engineering, University of California, Berkeley, Berkeley, California 94720, United States.; Innovative Genomics Institute, Berkeley, California 94720, United States.; California Institute for Quantitative Biosciences, University of California, Berkeley, Berkeley, California 94720, United States.; Chan Zuckerberg Biohub, San Francisco, California 94158, United States.; Department of Radiology and Precision Health Program, Michigan State University, East Lansing, Michigan 48824, United States.; Zymosense Inc., Ames, Iowa 50010, United States.","Shahriar Sharifi: Department of Radiology and Precision Health Program, Michigan State University, East Lansing, Michigan 48824, United States.Nigel Reuel: Department of Chemical and Biological Engineering, Iowa State University, Ames, Iowa 50011, United States.; Zymosense Inc., Ames, Iowa 50010, United States.Nathaniel Kallmyer: Zymosense Inc., Ames, Iowa 50010, United States.Ethan Sun: Department of Chemical and Biomolecular Engineering, University of California, Berkeley, Berkeley, California 94720, United States.Markita P Landry: Department of Chemical and Biomolecular Engineering, University of California, Berkeley, Berkeley, California 94720, United States.; Innovative Genomics Institute, Berkeley, California 94720, United States.; California Institute for Quantitative Biosciences, University of California, Berkeley, Berkeley, California 94720, United States.; Chan Zuckerberg Biohub, San Francisco, California 94158, United States.Morteza Mahmoudi: Department of Radiology and Precision Health Program, Michigan State University, East Lansing, Michigan 48824, United States.",,,,,,0
5,2023-01-10,Emma Lundberg,,,Yashvardhan Jain,Indiana University,bioRxiv,10.1101/2023.01.05.522764,,Segmenting functional tissue units across human organs using community-driven development of generalizable machine learning algorithms,http://www.biorxiv.org/content/10.1101/2023.01.05.522764v1,"The development of a reference atlas of the healthy human body requires automated image segmentation of major anatomical structures across multiple organs based on spatial bioimages generated from various sources with differences in sample preparation. We present the setup and results of the ""Hacking the Human Body"" machine learning algorithm development competition hosted by the Human Biomolecular Atlas (HuBMAP) and the Human Protein Atlas (HPA) teams on the Kaggle platform. We showcase how 1,175 teams from 78 countries engaged in community- driven, open-science code development that resulted in machine learning models which successfully segment anatomical structures across five organs using histology images from two consortia and that will be productized in the HuBMAP data portal to process large datasets at scale in support of Human Reference Atlas construction. We discuss the benchmark data created for the competition, major challenges faced by the participants, and the winning models and strategies.",,,biorxiv;2023.01.05.522764,1,new results,2023-01-06,01/06/2023,,Yashvardhan Jain; Leah L. Godwin; Sripad Joshi; Shriya Mandarapu; Trang Le; Cecilia Lindskog; Emma Lundberg; Katy Börner,"Jain, Y.; Godwin, L. L.; Joshi, S.; Mandarapu, S.; Le, T.; Lindskog, C.; Lundberg, E.; Börner, K.","Department of Intelligent Systems Engineering, Luddy School of Informatics, Computing, and Engineering, Indiana University; Department of Intelligent Systems Engineering, Luddy School of Informatics, Computing, and Engineering, Indiana University; Department of Intelligent Systems Engineering, Luddy School of Informatics, Computing, and Engineering, Indiana University; Department of Intelligent Systems Engineering, Luddy School of Informatics, Computing, and Engineering, Indiana University; Science for Life Laboratory, School of Engineering Sciences in Chemistry, Biotechnology and Health, KTH - Royal Institute of Technology; Department of Bioengineering, Stanford University; Department of Immunology, Genetics and Pathology, Division of Cancer Precision Medicine, Uppsala University; Science for Life Laboratory, School of Engineering Sciences in Chemistry, Biotechnology and Health, KTH - Royal Institute of Technology; Department of Bioengineering, Stanford University; Department of Pathology, Stanford University; Chan Zuckerberg Biohub; Department of Intelligent Systems Engineering, Luddy School of Informatics, Computing, and Engineering, Indiana University","Yashvardhan Jain, Department of Intelligent Systems Engineering, Luddy School of Informatics, Computing, and Engineering, Indiana University], [Leah L. Godwin, Department of Intelligent Systems Engineering, Luddy School of Informatics, Computing, and Engineering, Indiana University], [Sripad Joshi, Department of Intelligent Systems Engineering, Luddy School of Informatics, Computing, and Engineering, Indiana University], [Shriya Mandarapu, Department of Intelligent Systems Engineering, Luddy School of Informatics, Computing, and Engineering, Indiana University], [Trang Le, Science for Life Laboratory, School of Engineering Sciences in Chemistry, Biotechnology and Health, KTH - Royal Institute of Technology, Department of Bioengineering, Stanford University], [Cecilia Lindskog, Department of Immunology, Genetics and Pathology, Division of Cancer Precision Medicine, Uppsala University], [Emma Lundberg, Science for Life Laboratory, School of Engineering Sciences in Chemistry, Biotechnology and Health, KTH - Royal Institute of Technology, Department of Bioengineering, Stanford University, Department of Pathology, Stanford University, Chan Zuckerberg Biohub], [Katy Börner, Department of Intelligent Systems Engineering, Luddy School of Informatics, Computing, and Engineering, Indiana University",NA,,,,,0
