record id,save datetime,biohub author,possible biohub author,format biohub author,corresponding author,corresponding author institution,journal,doi,pmid,title,url,abstract,keyword,pdf url,version,version number,type,date,epost date,publish date,authors,authors2,affiliations list,author - affiliations,published or not,confirm published doi,confirm preprint doi,possible match result,match id,record change number
22,2023-02-01,"Altman, Russ",,"Altman, Russ",,,Protein science : a publication of the Protein Society,10.1002/pro.4541,36519247.0,COLLAPSE: A representation learning framework for identification and characterization of protein structural sites.,https://pubmed.ncbi.nlm.nih.gov/36519247,"The identification and characterization of the structural sites which contribute to protein function are crucial for understanding biological mechanisms, evaluating disease risk, and developing targeted therapies. However, the quantity of known protein structures is rapidly outpacing our ability to functionally annotate them. Existing methods for function prediction either do not operate on local sites, suffer from high false positive or false negative rates, or require large site-specific training datasets, necessitating the development of new computational methods for annotating functional sites at scale. We present COLLAPSE (Compressed Latents Learned from Aligned Protein Structural Environments), a framework for learning deep representations of protein sites. COLLAPSE operates directly on the 3D positions of atoms surrounding a site and uses evolutionary relationships between homologous proteins as a self-supervision signal, enabling learned embeddings to implicitly capture structure-function relationships within each site. Our representations generalize across disparate tasks in a transfer learning context, achieving state-of-the-art performance on standardized benchmarks (protein-protein interactions and mutation stability) and on the prediction of functional sites from the Prosite database. We use COLLAPSE to search for similar sites across large protein datasets and to annotate proteins based on a database of known functional sites. These methods demonstrate that COLLAPSE is computationally efficient, tunable, and interpretable, providing a general-purpose platform for computational protein analysis.",deep learning; functional site annotation; protein structure analysis; representation learning; structural informatics,,,,,2022-12-16,,2022/12/16,Alexander Derry; Russ B Altman,,"Department of Biomedical Data Science, Stanford University, Stanford, California, USA.; Department of Biomedical Data Science, Stanford University, Stanford, California, USA.; Departments of Bioengineering, Genetics, and Medicine, Stanford University, Stanford, California, USA.","Alexander Derry: Department of Biomedical Data Science, Stanford University, Stanford, California, USA.Russ B Altman: Department of Biomedical Data Science, Stanford University, Stanford, California, USA.; Departments of Bioengineering, Genetics, and Medicine, Stanford University, Stanford, California, USA.",,,10.1101/2022.07.20.500713,,,0
23,2023-02-01,Peter S Kim,,"Kim, Peter; Kim, Peter",,,Journal of virology,10.1128/jvi.01647-22,36541800.0,Enhancing HIV-1 Neutralization by Increasing the Local Concentration of Membrane-Proximal External Region-Directed Broadly Neutralizing Antibodies.,https://pubmed.ncbi.nlm.nih.gov/36541800,"Broadly neutralizing antibodies (bNAbs) against the membrane-proximal external region (MPER) of the gp41 component of the human immunodeficiency virus type 1 (HIV-1) envelope (Env) are characterized by long, hydrophobic, heavy chain complementarity-determining region 3s (HCDR3s) that interact with the MPER and some viral membrane lipids to achieve increased local concentrations. Here, we show that increasing the local concentration of MPER-directed bNAbs at the cell surface via binding to the high-affinity Fc receptor FcγRI potentiates their ability to prevent viral entry in a manner analogous to the previously reported observation wherein the lipid-binding activity of MPER bNAbs increases their concentration at the viral surface membrane. However, binding of MPER-directed bNAb 10E8 to FcγRI abolishes the neutralization synergy that is seen with the N-heptad repeat (NHR)-targeting antibody D5_AR and NHR-targeting small molecule enfuvirtide (T20), possibly due to decreased accessibility of the NHR in the FcγRI-10E8-MPER complex. Taken together, our results suggest that lipid-binding activity and FcγRI-mediated potentiation function in concert to improve the potency of MPER-directed bNAbs by increasing their local concentration near the site of viral fusion. Therefore, lipid binding may not be a strict requirement for potent neutralization by MPER-targeting bNAbs, as alternative methods can achieve similar increases in local concentrations while avoiding potential liabilities associated with immunologic host tolerance. ",HIV-1; MPER; broadly neutralizing antibody; gp41; lipid binding; neutralization,,,,,2022-12-22,2022/12/21,2022/12/22,Soohyun Kim; Maria V Filsinger Interrante; Peter S Kim,,"Department of Biochemistry, Stanford University School of Medicine, Stanford, California, USA.; Sarafan ChEM-H, Stanford University, Stanford, California, USA.; Department of Biochemistry, Stanford University School of Medicine, Stanford, California, USA.; Sarafan ChEM-H, Stanford University, Stanford, California, USA.; Chan Zuckerberg Biohub, San Francisco, California, USA.; Sarafan ChEM-H, Stanford University, Stanford, California, USA.; Stanford Medical Scientist Training Program, Stanford University School of Medicine, Stanford, California, USA.; Stanford Biophysics Program, Stanford University School of Medicine, Stanford, California, USA.","Soohyun Kim: Department of Biochemistry, Stanford University School of Medicine, Stanford, California, USA.; Sarafan ChEM-H, Stanford University, Stanford, California, USA.Maria V Filsinger Interrante: Sarafan ChEM-H, Stanford University, Stanford, California, USA.; Stanford Medical Scientist Training Program, Stanford University School of Medicine, Stanford, California, USA.; Stanford Biophysics Program, Stanford University School of Medicine, Stanford, California, USA.Peter S Kim: Department of Biochemistry, Stanford University School of Medicine, Stanford, California, USA.; Sarafan ChEM-H, Stanford University, Stanford, California, USA.; Chan Zuckerberg Biohub, San Francisco, California, USA.",,,,,,0
24,2023-02-01,"Priest, James",,"Priest, James; Priest, James",,,"Arteriosclerosis, thrombosis, and vascular biology",10.1161/ATVBAHA.122.318149,36601961.0,Relationship Between Ascending Thoracic Aortic Diameter and Blood Pressure: A Mendelian Randomization Study.,https://pubmed.ncbi.nlm.nih.gov/36601961,"Observational studies identified elevated blood pressure (BP) as a strong risk factor for thoracic aortic dilation, and BP reduction is the primary medical intervention recommended to prevent progression of aortic aneurysms. However, although BP may impact aortic dilation, aortic size may also impact BP. The causal relationship between BP and thoracic aortic size has not been reliably established.",Mendelian randomization; analysis; aneurysm; aorta; blood pressure; genomics,,,,,2023-01-06,2023/01/05,2023/1/6,John DePaolo; Michael G Levin; Catherine Tcheandjieu; James R Priest; Dipender Gill; Stephen Burgess; Scott M Damrauer; Julio A Chirinos,,"Chief Scientific Advisor Office, Research and Early Development, Novo Nordisk, Copenhagen, Denmark (D.G.).; Department of Epidemiology and Biostatistics, School of Public Health, Imperial College London, United Kingdom (D.G.).; Department of Surgery (J.D., S.M.D.), Perelman School of Medicine, University of Pennsylvania, Philadelphia.; Department of Surgery (J.D., S.M.D.), Perelman School of Medicine, University of Pennsylvania, Philadelphia.; Department of Genetics (S.M.D.), Perelman School of Medicine, University of Pennsylvania, Philadelphia.; Corporal Michael Crescenz VA Medical Center, Philadelphia, PA (S.M.D.).; Division of Cardiovascular Medicine, Department of Medicine (M.G.L., J.A.C.), Perelman School of Medicine, University of Pennsylvania, Philadelphia.; Division of Pediatric Cardiology, Department of Pediatrics, Stanford University School of Medicine, CA (J.R.P.).; Gladstone Institute of Data Science and Biotechnology, Gladstone Institutes, San Francisco, CA (C.T.).; Department of Epidemiology and Biostatistics, University of California San Francisco (C.T.).; MRC Integrative Epidemiology Unit, University of Bristol, United Kingdom (S.B.).; Department of Public Health and Primary Care, University of Cambridge, United Kingdom (S.B.).","John DePaolo: Department of Surgery (J.D., S.M.D.), Perelman School of Medicine, University of Pennsylvania, Philadelphia.Michael G Levin: Division of Cardiovascular Medicine, Department of Medicine (M.G.L., J.A.C.), Perelman School of Medicine, University of Pennsylvania, Philadelphia.Catherine Tcheandjieu: Gladstone Institute of Data Science and Biotechnology, Gladstone Institutes, San Francisco, CA (C.T.).; Department of Epidemiology and Biostatistics, University of California San Francisco (C.T.).James R Priest: Division of Pediatric Cardiology, Department of Pediatrics, Stanford University School of Medicine, CA (J.R.P.).Dipender Gill: Chief Scientific Advisor Office, Research and Early Development, Novo Nordisk, Copenhagen, Denmark (D.G.).; Department of Epidemiology and Biostatistics, School of Public Health, Imperial College London, United Kingdom (D.G.).Stephen Burgess: MRC Integrative Epidemiology Unit, University of Bristol, United Kingdom (S.B.).; Department of Public Health and Primary Care, University of Cambridge, United Kingdom (S.B.).Scott M Damrauer: Department of Surgery (J.D., S.M.D.), Perelman School of Medicine, University of Pennsylvania, Philadelphia.; Department of Genetics (S.M.D.), Perelman School of Medicine, University of Pennsylvania, Philadelphia.; Corporal Michael Crescenz VA Medical Center, Philadelphia, PA (S.M.D.).Julio A Chirinos: Division of Cardiovascular Medicine, Department of Medicine (M.G.L., J.A.C.), Perelman School of Medicine, University of Pennsylvania, Philadelphia.",,,,,,0
25,2023-02-01,"Brown, J[ames]",,,Riaan van Tonder,"Institute of Sport and Exercise Medicine, Department of Exercise, Sport and Lifestyle Medicine, Faculty of Medicine and Health Sciences, Stellenbosch University, Cape Town, South Africa riaanvt@icloud.com.; IOC Research Centre, Cape Town, South Africa.",Injury prevention : journal of the International Society for Child and Adolescent Injury Prevention,10.1136/ip-2022-044714,36600566.0,Tackling sport-related concussion: effectiveness of lowering the maximum legal height of the tackle in amateur male rugby - a cross-sectional analytical study.,https://pubmed.ncbi.nlm.nih.gov/36600566,"Rugby union ('rugby') is popular globally, with most of its participants being amateur. Concern regarding sport-related concussion (SRC) sustained during rugby is increasing. SRC occurs most frequently in the tackle, yet few interventions have aimed to mitigate this risk factor. This study investigated the influence of a lowered legal tackle height on SRC incidence in amateur rugby.",concussion; recreation / sports; traumatic brain injury,,,,,2023-01-06,2022/12/06,2023/1/6,Riaan van Tonder; Lindsay Starling; Sean Surmon; Pierre Viviers; Wilbur Kraak; Pieter-Henk Boer; Esme Jordaan; Sharief Hendricks; Keith A Stokes; Wayne Derman; James Craig Brown,,"Biostatistics Unit, South African Medical Research Council, Cape Town, South Africa.; Statistics and Population Studies Department, University of the Western Cape, Cape Town, South Africa.; Department for Health, University of Bath, Bath, UK.; Department for Health, University of Bath, Bath, UK.; Medical Services, Rugby Football Union, London, UK.; Department of Human Movement Science, Cape Peninsula University of Technology, Wellington, South Africa.; Division of Physiological Sciences and Health through Physical Activity, Lifestyle and Sport Research Centre, Department of Human Biology, Faculty of Health Sciences, University of Cape Town, Cape Town, South Africa.; Carnegie Applied Rugby Research (CARR) Centre, Carnegie School of Sport, Leeds Beckett University, Leeds, UK.; Division of Sport Science, Department of Exercise, Sport and Lifestyle Medicine, Faculty of Medicine and Health Sciences, Stellenbosch University, Stellenbosch, South Africa.; Institute of Sport and Exercise Medicine, Department of Exercise, Sport and Lifestyle Medicine, Faculty of Medicine and Health Sciences, Stellenbosch University, Cape Town, South Africa riaanvt@icloud.com.; IOC Research Centre, Cape Town, South Africa.; Institute of Sport and Exercise Medicine, Department of Exercise, Sport and Lifestyle Medicine, Faculty of Medicine and Health Sciences, Stellenbosch University, Cape Town, South Africa.; Campus Health Service, Stellenbosch University, Stellenbosch, South Africa.; Institute of Sport and Exercise Medicine, Department of Exercise, Sport and Lifestyle Medicine, Faculty of Medicine and Health Sciences, Stellenbosch University, Cape Town, South Africa.; IOC Research Centre, Cape Town, South Africa.; Maties Sport, Stellenbosch University, Stellenbosch, South Africa.","Riaan van Tonder: Institute of Sport and Exercise Medicine, Department of Exercise, Sport and Lifestyle Medicine, Faculty of Medicine and Health Sciences, Stellenbosch University, Cape Town, South Africa riaanvt@icloud.com.; IOC Research Centre, Cape Town, South Africa.Lindsay Starling: Department for Health, University of Bath, Bath, UK.Sean Surmon: Maties Sport, Stellenbosch University, Stellenbosch, South Africa.Pierre Viviers: Institute of Sport and Exercise Medicine, Department of Exercise, Sport and Lifestyle Medicine, Faculty of Medicine and Health Sciences, Stellenbosch University, Cape Town, South Africa.; Campus Health Service, Stellenbosch University, Stellenbosch, South Africa.Wilbur Kraak: Division of Sport Science, Department of Exercise, Sport and Lifestyle Medicine, Faculty of Medicine and Health Sciences, Stellenbosch University, Stellenbosch, South Africa.Pieter-Henk Boer: Department of Human Movement Science, Cape Peninsula University of Technology, Wellington, South Africa.Esme Jordaan: Biostatistics Unit, South African Medical Research Council, Cape Town, South Africa.; Statistics and Population Studies Department, University of the Western Cape, Cape Town, South Africa.Sharief Hendricks: Division of Physiological Sciences and Health through Physical Activity, Lifestyle and Sport Research Centre, Department of Human Biology, Faculty of Health Sciences, University of Cape Town, Cape Town, South Africa.; Carnegie Applied Rugby Research (CARR) Centre, Carnegie School of Sport, Leeds Beckett University, Leeds, UK.Keith A Stokes: Department for Health, University of Bath, Bath, UK.; Medical Services, Rugby Football Union, London, UK.Wayne Derman: Institute of Sport and Exercise Medicine, Department of Exercise, Sport and Lifestyle Medicine, Faculty of Medicine and Health Sciences, Stellenbosch University, Cape Town, South Africa.; IOC Research Centre, Cape Town, South Africa.James Craig Brown: Institute of Sport and Exercise Medicine, Department of Exercise, Sport and Lifestyle Medicine, Faculty of Medicine and Health Sciences, Stellenbosch University, Cape Town, South Africa.; IOC Research Centre, Cape Town, South Africa.",,,,,,0
26,2023-02-01,"Huang, Kerwyn",,"Huang, KC; Huang, KC; Huang, KC",Karina B Xavier; Kerwyn Casey Huang; Benjamin H Good,"Instituto Gulbenkian de Ciência, 2780-156 Oeiras, Portugal. Electronic address: kxavier@igc.gulbenkian.pt.Department of Microbiology and Immunology, Stanford University School of Medicine, Stanford, CA 94305, USA; Department of Bioengineering, Stanford University, Stanford, CA 94305, USA; Chan Zuckerberg Biohub, San Francisco, CA 94158, USA. Electronic address: kchuang@stanford.edu.Department of Applied Physics, Stanford University, Stanford, CA 94305, USA. Electronic address: bhgood@stanford.edu.",Current opinion in microbiology,10.1016/j.mib.2022.102258,36608574.0,Within-host evolution of the gut microbiome.,https://pubmed.ncbi.nlm.nih.gov/36608574,"Gut bacteria inhabit a complex environment that is shaped by interactions with their host and the other members of the community. While these ecological interactions have evolved over millions of years, mounting evidence suggests that gut commensals can evolve on much shorter timescales as well, by acquiring new mutations within individual hosts. In this review, we highlight recent progress in understanding the causes and consequences of short-term evolution in the mammalian gut, from experimental evolution in murine hosts to longitudinal tracking of human cohorts. We also discuss new opportunities for future progress by expanding the repertoire of focal species, hosts, and surrounding communities, and by combining deep-sequencing technologies with quantitative frameworks from population genetics.",,,,,,2023-01-07,2023/01/04,2023/1/7,Tanja Dapa; Daniel Pgh Wong; Kimberly S Vasquez; Karina B Xavier; Kerwyn Casey Huang; Benjamin H Good,,"Department of Applied Physics, Stanford University, Stanford, CA 94305, USA.; Department of Applied Physics, Stanford University, Stanford, CA 94305, USA. Electronic address: bhgood@stanford.edu.; Department of Microbiology and Immunology, Stanford University School of Medicine, Stanford, CA 94305, USA.; Department of Microbiology and Immunology, Stanford University School of Medicine, Stanford, CA 94305, USA; Department of Bioengineering, Stanford University, Stanford, CA 94305, USA; Chan Zuckerberg Biohub, San Francisco, CA 94158, USA. Electronic address: kchuang@stanford.edu.; Instituto Gulbenkian de Ciência, 2780-156 Oeiras, Portugal.; Instituto Gulbenkian de Ciência, 2780-156 Oeiras, Portugal. Electronic address: kxavier@igc.gulbenkian.pt.","Tanja Dapa: Instituto Gulbenkian de Ciência, 2780-156 Oeiras, Portugal.Daniel Pgh Wong: Department of Applied Physics, Stanford University, Stanford, CA 94305, USA.Kimberly S Vasquez: Department of Microbiology and Immunology, Stanford University School of Medicine, Stanford, CA 94305, USA.Karina B Xavier: Instituto Gulbenkian de Ciência, 2780-156 Oeiras, Portugal. Electronic address: kxavier@igc.gulbenkian.pt.Kerwyn Casey Huang: Department of Microbiology and Immunology, Stanford University School of Medicine, Stanford, CA 94305, USA; Department of Bioengineering, Stanford University, Stanford, CA 94305, USA; Chan Zuckerberg Biohub, San Francisco, CA 94158, USA. Electronic address: kchuang@stanford.edu.Benjamin H Good: Department of Applied Physics, Stanford University, Stanford, CA 94305, USA. Electronic address: bhgood@stanford.edu.",,,,,,0
27,2023-02-01,"Brown, J[ames]",,,,,"Obesity (Silver Spring, Md.)",10.1002/oby.23649,36628617.0,Obesity and metabolic dysfunction correlate with background parenchymal enhancement in premenopausal women.,https://pubmed.ncbi.nlm.nih.gov/36628617,"This study tested the hypothesis that obesity and metabolic abnormalities correlate with background parenchymal enhancement (BPE), the volume and intensity of enhancing fibroglandular breast tissue on dynamic contrast-enhanced magnetic resonance imaging.",,,,,,2023-01-12,2023/01/11,2023/1/12,Justin C Brown; Jennifer A Ligibel; Tracy E Crane; Despina Kontos; Shengping Yang; Emily F Conant; Julie A Mack; Rexford S Ahima; Kathryn H Schmitz,,"Dana-Farber Cancer Institute, Boston, Massachusetts, USA.; Department of Medicine, Division of Endocrinology, Diabetes and Metabolism, Johns Hopkins University School of Medicine, Baltimore, Maryland, USA.; Miller School of Medicine, University of Miami, Miami, Florida, USA.; Penn State College of Medicine, Hershey, Pennsylvania, USA.; Pennington Biomedical Research Center, Baton Rouge, Louisiana, USA.; Pennington Biomedical Research Center, Baton Rouge, Louisiana, USA.; LSU Health Sciences Center New Orleans School of Medicine, New Orleans, Louisiana, USA.; Stanley S. Scott Cancer Center, Louisiana State University Health Sciences Center, New Orleans, Louisiana, USA.; University of Pennsylvania, Perelman School of Medicine, Philadelphia, Pennsylvania, USA.","Justin C Brown: Pennington Biomedical Research Center, Baton Rouge, Louisiana, USA.; LSU Health Sciences Center New Orleans School of Medicine, New Orleans, Louisiana, USA.; Stanley S. Scott Cancer Center, Louisiana State University Health Sciences Center, New Orleans, Louisiana, USA.Jennifer A Ligibel: Dana-Farber Cancer Institute, Boston, Massachusetts, USA.Tracy E Crane: Miller School of Medicine, University of Miami, Miami, Florida, USA.Despina Kontos: University of Pennsylvania, Perelman School of Medicine, Philadelphia, Pennsylvania, USA.Shengping Yang: Pennington Biomedical Research Center, Baton Rouge, Louisiana, USA.Emily F Conant: University of Pennsylvania, Perelman School of Medicine, Philadelphia, Pennsylvania, USA.Julie A Mack: Penn State College of Medicine, Hershey, Pennsylvania, USA.Rexford S Ahima: Department of Medicine, Division of Endocrinology, Diabetes and Metabolism, Johns Hopkins University School of Medicine, Baltimore, Maryland, USA.Kathryn H Schmitz: Penn State College of Medicine, Hershey, Pennsylvania, USA.",,,,,,0
