record id,save datetime,biohub author,possible biohub author,format biohub author,corresponding author,corresponding author institution,journal,doi,pmid,title,url,abstract,keyword,pdf url,version,version number,type,date,epost date,publish date,authors,authors2,affiliations list,author - affiliations,published or not,confirm published doi,confirm preprint doi,possible match result,match id,record change number
1,2023-02-04,,,,,,American journal of medical genetics. Part A,10.1002/ajmg.a.63020,36308388.0,Obstetrical and neonatal outcomes of cardio-facio-cutaneous syndrome: Prenatal consequences of Ras/MAPK dysregulation.,https://pubmed.ncbi.nlm.nih.gov/36308388,"We systematically delineated the prenatal phenotype, and obstetrical and neonatal outcomes of the RASopathy cardio-facio-cutaneous (CFC) syndrome. A comprehensive, retrospective medical history survey was distributed to parents of children with confirmed CFC in collaboration with CFC International, Inc. Data were collected on CFC gene variant, maternal characteristics, pregnancy course, delivery, and neonatal outcomes with the support of medical records. We identified 43 individuals with pathogenic variants in BRAF (81%), MEK1 (14%), or MEK2 (5%) genes. The median age was 8.5 years. Hyperemesis gravidarum, gestational diabetes, gestational hypertension, and preeclampsia occurred in 5/43 (12%), 4/43 (9%), 3/43 (7%), and 3/43 (7%) of pregnancies, respectively. Second and third trimester ultrasound abnormalities included polyhydramnios, macrocephaly, macrosomia, and renal and cardiac abnormalities. Delivery occurred via spontaneous vaginal, operative vaginal, or cesarean delivery in 15/42 (36%), 7/42 (16%), and 20/42 (48%), respectively. Median gestational age at delivery was 37 weeks and median birth weight was 3501 grams. Germline pathogenic vaiants had mutiple congenital consequences including polyhydramnios, renal and cardiac abnormalities, macrosomia, and macrocephaly on second and third trimester ultrasound. Elevated rates of operative delivery and neonatal complications were also noted. Understanding and defining a prenatal phenotype may improve prenatal prognostic counseling and outcomes.",RASopathy; Ras/MAPK; cardio-facio-cutaneous syndrome; prenatal; signal transduction pathway,,,,,2022-10-30,2022/10/29,2022/10/30,Angie C Jelin; Amanda Mahle; Susan H Tran; Teresa N Sparks; Katherine A Rauen,,"Department of Gynecology and Obstetrics, Johns Hopkins University School of Medicine, Baltimore, Maryland, United States.; Department of Gynecology and Obstetrics, Johns Hopkins University School of Medicine, Baltimore, Maryland, United States.; Department of Genetic Medicine, Johns Hopkins University School of Medicine, Baltimore, Maryland, United States.; Department of Obstetrics, Gynecology and Reproductive Sciences, University of California San Francisco, San Francisco, California, United States.; Division of Genomic Medicine, Department of Pediatrics, MIND Institute, University of California Davis, Davis, California, United States.; Division of Maternal-Fetal Medicine, Legacy Medical Group, Portland, Oregon, United States.","Angie C Jelin: Department of Gynecology and Obstetrics, Johns Hopkins University School of Medicine, Baltimore, Maryland, United States.; Department of Genetic Medicine, Johns Hopkins University School of Medicine, Baltimore, Maryland, United States.Amanda Mahle: Department of Gynecology and Obstetrics, Johns Hopkins University School of Medicine, Baltimore, Maryland, United States.Susan H Tran: Division of Maternal-Fetal Medicine, Legacy Medical Group, Portland, Oregon, United States.Teresa N Sparks: Department of Obstetrics, Gynecology and Reproductive Sciences, University of California San Francisco, San Francisco, California, United States.Katherine A Rauen: Division of Genomic Medicine, Department of Pediatrics, MIND Institute, University of California Davis, Davis, California, United States.",,,,,,0
2,2023-02-04,Seth L Shipman,,,Seth L Shipman,"Gladstone Institute of Data Science and Biotechnology, San Francisco, CA, USA; Department of Bioengineering and Therapeutic Sciences, University of California, San Francisco, CA, USA; Chan Zuckerberg Biohub, San Francisco, CA, USA. Electronic address: seth.shipman@gladstone.ucsf.edu.",Current opinion in biotechnology,10.1016/j.copbio.2022.102855,36481341.0,Molecular recording: transcriptional data collection into the genome.,https://pubmed.ncbi.nlm.nih.gov/36481341,"Advances in regenerative medicine depend upon understanding the complex transcriptional choreography that guides cellular development. Transcriptional molecular recorders, tools that record different transcriptional events into the genome of cells, hold promise to elucidate both the intensity and timing of transcriptional activity at single-cell resolution without requiring destructive multitime point assays. These technologies are dependent on DNA writers, which translate transcriptional signals into stable genomic mutations that encode the duration, intensity, and order of transcriptional events. In this review, we highlight recent progress toward more informative and multiplexable transcriptional recording through the use of three different types of DNA writing - recombineering, Cas1-Cas2 acquisition, and prime editing - and the architecture of the genomic data generated.",,,,,,2022-12-09,2022/12/05,2022/12/9,Sierra K Lear; Seth L Shipman,,"Gladstone Institute of Data Science and Biotechnology, San Francisco, CA, USA; Department of Bioengineering and Therapeutic Sciences, University of California, San Francisco, CA, USA; Chan Zuckerberg Biohub, San Francisco, CA, USA. Electronic address: seth.shipman@gladstone.ucsf.edu.; Gladstone Institute of Data Science and Biotechnology, San Francisco, CA, USA; Graduate Program in Bioengineering, University of California, San Francisco and Berkeley, CA, USA.","Sierra K Lear: Gladstone Institute of Data Science and Biotechnology, San Francisco, CA, USA; Graduate Program in Bioengineering, University of California, San Francisco and Berkeley, CA, USA.Seth L Shipman: Gladstone Institute of Data Science and Biotechnology, San Francisco, CA, USA; Department of Bioengineering and Therapeutic Sciences, University of California, San Francisco, CA, USA; Chan Zuckerberg Biohub, San Francisco, CA, USA. Electronic address: seth.shipman@gladstone.ucsf.edu.",,,,,,0
3,2023-02-04,Daniel A Fletcher,,"Fletcher, Dan; Fletcher, Dan; Fletcher, Dan; Fletcher, Dan; Fletcher, Dan",Wendell A Lim,"UCSF Cell Design Institute, University of California, San Francisco, CA, USA. wendell.lim@ucsf.edu.; Department of Cellular and Molecular Pharmacology, University of California, San Francisco, CA, USA. wendell.lim@ucsf.edu.; Center for Cellular Construction, University of California, San Francisco, CA, USA. wendell.lim@ucsf.edu.",Nature,10.1038/s41586-022-05622-z,36509107.0,Programming multicellular assembly with synthetic cell adhesion molecules.,https://pubmed.ncbi.nlm.nih.gov/36509107,"Cell adhesion molecules are ubiquitous in multicellular organisms, specifying precise cell-cell interactions in processes as diverse as tissue development, immune cell trafficking and the wiring of the nervous system",,,,,,2022-12-13,2022/12/12,2022/12/13,Adam J Stevens; Andrew R Harris; Josiah Gerdts; Ki H Kim; Coralie Trentesaux; Jonathan T Ramirez; Wesley L McKeithan; Faranak Fattahi; Ophir D Klein; Daniel A Fletcher; Wendell A Lim,,"Center for Cellular Construction, University of California, San Francisco, CA, USA.; Department of Bioengineering, University of California, Berkeley, CA, USA.; Chan Zuckerberg Biohub, San Francisco, CA, USA.; Center for Cellular Construction, University of California, San Francisco, CA, USA.; Department of Bioengineering, University of California, Berkeley, CA, USA.; Department of Mechanical and Aerospace Engineering, Carleton University, Ottawa, Ontario, Canada.; Department of Cellular and Molecular Pharmacology, University of California, San Francisco, CA, USA.; Eli and Edythe Broad Center of Regeneration Medicine and Stem Cell Research, University of California, San Francisco, CA, USA.; Program in Craniofacial Biology, University of California, San Francisco, CA, USA.; Department of Orofacial Sciences, University of California, San Francisco, CA, USA.; Program in Craniofacial Biology, University of California, San Francisco, CA, USA.; Department of Orofacial Sciences, University of California, San Francisco, CA, USA.; Department of Pediatrics, Cedars-Sinai Medical Center, Los Angeles, CA, USA.; UCSF Cell Design Institute, University of California, San Francisco, CA, USA. wendell.lim@ucsf.edu.; Department of Cellular and Molecular Pharmacology, University of California, San Francisco, CA, USA. wendell.lim@ucsf.edu.; Center for Cellular Construction, University of California, San Francisco, CA, USA. wendell.lim@ucsf.edu.; UCSF Cell Design Institute, University of California, San Francisco, CA, USA.; Department of Cellular and Molecular Pharmacology, University of California, San Francisco, CA, USA.; Center for Cellular Construction, University of California, San Francisco, CA, USA.; UCSF Cell Design Institute, University of California, San Francisco, CA, USA.; Department of Cellular and Molecular Pharmacology, University of California, San Francisco, CA, USA.; Center for Cellular Construction, University of California, San Francisco, CA, USA.; Department of Neurology, Weill Institute for Neuroscience, University of California, San Francisco, CA, USA.; UCSF Cell Design Institute, University of California, San Francisco, CA, USA.; Department of Cellular and Molecular Pharmacology, University of California, San Francisco, CA, USA.; Center for Cellular Construction, University of California, San Francisco, CA, USA.; Maze Therapeutics, San Francisco, CA, USA.","Adam J Stevens: UCSF Cell Design Institute, University of California, San Francisco, CA, USA.; Department of Cellular and Molecular Pharmacology, University of California, San Francisco, CA, USA.; Center for Cellular Construction, University of California, San Francisco, CA, USA.Andrew R Harris: Center for Cellular Construction, University of California, San Francisco, CA, USA.; Department of Bioengineering, University of California, Berkeley, CA, USA.; Department of Mechanical and Aerospace Engineering, Carleton University, Ottawa, Ontario, Canada.Josiah Gerdts: UCSF Cell Design Institute, University of California, San Francisco, CA, USA.; Department of Cellular and Molecular Pharmacology, University of California, San Francisco, CA, USA.; Center for Cellular Construction, University of California, San Francisco, CA, USA.; Department of Neurology, Weill Institute for Neuroscience, University of California, San Francisco, CA, USA.Ki H Kim: UCSF Cell Design Institute, University of California, San Francisco, CA, USA.; Department of Cellular and Molecular Pharmacology, University of California, San Francisco, CA, USA.; Center for Cellular Construction, University of California, San Francisco, CA, USA.Coralie Trentesaux: Program in Craniofacial Biology, University of California, San Francisco, CA, USA.; Department of Orofacial Sciences, University of California, San Francisco, CA, USA.Jonathan T Ramirez: Department of Cellular and Molecular Pharmacology, University of California, San Francisco, CA, USA.; Eli and Edythe Broad Center of Regeneration Medicine and Stem Cell Research, University of California, San Francisco, CA, USA.Wesley L McKeithan: UCSF Cell Design Institute, University of California, San Francisco, CA, USA.; Department of Cellular and Molecular Pharmacology, University of California, San Francisco, CA, USA.; Center for Cellular Construction, University of California, San Francisco, CA, USA.; Maze Therapeutics, San Francisco, CA, USA.Faranak Fattahi: Department of Cellular and Molecular Pharmacology, University of California, San Francisco, CA, USA.; Eli and Edythe Broad Center of Regeneration Medicine and Stem Cell Research, University of California, San Francisco, CA, USA.Ophir D Klein: Program in Craniofacial Biology, University of California, San Francisco, CA, USA.; Department of Orofacial Sciences, University of California, San Francisco, CA, USA.; Department of Pediatrics, Cedars-Sinai Medical Center, Los Angeles, CA, USA.Daniel A Fletcher: Center for Cellular Construction, University of California, San Francisco, CA, USA.; Department of Bioengineering, University of California, Berkeley, CA, USA.; Chan Zuckerberg Biohub, San Francisco, CA, USA.Wendell A Lim: UCSF Cell Design Institute, University of California, San Francisco, CA, USA. wendell.lim@ucsf.edu.; Department of Cellular and Molecular Pharmacology, University of California, San Francisco, CA, USA. wendell.lim@ucsf.edu.; Center for Cellular Construction, University of California, San Francisco, CA, USA. wendell.lim@ucsf.edu.",,,,,,0
4,2023-02-04,Peter S Kim,,"Kim, Peter; Kim, Peter; Kim, Peter; Kim, Peter; Kim, Peter",,,Journal of virology,10.1128/jvi.01647-22,36541800.0,Enhancing HIV-1 Neutralization by Increasing the Local Concentration of Membrane-Proximal External Region-Directed Broadly Neutralizing Antibodies.,https://pubmed.ncbi.nlm.nih.gov/36541800,"Broadly neutralizing antibodies (bNAbs) against the membrane-proximal external region (MPER) of the gp41 component of the human immunodeficiency virus type 1 (HIV-1) envelope (Env) are characterized by long, hydrophobic, heavy chain complementarity-determining region 3s (HCDR3s) that interact with the MPER and some viral membrane lipids to achieve increased local concentrations. Here, we show that increasing the local concentration of MPER-directed bNAbs at the cell surface via binding to the high-affinity Fc receptor FcγRI potentiates their ability to prevent viral entry in a manner analogous to the previously reported observation wherein the lipid-binding activity of MPER bNAbs increases their concentration at the viral surface membrane. However, binding of MPER-directed bNAb 10E8 to FcγRI abolishes the neutralization synergy that is seen with the N-heptad repeat (NHR)-targeting antibody D5_AR and NHR-targeting small molecule enfuvirtide (T20), possibly due to decreased accessibility of the NHR in the FcγRI-10E8-MPER complex. Taken together, our results suggest that lipid-binding activity and FcγRI-mediated potentiation function in concert to improve the potency of MPER-directed bNAbs by increasing their local concentration near the site of viral fusion. Therefore, lipid binding may not be a strict requirement for potent neutralization by MPER-targeting bNAbs, as alternative methods can achieve similar increases in local concentrations while avoiding potential liabilities associated with immunologic host tolerance. ",HIV-1; MPER; broadly neutralizing antibody; gp41; lipid binding; neutralization,,,,,2022-12-22,2022/12/21,2022/12/22,Soohyun Kim; Maria V Filsinger Interrante; Peter S Kim,,"Department of Biochemistry, Stanford University School of Medicine, Stanford, California, USA.; Sarafan ChEM-H, Stanford University, Stanford, California, USA.; Department of Biochemistry, Stanford University School of Medicine, Stanford, California, USA.; Sarafan ChEM-H, Stanford University, Stanford, California, USA.; Chan Zuckerberg Biohub, San Francisco, California, USA.; Sarafan ChEM-H, Stanford University, Stanford, California, USA.; Stanford Medical Scientist Training Program, Stanford University School of Medicine, Stanford, California, USA.; Stanford Biophysics Program, Stanford University School of Medicine, Stanford, California, USA.","Soohyun Kim: Department of Biochemistry, Stanford University School of Medicine, Stanford, California, USA.; Sarafan ChEM-H, Stanford University, Stanford, California, USA.Maria V Filsinger Interrante: Sarafan ChEM-H, Stanford University, Stanford, California, USA.; Stanford Medical Scientist Training Program, Stanford University School of Medicine, Stanford, California, USA.; Stanford Biophysics Program, Stanford University School of Medicine, Stanford, California, USA.Peter S Kim: Department of Biochemistry, Stanford University School of Medicine, Stanford, California, USA.; Sarafan ChEM-H, Stanford University, Stanford, California, USA.; Chan Zuckerberg Biohub, San Francisco, California, USA.",,,,,,0
5,2023-02-04,Kerwyn Casey Huang,,"Huang, KC; Huang, KC; Huang, KC; Huang, KC; Huang, KC; Huang, KC",Karina B Xavier; Kerwyn Casey Huang; Benjamin H Good,"Instituto Gulbenkian de Ciência, 2780-156 Oeiras, Portugal. Electronic address: kxavier@igc.gulbenkian.pt.Department of Microbiology and Immunology, Stanford University School of Medicine, Stanford, CA 94305, USA; Department of Bioengineering, Stanford University, Stanford, CA 94305, USA; Chan Zuckerberg Biohub, San Francisco, CA 94158, USA. Electronic address: kchuang@stanford.edu.Department of Applied Physics, Stanford University, Stanford, CA 94305, USA. Electronic address: bhgood@stanford.edu.",Current opinion in microbiology,10.1016/j.mib.2022.102258,36608574.0,Within-host evolution of the gut microbiome.,https://pubmed.ncbi.nlm.nih.gov/36608574,"Gut bacteria inhabit a complex environment that is shaped by interactions with their host and the other members of the community. While these ecological interactions have evolved over millions of years, mounting evidence suggests that gut commensals can evolve on much shorter timescales as well, by acquiring new mutations within individual hosts. In this review, we highlight recent progress in understanding the causes and consequences of short-term evolution in the mammalian gut, from experimental evolution in murine hosts to longitudinal tracking of human cohorts. We also discuss new opportunities for future progress by expanding the repertoire of focal species, hosts, and surrounding communities, and by combining deep-sequencing technologies with quantitative frameworks from population genetics.",,,,,,2023-01-07,2023/01/04,2023/1/7,Tanja Dapa; Daniel Pgh Wong; Kimberly S Vasquez; Karina B Xavier; Kerwyn Casey Huang; Benjamin H Good,,"Department of Applied Physics, Stanford University, Stanford, CA 94305, USA.; Department of Applied Physics, Stanford University, Stanford, CA 94305, USA. Electronic address: bhgood@stanford.edu.; Department of Microbiology and Immunology, Stanford University School of Medicine, Stanford, CA 94305, USA.; Department of Microbiology and Immunology, Stanford University School of Medicine, Stanford, CA 94305, USA; Department of Bioengineering, Stanford University, Stanford, CA 94305, USA; Chan Zuckerberg Biohub, San Francisco, CA 94158, USA. Electronic address: kchuang@stanford.edu.; Instituto Gulbenkian de Ciência, 2780-156 Oeiras, Portugal.; Instituto Gulbenkian de Ciência, 2780-156 Oeiras, Portugal. Electronic address: kxavier@igc.gulbenkian.pt.","Tanja Dapa: Instituto Gulbenkian de Ciência, 2780-156 Oeiras, Portugal.Daniel Pgh Wong: Department of Applied Physics, Stanford University, Stanford, CA 94305, USA.Kimberly S Vasquez: Department of Microbiology and Immunology, Stanford University School of Medicine, Stanford, CA 94305, USA.Karina B Xavier: Instituto Gulbenkian de Ciência, 2780-156 Oeiras, Portugal. Electronic address: kxavier@igc.gulbenkian.pt.Kerwyn Casey Huang: Department of Microbiology and Immunology, Stanford University School of Medicine, Stanford, CA 94305, USA; Department of Bioengineering, Stanford University, Stanford, CA 94305, USA; Chan Zuckerberg Biohub, San Francisco, CA 94158, USA. Electronic address: kchuang@stanford.edu.Benjamin H Good: Department of Applied Physics, Stanford University, Stanford, CA 94305, USA. Electronic address: bhgood@stanford.edu.",,,,,,0
6,2023-02-04,Dmitri A Petrov,,,Julien Sage,"Department of Pediatrics, Stanford University, 265 Campus Drive, SIM1 G2078, Stanford, CA 94305, USA; Department of Genetics, Stanford University, Stanford, CA 94305, USA. Electronic address: julsage@stanford.edu.",Cell reports,10.1016/j.celrep.2023.111990,36640300.0,A multiplexed in vivo approach to identify driver genes in small cell lung cancer.,https://pubmed.ncbi.nlm.nih.gov/36640300,"Small cell lung cancer (SCLC) is a lethal form of lung cancer. Here, we develop a quantitative multiplexed approach on the basis of lentiviral barcoding with somatic CRISPR-Cas9-mediated genome editing to functionally investigate candidate regulators of tumor initiation and growth in genetically engineered mouse models of SCLC. We found that naphthalene pre-treatment enhances lentiviral vector-mediated SCLC initiation, enabling high multiplicity of tumor clones for analysis through high-throughput sequencing methods. Candidate drivers of SCLC identified from a meta-analysis across multiple human SCLC genomic datasets were tested using this approach, which defines both positive and detrimental impacts of inactivating 40 genes across candidate pathways on SCLC development. This analysis and subsequent validation in human SCLC cells establish TSC1 in the PI3K-AKT-mTOR pathway as a robust tumor suppressor in SCLC. This approach should illuminate drivers of SCLC, facilitate the development of precision therapies for defined SCLC genotypes, and identify therapeutic targets.",CP: Cancer; CRISPR screening; MTOR; SCLC; TSC1; functional genomics; meta-analysis; mouse models; naphthalene; small cell lung cancer; tumor suppression,,,,,2023-01-15,2023/01/13,2023/1/15,Myung Chang Lee; Hongchen Cai; Christopher W Murray; Chuan Li; Yan Ting Shue; Laura Andrejka; Andy L He; Alessandra M E Holzem; Alexandros P Drainas; Julie H Ko; Garry L Coles; Christina Kong; Shirley Zhu; ChunFang Zhu; Jason Wang; Matt van de Rijn; Dmitri A Petrov; Monte M Winslow; Julien Sage,,"Department of Biology, Stanford University, Stanford, CA 94305, USA.; Department of Biology, Stanford University, Stanford, CA 94305, USA; Chan Zuckerberg Biohub, San Francisco, CA 94158, USA.; Department of Genetics, Stanford University, Stanford, CA 94305, USA.; Department of Genetics, Stanford University, Stanford, CA 94305, USA; Department of Pathology, Stanford University, Stanford, CA 94305, USA.; Department of Pathology, Stanford University, Stanford, CA 94305, USA.; Department of Pediatrics, Stanford University, 265 Campus Drive, SIM1 G2078, Stanford, CA 94305, USA; Department of Genetics, Stanford University, Stanford, CA 94305, USA.; Department of Pediatrics, Stanford University, 265 Campus Drive, SIM1 G2078, Stanford, CA 94305, USA; Department of Genetics, Stanford University, Stanford, CA 94305, USA. Electronic address: julsage@stanford.edu.","Myung Chang Lee: Department of Pediatrics, Stanford University, 265 Campus Drive, SIM1 G2078, Stanford, CA 94305, USA; Department of Genetics, Stanford University, Stanford, CA 94305, USA.Hongchen Cai: Department of Genetics, Stanford University, Stanford, CA 94305, USA.Christopher W Murray: Department of Genetics, Stanford University, Stanford, CA 94305, USA.Chuan Li: Department of Biology, Stanford University, Stanford, CA 94305, USA.Yan Ting Shue: Department of Pediatrics, Stanford University, 265 Campus Drive, SIM1 G2078, Stanford, CA 94305, USA; Department of Genetics, Stanford University, Stanford, CA 94305, USA.Laura Andrejka: Department of Genetics, Stanford University, Stanford, CA 94305, USA.Andy L He: Department of Pediatrics, Stanford University, 265 Campus Drive, SIM1 G2078, Stanford, CA 94305, USA; Department of Genetics, Stanford University, Stanford, CA 94305, USA.Alessandra M E Holzem: Department of Pediatrics, Stanford University, 265 Campus Drive, SIM1 G2078, Stanford, CA 94305, USA; Department of Genetics, Stanford University, Stanford, CA 94305, USA.Alexandros P Drainas: Department of Pediatrics, Stanford University, 265 Campus Drive, SIM1 G2078, Stanford, CA 94305, USA; Department of Genetics, Stanford University, Stanford, CA 94305, USA.Julie H Ko: Department of Pediatrics, Stanford University, 265 Campus Drive, SIM1 G2078, Stanford, CA 94305, USA; Department of Genetics, Stanford University, Stanford, CA 94305, USA.Garry L Coles: Department of Pediatrics, Stanford University, 265 Campus Drive, SIM1 G2078, Stanford, CA 94305, USA; Department of Genetics, Stanford University, Stanford, CA 94305, USA.Christina Kong: Department of Pathology, Stanford University, Stanford, CA 94305, USA.Shirley Zhu: Department of Pathology, Stanford University, Stanford, CA 94305, USA.ChunFang Zhu: Department of Pathology, Stanford University, Stanford, CA 94305, USA.Jason Wang: Department of Pathology, Stanford University, Stanford, CA 94305, USA.Matt van de Rijn: Department of Pathology, Stanford University, Stanford, CA 94305, USA.Dmitri A Petrov: Department of Biology, Stanford University, Stanford, CA 94305, USA; Chan Zuckerberg Biohub, San Francisco, CA 94158, USA.Monte M Winslow: Department of Genetics, Stanford University, Stanford, CA 94305, USA; Department of Pathology, Stanford University, Stanford, CA 94305, USA.Julien Sage: Department of Pediatrics, Stanford University, 265 Campus Drive, SIM1 G2078, Stanford, CA 94305, USA; Department of Genetics, Stanford University, Stanford, CA 94305, USA. Electronic address: julsage@stanford.edu.",,,10.1101/2022.03.28.485708,,,0
