record id,save datetime,biohub author,possible biohub author,format biohub author,corresponding author,corresponding author institution,journal,doi,pmid,title,url,abstract,keyword,pdf url,version,version number,type,date,epost date,publish date,authors,authors2,affiliations list,author - affiliations,published or not,confirm published doi,confirm preprint doi,possible match result,match id,record change number
17,2023-02-01,"Huang, Bo",,"Huang, Bo",Xingmei Yang; Ping Gong,"State Key Laboratory of Oral Diseases, National Clinical Research Center for Oral Diseases, West China Hospital of Stomatology, Sichuan University, Chengdu, China; Department of Oral Implantology, West China Hospital of Stomatology, Sichuan University, Chengdu, China. Electronic address: 65167950@qq.com.State Key Laboratory of Oral Diseases, National Clinical Research Center for Oral Diseases, West China Hospital of Stomatology, Sichuan University, Chengdu, China; Department of Oral Implantology, West China Hospital of Stomatology, Sichuan University, Chengdu, China. Electronic address: dentistgong@hotmail.com.",Tissue & cell,10.1016/j.tice.2022.101985,36459840.0,Low-intensity pulsed ultrasound promotes proliferation and myelinating genes expression of Schwann cells through NRG1/ErbB signaling pathway.,https://pubmed.ncbi.nlm.nih.gov/36459840,"Schwann cells (SCs) are the major component of myelin sheath in the peripheral nervous system, which are necessary in the development, function maintenance, and repair of peripheral nerves. This study aimed to investigate the potential mechanism of low-intensity pulsed ultrasound (LIPUS) affecting the proliferation and myelinating activity of SCs. Rat Schwann cell line RSC96 were cultured and exposed to LIPUS of different duty ratios (control, 20 %, 50 %, 80 %). Results demonstrated that LIPUS with a duty ratio of 50 % showing the maximal effect in facilitating proliferation of SCs. The expressions of Krox20 and myelin basic protein (MBP), the key molecules of SC myelination, and the potent inducer of myelination neuregulin 1 (NRG1) and its receptors ErbB2 and ErbB3 increased significantly by LIPUS. The reaction of these factors to LIPUS were both time- and duty ratio-dependent: namely LIPUS with higher duty ratios took effects when applied repeatedly over more consecutive days. These observations indicated that NRG1/ErbB signaling pathway might contribute to the effects of LIPUS on the proliferation and myelinating status of SCs, which could be one of the mechanisms in the protective role of LIPUS in nerve repair and regeneration. Our work provided novel insights for promising strategies of nerve repair therapy.",ErbB; Low-intensity pulsed ultrasound (LIPUS); Myelination; NRG1; Proliferation; Schwann Cells (SCs),,,,,2022-12-03,2022/11/21,2022/12/3,Bo Huang; Yixuan Jiang; Liang Zhang; Bo Yang; Yanjun Guo; Xingmei Yang; Ping Gong,,"Department of Implant Dentistry, Beijing Stomatological Hospital, Capital Medical University, Beijing, China.; State Key Laboratory of Oral Diseases, National Clinical Research Center for Oral Diseases, West China Hospital of Stomatology, Sichuan University, Chengdu, China; Department of General Dentistry, West China Hospital of Stomatology, Sichuan University, Chengdu, China.; State Key Laboratory of Oral Diseases, National Clinical Research Center for Oral Diseases, West China Hospital of Stomatology, Sichuan University, Chengdu, China; Department of Oral Implantology, West China Hospital of Stomatology, Sichuan University, Chengdu, China.; State Key Laboratory of Oral Diseases, National Clinical Research Center for Oral Diseases, West China Hospital of Stomatology, Sichuan University, Chengdu, China; Department of Oral Implantology, West China Hospital of Stomatology, Sichuan University, Chengdu, China. Electronic address: 65167950@qq.com.; State Key Laboratory of Oral Diseases, National Clinical Research Center for Oral Diseases, West China Hospital of Stomatology, Sichuan University, Chengdu, China; Department of Oral Implantology, West China Hospital of Stomatology, Sichuan University, Chengdu, China. Electronic address: dentistgong@hotmail.com.; State Key Laboratory of Oral Diseases, National Clinical Research Center for Oral Diseases, West China Hospital of Stomatology, Sichuan University, Chengdu, China; Department of Oral Implantology, West China Hospital of Stomatology, Sichuan University, Chengdu, China; Center of Stomatology, West China Xiamen Hospital, Sichuan University, Xiamen, China.; State Key Laboratory of Oral Diseases, National Clinical Research Center for Oral Diseases, West China Hospital of Stomatology, Sichuan University, Chengdu, China; Jinjiang out-patient section, West China Hospital of Stomatology, Sichuan University, Chengdu, China.","Bo Huang: State Key Laboratory of Oral Diseases, National Clinical Research Center for Oral Diseases, West China Hospital of Stomatology, Sichuan University, Chengdu, China; Department of General Dentistry, West China Hospital of Stomatology, Sichuan University, Chengdu, China.Yixuan Jiang: State Key Laboratory of Oral Diseases, National Clinical Research Center for Oral Diseases, West China Hospital of Stomatology, Sichuan University, Chengdu, China; Department of Oral Implantology, West China Hospital of Stomatology, Sichuan University, Chengdu, China.Liang Zhang: State Key Laboratory of Oral Diseases, National Clinical Research Center for Oral Diseases, West China Hospital of Stomatology, Sichuan University, Chengdu, China; Department of Oral Implantology, West China Hospital of Stomatology, Sichuan University, Chengdu, China; Center of Stomatology, West China Xiamen Hospital, Sichuan University, Xiamen, China.Bo Yang: Department of Implant Dentistry, Beijing Stomatological Hospital, Capital Medical University, Beijing, China.Yanjun Guo: State Key Laboratory of Oral Diseases, National Clinical Research Center for Oral Diseases, West China Hospital of Stomatology, Sichuan University, Chengdu, China; Jinjiang out-patient section, West China Hospital of Stomatology, Sichuan University, Chengdu, China.Xingmei Yang: State Key Laboratory of Oral Diseases, National Clinical Research Center for Oral Diseases, West China Hospital of Stomatology, Sichuan University, Chengdu, China; Department of Oral Implantology, West China Hospital of Stomatology, Sichuan University, Chengdu, China. Electronic address: 65167950@qq.com.Ping Gong: State Key Laboratory of Oral Diseases, National Clinical Research Center for Oral Diseases, West China Hospital of Stomatology, Sichuan University, Chengdu, China; Department of Oral Implantology, West China Hospital of Stomatology, Sichuan University, Chengdu, China. Electronic address: dentistgong@hotmail.com.",,,,,,0
18,2023-02-01,"Brown, J[ames]",,,Robert C Axtell; Holly Van Remmen,"Arthritis & Clinical Immunology, Oklahoma Medical Research Foundation, OK, USA. Electronic address: bob-axtell@omrf.org.Aging & Metabolism Research Program, Oklahoma Medical Research Foundation, OK, USA; Oklahoma City VA Medical Center, Oklahoma City, OK, USA. Electronic address: Holly-VanRemmen@omrf.org.",Redox biology,10.1016/j.redox.2022.102550,36470129.0,"Neuronal deletion of MnSOD in mice leads to demyelination, inflammation and progressive paralysis that mimics phenotypes associated with progressive multiple sclerosis.",https://pubmed.ncbi.nlm.nih.gov/36470129,"Neuronal oxidative stress has been implicated in aging and neurodegenerative disease. Here we investigated the impact of elevated oxidative stress induced in mouse spinal cord by deletion of Mn-Superoxide dismutase (MnSOD) using a neuron specific Cre recombinase in Sod2 floxed mice (i-mn-Sod2 KO). Sod2 deletion in spinal cord neurons was associated with mitochondrial alterations and peroxide generation. Phenotypically, i-mn-Sod2 KO mice experienced hindlimb paralysis and clasping behavior associated with extensive demyelination and reduced nerve conduction velocity, axonal degeneration, enhanced blood brain barrier permeability, elevated inflammatory cytokines, microglia activation, infiltration of neutrophils and necroptosis in spinal cord. In contrast, spinal cord motor neuron number, innervation of neuromuscular junctions, muscle mass, and contractile function were not altered. Overall, our findings show that loss of MnSOD in spinal cord promotes a phenotype of demyelination, inflammation and progressive paralysis that mimics phenotypes associated with progressive multiple sclerosis.",Demyelination; Inflammation; Mitochondria; Mn superoxide dismutase; Multiple sclerosis; Necroptosis; Neurons,,,,,2022-12-06,2022/11/26,2022/12/6,Shylesh Bhaskaran; Gaurav Kumar; Nidheesh Thadathil; Katarzyna M Piekarz; Sabira Mohammed; Sergio Dominguez Lopez; Rizwan Qaisar; Dorothy Walton; Jacob L Brown; Ashley Murphy; Nataliya Smith; Debra Saunders; Michael J Beckstead; Scott Plafker; Tommy L Lewis; Rheal Towner; Sathyaseelan S Deepa; Arlan Richardson; Robert C Axtell; Holly Van Remmen,,"Advanced Magnetic Resonance Center, Oklahoma Medical Research Foundation, OK, USA.; Aging & Metabolism Research Program, Oklahoma Medical Research Foundation, OK, USA.; Aging & Metabolism Research Program, Oklahoma Medical Research Foundation, OK, USA; Oklahoma City VA Medical Center, Oklahoma City, OK, USA.; Aging & Metabolism Research Program, Oklahoma Medical Research Foundation, OK, USA; Oklahoma City VA Medical Center, Oklahoma City, OK, USA. Electronic address: Holly-VanRemmen@omrf.org.; Arthritis & Clinical Immunology, Oklahoma Medical Research Foundation, OK, USA.; Arthritis & Clinical Immunology, Oklahoma Medical Research Foundation, OK, USA. Electronic address: bob-axtell@omrf.org.; Department of Biochemistry and Molecular Biology, University of Oklahoma Health Sciences Center, OK, USA.; Department of Biochemistry and Molecular Biology, University of Oklahoma Health Sciences Center, OK, USA; Stephenson Cancer Center, University of Oklahoma Health Sciences Center, Oklahoma City, OK, USA.; Department of Biochemistry and Molecular Biology, University of Oklahoma Health Sciences Center, OK, USA; Stephenson Cancer Center, University of Oklahoma Health Sciences Center, Oklahoma City, OK, USA; Oklahoma City VA Medical Center, Oklahoma City, OK, USA.; Stephenson Cancer Center, University of Oklahoma Health Sciences Center, Oklahoma City, OK, USA.","Shylesh Bhaskaran: Aging & Metabolism Research Program, Oklahoma Medical Research Foundation, OK, USA.Gaurav Kumar: Arthritis & Clinical Immunology, Oklahoma Medical Research Foundation, OK, USA.Nidheesh Thadathil: Department of Biochemistry and Molecular Biology, University of Oklahoma Health Sciences Center, OK, USA.Katarzyna M Piekarz: Aging & Metabolism Research Program, Oklahoma Medical Research Foundation, OK, USA.Sabira Mohammed: Stephenson Cancer Center, University of Oklahoma Health Sciences Center, Oklahoma City, OK, USA.Sergio Dominguez Lopez: Aging & Metabolism Research Program, Oklahoma Medical Research Foundation, OK, USA.Rizwan Qaisar: Aging & Metabolism Research Program, Oklahoma Medical Research Foundation, OK, USA.Dorothy Walton: Aging & Metabolism Research Program, Oklahoma Medical Research Foundation, OK, USA.Jacob L Brown: Aging & Metabolism Research Program, Oklahoma Medical Research Foundation, OK, USA; Oklahoma City VA Medical Center, Oklahoma City, OK, USA.Ashley Murphy: Aging & Metabolism Research Program, Oklahoma Medical Research Foundation, OK, USA.Nataliya Smith: Advanced Magnetic Resonance Center, Oklahoma Medical Research Foundation, OK, USA.Debra Saunders: Advanced Magnetic Resonance Center, Oklahoma Medical Research Foundation, OK, USA.Michael J Beckstead: Aging & Metabolism Research Program, Oklahoma Medical Research Foundation, OK, USA; Oklahoma City VA Medical Center, Oklahoma City, OK, USA.Scott Plafker: Aging & Metabolism Research Program, Oklahoma Medical Research Foundation, OK, USA.Tommy L Lewis: Aging & Metabolism Research Program, Oklahoma Medical Research Foundation, OK, USA.Rheal Towner: Advanced Magnetic Resonance Center, Oklahoma Medical Research Foundation, OK, USA.Sathyaseelan S Deepa: Department of Biochemistry and Molecular Biology, University of Oklahoma Health Sciences Center, OK, USA; Stephenson Cancer Center, University of Oklahoma Health Sciences Center, Oklahoma City, OK, USA.Arlan Richardson: Department of Biochemistry and Molecular Biology, University of Oklahoma Health Sciences Center, OK, USA; Stephenson Cancer Center, University of Oklahoma Health Sciences Center, Oklahoma City, OK, USA; Oklahoma City VA Medical Center, Oklahoma City, OK, USA.Robert C Axtell: Arthritis & Clinical Immunology, Oklahoma Medical Research Foundation, OK, USA. Electronic address: bob-axtell@omrf.org.Holly Van Remmen: Aging & Metabolism Research Program, Oklahoma Medical Research Foundation, OK, USA; Oklahoma City VA Medical Center, Oklahoma City, OK, USA. Electronic address: Holly-VanRemmen@omrf.org.",,,,,,0
19,2023-02-01,"Huang, Bo",,"Huang, Bo",,,Molecular medicine reports,10.3892/mmr.2022.12910,36484396.0,[Retracted] MicroRNA‑509 targets PAX6 to inhibit cell proliferation and invasion in papillary thyroid carcinoma.,https://pubmed.ncbi.nlm.nih.gov/36484396,"Following the publication of this paper, it was drawn to the Editors' attention by a concerned reader that several of the panels shown for the cell invasion assays in Figs. 2C and 5D were strikingly similar to data appearing in different form in other articles by different authors. Owing to the fact that the contentious data in the above article had already been published elsewhere, or were already under consideration for publication, prior to its submission to ",invasion; microRNA‑509; paired box 6; papillary thyroid carcinoma; proliferation,,,,,2022-12-10,2022/12/09,2022/12/10,Shuilong Zhang; Qiang Wang; Dewei Li; Bo Huang; Xia Hou; Dongliang Wang,,"Department of Chest Radiotherapy, Tumor Hospital of Shanxi Province, Taiyuan, Shanxi 030012, P.R. China.; Department of Gastrointestinal Pancreas, Hernia and Abdominal Wall Surgery, Shanxi Provincial People's Hospital, Taiyuan, Shanxi 030012, P.R. China.; Department of Thyroid Surgery, Hernia and Abdominal Wall Surgery, Shanxi Provincial People's Hospital, Taiyuan, Shanxi 030012, P.R. China.","Shuilong Zhang: Department of Thyroid Surgery, Hernia and Abdominal Wall Surgery, Shanxi Provincial People's Hospital, Taiyuan, Shanxi 030012, P.R. China.Qiang Wang: Department of Thyroid Surgery, Hernia and Abdominal Wall Surgery, Shanxi Provincial People's Hospital, Taiyuan, Shanxi 030012, P.R. China.Dewei Li: Department of Thyroid Surgery, Hernia and Abdominal Wall Surgery, Shanxi Provincial People's Hospital, Taiyuan, Shanxi 030012, P.R. China.Bo Huang: Department of Gastrointestinal Pancreas, Hernia and Abdominal Wall Surgery, Shanxi Provincial People's Hospital, Taiyuan, Shanxi 030012, P.R. China.Xia Hou: Department of Chest Radiotherapy, Tumor Hospital of Shanxi Province, Taiyuan, Shanxi 030012, P.R. China.Dongliang Wang: Department of Thyroid Surgery, Hernia and Abdominal Wall Surgery, Shanxi Provincial People's Hospital, Taiyuan, Shanxi 030012, P.R. China.",,,,,,0
20,2023-02-01,"Fletcher, Daniel",,"Fletcher, Dan; Fletcher, Dan",Wendell A Lim,"UCSF Cell Design Institute, University of California, San Francisco, CA, USA. wendell.lim@ucsf.edu.; Department of Cellular and Molecular Pharmacology, University of California, San Francisco, CA, USA. wendell.lim@ucsf.edu.; Center for Cellular Construction, University of California, San Francisco, CA, USA. wendell.lim@ucsf.edu.",Nature,10.1038/s41586-022-05622-z,36509107.0,Programming multicellular assembly with synthetic cell adhesion molecules.,https://pubmed.ncbi.nlm.nih.gov/36509107,"Cell adhesion molecules are ubiquitous in multicellular organisms, specifying precise cell-cell interactions in processes as diverse as tissue development, immune cell trafficking and the wiring of the nervous system",,,,,,2022-12-13,2022/12/12,2022/12/13,Adam J Stevens; Andrew R Harris; Josiah Gerdts; Ki H Kim; Coralie Trentesaux; Jonathan T Ramirez; Wesley L McKeithan; Faranak Fattahi; Ophir D Klein; Daniel A Fletcher; Wendell A Lim,,"Center for Cellular Construction, University of California, San Francisco, CA, USA.; Department of Bioengineering, University of California, Berkeley, CA, USA.; Chan Zuckerberg Biohub, San Francisco, CA, USA.; Center for Cellular Construction, University of California, San Francisco, CA, USA.; Department of Bioengineering, University of California, Berkeley, CA, USA.; Department of Mechanical and Aerospace Engineering, Carleton University, Ottawa, Ontario, Canada.; Department of Cellular and Molecular Pharmacology, University of California, San Francisco, CA, USA.; Eli and Edythe Broad Center of Regeneration Medicine and Stem Cell Research, University of California, San Francisco, CA, USA.; Program in Craniofacial Biology, University of California, San Francisco, CA, USA.; Department of Orofacial Sciences, University of California, San Francisco, CA, USA.; Program in Craniofacial Biology, University of California, San Francisco, CA, USA.; Department of Orofacial Sciences, University of California, San Francisco, CA, USA.; Department of Pediatrics, Cedars-Sinai Medical Center, Los Angeles, CA, USA.; UCSF Cell Design Institute, University of California, San Francisco, CA, USA. wendell.lim@ucsf.edu.; Department of Cellular and Molecular Pharmacology, University of California, San Francisco, CA, USA. wendell.lim@ucsf.edu.; Center for Cellular Construction, University of California, San Francisco, CA, USA. wendell.lim@ucsf.edu.; UCSF Cell Design Institute, University of California, San Francisco, CA, USA.; Department of Cellular and Molecular Pharmacology, University of California, San Francisco, CA, USA.; Center for Cellular Construction, University of California, San Francisco, CA, USA.; UCSF Cell Design Institute, University of California, San Francisco, CA, USA.; Department of Cellular and Molecular Pharmacology, University of California, San Francisco, CA, USA.; Center for Cellular Construction, University of California, San Francisco, CA, USA.; Department of Neurology, Weill Institute for Neuroscience, University of California, San Francisco, CA, USA.; UCSF Cell Design Institute, University of California, San Francisco, CA, USA.; Department of Cellular and Molecular Pharmacology, University of California, San Francisco, CA, USA.; Center for Cellular Construction, University of California, San Francisco, CA, USA.; Maze Therapeutics, San Francisco, CA, USA.","Adam J Stevens: UCSF Cell Design Institute, University of California, San Francisco, CA, USA.; Department of Cellular and Molecular Pharmacology, University of California, San Francisco, CA, USA.; Center for Cellular Construction, University of California, San Francisco, CA, USA.Andrew R Harris: Center for Cellular Construction, University of California, San Francisco, CA, USA.; Department of Bioengineering, University of California, Berkeley, CA, USA.; Department of Mechanical and Aerospace Engineering, Carleton University, Ottawa, Ontario, Canada.Josiah Gerdts: UCSF Cell Design Institute, University of California, San Francisco, CA, USA.; Department of Cellular and Molecular Pharmacology, University of California, San Francisco, CA, USA.; Center for Cellular Construction, University of California, San Francisco, CA, USA.; Department of Neurology, Weill Institute for Neuroscience, University of California, San Francisco, CA, USA.Ki H Kim: UCSF Cell Design Institute, University of California, San Francisco, CA, USA.; Department of Cellular and Molecular Pharmacology, University of California, San Francisco, CA, USA.; Center for Cellular Construction, University of California, San Francisco, CA, USA.Coralie Trentesaux: Program in Craniofacial Biology, University of California, San Francisco, CA, USA.; Department of Orofacial Sciences, University of California, San Francisco, CA, USA.Jonathan T Ramirez: Department of Cellular and Molecular Pharmacology, University of California, San Francisco, CA, USA.; Eli and Edythe Broad Center of Regeneration Medicine and Stem Cell Research, University of California, San Francisco, CA, USA.Wesley L McKeithan: UCSF Cell Design Institute, University of California, San Francisco, CA, USA.; Department of Cellular and Molecular Pharmacology, University of California, San Francisco, CA, USA.; Center for Cellular Construction, University of California, San Francisco, CA, USA.; Maze Therapeutics, San Francisco, CA, USA.Faranak Fattahi: Department of Cellular and Molecular Pharmacology, University of California, San Francisco, CA, USA.; Eli and Edythe Broad Center of Regeneration Medicine and Stem Cell Research, University of California, San Francisco, CA, USA.Ophir D Klein: Program in Craniofacial Biology, University of California, San Francisco, CA, USA.; Department of Orofacial Sciences, University of California, San Francisco, CA, USA.; Department of Pediatrics, Cedars-Sinai Medical Center, Los Angeles, CA, USA.Daniel A Fletcher: Center for Cellular Construction, University of California, San Francisco, CA, USA.; Department of Bioengineering, University of California, Berkeley, CA, USA.; Chan Zuckerberg Biohub, San Francisco, CA, USA.Wendell A Lim: UCSF Cell Design Institute, University of California, San Francisco, CA, USA. wendell.lim@ucsf.edu.; Department of Cellular and Molecular Pharmacology, University of California, San Francisco, CA, USA. wendell.lim@ucsf.edu.; Center for Cellular Construction, University of California, San Francisco, CA, USA. wendell.lim@ucsf.edu.",,,,,,0
21,2023-02-01,"Zhang, Wenjun",,"Zhang, Wenjun",Chuan Huang; Yingzhou Huang,"State Key Laboratory of Coal Mine Disaster Dynamics and Control, Chongqing University, Chongqing 400044, China; College of Environment and Ecology, Chongqing University, Chongqing 400044, China. Electronic address: hclsjb@163.com.College of Physics, Chongqing University, Chongqing, 400044, China. Electronic address: yzhuang@cqu.edu.cn.","Waste management (New York, N.Y.)",10.1016/j.wasman.2022.12.006,36508910.0,Prediction for odor gas generation from domestic waste based on machine learning.,https://pubmed.ncbi.nlm.nih.gov/36508910,"Domestic waste is prone to produce a variety of volatile organic compounds (VOCs), which often has unpleasant odors. A key process in treating odor gases is predicting the production of odors from domestic waste. In this study, four factors of domestic waste (weight, wet composition, temperature, and fermentation time) were adopted to be the prediction indicators in the prediction for domestic waste odor gases. Machine learning models (Random Forest, XGBoost, LightGBM) were established using the odor intensity values of 512 odor gases from domestic waste. Based on these data, the regression prediction with supervised machine learning was achieved, in which three different algorithmic models were evaluated for prediction performance. A Random Forest model with a R",Domestic waste; Machine learning; Odor gases; Prediction; Random forest,,,,,2022-12-13,2022/12/10,2022/12/13,Yuanyan Jiang; Jiawei Huang; Wei Luo; Kejin Chen; Wenrou Yu; Wenjun Zhang; Chuan Huang; Junjun Yang; Yingzhou Huang,,"CITIC Environmental Technology Investment (China) Co., Ltd, Guangzhou 510000, China.; College of Physics, Chongqing University, Chongqing, 400044, China.; College of Physics, Chongqing University, Chongqing, 400044, China. Electronic address: yzhuang@cqu.edu.cn.; State Key Laboratory of Coal Mine Disaster Dynamics and Control, Chongqing University, Chongqing 400044, China; College of Environment and Ecology, Chongqing University, Chongqing 400044, China.; State Key Laboratory of Coal Mine Disaster Dynamics and Control, Chongqing University, Chongqing 400044, China; College of Environment and Ecology, Chongqing University, Chongqing 400044, China. Electronic address: hclsjb@163.com.","Yuanyan Jiang: State Key Laboratory of Coal Mine Disaster Dynamics and Control, Chongqing University, Chongqing 400044, China; College of Environment and Ecology, Chongqing University, Chongqing 400044, China.Jiawei Huang: State Key Laboratory of Coal Mine Disaster Dynamics and Control, Chongqing University, Chongqing 400044, China; College of Environment and Ecology, Chongqing University, Chongqing 400044, China.Wei Luo: CITIC Environmental Technology Investment (China) Co., Ltd, Guangzhou 510000, China.Kejin Chen: State Key Laboratory of Coal Mine Disaster Dynamics and Control, Chongqing University, Chongqing 400044, China; College of Environment and Ecology, Chongqing University, Chongqing 400044, China.Wenrou Yu: State Key Laboratory of Coal Mine Disaster Dynamics and Control, Chongqing University, Chongqing 400044, China; College of Environment and Ecology, Chongqing University, Chongqing 400044, China.Wenjun Zhang: State Key Laboratory of Coal Mine Disaster Dynamics and Control, Chongqing University, Chongqing 400044, China; College of Environment and Ecology, Chongqing University, Chongqing 400044, China.Chuan Huang: State Key Laboratory of Coal Mine Disaster Dynamics and Control, Chongqing University, Chongqing 400044, China; College of Environment and Ecology, Chongqing University, Chongqing 400044, China. Electronic address: hclsjb@163.com.Junjun Yang: College of Physics, Chongqing University, Chongqing, 400044, China.Yingzhou Huang: College of Physics, Chongqing University, Chongqing, 400044, China. Electronic address: yzhuang@cqu.edu.cn.",,,,,,0
