record id,save datetime,biohub author,possible biohub author,format biohub author,corresponding author,corresponding author institution,journal,doi,pmid,title,url,abstract,keyword,pdf url,version,version number,type,date,epost date,publish date,authors,authors2,affiliations list,author - affiliations,published or not,confirm published doi,confirm preprint doi,possible match result,match id,record change number
28,2023-02-01,"Brown, J[ames]",,,F A Siebzehnrubl; W P Gray,"School of Biosciences, European Cancer Stem Cell Research Institute, Cardiff University, Cardiff CF24 4HQ, United Kingdom. Electronic address: fas@cardiff.ac.uk.Division of Psychological Medicine and Clinical Neurosciences, University Hospital Wales, Cardiff and Vale University Health Board, CF14 4XW, United Kingdom; Department of Neurosurgery, University Hospital of Wales, Cardiff, United Kingdom; B.R.A.I.N Biomedical Research Unit, Cardiff University, United Kingdom. Electronic address: graywp@cardiff.ac.uk.",Biochemical pharmacology,10.1016/j.bcp.2023.115410,36632958.0,A high-density 3-dimensional culture model of human glioblastoma for rapid screening of therapeutic resistance.,https://pubmed.ncbi.nlm.nih.gov/36632958,"Glioblastoma is among the most lethal cancers, with no known cure. A multitude of therapeutics are being developed or in clinical trials, but currently there are no ways to predict which patient may benefit the most from which drug. Assays that allow prediction of the tumor's response to anti-cancer drugs may improve clinical decision-making. Here, we present a high-density 3D primary cell culture model for short-term testing from resected glioblastoma tissue that is set up on the day of surgery, established within 7 days and viable for at least 3 weeks. High-density 3D cultures contain tumor and host cells, including microglia, and retain key histopathological characteristics of their parent tumors, including proliferative activity, expression of the marker GFAP, and presence of giant cells. This provides a proof-of-concept that 3D primary cultures may be useful to model tumor heterogeneity. Importantly, we show that high-density 3D cultures can be used to test chemotherapy response within a 2-3-week timeframe and are predictive of patient response to Temozolomide therapy. Thus, primary high-density 3D cultures could be a useful tool for brain cancer research and prediction of therapeutic resistance.",In vitro; Personalized medicine; Precision medicine; Preclinical models,,,,,2023-01-13,2023/01/09,2023/1/13,J M C Brown; M Zaben; C Ormonde; F Sharouf; R Spencer; H Bhatt; F A Siebzehnrubl; W P Gray,,"Department of Neurosurgery, University Hospital of Wales, Cardiff, United Kingdom.; Division of Psychological Medicine and Clinical Neurosciences, University Hospital Wales, Cardiff and Vale University Health Board, CF14 4XW, United Kingdom.; Division of Psychological Medicine and Clinical Neurosciences, University Hospital Wales, Cardiff and Vale University Health Board, CF14 4XW, United Kingdom; B.R.A.I.N Biomedical Research Unit, Cardiff University, United Kingdom.; Division of Psychological Medicine and Clinical Neurosciences, University Hospital Wales, Cardiff and Vale University Health Board, CF14 4XW, United Kingdom; Department of Neurosurgery, University Hospital of Wales, Cardiff, United Kingdom; B.R.A.I.N Biomedical Research Unit, Cardiff University, United Kingdom.; Division of Psychological Medicine and Clinical Neurosciences, University Hospital Wales, Cardiff and Vale University Health Board, CF14 4XW, United Kingdom; Department of Neurosurgery, University Hospital of Wales, Cardiff, United Kingdom; B.R.A.I.N Biomedical Research Unit, Cardiff University, United Kingdom. Electronic address: graywp@cardiff.ac.uk.; School of Biosciences, European Cancer Stem Cell Research Institute, Cardiff University, Cardiff CF24 4HQ, United Kingdom. Electronic address: fas@cardiff.ac.uk.","J M C Brown: Division of Psychological Medicine and Clinical Neurosciences, University Hospital Wales, Cardiff and Vale University Health Board, CF14 4XW, United Kingdom.M Zaben: Division of Psychological Medicine and Clinical Neurosciences, University Hospital Wales, Cardiff and Vale University Health Board, CF14 4XW, United Kingdom; Department of Neurosurgery, University Hospital of Wales, Cardiff, United Kingdom; B.R.A.I.N Biomedical Research Unit, Cardiff University, United Kingdom.C Ormonde: Division of Psychological Medicine and Clinical Neurosciences, University Hospital Wales, Cardiff and Vale University Health Board, CF14 4XW, United Kingdom; B.R.A.I.N Biomedical Research Unit, Cardiff University, United Kingdom.F Sharouf: Division of Psychological Medicine and Clinical Neurosciences, University Hospital Wales, Cardiff and Vale University Health Board, CF14 4XW, United Kingdom; Department of Neurosurgery, University Hospital of Wales, Cardiff, United Kingdom; B.R.A.I.N Biomedical Research Unit, Cardiff University, United Kingdom.R Spencer: Division of Psychological Medicine and Clinical Neurosciences, University Hospital Wales, Cardiff and Vale University Health Board, CF14 4XW, United Kingdom; Department of Neurosurgery, University Hospital of Wales, Cardiff, United Kingdom; B.R.A.I.N Biomedical Research Unit, Cardiff University, United Kingdom.H Bhatt: Department of Neurosurgery, University Hospital of Wales, Cardiff, United Kingdom.F A Siebzehnrubl: School of Biosciences, European Cancer Stem Cell Research Institute, Cardiff University, Cardiff CF24 4HQ, United Kingdom. Electronic address: fas@cardiff.ac.uk.W P Gray: Division of Psychological Medicine and Clinical Neurosciences, University Hospital Wales, Cardiff and Vale University Health Board, CF14 4XW, United Kingdom; Department of Neurosurgery, University Hospital of Wales, Cardiff, United Kingdom; B.R.A.I.N Biomedical Research Unit, Cardiff University, United Kingdom. Electronic address: graywp@cardiff.ac.uk.",,,10.1101/2022.10.22.22281352,,,0
29,2023-02-01,"Brown, J[ames]",,,,,Neurology. Genetics,10.1212/NXG.0000000000200037,36644447.0,Prevalence of Frontotemporal Dementia in Females of 5 Hispanic Families With R159H VCP Multisystem Proteinopathy.,https://pubmed.ncbi.nlm.nih.gov/36644447,Missense variants of the valosin-containing protein (,,,,,,2023-01-17,2023/01/11,2023/1/17,Alyaa Shmara; Liliane Gibbs; Ryan Patrick Mahoney; Kyle Hurth; Vanessa S Goodwill; Alicia Cuber; Regina Im; Donald P Pizzo; Jerry Brown; Christina Laukaitis; Shalini Mahajan; Virginia Kimonis,,"Division of Genetics and Genomic Medicine (A.S., R.P.M., A.C., R.I., V.K.), Department of Pediatrics, University of California, Irvine; Pediatric Radiology (L.G.), Department of Radiology, University of California, Irvine; Department of Pathology (K.H.), LAC + USC and Keck School of Medicine, University of Southern California, Los Angeles; Department of Pathology (V.S.G., D.P.P.), University of California, San Diego; Cure VCP Disease (J.B.), previously at Diagnostic Radiology, Tripler Army Medical Center, Honolulu, HI; Department of Genetics (C.L.), Carle Clinic and Carle Illinois College of Medicine, Urbana; and Department of Neurology (S.M.), Cedars Sinai Medical Center, Los Angeles, CA.","Alyaa Shmara: Division of Genetics and Genomic Medicine (A.S., R.P.M., A.C., R.I., V.K.), Department of Pediatrics, University of California, Irvine; Pediatric Radiology (L.G.), Department of Radiology, University of California, Irvine; Department of Pathology (K.H.), LAC + USC and Keck School of Medicine, University of Southern California, Los Angeles; Department of Pathology (V.S.G., D.P.P.), University of California, San Diego; Cure VCP Disease (J.B.), previously at Diagnostic Radiology, Tripler Army Medical Center, Honolulu, HI; Department of Genetics (C.L.), Carle Clinic and Carle Illinois College of Medicine, Urbana; and Department of Neurology (S.M.), Cedars Sinai Medical Center, Los Angeles, CA.Liliane Gibbs: Division of Genetics and Genomic Medicine (A.S., R.P.M., A.C., R.I., V.K.), Department of Pediatrics, University of California, Irvine; Pediatric Radiology (L.G.), Department of Radiology, University of California, Irvine; Department of Pathology (K.H.), LAC + USC and Keck School of Medicine, University of Southern California, Los Angeles; Department of Pathology (V.S.G., D.P.P.), University of California, San Diego; Cure VCP Disease (J.B.), previously at Diagnostic Radiology, Tripler Army Medical Center, Honolulu, HI; Department of Genetics (C.L.), Carle Clinic and Carle Illinois College of Medicine, Urbana; and Department of Neurology (S.M.), Cedars Sinai Medical Center, Los Angeles, CA.Ryan Patrick Mahoney: Division of Genetics and Genomic Medicine (A.S., R.P.M., A.C., R.I., V.K.), Department of Pediatrics, University of California, Irvine; Pediatric Radiology (L.G.), Department of Radiology, University of California, Irvine; Department of Pathology (K.H.), LAC + USC and Keck School of Medicine, University of Southern California, Los Angeles; Department of Pathology (V.S.G., D.P.P.), University of California, San Diego; Cure VCP Disease (J.B.), previously at Diagnostic Radiology, Tripler Army Medical Center, Honolulu, HI; Department of Genetics (C.L.), Carle Clinic and Carle Illinois College of Medicine, Urbana; and Department of Neurology (S.M.), Cedars Sinai Medical Center, Los Angeles, CA.Kyle Hurth: Division of Genetics and Genomic Medicine (A.S., R.P.M., A.C., R.I., V.K.), Department of Pediatrics, University of California, Irvine; Pediatric Radiology (L.G.), Department of Radiology, University of California, Irvine; Department of Pathology (K.H.), LAC + USC and Keck School of Medicine, University of Southern California, Los Angeles; Department of Pathology (V.S.G., D.P.P.), University of California, San Diego; Cure VCP Disease (J.B.), previously at Diagnostic Radiology, Tripler Army Medical Center, Honolulu, HI; Department of Genetics (C.L.), Carle Clinic and Carle Illinois College of Medicine, Urbana; and Department of Neurology (S.M.), Cedars Sinai Medical Center, Los Angeles, CA.Vanessa S Goodwill: Division of Genetics and Genomic Medicine (A.S., R.P.M., A.C., R.I., V.K.), Department of Pediatrics, University of California, Irvine; Pediatric Radiology (L.G.), Department of Radiology, University of California, Irvine; Department of Pathology (K.H.), LAC + USC and Keck School of Medicine, University of Southern California, Los Angeles; Department of Pathology (V.S.G., D.P.P.), University of California, San Diego; Cure VCP Disease (J.B.), previously at Diagnostic Radiology, Tripler Army Medical Center, Honolulu, HI; Department of Genetics (C.L.), Carle Clinic and Carle Illinois College of Medicine, Urbana; and Department of Neurology (S.M.), Cedars Sinai Medical Center, Los Angeles, CA.Alicia Cuber: Division of Genetics and Genomic Medicine (A.S., R.P.M., A.C., R.I., V.K.), Department of Pediatrics, University of California, Irvine; Pediatric Radiology (L.G.), Department of Radiology, University of California, Irvine; Department of Pathology (K.H.), LAC + USC and Keck School of Medicine, University of Southern California, Los Angeles; Department of Pathology (V.S.G., D.P.P.), University of California, San Diego; Cure VCP Disease (J.B.), previously at Diagnostic Radiology, Tripler Army Medical Center, Honolulu, HI; Department of Genetics (C.L.), Carle Clinic and Carle Illinois College of Medicine, Urbana; and Department of Neurology (S.M.), Cedars Sinai Medical Center, Los Angeles, CA.Regina Im: Division of Genetics and Genomic Medicine (A.S., R.P.M., A.C., R.I., V.K.), Department of Pediatrics, University of California, Irvine; Pediatric Radiology (L.G.), Department of Radiology, University of California, Irvine; Department of Pathology (K.H.), LAC + USC and Keck School of Medicine, University of Southern California, Los Angeles; Department of Pathology (V.S.G., D.P.P.), University of California, San Diego; Cure VCP Disease (J.B.), previously at Diagnostic Radiology, Tripler Army Medical Center, Honolulu, HI; Department of Genetics (C.L.), Carle Clinic and Carle Illinois College of Medicine, Urbana; and Department of Neurology (S.M.), Cedars Sinai Medical Center, Los Angeles, CA.Donald P Pizzo: Division of Genetics and Genomic Medicine (A.S., R.P.M., A.C., R.I., V.K.), Department of Pediatrics, University of California, Irvine; Pediatric Radiology (L.G.), Department of Radiology, University of California, Irvine; Department of Pathology (K.H.), LAC + USC and Keck School of Medicine, University of Southern California, Los Angeles; Department of Pathology (V.S.G., D.P.P.), University of California, San Diego; Cure VCP Disease (J.B.), previously at Diagnostic Radiology, Tripler Army Medical Center, Honolulu, HI; Department of Genetics (C.L.), Carle Clinic and Carle Illinois College of Medicine, Urbana; and Department of Neurology (S.M.), Cedars Sinai Medical Center, Los Angeles, CA.Jerry Brown: Division of Genetics and Genomic Medicine (A.S., R.P.M., A.C., R.I., V.K.), Department of Pediatrics, University of California, Irvine; Pediatric Radiology (L.G.), Department of Radiology, University of California, Irvine; Department of Pathology (K.H.), LAC + USC and Keck School of Medicine, University of Southern California, Los Angeles; Department of Pathology (V.S.G., D.P.P.), University of California, San Diego; Cure VCP Disease (J.B.), previously at Diagnostic Radiology, Tripler Army Medical Center, Honolulu, HI; Department of Genetics (C.L.), Carle Clinic and Carle Illinois College of Medicine, Urbana; and Department of Neurology (S.M.), Cedars Sinai Medical Center, Los Angeles, CA.Christina Laukaitis: Division of Genetics and Genomic Medicine (A.S., R.P.M., A.C., R.I., V.K.), Department of Pediatrics, University of California, Irvine; Pediatric Radiology (L.G.), Department of Radiology, University of California, Irvine; Department of Pathology (K.H.), LAC + USC and Keck School of Medicine, University of Southern California, Los Angeles; Department of Pathology (V.S.G., D.P.P.), University of California, San Diego; Cure VCP Disease (J.B.), previously at Diagnostic Radiology, Tripler Army Medical Center, Honolulu, HI; Department of Genetics (C.L.), Carle Clinic and Carle Illinois College of Medicine, Urbana; and Department of Neurology (S.M.), Cedars Sinai Medical Center, Los Angeles, CA.Shalini Mahajan: Division of Genetics and Genomic Medicine (A.S., R.P.M., A.C., R.I., V.K.), Department of Pediatrics, University of California, Irvine; Pediatric Radiology (L.G.), Department of Radiology, University of California, Irvine; Department of Pathology (K.H.), LAC + USC and Keck School of Medicine, University of Southern California, Los Angeles; Department of Pathology (V.S.G., D.P.P.), University of California, San Diego; Cure VCP Disease (J.B.), previously at Diagnostic Radiology, Tripler Army Medical Center, Honolulu, HI; Department of Genetics (C.L.), Carle Clinic and Carle Illinois College of Medicine, Urbana; and Department of Neurology (S.M.), Cedars Sinai Medical Center, Los Angeles, CA.Virginia Kimonis: Division of Genetics and Genomic Medicine (A.S., R.P.M., A.C., R.I., V.K.), Department of Pediatrics, University of California, Irvine; Pediatric Radiology (L.G.), Department of Radiology, University of California, Irvine; Department of Pathology (K.H.), LAC + USC and Keck School of Medicine, University of Southern California, Los Angeles; Department of Pathology (V.S.G., D.P.P.), University of California, San Diego; Cure VCP Disease (J.B.), previously at Diagnostic Radiology, Tripler Army Medical Center, Honolulu, HI; Department of Genetics (C.L.), Carle Clinic and Carle Illinois College of Medicine, Urbana; and Department of Neurology (S.M.), Cedars Sinai Medical Center, Los Angeles, CA.",,,,,,0
30,2023-02-01,Benjamin H. Good,,,Benjamin H Good,Stanford University,bioRxiv,10.1101/2022.05.13.491573,,Quantifying the adaptive landscape of commensal gut bacteria using high-resolution lineage tracking,http://www.biorxiv.org/content/10.1101/2022.05.13.491573v2,"Gut microbiota can adapt to their host environment by rapidly acquiring new mutations. However, the dynamics of this process are difficult to characterize in dominant gut species in their complex in vivo environment. Here we show that the fine-scale dynamics of genome-wide transposon libraries can enable quantitative inferences of these in vivo evolutionary forces. By analyzing >400,000 lineages across four human Bacteroides strains in gnotobiotic mice, we observed positive selection on thousands of previously hidden mutations - most of which were unrelated to their original gene knockouts. The spectrum of fitness benefits varied between species, and displayed diverse tradeoffs over time and in different dietary conditions, enabling inferences of their underlying function. These results suggest that within-host adaptations arise from an intense competition between numerous contending mutations, which can strongly influence their emergent evolutionary tradeoffs.",,,biorxiv;2022.05.13.491573,2,new results,2023-01-27,01/27/2023,,Daniel P.G.H. Wong; Benjamin H. Good,"Wong, D. P. G. H.; Good, B. H.","Department of Applied Physics, Stanford University; Department of Applied Physics, Stanford University; Department of Biology, Stanford University; Chan Zuckerberg Biohub","Daniel P.G.H. Wong, Department of Applied Physics, Stanford University], [Benjamin H. Good, Department of Applied Physics, Stanford University, Department of Biology, Stanford University, Chan Zuckerberg Biohub",NA,,,,,0
31,2023-02-01,"Brown, J[ames]",,,,,Journal of managed care & specialty pharmacy,10.18553/jmcp.2023.29.2.119,36705287.0,Comparative effectiveness of pegfilgrastim biosimilars vs originator for prevention of febrile neutropenia: A retrospective cohort study.,https://pubmed.ncbi.nlm.nih.gov/36705287,"BACKGROUND: Real-world evidence on the comparative effectiveness of pegfilgrastim biosimilars compared with the originator product is limited. OBJECTIVE: To compare the risk of febrile neutropenia (FN) among users of pegfilgrastim biosimilars (pegfilgrastim-jmdb and pegfilgrastim-cbqv) and the originator product. METHODS: A retrospective cohort study was conducted using 2019 IBM MarketScan databases to assess comparative effectiveness of pegfilgrastim originator and biosimilars for prevention of FN among patients receiving myelosuppressive chemotherapy. Patients with cancer, including breast, lung, colorectal, esophageal and gastric, pancreatic, prostate, ovarian, and non-Hodgkin lymphomas, initiating myelosuppressive chemotherapy courses were selected. We further selected patients who used pegfilgrastim originator and biosimilars within 3 days of chemotherapy completion. FN-associated hospitalizations were measured by International Classification of Diseases, Tenth Revision, Clinical Modification diagnosis codes. After 1:1 propensity score matching, we used equivalence (with a margin of 6%) hypothesis tests to compare FN-related hospitalization risk in the first cycle and across all cycles between biosimilars and originator users. RESULTS: A total of 2,045 patients were included, of which 445 (21.8%) used pegfilgrastim-jmdb, 636 (31.1%) used pegfilgrastim-cbqv, and 964 (47.1%) used pegfilgrastim originator. After matching, 13 out of 445 originator users and 17 out of 445 pegfilgrastim-jmdb users developed FN after the first chemotherapy cycle (risk difference was 0.9%; P < 0.001 for equivalence test indicating statistical equivalence). After matching, 14 out of 633 originator users and 16 out of 633 pegfilgrastim-cbqv users developed FN (risk difference was 0.32%; P < 0.001 for equivalence test indicating statistical equivalence). Results across all cycles (including the first cycle) were consistent with that in the first cycle. CONCLUSIONS: In this real-world study of patients with cancer receiving myelosuppressive chemotherapy, there was no difference in FN risk between patients receiving pegfilgrastim originator and biosimilars in the first cycle and across all cycles. These results add further to the current evidence on pegfilgrastim biosimilars and support wider adoption of pegfilgrastim biosimilars among payers, providers, and patients. Future studies assessing the tolerability, side effects, and other safety issues of pegfilgrastim biosimilars are needed.",,,,,,2023-01-28,,2023/1/28,Ching-Yu Wang; Scott M Vouri; Haesuk Park; Coy D Heldermon; Joshua D Brown,,"Department of Pharmaceutical Outcomes and Policy, College of Pharmacy.; Center for Drug Evaluation and Safety, University of Florida, Gainesville.; Division of Hematology & Oncology, College of Medicine, University of Florida, Gainesville.","Ching-Yu Wang: Department of Pharmaceutical Outcomes and Policy, College of Pharmacy.; Center for Drug Evaluation and Safety, University of Florida, Gainesville.Scott M Vouri: Department of Pharmaceutical Outcomes and Policy, College of Pharmacy.; Center for Drug Evaluation and Safety, University of Florida, Gainesville.Haesuk Park: Department of Pharmaceutical Outcomes and Policy, College of Pharmacy.; Center for Drug Evaluation and Safety, University of Florida, Gainesville.Coy D Heldermon: Division of Hematology & Oncology, College of Medicine, University of Florida, Gainesville.Joshua D Brown: Department of Pharmaceutical Outcomes and Policy, College of Pharmacy.; Center for Drug Evaluation and Safety, University of Florida, Gainesville.",,,,,,0
32,2023-02-01,,,,Jamie H. D. Cate,"University of California, Berkeley",bioRxiv,10.1101/2023.01.25.525534,,Aminobenzoic acid derivatives obstruct induced fit in the catalytic center of the ribosome,http://www.biorxiv.org/content/10.1101/2023.01.25.525534v2,"The Escherichia coli ribosome can incorporate a variety of non-O_SCPLOWLC_SCPLOW--amino acid monomers into polypeptide chains, but with poor efficiency. Although these monomers span a diverse set of compounds, there exists no high-resolution structural information regarding their positioning within the catalytic center of the ribosome, the peptidyl transferase center (PTC). Thus, details regarding the mechanism of amide bond formation and the structural basis for differences and defects in incorporation efficiency remain unknown. Within a set of three aminobenzoic acid derivatives-3-aminopyridine-4-carboxylic acid (Apy), ortho-aminobenzoic acid (oABZ), and meta-aminobenzoic acid (mABZ)-the ribosome incorporates Apy into polypeptide chains with the highest efficiency, followed by oABZ and then mABZ, a trend that does not track with the nucleophilicity of the reactive amines. Here, we report high resolution cryo-EM structures of the ribosome with these three aminobenzoic acid derivatives charged on tRNA bound in the aminoacyl-tRNA site (A site). These structures reveal how the aromatic ring of each monomer sterically blocks positioning of nucleotide U2506, thereby preventing rearrangement of nucleotide U2585 and the resulting induced fit in the PTC required for efficient amide bond formation. They also reveal disruptions to the ""proton wire"" responsible for facilitating formation and breakdown of the tetrahedral intermediate. Together, the cryo-EM structures reported here provide a clear rationale for differences in reactivity of aminobenzoic acid derivatives relative to O_SCPLOWLC_SCPLOW--amino acids and each other, and point to stereochemical constraints on the size and geometry of non-proteinogenic monomers that can be accepted efficiently by wild-type ribosomes.",,,biorxiv;2023.01.25.525534,2,new results,2023-01-31,01/31/2023,,Chandrima Majumdar; Joshua A Walker; Matthew B Francis; Alanna Schepartz; Jamie H. D. Cate,"Majumdar, C.; Walker, J. A.; Francis, M. B.; Schepartz, A.; Cate, J. H. D.","University of California, Berkeley; University of California, Berkeley; University of California, Berkeley; University of California, Berkeley; University of California, Berkeley","Chandrima Majumdar, University of California, Berkeley], [Joshua A Walker, University of California, Berkeley], [Matthew B Francis, University of California, Berkeley], [Alanna Schepartz, University of California, Berkeley], [Jamie H. D. Cate, University of California, Berkeley",NA,,,,,0
