record id,save datetime,biohub author,possible biohub author,format biohub author,corresponding author,corresponding author institution,journal,doi,pmid,title,url,abstract,keyword,pdf url,version,version number,type,date,epost date,publish date,authors,authors2,affiliations list,author - affiliations,published or not,confirm published doi,confirm preprint doi,possible match result,match id,record change number
1,2023-01-01,Joseph L DeRisi,,"DeRisi, Joe; DeRisi, Joe; DeRisi, Joe; DeRisi, Joe; DeRisi, Joe",,,Diabetes,10.2337/db21-1172,35709010.0,Autoantibodies to Perilipin-1 Define a Subset of Acquired Generalized Lipodystrophy.,https://pubmed.ncbi.nlm.nih.gov/35709010,"Acquired lipodystrophy is often characterized as an idiopathic subtype of lipodystrophy. Despite suspicion of an immune-mediated pathology, biomarkers such as autoantibodies are generally lacking. Here, we used an unbiased proteome-wide screening approach to identify autoantibodies to the adipocyte-specific lipid droplet protein perilipin 1 (PLIN1) in a murine model of autoimmune polyendocrine syndrome type 1 (APS1). We then tested for PLIN1 autoantibodies in human subjects with acquired lipodystrophy with two independent severe breaks in immune tolerance (including APS1) along with control subjects using a specific radioligand binding assay and indirect immunofluorescence on fat tissue. We identified autoantibodies to PLIN1 in these two cases, including the first reported case of APS1 with acquired lipodystrophy and a second patient who acquired lipodystrophy as an immune-related adverse event following cancer immunotherapy. Lastly, we also found PLIN1 autoantibodies to be specifically enriched in a subset of patients with acquired generalized lipodystrophy (17 of 46 [37%]), particularly those with panniculitis and other features of autoimmunity. These data lend additional support to new literature that suggests that PLIN1 autoantibodies represent a marker of acquired autoimmune lipodystrophies and further link them to a break in immune tolerance.",,,,,,2022-06-17,,2022/6/17,Caleigh Mandel-Brehm; Sara E Vazquez; Christopher Liverman; Mickie Cheng; Zoe Quandt; Andrew F Kung; Audrey Parent; Brenda Miao; Emmanuel Disse; Christine Cugnet-Anceau; Stéphane Dalle; Elizaveta Orlova; Elena Frolova; Diana Alba; Aaron Michels; Bergithe E Oftedal; Michail S Lionakis; Eystein S Husebye; Anil K Agarwal; Xilong Li; Chengsong Zhu; Quan Li; Elif Oral; Rebecca Brown; Mark S Anderson; Abhimanyu Garg; Joseph L DeRisi,,"Barbara Davis Center for Childhood Diabetes, University of Colorado School of Medicine, Aurora, CO.; Department of Biochemistry and Biophysics, University of California, San Francisco, San Francisco, CA.; Department of Biochemistry and Biophysics, University of California, San Francisco, San Francisco, CA.; Chan Zuckerberg Biohub, San Francisco, CA.; Department of Biochemistry and Biophysics, University of California, San Francisco, San Francisco, CA.; Diabetes Center, University of California, San Francisco, San Francisco, CA.; Department of Immunology, UT Southwestern Medical Center, Dallas, TX.; Department of Medicine, Haukeland University Hospital, Bergen, Norway.; Department of Clinical Science and K.G. Jebsen Center for Autoimmune Disorders, University of Bergen, Bergen, Norway.; Department of Pathology, University of California, San Francisco, San Francisco, CA.; Department of Population and Data Sciences, UT Southwestern Medical Center, Dallas, TX.; Diabetes Center, University of California, San Francisco, San Francisco, CA.; Diabetes Center, University of California, San Francisco, San Francisco, CA.; Department of Medicine, University of California, San Francisco, San Francisco, CA.; Division of Metabolism, Endocrinology & Diabetes and Caswell Diabetes Institute, University of Michigan, Ann Arbor, MI.; Division of Nutrition and Metabolic Diseases, Department of Internal Medicine, UT Southwestern Medical Center, Dallas, TX.; Endocrinology Diabetology and Nutrition Department, Lyon Sud Hospital, Hospices Civils de Lyon, Pierre-Bénite, France.; ImmuCare, Cancer Institute of Hospices Civils de Lyon (IC-HCL), Lyon, France.; Endocrinology Research Centre, Institute of Paediatric Endocrinology, Moscow, Russia.; Eunice Kennedy Shriver National Institute of Child Health and Human Development, National Institutes of Health, Bethesda, MD.; Fungal Pathogenesis Section, Laboratory of Clinical Immunology and Microbiology, National Institute of Allergy and Infectious Diseases, National Institutes of Health, Bethesda, MD.; ImmuCare, Cancer Institute of Hospices Civils de Lyon (IC-HCL), Lyon, France.; Dermatology Department, Lyon Sud Hospital, Hospices Civils de Lyon, Pierre-Bénite, France.; National Medical Research Center of Children's Health, Moscow, Russia.; University of Bergen, Bergen, Norway.; Department of Medicine, Haukeland University Hospital, Bergen, Norway.","Caleigh Mandel-Brehm: Department of Biochemistry and Biophysics, University of California, San Francisco, San Francisco, CA.Sara E Vazquez: Department of Biochemistry and Biophysics, University of California, San Francisco, San Francisco, CA.; Diabetes Center, University of California, San Francisco, San Francisco, CA.Christopher Liverman: Department of Pathology, University of California, San Francisco, San Francisco, CA.Mickie Cheng: Diabetes Center, University of California, San Francisco, San Francisco, CA.Zoe Quandt: Diabetes Center, University of California, San Francisco, San Francisco, CA.; Department of Medicine, University of California, San Francisco, San Francisco, CA.Andrew F Kung: Department of Biochemistry and Biophysics, University of California, San Francisco, San Francisco, CA.Audrey Parent: Diabetes Center, University of California, San Francisco, San Francisco, CA.Brenda Miao: Department of Biochemistry and Biophysics, University of California, San Francisco, San Francisco, CA.; Diabetes Center, University of California, San Francisco, San Francisco, CA.Emmanuel Disse: Endocrinology Diabetology and Nutrition Department, Lyon Sud Hospital, Hospices Civils de Lyon, Pierre-Bénite, France.; ImmuCare, Cancer Institute of Hospices Civils de Lyon (IC-HCL), Lyon, France.Christine Cugnet-Anceau: Endocrinology Diabetology and Nutrition Department, Lyon Sud Hospital, Hospices Civils de Lyon, Pierre-Bénite, France.; ImmuCare, Cancer Institute of Hospices Civils de Lyon (IC-HCL), Lyon, France.Stéphane Dalle: ImmuCare, Cancer Institute of Hospices Civils de Lyon (IC-HCL), Lyon, France.; Dermatology Department, Lyon Sud Hospital, Hospices Civils de Lyon, Pierre-Bénite, France.Elizaveta Orlova: Endocrinology Research Centre, Institute of Paediatric Endocrinology, Moscow, Russia.Elena Frolova: National Medical Research Center of Children's Health, Moscow, Russia.Diana Alba: Diabetes Center, University of California, San Francisco, San Francisco, CA.; Department of Medicine, University of California, San Francisco, San Francisco, CA.Aaron Michels: Barbara Davis Center for Childhood Diabetes, University of Colorado School of Medicine, Aurora, CO.Bergithe E Oftedal: University of Bergen, Bergen, Norway.; Department of Medicine, Haukeland University Hospital, Bergen, Norway.Michail S Lionakis: Fungal Pathogenesis Section, Laboratory of Clinical Immunology and Microbiology, National Institute of Allergy and Infectious Diseases, National Institutes of Health, Bethesda, MD.Eystein S Husebye: Department of Medicine, Haukeland University Hospital, Bergen, Norway.; Department of Clinical Science and K.G. Jebsen Center for Autoimmune Disorders, University of Bergen, Bergen, Norway.Anil K Agarwal: Division of Nutrition and Metabolic Diseases, Department of Internal Medicine, UT Southwestern Medical Center, Dallas, TX.Xilong Li: Department of Population and Data Sciences, UT Southwestern Medical Center, Dallas, TX.Chengsong Zhu: Department of Immunology, UT Southwestern Medical Center, Dallas, TX.Quan Li: Department of Immunology, UT Southwestern Medical Center, Dallas, TX.Elif Oral: Division of Metabolism, Endocrinology & Diabetes and Caswell Diabetes Institute, University of Michigan, Ann Arbor, MI.Rebecca Brown: Eunice Kennedy Shriver National Institute of Child Health and Human Development, National Institutes of Health, Bethesda, MD.Mark S Anderson: Diabetes Center, University of California, San Francisco, San Francisco, CA.; Department of Medicine, University of California, San Francisco, San Francisco, CA.Abhimanyu Garg: Division of Nutrition and Metabolic Diseases, Department of Internal Medicine, UT Southwestern Medical Center, Dallas, TX.Joseph L DeRisi: Department of Biochemistry and Biophysics, University of California, San Francisco, San Francisco, CA.; Chan Zuckerberg Biohub, San Francisco, CA.",,,10.1101/2021.09.24.21263657,,,0
2,2023-01-01,Vida Ahyong; Katrina Kalantar; Chaz Langelier; Lucy M Li; Maira Phelps; Cristina M Tato; Manu Vanaerschot,,"Li, Lucy; Rosenberg, Oren; Tato, Cristina",,,Global health action,10.1080/16549716.2022.2062175,35730550.0,Workshop-based learning and networking: a scalable model for research capacity strengthening in low- and middle-income countries.,https://pubmed.ncbi.nlm.nih.gov/35730550,"Science education and research have the potential to drive profound change in low- and middle-income countries (LMICs) through encouraging innovation, attracting industry, and creating job opportunities. However, in LMICs, research capacity is often limited, and acquisition of funding and access to state-of-the-art technologies is challenging. The Alliance for Global Health and Science (the Alliance) was founded as a partnership between the University of California, Berkeley (USA) and Makerere University (Uganda), with the goal of strengthening Makerere University's capacity for bioscience research. The flagship program of the Alliance partnership is the MU/UCB Biosciences Training Program, an in-country, hands-on workshop model that trains a large number of students from Makerere University in infectious disease and molecular biology research. This approach nucleates training of larger and more diverse groups of students, development of mentoring and bi-directional research partnerships, and support of the local economy. Here, we describe the project, its conception, implementation, challenges, and outcomes of bioscience research workshops. We aim to provide a blueprint for workshop implementation, and create a valuable resource for bioscience research capacity strengthening in LMICs.",Africa; Capacity strengthening; Uganda; infectious diseases; research,,,,,2022-06-23,,2022/6/23,Celine Perier; Emmanuel Nasinghe; Isabelle Charles; Leoson Junior Ssetaba; Vida Ahyong; Derek Bangs; P Robert Beatty; Nadine Czudnochowski; Amy Diallo; Eli Dugan; Jacqueline M Fabius; Hildy Fong Baker; Jackson Gardner; Stephen Isaacs; Birungi Joanah; Katrina Kalantar; David Kateete; Matt Knight; Maria Krasilnikov; Nevan J Krogan; Chaz Langelier; Eric Lee; Lucy M Li; Daniel Licht; Katie Lien; Zilose Lyons; Gerald Mboowa; Ivan Mwebaza; Savannah Mwesigwa; Geraldine Nalwadda; Robert Nichols; Maria Elena Penaranda; Sarah Petnic; Maira Phelps; Stephen J Popper; Michael Rape; Arthur Reingold; Richard Robbins; Oren S Rosenberg; David F Savage; Samuel Schildhauer; Matthew L Settles; Ivan Sserwadda; Sarah Stanley; Cristina M Tato; Alexandra Tsitsiklis; Erik Van Dis; Manu Vanaerschot; Joanna Vinden; Jeffery S Cox; Moses L Joloba; Julia Schaletzky,,"California China Climate Institute, University of California, Berkeley, CA, USA.; California Department of Public Health, Richmond, CA, USA.; Chan Zuckerberg Biohub, San Francisco, CA, USA.; Department of Immunology, University of Washington School of Medicine, Seattle, WA, USA.; Department of Medicine, University of California, San Francisco, CA, USA.; Department of Molecular Biology and Microbiology, Tufts Graduate School of Biomedical Sciences, Boston, MA, USA.; Department of Molecular and Cell Biology, University of California, Berkeley, CA, USA.; Department of Molecular and Cell Biology, University of California, Berkeley, CA, USA.; Division of Infectious Disease and Vaccinology, School of Public Health, University of California, Berkeley, CA, USA.; Department of Plant and Microbial Biology, University of California, Berkeley, CA, USA.; Division of Epidemiology and Biostatistics, School of Public Health, University of California, Berkeley, CA, USA.; Division of Infectious Diseases and Immunity, School of Public Health, University of California, Berkeley, CA, USA.; Former CEO, Aduro BioTech, Berkeley, CA, USA.; Graduate Group in Infectious Diseases and Immunity, School of Public Health, University of California, Berkeley, CA, USA.; H. Wheeler Center for Emerging & Neglected Diseases (CEND), University of California, Berkeley, CA, USA.; H. Wheeler Center for Emerging & Neglected Diseases (CEND), University of California, Berkeley, CA, USA.; Department of Molecular and Cell Biology, University of California, Berkeley, CA, USA.; Howard Hughes Medical Institute, University of California, Berkeley, CA, USA.; Pritzker School of Medicine, University of Chicago, Chicago, IL, USA.; Quality and Clinical Excellence Department, Providence Queen of the Valley Medical Center, Napa, CA, USA.; Quantitative Biosciences Institute (QBI), University of California, San Francisco, CA, USA.; Quantitative Biosciences Institute (QBI), University of California, San Francisco, CA, USA.; Gladstone Institute of Data Science and Biotechnology, J. David Gladstone Institutes, San Francisco, CA, USA.; School of Biomedical Sciences, Makerere University, Kampala, Uganda.; School of Public Health, Center for Global Public Health (CGPH), University of California, Berkeley, CA, USA.; Sustainable Sciences Institute, San Francisco, CA, USA.; Sustainable Sciences Institute, San Francisco, CA, USA.; School of Public Health, Department of Infectious Disease and Vaccinology, University of California, Berkeley, CA, USA.; UC Davis Genome Center, Davis, CA, USA.; Wareham Development, San Rafael, CA, USA.","Celine Perier: H. Wheeler Center for Emerging & Neglected Diseases (CEND), University of California, Berkeley, CA, USA.Emmanuel Nasinghe: School of Biomedical Sciences, Makerere University, Kampala, Uganda.Isabelle Charles: H. Wheeler Center for Emerging & Neglected Diseases (CEND), University of California, Berkeley, CA, USA.Leoson Junior Ssetaba: School of Biomedical Sciences, Makerere University, Kampala, Uganda.Vida Ahyong: Chan Zuckerberg Biohub, San Francisco, CA, USA.Derek Bangs: Department of Molecular and Cell Biology, University of California, Berkeley, CA, USA.P Robert Beatty: Department of Molecular and Cell Biology, University of California, Berkeley, CA, USA.Nadine Czudnochowski: Department of Medicine, University of California, San Francisco, CA, USA.Amy Diallo: Department of Medicine, University of California, San Francisco, CA, USA.Eli Dugan: Department of Molecular and Cell Biology, University of California, Berkeley, CA, USA.Jacqueline M Fabius: Quantitative Biosciences Institute (QBI), University of California, San Francisco, CA, USA.Hildy Fong Baker: School of Public Health, Center for Global Public Health (CGPH), University of California, Berkeley, CA, USA.Jackson Gardner: Department of Medicine, University of California, San Francisco, CA, USA.Stephen Isaacs: Former CEO, Aduro BioTech, Berkeley, CA, USA.Birungi Joanah: School of Biomedical Sciences, Makerere University, Kampala, Uganda.Katrina Kalantar: Chan Zuckerberg Biohub, San Francisco, CA, USA.David Kateete: School of Biomedical Sciences, Makerere University, Kampala, Uganda.Matt Knight: Department of Plant and Microbial Biology, University of California, Berkeley, CA, USA.Maria Krasilnikov: Department of Molecular Biology and Microbiology, Tufts Graduate School of Biomedical Sciences, Boston, MA, USA.Nevan J Krogan: Quantitative Biosciences Institute (QBI), University of California, San Francisco, CA, USA.; Gladstone Institute of Data Science and Biotechnology, J. David Gladstone Institutes, San Francisco, CA, USA.Chaz Langelier: Chan Zuckerberg Biohub, San Francisco, CA, USA.Eric Lee: Graduate Group in Infectious Diseases and Immunity, School of Public Health, University of California, Berkeley, CA, USA.Lucy M Li: Chan Zuckerberg Biohub, San Francisco, CA, USA.Daniel Licht: Department of Molecular and Cell Biology, University of California, Berkeley, CA, USA.Katie Lien: Pritzker School of Medicine, University of Chicago, Chicago, IL, USA.Zilose Lyons: California China Climate Institute, University of California, Berkeley, CA, USA.Gerald Mboowa: School of Biomedical Sciences, Makerere University, Kampala, Uganda.Ivan Mwebaza: School of Biomedical Sciences, Makerere University, Kampala, Uganda.Savannah Mwesigwa: School of Biomedical Sciences, Makerere University, Kampala, Uganda.Geraldine Nalwadda: School of Biomedical Sciences, Makerere University, Kampala, Uganda.Robert Nichols: Department of Molecular and Cell Biology, University of California, Berkeley, CA, USA.Maria Elena Penaranda: Sustainable Sciences Institute, San Francisco, CA, USA.Sarah Petnic: Quality and Clinical Excellence Department, Providence Queen of the Valley Medical Center, Napa, CA, USA.Maira Phelps: Chan Zuckerberg Biohub, San Francisco, CA, USA.Stephen J Popper: Sustainable Sciences Institute, San Francisco, CA, USA.; School of Public Health, Department of Infectious Disease and Vaccinology, University of California, Berkeley, CA, USA.Michael Rape: Howard Hughes Medical Institute, University of California, Berkeley, CA, USA.Arthur Reingold: Division of Epidemiology and Biostatistics, School of Public Health, University of California, Berkeley, CA, USA.Richard Robbins: Wareham Development, San Rafael, CA, USA.Oren S Rosenberg: Department of Medicine, University of California, San Francisco, CA, USA.David F Savage: Department of Molecular and Cell Biology, University of California, Berkeley, CA, USA.Samuel Schildhauer: California Department of Public Health, Richmond, CA, USA.Matthew L Settles: UC Davis Genome Center, Davis, CA, USA.Ivan Sserwadda: School of Biomedical Sciences, Makerere University, Kampala, Uganda.Sarah Stanley: Department of Molecular and Cell Biology, University of California, Berkeley, CA, USA.; Division of Infectious Disease and Vaccinology, School of Public Health, University of California, Berkeley, CA, USA.Cristina M Tato: Chan Zuckerberg Biohub, San Francisco, CA, USA.Alexandra Tsitsiklis: Department of Medicine, University of California, San Francisco, CA, USA.Erik Van Dis: Department of Immunology, University of Washington School of Medicine, Seattle, WA, USA.Manu Vanaerschot: Chan Zuckerberg Biohub, San Francisco, CA, USA.Joanna Vinden: Division of Infectious Diseases and Immunity, School of Public Health, University of California, Berkeley, CA, USA.Jeffery S Cox: H. Wheeler Center for Emerging & Neglected Diseases (CEND), University of California, Berkeley, CA, USA.; Department of Molecular and Cell Biology, University of California, Berkeley, CA, USA.Moses L Joloba: School of Biomedical Sciences, Makerere University, Kampala, Uganda.Julia Schaletzky: H. Wheeler Center for Emerging & Neglected Diseases (CEND), University of California, Berkeley, CA, USA.",,,,,,0
3,2023-01-01,"Kim, Peter",,"Kim, Peter",Francesca Di Cara; Richard A Rachubinski,"Dalhousie University, Department of Microbiology and Immunology, Halifax, NS B3K 6R8, Canada. Electronic address: dicara@dal.ca.University of Alberta, Department of Cell Biology, Edmonton, AB T6G 2H7, Canada. Electronic address: rick.rachubinski@ualberta.ca.",Trends in cell biology,10.1016/j.tcb.2022.06.001,35788297.0,The peroxisome: an up-and-coming organelle in immunometabolism.,https://pubmed.ncbi.nlm.nih.gov/35788297,"Peroxisomes are essential metabolic organelles, well known for their roles in the metabolism of complex lipids and reactive ionic species. In the past 10 years, peroxisomes have also been cast as central regulators of immunity. Lipid metabolites of peroxisomes, such as polyunsaturated fatty acids (PUFAs), are precursors for important immune mediators, including leukotrienes (LTs) and resolvins. Peroxisomal redox metabolism modulates cellular immune signaling such as nuclear factor kappa-light-chain-enhancer of activated B cells (NF-κB) activation. Additionally, peroxisomal β-oxidation and ether lipid synthesis control the development and aspects of the activation of both innate and adaptive immune cells. Finally, peroxisome number and metabolic activity have been linked to inflammatory diseases. These discoveries have opened avenues of investigation aimed at targeting peroxisomes for therapeutic intervention in immune disorders, inflammation, and cancer.",host–pathogen interaction; immune signaling; immunometabolism; peroxisome; phagocytosis,,,,,2022-07-06,2022/07/01,2022/7/6,Francesca Di Cara; Stéphane Savary; Werner J Kovacs; Peter Kim; Richard A Rachubinski,,"Cell Biology Program, Hospital for Sick Children, Peter Gilgan Centre for Research and Learning, Toronto, ON, Canada; Department of Biochemistry, University of Toronto, Toronto, ON, Canada; Department of Biomedical Science and Engineering, Gwangju Institute of Science and Technology, Gwangju, South Korea.; Dalhousie University, Department of Microbiology and Immunology, Halifax, NS B3K 6R8, Canada. Electronic address: dicara@dal.ca.; Institute of Molecular Health Sciences, Swiss Federal Institute of Technology in Zurich (ETH Zürich), Zurich, Switzerland.; Lab. Bio-PeroxIL EA7270, University of Bourgogne Franche-Comté, 6 Bd Gabriel, 21000 Dijon, France.; University of Alberta, Department of Cell Biology, Edmonton, AB T6G 2H7, Canada. Electronic address: rick.rachubinski@ualberta.ca.","Francesca Di Cara: Dalhousie University, Department of Microbiology and Immunology, Halifax, NS B3K 6R8, Canada. Electronic address: dicara@dal.ca.Stéphane Savary: Lab. Bio-PeroxIL EA7270, University of Bourgogne Franche-Comté, 6 Bd Gabriel, 21000 Dijon, France.Werner J Kovacs: Institute of Molecular Health Sciences, Swiss Federal Institute of Technology in Zurich (ETH Zürich), Zurich, Switzerland.Peter Kim: Cell Biology Program, Hospital for Sick Children, Peter Gilgan Centre for Research and Learning, Toronto, ON, Canada; Department of Biochemistry, University of Toronto, Toronto, ON, Canada; Department of Biomedical Science and Engineering, Gwangju Institute of Science and Technology, Gwangju, South Korea.Richard A Rachubinski: University of Alberta, Department of Cell Biology, Edmonton, AB T6G 2H7, Canada. Electronic address: rick.rachubinski@ualberta.ca.",,,,,,0
4,2023-01-01,"Xu, Ke",,"Xu, Ke",,,Pediatric obesity,10.1111/ijpo.12969,36102013.0,Maternal pre-pregnancy body mass index and offspring with overweight/obesity at preschool age: The possible role of epigenome-wide DNA methylation changes in cord blood.,https://pubmed.ncbi.nlm.nih.gov/36102013,Epigenome-wide association studies have identified some DNA methylation sites associated with body mass index (BMI) or obesity. Studies in the Asian population are lacking.,DNA methylation; body mass index; childhood obesity; pre-pregnancy weight,,,,,2022-09-15,2022/09/14,2022/9/15,Ruixia Chang; Yuanyuan Zhang; Jiahong Sun; Ke Xu; Chunan Li; Jingli Zhang; Wenhua Mei; Hongzhong Zhang; Jianduan Zhang,,"Department of Maternal and Child Health, School of Public Health, Tongji Medical College, Huazhong University of Science and Technology, Wuhan, China.; Traditional Chinese Medicine Hospital, Zhuhai, Guangdong, China.; Zhuhai Center for Disease Control and Prevention, Zhuhai, Guangdong, China.; Zhuhai Women and Children's Hospital, Zhuhai, Guangdong, China.","Ruixia Chang: Department of Maternal and Child Health, School of Public Health, Tongji Medical College, Huazhong University of Science and Technology, Wuhan, China.Yuanyuan Zhang: Department of Maternal and Child Health, School of Public Health, Tongji Medical College, Huazhong University of Science and Technology, Wuhan, China.Jiahong Sun: Department of Maternal and Child Health, School of Public Health, Tongji Medical College, Huazhong University of Science and Technology, Wuhan, China.Ke Xu: Department of Maternal and Child Health, School of Public Health, Tongji Medical College, Huazhong University of Science and Technology, Wuhan, China.Chunan Li: Department of Maternal and Child Health, School of Public Health, Tongji Medical College, Huazhong University of Science and Technology, Wuhan, China.Jingli Zhang: Traditional Chinese Medicine Hospital, Zhuhai, Guangdong, China.Wenhua Mei: Zhuhai Center for Disease Control and Prevention, Zhuhai, Guangdong, China.Hongzhong Zhang: Zhuhai Women and Children's Hospital, Zhuhai, Guangdong, China.Jianduan Zhang: Department of Maternal and Child Health, School of Public Health, Tongji Medical College, Huazhong University of Science and Technology, Wuhan, China.",,,,,,0
