record id,save datetime,biohub author,possible biohub author,format biohub author,corresponding author,corresponding author institution,journal,doi,pmid,title,url,abstract,keyword,pdf url,version,version number,type,date,epost date,publish date,authors,authors2,affiliations list,author - affiliations,published or not,confirm published doi,confirm preprint doi,possible match result,match id,record change number
10,2023-02-10,,,,Zaki Molvi,Memorial Sloan Kettering Cancer Center,bioRxiv,10.1101/2023.02.08.527552,,The landscape of MHC-presented phosphopeptides yields actionable shared tumor antigens for cancer immunotherapy across multiple HLA alleles,http://www.biorxiv.org/content/10.1101/2023.02.08.527552v2,"Phosphorylated peptides have been shown to be presented by MHC molecules, particularly by cancer cells that are characterized by aberrant phosphorylation. Phosphopeptides presented in complex with human leukocyte antigen (HLA) have been reported to provide a stability advantage over their unmodified counterparts when presented by the common HLA allele A*02:01. This stability in turn is thought to translate to enhanced immunogenicity. Whether tumor-associated phosphopeptides presented by other common alleles exhibit immunogenicity and structural characteristics similar to those presented by A*02:01 is unclear. Therefore, we sought to determine the identity, structural features, and immunogenicity of phosphopeptides presented by the common alleles HLA-A*03:01, -A*11:01, -C*07:01, and -C*07:02. We isolated peptide-MHC complexes by immunoprecipitation of 10 healthy and neoplastic tissue samples using mass spectrometry, and then combined the resulting data with public immunopeptidomics datasets to assemble a curated set of 2,466 phosphopeptides presented by 20 distinct healthy and neoplastic tissue types. We determined the biochemical features of selected phosphopeptides by in vitro binding assays and in silico docking, and their immunogenicity by analyzing healthy donor T cells for phosphopeptide-specific multimer binding and cytokine production. We demonstrated that HLA-A*03:01 and -A*11:01 present shared phosphopeptides on multiple tumor types, particularly lymphomas and leukemias; a subset of these peptides were not found on healthy tissues. These phosphopeptides generally exhibited similar binding to A*11:01 and similar or worse binding to A*03:01 than their unmodified counterparts. Additionally, we found that HLA-C*07:01 phosphopeptides were generally presented in the absence of their unmodified counterparts, and were dependent on B-pocket interactions that were absent in C*07:02, but such interactions were still permissive to unmodified peptide binding. We found that HLA-A*02:01 and -A*11:01 phosphopeptide-specific T cells could be readily detected in an autologous setting, even when the wildtype peptide was co-presented. In contrast, HLA-A*03:01 or -C*07:01 phosphopeptide-specific T cell responses were not elicited in autologous donors, but could be elicited in allogeneic donors. Our results demonstrated that phosphopeptides across multiple alleles represent shared tumor-specific antigens that could be targeted for cancer immunotherapy, but the immunogenicity of such phosphopeptides is not a general feature, which may be explained by a lack of increase in energetic favorability associated with phosphopeptide binding to A*03:01. Thus, to address an expanded patient population, phosphopeptide-targeted immunotherapies should be wary of allele-specific differences.",,,biorxiv;2023.02.08.527552,2,new results,2023-02-09,02/09/2023,,Zaki Molvi; Martin G. Klatt; Tao Dao; Jessica Urraca; David A. Scheinberg; Richard J. O'Reilly,"Molvi, Z.; Klatt, M. G.; Dao, T.; Urraca, J.; Scheinberg, D. A.; O'Reilly, R. J.",Memorial Sloan Kettering Cancer Center;; Charité -- University Medicine Berlin; Memorial Sloan Kettering Cancer Center;; Memorial Sloan Kettering Cancer Center;; Memorial Sloan Kettering Cancer Center;; Memorial Sloan Kettering Cancer Center;,"Zaki Molvi, Memorial Sloan Kettering Cancer Center;], [Martin G. Klatt, Charité -- University Medicine Berlin], [Tao Dao, Memorial Sloan Kettering Cancer Center;], [Jessica Urraca, Memorial Sloan Kettering Cancer Center;], [David A. Scheinberg, Memorial Sloan Kettering Cancer Center;], [""Richard J. OReilly"", Memorial Sloan Kettering Cancer Center;",NA,,,,,0
11,2023-02-10,,,,Melanie Ott,"Gladstone Institutes, San Francisco, CA; Department of Medicine, University of California, San Francisco, CA",bioRxiv,10.1101/2023.01.31.525914,,Rapid assembly of SARS-CoV-2 genomes reveals attenuation of the Omicron BA.1 variant through NSP6,http://www.biorxiv.org/content/10.1101/2023.01.31.525914v1,"Although the SARS-CoV-2 Omicron variant (BA.1) spread rapidly across the world and effectively evaded immune responses, its viral fitness in cell and animal models was reduced. The precise nature of this attenuation remains unknown as generating replication-competent viral genomes is challenging because of the length of the viral genome (30kb). Here, we designed a plasmid-based viral genome assembly and rescue strategy (pGLUE) that constructs complete infectious viruses or noninfectious subgenomic replicons in a single ligation reaction with >80% efficiency. Fully sequenced replicons and infectious viral stocks can be generated in 1 and 3 weeks, respectively. By testing a series of naturally occurring viruses as well as Delta-Omicron chimeric replicons, we show that Omicron nonstructural protein 6 harbors critical attenuating mutations, which dampen viral RNA replication and reduce lipid droplet consumption. Thus, pGLUE overcomes remaining barriers to broadly study SARS-CoV-2 replication and reveals deficits in nonstructural protein function underlying Omicron attenuation.",,,biorxiv;2023.01.31.525914,1,new results,2023-02-09,02/09/2023,,Taha Y Taha; Irene P Chen; Jennifer M Hayashi; Takako Tabata; Keith Walcott; Gabriella R Kimmerly; Abdullah M Syed; Alison Ciling; Rahul K Suryawanshi; Hannah S Martin; Bryan H Bach; Chia-Lin Tsou; Mauricio Montano; Mir M Khalid; Bharath K Sreekumar; G. Renuka Kumar; Stacia Wyman; Jennifer A Doudna; Melanie Ott,"Taha, T. Y.; Chen, I. P.; Hayashi, J. M.; Tabata, T.; Walcott, K.; Kimmerly, G. R.; Syed, A. M.; Ciling, A.; Suryawanshi, R. K.; Martin, H. S.; Bach, B. H.; Tsou, C.-L.; Montano, M.; Khalid, M. M.; Sreekumar, B. K.; Kumar, G. R.; Wyman, S.; Doudna, J. A.; Ott, M.","Gladstone Institutes;; Gladstone Institutes, San Francisco, CA; Department of Medicine, University of California, San Francisco, CA;; Gladstone Institutes, San Francisco, CA;; Gladstone Institutes, San Francisco, CA;; Gladstone Institutes, San Francisco, CA;; Gladstone Institutes, San Francisco, CA;; Gladstone Institutes, San Francisco, CA;; Gladstone Institutes, San Francisco, CA;; Gladstone Institutes, San Francisco, CA;; Gladstone Institutes, San Francisco, CA;; Innovative Genomics Institute, University of California, Berkeley, Berkeley, CA;; Gladstone Institutes;; Gladstone Institutes;; Gladstone Institutes;; Gladstone Institutes;; Gladstone Institutes;; Innovative Genomics Institute, University of California, Berkeley, Berkeley, CA;; Gladstone Institutes, San Francisco, CA; Innovative Genomics Institute, University of California, Berkeley, Berkeley, CA; Gladstone Institutes, San Francisco, CA; Department of Medicine, University of California, San Francisco, CA;","Taha Y Taha, Gladstone Institutes;], [Irene P Chen, Gladstone Institutes, San Francisco, CA; Department of Medicine, University of California, San Francisco, CA;], [Jennifer M Hayashi, Gladstone Institutes, San Francisco, CA;], [Takako Tabata, Gladstone Institutes, San Francisco, CA;], [Keith Walcott, Gladstone Institutes, San Francisco, CA;], [Gabriella R Kimmerly, Gladstone Institutes, San Francisco, CA;], [Abdullah M Syed, Gladstone Institutes, San Francisco, CA;], [Alison Ciling, Gladstone Institutes, San Francisco, CA;], [Rahul K Suryawanshi, Gladstone Institutes, San Francisco, CA;], [Hannah S Martin, Gladstone Institutes, San Francisco, CA;], [Bryan H Bach, Innovative Genomics Institute, University of California, Berkeley, Berkeley, CA;], [Chia-Lin Tsou, Gladstone Institutes;], [Mauricio Montano, Gladstone Institutes;], [Mir M Khalid, Gladstone Institutes;], [Bharath K Sreekumar, Gladstone Institutes;], [G. Renuka Kumar, Gladstone Institutes;], [Stacia Wyman, Innovative Genomics Institute, University of California, Berkeley, Berkeley, CA;], [Jennifer A Doudna, Gladstone Institutes, San Francisco, CA; Innovative Genomics Institute, University of California, Berkeley, Berkeley, CA], [Melanie Ott, Gladstone Institutes, San Francisco, CA; Department of Medicine, University of California, San Francisco, CA;",NA,,,,,0
12,2023-02-10,Christopher J Hernandez,,,,,Journal of bone and mineral research : the official journal of the American Society for Bone and Mineral Research,10.1002/jbmr.4781,36754846.0,Suppression of Remodeling and Bone Fragility.,https://pubmed.ncbi.nlm.nih.gov/36754846,,,,,,,2023-02-09,2023/02/08,2023/2/9,Christopher J Hernandez,,"Departments of Orthopaedic Surgery and Bioengineering and Therapeutic Sciences, University of California, San Francisco, CA, USA.; Chan Zuckerberg Biohub, San Francisco, CA, USA.","Christopher J Hernandez: Departments of Orthopaedic Surgery and Bioengineering and Therapeutic Sciences, University of California, San Francisco, CA, USA.; Chan Zuckerberg Biohub, San Francisco, CA, USA.",,,,,,0
13,2023-02-10,Nir Yosef,,"Yosef, Nir; Yosef, Nir; Yosef, Nir",Markus Kleinewietfeld,"VIB Laboratory of Translational Immunomodulation, VIB Center for Inflammation Research (IRC), Hasselt University, 3590 Diepenbeek, Belgium; Department of Immunology, Biomedical Research Institute, Hasselt University, 3590 Diepenbeek, Belgium. Electronic address: markus.kleinewietfeld@uhasselt.vib.be.",Cell metabolism,10.1016/j.cmet.2023.01.009,36754020.0,Sodium perturbs mitochondrial respiration and induces dysfunctional Tregs.,https://pubmed.ncbi.nlm.nih.gov/36754020,FOXP3,FOXP3; autoimmunity; high salt; mitochondrial respiration; regulatory T cells,,,,,2023-02-09,,2023/2/9,Beatriz F Côrte-Real; Ibrahim Hamad; Rebeca Arroyo Hornero; Sabrina Geisberger; Joris Roels; Lauren Van Zeebroeck; Aleksandra Dyczko; Marike W van Gisbergen; Henry Kurniawan; Allon Wagner; Nir Yosef; Susanne N Y Weiss; Klaus G Schmetterer; Agnes Schröder; Luka Krampert; Stefanie Haase; Hendrik Bartolomaeus; Niels Hellings; Yvan Saeys; Ludwig J Dubois; Dirk Brenner; Stefan Kempa; David A Hafler; Johannes Stegbauer; Ralf A Linker; Jonathan Jantsch; Dominik N Müller; Markus Kleinewietfeld,,"Department of Electrical Engineering and Computer Science, University of California, Berkeley, Berkeley, CA 94720, USA; Center for Computational Biology, University of California, Berkeley, Berkeley, CA 94720, USA.; Department of Electrical Engineering and Computer Science, University of California, Berkeley, Berkeley, CA 94720, USA; Center for Computational Biology, University of California, Berkeley, Berkeley, CA 94720, USA; Chan Zuckerberg Biohub Investigator, San Francisco, CA 94158, USA; Ragon Institute of Massachusetts General Hospital, MIT and Harvard University, Cambridge, MA 02139, USA; Department of Systems Immunology, Weizmann Institute of Science, 7610001 Rehovot, Israel.; Department of Immunology, Biomedical Research Institute, Hasselt University, 3590 Diepenbeek, Belgium.; Department of Nephrology, Medical Faculty, University Hospital Düsseldorf, Heinrich-Heine University Düsseldorf, 40225 Düsseldorf, Germany.; Department of Neurology, University of Regensburg, 93053 Regensburg, Germany.; Department of Orthodontics, University Hospital Regensburg, 93053 Regensburg, Germany.; Departments of Neurology and Immunobiology, Yale School of Medicine, New Haven, CT 06511, USA; Broad Institute of MIT and Harvard, Cambridge, MA 02142, USA.; Experimental & Molecular Immunology, Department of Infection and Immunity, Luxembourg Institute of Health, 4354 Esch-sur-Alzette, Luxembourg.; Experimental & Molecular Immunology, Department of Infection and Immunity, Luxembourg Institute of Health, 4354 Esch-sur-Alzette, Luxembourg; Odense Research Center for Anaphylaxis (ORCA), Department of Dermatology and Allergy Center, Odense University Hospital, University of Southern Denmark, 5230 Odense, Denmark.; Experimental and Clinical Research Center, a joint cooperation of Max Delbrück Center for Molecular Medicine and Charité-Universitätsmedizin Berlin, 13125 Berlin, Germany; DZHK (German Centre for Cardiovascular Research), partner site Berlin, 10785 Berlin, Germany.; Experimental and Clinical Research Center, a joint cooperation of Max Delbrück Center for Molecular Medicine and Charité-Universitätsmedizin Berlin, 13125 Berlin, Germany; DZHK (German Centre for Cardiovascular Research), partner site Berlin, 10785 Berlin, Germany; Charité - Universitätsmedizin Berlin, Corporate Member of Freie Universität Berlin, Humboldt Universität zu Berlin, and Berlin Institute of Health, 10117 Berlin, Germany; Max-Delbrück-Center for Molecular Medicine in the Helmholtz Association, 13125 Berlin, Germany.; Experimental and Clinical Research Center, a joint cooperation of Max Delbrück Center for Molecular Medicine and Charité-Universitätsmedizin Berlin, 13125 Berlin, Germany; Max-Delbrück-Center for Molecular Medicine in the Helmholtz Association (MDC), Berlin Institute for Medical Systems Biology (BIMSB), Integrative Proteomics and Metabolomics, 13125 Berlin, Germany; DZHK (German Centre for Cardiovascular Research), partner site Berlin, 10785 Berlin, Germany; Charité - Universitätsmedizin Berlin, Corporate Member of Freie Universität Berlin, Humboldt Universität zu Berlin, and Berlin Institute of Health, 10117 Berlin, Germany.; Institute of Clinical Microbiology and Hygiene, University Hospital Regensburg and University of Regensburg, 93053 Regensburg, Germany.; Institute of Clinical Microbiology and Hygiene, University Hospital Regensburg and University of Regensburg, 93053 Regensburg, Germany; Department of Laboratory Medicine, Medical University of Vienna, 1090 Vienna, Austria.; Institute of Clinical Microbiology and Hygiene, University Hospital Regensburg and University of Regensburg, 93053 Regensburg, Germany; Institute for Medical Microbiology, Immunology, and Hygiene, University Hospital Cologne and Faculty of Medicine, University of Cologne, 50935 Cologne, Germany.; Max-Delbrück-Center for Molecular Medicine in the Helmholtz Association (MDC), Berlin Institute for Medical Systems Biology (BIMSB), Integrative Proteomics and Metabolomics, 13125 Berlin, Germany.; The M-Lab, Department of Precision Medicine, GROW - School for Oncology and Developmental Biology, Maastricht University, 6200 MD Maastricht, the Netherlands.; VIB Laboratory of Translational Immunomodulation, VIB Center for Inflammation Research (IRC), Hasselt University, 3590 Diepenbeek, Belgium; Department of Immunology, Biomedical Research Institute, Hasselt University, 3590 Diepenbeek, Belgium.; VIB Laboratory of Translational Immunomodulation, VIB Center for Inflammation Research (IRC), Hasselt University, 3590 Diepenbeek, Belgium; Department of Immunology, Biomedical Research Institute, Hasselt University, 3590 Diepenbeek, Belgium. Electronic address: markus.kleinewietfeld@uhasselt.vib.be.; VIB-UGent Center for Inflammation Research, 9052 Gent, Belgium.; VIB-UGent Center for Inflammation Research, 9052 Gent, Belgium; VIB BioImaging Core, 9052 Gent, Belgium.","Beatriz F Côrte-Real: VIB Laboratory of Translational Immunomodulation, VIB Center for Inflammation Research (IRC), Hasselt University, 3590 Diepenbeek, Belgium; Department of Immunology, Biomedical Research Institute, Hasselt University, 3590 Diepenbeek, Belgium.Ibrahim Hamad: VIB Laboratory of Translational Immunomodulation, VIB Center for Inflammation Research (IRC), Hasselt University, 3590 Diepenbeek, Belgium; Department of Immunology, Biomedical Research Institute, Hasselt University, 3590 Diepenbeek, Belgium.Rebeca Arroyo Hornero: VIB Laboratory of Translational Immunomodulation, VIB Center for Inflammation Research (IRC), Hasselt University, 3590 Diepenbeek, Belgium; Department of Immunology, Biomedical Research Institute, Hasselt University, 3590 Diepenbeek, Belgium.Sabrina Geisberger: Experimental and Clinical Research Center, a joint cooperation of Max Delbrück Center for Molecular Medicine and Charité-Universitätsmedizin Berlin, 13125 Berlin, Germany; Max-Delbrück-Center for Molecular Medicine in the Helmholtz Association (MDC), Berlin Institute for Medical Systems Biology (BIMSB), Integrative Proteomics and Metabolomics, 13125 Berlin, Germany; DZHK (German Centre for Cardiovascular Research), partner site Berlin, 10785 Berlin, Germany; Charité - Universitätsmedizin Berlin, Corporate Member of Freie Universität Berlin, Humboldt Universität zu Berlin, and Berlin Institute of Health, 10117 Berlin, Germany.Joris Roels: VIB-UGent Center for Inflammation Research, 9052 Gent, Belgium; VIB BioImaging Core, 9052 Gent, Belgium.Lauren Van Zeebroeck: VIB Laboratory of Translational Immunomodulation, VIB Center for Inflammation Research (IRC), Hasselt University, 3590 Diepenbeek, Belgium; Department of Immunology, Biomedical Research Institute, Hasselt University, 3590 Diepenbeek, Belgium.Aleksandra Dyczko: VIB Laboratory of Translational Immunomodulation, VIB Center for Inflammation Research (IRC), Hasselt University, 3590 Diepenbeek, Belgium; Department of Immunology, Biomedical Research Institute, Hasselt University, 3590 Diepenbeek, Belgium.Marike W van Gisbergen: The M-Lab, Department of Precision Medicine, GROW - School for Oncology and Developmental Biology, Maastricht University, 6200 MD Maastricht, the Netherlands.Henry Kurniawan: Experimental & Molecular Immunology, Department of Infection and Immunity, Luxembourg Institute of Health, 4354 Esch-sur-Alzette, Luxembourg.Allon Wagner: Department of Electrical Engineering and Computer Science, University of California, Berkeley, Berkeley, CA 94720, USA; Center for Computational Biology, University of California, Berkeley, Berkeley, CA 94720, USA.Nir Yosef: Department of Electrical Engineering and Computer Science, University of California, Berkeley, Berkeley, CA 94720, USA; Center for Computational Biology, University of California, Berkeley, Berkeley, CA 94720, USA; Chan Zuckerberg Biohub Investigator, San Francisco, CA 94158, USA; Ragon Institute of Massachusetts General Hospital, MIT and Harvard University, Cambridge, MA 02139, USA; Department of Systems Immunology, Weizmann Institute of Science, 7610001 Rehovot, Israel.Susanne N Y Weiss: Institute of Clinical Microbiology and Hygiene, University Hospital Regensburg and University of Regensburg, 93053 Regensburg, Germany.Klaus G Schmetterer: Institute of Clinical Microbiology and Hygiene, University Hospital Regensburg and University of Regensburg, 93053 Regensburg, Germany; Department of Laboratory Medicine, Medical University of Vienna, 1090 Vienna, Austria.Agnes Schröder: Department of Orthodontics, University Hospital Regensburg, 93053 Regensburg, Germany.Luka Krampert: Institute of Clinical Microbiology and Hygiene, University Hospital Regensburg and University of Regensburg, 93053 Regensburg, Germany.Stefanie Haase: Department of Neurology, University of Regensburg, 93053 Regensburg, Germany.Hendrik Bartolomaeus: Experimental and Clinical Research Center, a joint cooperation of Max Delbrück Center for Molecular Medicine and Charité-Universitätsmedizin Berlin, 13125 Berlin, Germany; DZHK (German Centre for Cardiovascular Research), partner site Berlin, 10785 Berlin, Germany.Niels Hellings: Department of Immunology, Biomedical Research Institute, Hasselt University, 3590 Diepenbeek, Belgium.Yvan Saeys: VIB-UGent Center for Inflammation Research, 9052 Gent, Belgium.Ludwig J Dubois: The M-Lab, Department of Precision Medicine, GROW - School for Oncology and Developmental Biology, Maastricht University, 6200 MD Maastricht, the Netherlands.Dirk Brenner: Experimental & Molecular Immunology, Department of Infection and Immunity, Luxembourg Institute of Health, 4354 Esch-sur-Alzette, Luxembourg; Odense Research Center for Anaphylaxis (ORCA), Department of Dermatology and Allergy Center, Odense University Hospital, University of Southern Denmark, 5230 Odense, Denmark.Stefan Kempa: Max-Delbrück-Center for Molecular Medicine in the Helmholtz Association (MDC), Berlin Institute for Medical Systems Biology (BIMSB), Integrative Proteomics and Metabolomics, 13125 Berlin, Germany.David A Hafler: Departments of Neurology and Immunobiology, Yale School of Medicine, New Haven, CT 06511, USA; Broad Institute of MIT and Harvard, Cambridge, MA 02142, USA.Johannes Stegbauer: Department of Nephrology, Medical Faculty, University Hospital Düsseldorf, Heinrich-Heine University Düsseldorf, 40225 Düsseldorf, Germany.Ralf A Linker: Department of Neurology, University of Regensburg, 93053 Regensburg, Germany.Jonathan Jantsch: Institute of Clinical Microbiology and Hygiene, University Hospital Regensburg and University of Regensburg, 93053 Regensburg, Germany; Institute for Medical Microbiology, Immunology, and Hygiene, University Hospital Cologne and Faculty of Medicine, University of Cologne, 50935 Cologne, Germany.Dominik N Müller: Experimental and Clinical Research Center, a joint cooperation of Max Delbrück Center for Molecular Medicine and Charité-Universitätsmedizin Berlin, 13125 Berlin, Germany; DZHK (German Centre for Cardiovascular Research), partner site Berlin, 10785 Berlin, Germany; Charité - Universitätsmedizin Berlin, Corporate Member of Freie Universität Berlin, Humboldt Universität zu Berlin, and Berlin Institute of Health, 10117 Berlin, Germany; Max-Delbrück-Center for Molecular Medicine in the Helmholtz Association, 13125 Berlin, Germany.Markus Kleinewietfeld: VIB Laboratory of Translational Immunomodulation, VIB Center for Inflammation Research (IRC), Hasselt University, 3590 Diepenbeek, Belgium; Department of Immunology, Biomedical Research Institute, Hasselt University, 3590 Diepenbeek, Belgium. Electronic address: markus.kleinewietfeld@uhasselt.vib.be.",,,,,,0
