record id,save datetime,biohub author,possible biohub author,format biohub author,corresponding author,corresponding author institution,journal,doi,pmid,title,url,abstract,keyword,pdf url,version,version number,type,date,epost date,publish date,authors,authors2,affiliations list,author - affiliations,published or not,confirm published doi,confirm preprint doi,possible match result,match id,record change number
14,2023-02-10,Charles Langelier,,,Matthew K Leroue,"Pediatrics, University of Colorado School of Medicine and Children's Hospital Colorado, Aurora, CO, USA. matthew.leroue@childrenscolorado.org.",Pediatric research,10.1038/s41390-023-02502-8,36750739.0,"Tobacco smoke exposure, the lower airways microbiome and outcomes of ventilated children.",https://pubmed.ncbi.nlm.nih.gov/36750739,"Tobacco smoke exposure increases the risk and severity of lower respiratory tract infections in children, yet the mechanisms remain unclear. We hypothesized that tobacco smoke exposure would modify the lower airway microbiome.",,,,,,2023-02-09,2023/02/07,2023/2/9,Matthew K Leroue; Kayla M Williamson; Paul C Curtin; Marci K Sontag; Brandie D Wagner; Lilliam Ambroggio; Moira Bixby; Stefanie A Busgang; Sharon E Murphy; Lisa A Peterson; Karin R Vevang; Christopher J Sipe; J Kirk Harris; Ron W Reeder; Christopher Locandro; Todd C Carpenter; Aline B Maddux; Eric A F Simões; Christina M Osborne; Charles E Robertson; Charles Langelier; Joseph A Carcillo; Kathleen L Meert; Murray M Pollack; Patrick S McQuillen; Peter M Mourani,,"Biostatistics and Informatics, University of Colorado, Colorado School of Public Health, Aurora, CO, USA.; CHEAR Data Center, Department of Environmental Medicine and Public Health, Icahn School of Medicine at Mount Sinai, New York, NY, USA.; Epidemiology, University of Colorado, Colorado School of Public Health, Aurora, CO, USA.; Masonic Cancer Center, University of Minnesota, Minneapolis, MN, USA.; Medicine, Division of Infectious Diseases, University of California San Francisco, San Francisco, CA, USA.; Chan Zuckerberg Biohub, San Francisco, CA, USA.; Medicine, Division of Infectious Diseases, University of Colorado School of Medicine and Children's Hospital Colorado, Aurora, CO, USA.; Pediatrics, Children's Hospital of Michigan, Central Michigan University, Detroit, MI, USA.; Pediatrics, Children's National Hospital, Washington, DC, USA.; Pediatrics, University of California San Francisco, San Francisco, CA, USA.; Pediatrics, University of Colorado School of Medicine and Children's Hospital Colorado, Aurora, CO, USA.; Pediatrics, University of Colorado School of Medicine and Children's Hospital Colorado, Aurora, CO, USA. matthew.leroue@childrenscolorado.org.; Pediatrics, University of Colorado School of Medicine and Children's Hospital Colorado, Aurora, CO, USA.; Epidemiology, University of Colorado, Colorado School of Public Health, Aurora, CO, USA.; Pediatrics, University of Colorado School of Medicine and Children's Hospital Colorado, Aurora, CO, USA.; Pediatrics, University of Arkansas for Medical Sciences and Arkansas Children's Research Institute, Little Rock, AR, USA.; Pediatrics, University of Pittsburgh, Pittsburgh, PA, USA.; Pediatrics, University of Utah, Salt Lake City, UT, USA.","Matthew K Leroue: Pediatrics, University of Colorado School of Medicine and Children's Hospital Colorado, Aurora, CO, USA. matthew.leroue@childrenscolorado.org.Kayla M Williamson: Biostatistics and Informatics, University of Colorado, Colorado School of Public Health, Aurora, CO, USA.Paul C Curtin: CHEAR Data Center, Department of Environmental Medicine and Public Health, Icahn School of Medicine at Mount Sinai, New York, NY, USA.Marci K Sontag: Epidemiology, University of Colorado, Colorado School of Public Health, Aurora, CO, USA.Brandie D Wagner: Biostatistics and Informatics, University of Colorado, Colorado School of Public Health, Aurora, CO, USA.Lilliam Ambroggio: Pediatrics, University of Colorado School of Medicine and Children's Hospital Colorado, Aurora, CO, USA.Moira Bixby: CHEAR Data Center, Department of Environmental Medicine and Public Health, Icahn School of Medicine at Mount Sinai, New York, NY, USA.Stefanie A Busgang: CHEAR Data Center, Department of Environmental Medicine and Public Health, Icahn School of Medicine at Mount Sinai, New York, NY, USA.Sharon E Murphy: Masonic Cancer Center, University of Minnesota, Minneapolis, MN, USA.Lisa A Peterson: Masonic Cancer Center, University of Minnesota, Minneapolis, MN, USA.Karin R Vevang: Masonic Cancer Center, University of Minnesota, Minneapolis, MN, USA.Christopher J Sipe: Masonic Cancer Center, University of Minnesota, Minneapolis, MN, USA.J Kirk Harris: Pediatrics, University of Colorado School of Medicine and Children's Hospital Colorado, Aurora, CO, USA.Ron W Reeder: Pediatrics, University of Utah, Salt Lake City, UT, USA.Christopher Locandro: Pediatrics, University of Utah, Salt Lake City, UT, USA.Todd C Carpenter: Pediatrics, University of Colorado School of Medicine and Children's Hospital Colorado, Aurora, CO, USA.Aline B Maddux: Pediatrics, University of Colorado School of Medicine and Children's Hospital Colorado, Aurora, CO, USA.Eric A F Simões: Pediatrics, University of Colorado School of Medicine and Children's Hospital Colorado, Aurora, CO, USA.; Epidemiology, University of Colorado, Colorado School of Public Health, Aurora, CO, USA.Christina M Osborne: Pediatrics, University of Colorado School of Medicine and Children's Hospital Colorado, Aurora, CO, USA.Charles E Robertson: Medicine, Division of Infectious Diseases, University of Colorado School of Medicine and Children's Hospital Colorado, Aurora, CO, USA.Charles Langelier: Medicine, Division of Infectious Diseases, University of California San Francisco, San Francisco, CA, USA.; Chan Zuckerberg Biohub, San Francisco, CA, USA.Joseph A Carcillo: Pediatrics, University of Pittsburgh, Pittsburgh, PA, USA.Kathleen L Meert: Pediatrics, Children's Hospital of Michigan, Central Michigan University, Detroit, MI, USA.Murray M Pollack: Pediatrics, Children's National Hospital, Washington, DC, USA.Patrick S McQuillen: Pediatrics, University of California San Francisco, San Francisco, CA, USA.Peter M Mourani: Pediatrics, University of Colorado School of Medicine and Children's Hospital Colorado, Aurora, CO, USA.; Pediatrics, University of Arkansas for Medical Sciences and Arkansas Children's Research Institute, Little Rock, AR, USA.",,,,,,0
15,2023-02-10,Hernan G Garcia,,,Michael B Eisen,"Howard Hughes Medical Institute. University of California, Berkeley.",bioRxiv,10.1101/2023.02.09.527927,,Unified bursting strategies in ectopic and endogenous even-skipped expression patterns,http://www.biorxiv.org/content/10.1101/2023.02.09.527927v1,"Transcription often occurs in bursts as gene promoters switch stochastically between active and inactive states. Enhancers can dictate transcriptional activity in animal development through the modulation of burst frequency, duration, or amplitude. Previous studies observed that different enhancers can achieve a wide range of transcriptional outputs through the same strategies of bursting control. For example, despite responding to different transcription factors, all even-skipped enhancers increase transcription by upregulating burst frequency and amplitude while burst duration remains largely constant. These shared bursting strategies suggest that a unified molecular mechanism constraints how enhancers modulate transcriptional output. Alternatively, different enhancers could have converged on the same bursting control strategy because of natural selection favoring one of these particular strategies. To distinguish between these two scenarios, we compared transcriptional bursting between endogenous and ectopic gene expression patterns. Because enhancers act under different regulatory inputs in ectopic patterns, dissimilar bursting control strategies between endogenous and ectopic patterns would suggest that enhancers adapted their bursting strategies to their trans-regulatory environment. Here, we generated ectopic even-skipped transcription patterns in fruit fly embryos and discovered that bursting strategies remain consistent in endogenous and ectopic even-skipped expression. These results provide evidence for a unified molecular mechanism shaping even-skipped bursting strategies and serve as a starting point to uncover the realm of strategies employed by other enhancers.",,,biorxiv;2023.02.09.527927,1,new results,2023-02-10,02/10/2023,,Augusto Berrocal; Nicholas C Lammers; Hernan G Garcia; Michael B Eisen,"Berrocal, A.; Lammers, N. C.; Garcia, H. G.; Eisen, M. B.","University of California, Berkeley. Current: University of California, San Francisco.;; University of California, Berkeley. Current: University of Washington, Seattle.;; Chan Zuckerberg Biohub. University of California Berkeley.;; Howard Hughes Medical Institute. University of California, Berkeley.","Augusto Berrocal, University of California, Berkeley. Current: University of California, San Francisco.;], [Nicholas C Lammers, University of California, Berkeley. Current: University of Washington, Seattle.;], [Hernan G Garcia, Chan Zuckerberg Biohub. University of California Berkeley.;], [Michael B Eisen, Howard Hughes Medical Institute. University of California, Berkeley.",NA,,,,,0
16,2023-02-10,,,,,,MMWR. Morbidity and mortality weekly report,10.15585/mmwr.mm7206e1,36757874.0,"Vital Signs: Health Disparities in Hemodialysis-Associated Staphylococcus aureus Bloodstream Infections - United States, 2017-2020.",https://pubmed.ncbi.nlm.nih.gov/36757874,"Racial and ethnic minorities are disproportionately affected by end-stage kidney disease (ESKD). ESKD patients on dialysis are at increased risk for Staphylococcus aureus bloodstream infections, but racial, ethnic, and socioeconomic disparities associated with this outcome are not well described.",,,,,,2023-02-10,2023/02/10,2023/2/10,Brian Rha; Isaac See; Lindsay Dunham; Preeta K Kutty; Lauren Moccia; Ibironke W Apata; Jennifer Ahern; Shelley Jung; Rongxia Li; Joelle Nadle; Susan Petit; Susan M Ray; Lee H Harrison; Carmen Bernu; Ruth Lynfield; Ghinwa Dumyati; Marissa Tracy; William Schaffner; D Cal Ham; Shelley S Magill; Erin N O'Leary; Jeneita Bell; Arjun Srinivasan; L Clifford McDonald; Jonathan R Edwards; Shannon Novosad,,,Brian Rha: Isaac See: Lindsay Dunham: Preeta K Kutty: Lauren Moccia: Ibironke W Apata: Jennifer Ahern: Shelley Jung: Rongxia Li: Joelle Nadle: Susan Petit: Susan M Ray: Lee H Harrison: Carmen Bernu: Ruth Lynfield: Ghinwa Dumyati: Marissa Tracy: William Schaffner: D Cal Ham: Shelley S Magill: Erin N O'Leary: Jeneita Bell: Arjun Srinivasan: L Clifford McDonald: Jonathan R Edwards: Shannon Novosad: ,,,,,,0
17,2023-02-10,"Altman, Russ",,"Altman, Russ; Altman, Russ",Sheng Wang,"School of Computer Science and Engineering, University of Washington, Seattle, WA, USA. swang@cs.washington.edu.",Nature communications,10.1038/s41467-023-36476-2,36759510.0,Multilingual translation for zero-shot biomedical classification using BioTranslator.,https://pubmed.ncbi.nlm.nih.gov/36759510,"Existing annotation paradigms rely on controlled vocabularies, where each data instance is classified into one term from a predefined set of controlled vocabularies. This paradigm restricts the analysis to concepts that are known and well-characterized. Here, we present the novel multilingual translation method BioTranslator to address this problem. BioTranslator takes a user-written textual description of a new concept and then translates this description to a non-text biological data instance. The key idea of BioTranslator is to develop a multilingual translation framework, where multiple modalities of biological data are all translated to text. We demonstrate how BioTranslator enables the identification of novel cell types using only a textual description and how BioTranslator can be further generalized to protein function prediction and drug target identification. Our tool frees scientists from limiting their analyses within predefined controlled vocabularies, enabling them to interact with biological data using free text.",,,,,,2023-02-10,2023/02/10,2023/2/10,Hanwen Xu; Addie Woicik; Hoifung Poon; Russ B Altman; Sheng Wang,,"Department of Bioengineering, Stanford University, Stanford, CA, USA.; Department of Genetics, Stanford University, Stanford, CA, USA.; Chan Zuckerberg Biohub, San Francisco, CA, USA.; Microsoft Research, Redmond, WA, USA.; School of Computer Science and Engineering, University of Washington, Seattle, WA, USA.; School of Computer Science and Engineering, University of Washington, Seattle, WA, USA. swang@cs.washington.edu.","Hanwen Xu: School of Computer Science and Engineering, University of Washington, Seattle, WA, USA.Addie Woicik: School of Computer Science and Engineering, University of Washington, Seattle, WA, USA.Hoifung Poon: Microsoft Research, Redmond, WA, USA.Russ B Altman: Department of Bioengineering, Stanford University, Stanford, CA, USA.; Department of Genetics, Stanford University, Stanford, CA, USA.; Chan Zuckerberg Biohub, San Francisco, CA, USA.Sheng Wang: School of Computer Science and Engineering, University of Washington, Seattle, WA, USA. swang@cs.washington.edu.",,,,,,0
18,2023-02-10,"Song, Yun",,"Song, Yun",,,Environmental technology,10.1080/09593330.2023.2179944,36763460.0,"Differential and mechanism analysis of sulfate influence on the degradation of 1,1,2- trichloroethane by nano- and micron-size zero-valent iron.",https://pubmed.ncbi.nlm.nih.gov/36763460,"The in-situ reduction of zero-valent iron (ZVI) is an effective method for removing chlorinated aliphatic hydrocarbons (CAHs) from groundwater. The heterogeneity of environmental conditions is also crucial in affecting dechlorination efficiency. Until now, the effect of Sulfate (SO","1,1,2-trichloroethane; reductive dechlorination; sulfate; surface complexes; zero-valent iron",,,,,2023-02-11,2023/02/10,2023/2/11,Yi Li; Naijin Wu; Jiuhao Song; Zhenxia Wang; Peizhong Li; Yun Song,,"Beijing Key Laboratory of Industrial Land Contamination and Remediation, Institute of Resources and Environment, Beijing Academy of Science and Technology, Beijing, 100089, China.; School of Resources and Environmental Engineering, Shanghai Polytechnic University, Shanghai, 201209, China.","Yi Li: Beijing Key Laboratory of Industrial Land Contamination and Remediation, Institute of Resources and Environment, Beijing Academy of Science and Technology, Beijing, 100089, China.Naijin Wu: Beijing Key Laboratory of Industrial Land Contamination and Remediation, Institute of Resources and Environment, Beijing Academy of Science and Technology, Beijing, 100089, China.Jiuhao Song: Beijing Key Laboratory of Industrial Land Contamination and Remediation, Institute of Resources and Environment, Beijing Academy of Science and Technology, Beijing, 100089, China.Zhenxia Wang: School of Resources and Environmental Engineering, Shanghai Polytechnic University, Shanghai, 201209, China.Peizhong Li: Beijing Key Laboratory of Industrial Land Contamination and Remediation, Institute of Resources and Environment, Beijing Academy of Science and Technology, Beijing, 100089, China.Yun Song: Beijing Key Laboratory of Industrial Land Contamination and Remediation, Institute of Resources and Environment, Beijing Academy of Science and Technology, Beijing, 100089, China.",,,,,,0
19,2023-02-10,"Brown, J[ames]",,,,,"Clinical toxicology (Philadelphia, Pa.)",10.1080/15563650.2022.2164505,36763346.0,Acute metonitazene poisoning reversed by naloxone.,https://pubmed.ncbi.nlm.nih.gov/36763346,,,,,,,2023-02-11,2023/02/10,2023/2/11,Adam White; Vincent Seah; Jared Brown; Catherine McDonald; Jason Tran; Darren M Roberts,,"Clinical Pharmacology and Toxicology, St Vincent's Hospital, Sydney, NSW, Australia.; Clinical Pharmacology and Toxicology, St Vincent's Hospital, Sydney, NSW, Australia.; NSW Poisons Information Centre, Children's Hospital Westmead, Westmead, NSW, Australia.; Edith Collins Centre, Drug Health Services, Royal Prince Alfred Hospital, Sydney, NSW, Australia.; Forensic Toxicology Laboratory, NSW Health Pathology, Forensic and Analytical Science Service, Lidcombe, NSW, Australia.; NSW Poisons Information Centre, Children's Hospital Westmead, Westmead, NSW, Australia.; Centre for Alcohol and Other Drugs, NSW Ministry of Health, St Leonards, NSW, Australia.","Adam White: Clinical Pharmacology and Toxicology, St Vincent's Hospital, Sydney, NSW, Australia.Vincent Seah: Clinical Pharmacology and Toxicology, St Vincent's Hospital, Sydney, NSW, Australia.Jared Brown: NSW Poisons Information Centre, Children's Hospital Westmead, Westmead, NSW, Australia.; Centre for Alcohol and Other Drugs, NSW Ministry of Health, St Leonards, NSW, Australia.Catherine McDonald: Forensic Toxicology Laboratory, NSW Health Pathology, Forensic and Analytical Science Service, Lidcombe, NSW, Australia.Jason Tran: Forensic Toxicology Laboratory, NSW Health Pathology, Forensic and Analytical Science Service, Lidcombe, NSW, Australia.Darren M Roberts: Clinical Pharmacology and Toxicology, St Vincent's Hospital, Sydney, NSW, Australia.; NSW Poisons Information Centre, Children's Hospital Westmead, Westmead, NSW, Australia.; Edith Collins Centre, Drug Health Services, Royal Prince Alfred Hospital, Sydney, NSW, Australia.",,,,,,0
20,2023-02-10,"Butte, Atul",,"Butte, Atul",,,PloS one,10.1371/journal.pone.0281365,36763574.0,Real-world utilization of SARS-CoV-2 serological testing in RNA positive patients across the United States.,https://pubmed.ncbi.nlm.nih.gov/36763574,"As diagnostic tests for COVID-19 were broadly deployed under Emergency Use Authorization, there emerged a need to understand the real-world utilization and performance of serological testing across the United States.",,,,,,2023-02-11,2023/02/10,2023/2/11,Carla V Rodriguez-Watson; Natalie E Sheils; Anthony M Louder; Elizabeth H Eldridge; Nancy D Lin; Benjamin D Pollock; Jennifer L Gatz; Shaun J Grannis; Rohit Vashisht; Kanwal Ghauri; Gina Valo; Aloka G Chakravarty; Tamar Lasky; Mary Jung; Stephen L Lovell; Jacqueline M Major; Carly Kabelac; Camille Knepper; Sandy Leonard; Peter J Embi; William G Jenkinson; Reyna Klesh; Omai B Garner; Ayan Patel; Lisa Dahm; Aiden Barin; Dan M Cooper; Tom Andriola; Carrie L Byington; Bridgit O Crews; Atul J Butte; Jeff Allen,,"Aetion, New York, New York, United States of America.; Bakar Computational Health Sciences Institute, University of California San Francisco, San Francisco, California, United States of America.; Bakar Computational Health Sciences Institute, University of California San Francisco, San Francisco, California, United States of America.; Center for Data-driven Insights and Innovation, University of California Health, Oakland, California, United States of America.; Center for Data-driven Insights and Innovation, University of California Health, Oakland, California, United States of America.; Center for Data-driven Insights and Innovation, University of California Health, Oakland, California, United States of America.; Office of Data and Information Technology, University of California, Irvine, California, United States of America.; Center for Data-driven Insights and Innovation, University of California Health, Oakland, California, United States of America.; Pediatric Exercise and Genomics Research Center, University of California Irvine School of Medicine, Irvine, California, United States of America.; Center for Devices and Radiological Health, U.S. Food and Drug Administration, Silver Spring, Maryland, United States of America.; Department of Pathology and Laboratory Medicine, UCLA Medical Center, Los Angeles, California, United States of America.; Department of Pathology and Laboratory Medicine, University of California, Irvine, California, United States of America.; Friends of Cancer Research, Washington, District of Columbia, United States of America.; Health Catalyst, Salt Lake City, Utah, United States of America.; HealthVerity, Philadelphia, Pennsylvania, United States of America.; Mayo Clinic, Rochester, Minnesota, United States of America.; Office of the Commissioner, U.S. Food and Drug Administration, Silver Spring, Maryland, United States of America.; OptumLabs, Minnetonka, Minnesota, United States of America.; Reagan-Udall Foundation for the FDA, Washington, District of Columbia, United States of America.; Regenstrief Institute, Indianapolis, Indiana, United States of America.; Regenstrief Institute, Indianapolis, Indiana, United States of America.; Department of Informatics and Health Services Research, Indiana University School of Medicine, Indianapolis, Indiana, United States of America.","Carla V Rodriguez-Watson: Reagan-Udall Foundation for the FDA, Washington, District of Columbia, United States of America.Natalie E Sheils: OptumLabs, Minnetonka, Minnesota, United States of America.Anthony M Louder: Aetion, New York, New York, United States of America.Elizabeth H Eldridge: Health Catalyst, Salt Lake City, Utah, United States of America.Nancy D Lin: Health Catalyst, Salt Lake City, Utah, United States of America.Benjamin D Pollock: Mayo Clinic, Rochester, Minnesota, United States of America.Jennifer L Gatz: Regenstrief Institute, Indianapolis, Indiana, United States of America.Shaun J Grannis: Regenstrief Institute, Indianapolis, Indiana, United States of America.; Department of Informatics and Health Services Research, Indiana University School of Medicine, Indianapolis, Indiana, United States of America.Rohit Vashisht: Bakar Computational Health Sciences Institute, University of California San Francisco, San Francisco, California, United States of America.Kanwal Ghauri: Reagan-Udall Foundation for the FDA, Washington, District of Columbia, United States of America.Gina Valo: Office of the Commissioner, U.S. Food and Drug Administration, Silver Spring, Maryland, United States of America.Aloka G Chakravarty: Office of the Commissioner, U.S. Food and Drug Administration, Silver Spring, Maryland, United States of America.Tamar Lasky: Office of the Commissioner, U.S. Food and Drug Administration, Silver Spring, Maryland, United States of America.Mary Jung: Center for Devices and Radiological Health, U.S. Food and Drug Administration, Silver Spring, Maryland, United States of America.Stephen L Lovell: Center for Devices and Radiological Health, U.S. Food and Drug Administration, Silver Spring, Maryland, United States of America.Jacqueline M Major: Center for Devices and Radiological Health, U.S. Food and Drug Administration, Silver Spring, Maryland, United States of America.Carly Kabelac: Aetion, New York, New York, United States of America.Camille Knepper: Mayo Clinic, Rochester, Minnesota, United States of America.Sandy Leonard: HealthVerity, Philadelphia, Pennsylvania, United States of America.Peter J Embi: Regenstrief Institute, Indianapolis, Indiana, United States of America.; Department of Informatics and Health Services Research, Indiana University School of Medicine, Indianapolis, Indiana, United States of America.William G Jenkinson: Mayo Clinic, Rochester, Minnesota, United States of America.Reyna Klesh: HealthVerity, Philadelphia, Pennsylvania, United States of America.Omai B Garner: Department of Pathology and Laboratory Medicine, UCLA Medical Center, Los Angeles, California, United States of America.Ayan Patel: Center for Data-driven Insights and Innovation, University of California Health, Oakland, California, United States of America.Lisa Dahm: Center for Data-driven Insights and Innovation, University of California Health, Oakland, California, United States of America.Aiden Barin: Center for Data-driven Insights and Innovation, University of California Health, Oakland, California, United States of America.Dan M Cooper: Center for Data-driven Insights and Innovation, University of California Health, Oakland, California, United States of America.; Pediatric Exercise and Genomics Research Center, University of California Irvine School of Medicine, Irvine, California, United States of America.Tom Andriola: Center for Data-driven Insights and Innovation, University of California Health, Oakland, California, United States of America.; Office of Data and Information Technology, University of California, Irvine, California, United States of America.Carrie L Byington: Center for Data-driven Insights and Innovation, University of California Health, Oakland, California, United States of America.Bridgit O Crews: Department of Pathology and Laboratory Medicine, University of California, Irvine, California, United States of America.Atul J Butte: Bakar Computational Health Sciences Institute, University of California San Francisco, San Francisco, California, United States of America.; Center for Data-driven Insights and Innovation, University of California Health, Oakland, California, United States of America.Jeff Allen: Friends of Cancer Research, Washington, District of Columbia, United States of America.",,,,,,0
