record id,save datetime,biohub author,possible biohub author,format biohub author,corresponding author,corresponding author institution,journal,doi,pmid,title,url,abstract,keyword,pdf url,version,version number,type,date,epost date,publish date,authors,authors2,affiliations list,author - affiliations,published or not,confirm published doi,confirm preprint doi,possible match result,match id,record change number
6,2023-01-10,Katherine S. Pollard,,,Michael Alexanian,Gladstone Institute,bioRxiv,10.1101/2023.01.06.522937,,Chromatin Remodeling Drives Immune-Fibroblast Crosstalk in Heart Failure Pathogenesis,http://www.biorxiv.org/content/10.1101/2023.01.06.522937v1,"Chronic inflammation and tissue fibrosis are common stress responses that worsen organ function, yet the molecular mechanisms governing their crosstalk are poorly understood. In diseased organs, stress-induced changes in gene expression fuel maladaptive cell state transitions and pathological interaction between diverse cellular compartments. Although chronic fibroblast activation worsens dysfunction of lung, liver, kidney, and heart, and exacerbates many cancers, the stress-sensing mechanisms initiating the transcriptional activation of fibroblasts are not well understood. Here, we show that conditional deletion of the transcription co-activator Brd4 in Cx3cr1-positive myeloid cells ameliorates heart failure and is associated with a dramatic reduction in fibroblast activation. Analysis of single-cell chromatin accessibility and BRD4 occupancy in vivo in Cx3cr1-positive cells identified a large enhancer proximal to Interleukin-1 beta (Il1b), and a series of CRISPR deletions revealed the precise stress-dependent regulatory element that controlled expression of Il1b in disease. Secreted IL1B functioned non-cell autonomously to activate a p65/RELA-dependent enhancer near the transcription factor MEOX1, resulting in a profibrotic response in human cardiac fibroblasts. In vivo, antibody-mediated IL1B neutralization prevented stress-induced expression of MEOX1, inhibited fibroblast activation, and improved cardiac function in heart failure. The elucidation of BRD4-dependent crosstalk between a specific immune cell subset and fibroblasts through IL1B provides new therapeutic strategies for heart disease and other disorders of chronic inflammation and maladaptive tissue remodeling.",,,biorxiv;2023.01.06.522937,1,new results,2023-01-07,01/07/2023,,Michael Alexanian; Arun Padmanabhan; Tomohiro Nishino; Joshua G. Travers; Lin Ye; Clara Youngna Lee; Nandhini Sadagopan; Yu Huang; Angelo Pelonero; Kirsten Auclair; Ada Zhu; Barbara Gonzalez Teran; Will Flanigan; Charis Kee-Seon Kim; Koya Lumbao-Conradson; Mauro Costa; Rajan Jain; Israel Charo; Saptarsi M. Haldar; Katherine S. Pollard; Ronald J. Vagnozzi; Timothy A. McKinsey; Pawel F. Przytycki; Deepak Srivastava,"Alexanian, M.; Padmanabhan, A.; Nishino, T.; Travers, J. G.; Ye, L.; Lee, C. Y.; Sadagopan, N.; Huang, Y.; Pelonero, A.; Auclair, K.; Zhu, A.; Gonzalez Teran, B.; Flanigan, W.; Kim, C. K.-S.; Lumbao-Conradson, K.; Costa, M.; Jain, R.; Charo, I.; Haldar, S. M.; Pollard, K. S.; Vagnozzi, R. J.; McKinsey, T. A.; Przytycki, P. F.; Srivastava, D.","Gladstone Institutes; Roddenberry Center for Stem Cell Biology and Medicine at Gladstone Institutes; Department of Pediatrics, University of California, San Francisco; Gladstone Institutes; Roddenberry Center for Stem Cell Biology and Medicine at Gladstone Institutes; Department of Medicine, Division of Cardiology, University of California; Chan Zuckerberg Biohub; Gladstone Institutes; Roddenberry Center for Stem Cell Biology and Medicine at Gladstone Institutes; Department of Medicine, Division of Cardiology and Consortium for Fibrosis Research & Translation, University of Colorado Anschutz Medical Campus; Gladstone Institutes; Roddenberry Center for Stem Cell Biology and Medicine at Gladstone Institutes; Gladstone Institutes; Roddenberry Center for Stem Cell Biology and Medicine at Gladstone Institutes; Department of Medicine, Division of Cardiology, University of California; Gladstone Institutes; Roddenberry Center for Stem Cell Biology and Medicine at Gladstone Institutes; Department of Medicine, Division of Cardiology, University of California; Gladstone Institutes; Roddenberry Center for Stem Cell Biology and Medicine at Gladstone Institutes; Gladstone Institutes; Roddenberry Center for Stem Cell Biology and Medicine at Gladstone Institutes; Gladstone Institutes; Roddenberry Center for Stem Cell Biology and Medicine at Gladstone Institutes; Gladstone Institutes; Roddenberry Center for Stem Cell Biology and Medicine at Gladstone Institutes; Gladstone Institutes; Roddenberry Center for Stem Cell Biology and Medicine at Gladstone Institutes; Gladstone Institutes; UC Berkeley-UCSF Joint Program in Bioengineering; Gladstone Institutes; Roddenberry Center for Stem Cell Biology and Medicine at Gladstone Institutes; Department of Medicine, Division of Cardiology and Consortium for Fibrosis Research & Translation, University of Colorado Anschutz Medical Campus; Gladstone Institutes; Roddenberry Center for Stem Cell Biology and Medicine at Gladstone Institutes; Cardiovascular Institute, Epigenetics Institute, and Department of Medicine, Perelman School of Medicine, University of Pennsylvania; ChemoCentryx; Gladstone Institutes; Department of Medicine, Division of Cardiology, University of California; Amgen Research, Cardiometabolic Disorders; Gladstone Institutes; Chan Zuckerberg Biohub; Institute for Computational Health Sciences, University of California; Department of Epidemiology & Biostatistics, University of California; Institute for Human Genetics, University of California; Department of Medicine, Division of Cardiology and Consortium for Fibrosis Research & Translation, University of Colorado Anschutz Medical Campus; Department of Medicine, Division of Cardiology and Consortium for Fibrosis Research & Translation, University of Colorado Anschutz Medical Campus; Gladstone Institutes; Faculty of Computing & Data Sciences, Boston University; Gladstone Institutes; Roddenberry Center for Stem Cell Biology and Medicine at Gladstone Institutes; Department of Pediatrics, University of California, San Francisco; Department of Biochemistry and Biophysics, University of California","Michael Alexanian, Gladstone Institutes, Roddenberry Center for Stem Cell Biology and Medicine at Gladstone Institutes, Department of Pediatrics, University of California, San Francisco], [Arun Padmanabhan, Gladstone Institutes, Roddenberry Center for Stem Cell Biology and Medicine at Gladstone Institutes, Department of Medicine, Division of Cardiology, University of California, Chan Zuckerberg Biohub], [Tomohiro Nishino, Gladstone Institutes, Roddenberry Center for Stem Cell Biology and Medicine at Gladstone Institutes], [Joshua G. Travers, Department of Medicine, Division of Cardiology and Consortium for Fibrosis Research & Translation, University of Colorado Anschutz Medical Campus], [Lin Ye, Gladstone Institutes, Roddenberry Center for Stem Cell Biology and Medicine at Gladstone Institutes], [Clara Youngna Lee, Gladstone Institutes, Roddenberry Center for Stem Cell Biology and Medicine at Gladstone Institutes, Department of Medicine, Division of Cardiology, University of California], [Nandhini Sadagopan, Gladstone Institutes, Roddenberry Center for Stem Cell Biology and Medicine at Gladstone Institutes, Department of Medicine, Division of Cardiology, University of California], [Yu Huang, Gladstone Institutes, Roddenberry Center for Stem Cell Biology and Medicine at Gladstone Institutes], [Angelo Pelonero, Gladstone Institutes, Roddenberry Center for Stem Cell Biology and Medicine at Gladstone Institutes], [Kirsten Auclair, Gladstone Institutes, Roddenberry Center for Stem Cell Biology and Medicine at Gladstone Institutes], [Ada Zhu, Gladstone Institutes, Roddenberry Center for Stem Cell Biology and Medicine at Gladstone Institutes], [Barbara Gonzalez Teran, Gladstone Institutes, Roddenberry Center for Stem Cell Biology and Medicine at Gladstone Institutes], [Will Flanigan, Gladstone Institutes, UC Berkeley-UCSF Joint Program in Bioengineering], [Charis Kee-Seon Kim, Gladstone Institutes, Roddenberry Center for Stem Cell Biology and Medicine at Gladstone Institutes], [Koya Lumbao-Conradson, Department of Medicine, Division of Cardiology and Consortium for Fibrosis Research & Translation, University of Colorado Anschutz Medical Campus], [Mauro Costa, Gladstone Institutes, Roddenberry Center for Stem Cell Biology and Medicine at Gladstone Institutes], [Rajan Jain, Cardiovascular Institute, Epigenetics Institute, and Department of Medicine, Perelman School of Medicine, University of Pennsylvania], [Israel Charo, ChemoCentryx], [Saptarsi M. Haldar, Gladstone Institutes, Department of Medicine, Division of Cardiology, University of California, Amgen Research, Cardiometabolic Disorders], [Katherine S. Pollard, Gladstone Institutes, Chan Zuckerberg Biohub, Institute for Computational Health Sciences, University of California, Department of Epidemiology & Biostatistics, University of California, Institute for Human Genetics, University of California], [Ronald J. Vagnozzi, Department of Medicine, Division of Cardiology and Consortium for Fibrosis Research & Translation, University of Colorado Anschutz Medical Campus], [Timothy A. McKinsey, Department of Medicine, Division of Cardiology and Consortium for Fibrosis Research & Translation, University of Colorado Anschutz Medical Campus], [Pawel F. Przytycki, Gladstone Institutes, Faculty of Computing & Data Sciences, Boston University], [Deepak Srivastava, Gladstone Institutes, Roddenberry Center for Stem Cell Biology and Medicine at Gladstone Institutes, Department of Pediatrics, University of California, San Francisco, Department of Biochemistry and Biophysics, University of California",NA,,,,,0
7,2023-01-10,Stephen R Quake,,"Quake, Steve; Quake, Steve; Quake, Steve; Quake, Steve; Quake, Steve; Quake, Steve",,,Science advances,10.1126/sciadv.add4333,36608122.0,Single-cell profiling identifies ACE,https://pubmed.ncbi.nlm.nih.gov/36608122,"Macrophages mediate key antimicrobial responses against intracellular bacterial pathogens, such as ",,,,,,2023-01-07,2023/01/06,2023/1/7,Trung H M Pham; Yuan Xue; Susan M Brewer; Kenneth E Bernstein; Stephen R Quake; Denise M Monack,,"Department of Bioengineering, Stanford University, Stanford, CA, USA.; Department of Bioengineering, Stanford University, Stanford, CA, USA.; Chan Zuckerberg Biohub, San Francisco, CA, USA.; Department of Microbiology and Immunology, Stanford University, School of Medicine, Stanford, CA, USA.; Department of Microbiology and Immunology, Stanford University, School of Medicine, Stanford, CA, USA.; Department of Pediatrics, Stanford University School of Medicine, Stanford, CA, USA.; Department of Pathology and Laboratory Medicine, Cedars-Sinai Medical Center, Los Angeles, CA, USA.","Trung H M Pham: Department of Microbiology and Immunology, Stanford University, School of Medicine, Stanford, CA, USA.; Department of Pediatrics, Stanford University School of Medicine, Stanford, CA, USA.Yuan Xue: Department of Bioengineering, Stanford University, Stanford, CA, USA.Susan M Brewer: Department of Microbiology and Immunology, Stanford University, School of Medicine, Stanford, CA, USA.Kenneth E Bernstein: Department of Pathology and Laboratory Medicine, Cedars-Sinai Medical Center, Los Angeles, CA, USA.Stephen R Quake: Department of Bioengineering, Stanford University, Stanford, CA, USA.; Chan Zuckerberg Biohub, San Francisco, CA, USA.Denise M Monack: Department of Microbiology and Immunology, Stanford University, School of Medicine, Stanford, CA, USA.",,,,,,0
8,2023-01-10,Adam Frost,,"Frost, Adam",Michael Grabe; Adam Frost,"Department of Pharmaceutical Chemistry, University of California San Francisco, San Francisco, CA, USA. michael.grabe@ucsf.edu.; Cardiovascular Research Institute, University of California San Francisco (UCSF), San Francisco, CA, USA. michael.grabe@ucsf.edu.Department of Biochemistry and Biophysics, University of California San Francisco, San Francisco, CA, USA. afrost@altoslabs.com.; Chan Zuckerberg Biohub, San Francisco, CA, USA. afrost@altoslabs.com.; Department of Biochemistry, University of Utah, Salt Lake City, UT, USA. afrost@altoslabs.com.; Altos Labs, Redwood City, CA, USA. afrost@altoslabs.com.",Nature structural & molecular biology,10.1038/s41594-022-00898-1,36624348.0,Brominated lipid probes expose structural asymmetries in constricted membranes.,https://pubmed.ncbi.nlm.nih.gov/36624348,"Lipids in biological membranes are thought to be functionally organized, but few experimental tools can probe nanoscale membrane structure. Using brominated lipids as contrast probes for cryo-EM and a model ESCRT-III membrane-remodeling system composed of human CHMP1B and IST1, we observed leaflet-level and protein-localized structural lipid patterns within highly constricted and thinned membrane nanotubes. These nanotubes differed markedly from protein-free, flat bilayers in leaflet thickness, lipid diffusion rates and lipid compositional and conformational asymmetries. Simulations and cryo-EM imaging of brominated stearoyl-docosahexanenoyl-phosphocholine showed how a pair of phenylalanine residues scored the outer leaflet with a helical hydrophobic defect where polyunsaturated docosahexaenoyl tails accumulated at the bilayer surface. Combining cryo-EM of halogenated lipids with molecular dynamics thus enables new characterizations of the composition and structure of membranes on molecular length scales.",,,,,,2023-01-10,2023/01/09,2023/1/10,Frank R Moss; James Lincoff; Maxwell Tucker; Arshad Mohammed; Michael Grabe; Adam Frost,,"Department of Biochemistry and Biophysics, University of California San Francisco, San Francisco, CA, USA. afrost@altoslabs.com.; Chan Zuckerberg Biohub, San Francisco, CA, USA. afrost@altoslabs.com.; Department of Biochemistry, University of Utah, Salt Lake City, UT, USA. afrost@altoslabs.com.; Altos Labs, Redwood City, CA, USA. afrost@altoslabs.com.; Department of Biochemistry and Biophysics, University of California San Francisco, San Francisco, CA, USA.; SLAC National Accelerator Laboratory, Menlo Park, CA, USA.; Altos Labs, Redwood City, CA, USA.; Department of Biochemistry and Biophysics, University of California San Francisco, San Francisco, CA, USA.; University of California Berkeley, Berkeley, CA, USA.; Altos Labs, Redwood City, CA, USA.; Department of Pharmaceutical Chemistry, University of California San Francisco, San Francisco, CA, USA. michael.grabe@ucsf.edu.; Cardiovascular Research Institute, University of California San Francisco (UCSF), San Francisco, CA, USA. michael.grabe@ucsf.edu.; Department of Pharmaceutical Chemistry, University of California San Francisco, San Francisco, CA, USA.; Cardiovascular Research Institute, University of California San Francisco (UCSF), San Francisco, CA, USA.","Frank R Moss: Department of Biochemistry and Biophysics, University of California San Francisco, San Francisco, CA, USA.; SLAC National Accelerator Laboratory, Menlo Park, CA, USA.; Altos Labs, Redwood City, CA, USA.James Lincoff: Department of Pharmaceutical Chemistry, University of California San Francisco, San Francisco, CA, USA.; Cardiovascular Research Institute, University of California San Francisco (UCSF), San Francisco, CA, USA.Maxwell Tucker: Department of Pharmaceutical Chemistry, University of California San Francisco, San Francisco, CA, USA.; Cardiovascular Research Institute, University of California San Francisco (UCSF), San Francisco, CA, USA.Arshad Mohammed: Department of Biochemistry and Biophysics, University of California San Francisco, San Francisco, CA, USA.; University of California Berkeley, Berkeley, CA, USA.; Altos Labs, Redwood City, CA, USA.Michael Grabe: Department of Pharmaceutical Chemistry, University of California San Francisco, San Francisco, CA, USA. michael.grabe@ucsf.edu.; Cardiovascular Research Institute, University of California San Francisco (UCSF), San Francisco, CA, USA. michael.grabe@ucsf.edu.Adam Frost: Department of Biochemistry and Biophysics, University of California San Francisco, San Francisco, CA, USA. afrost@altoslabs.com.; Chan Zuckerberg Biohub, San Francisco, CA, USA. afrost@altoslabs.com.; Department of Biochemistry, University of Utah, Salt Lake City, UT, USA. afrost@altoslabs.com.; Altos Labs, Redwood City, CA, USA. afrost@altoslabs.com.",,,,,,0
9,2023-01-10,"Xu, Ke",,"Xu, Ke",Katie Lin,"Department of Emergency Medicine, Room C231 Foothills Medical Centre, University of Calgary, 1403 29 St NW, Calgary, AB, T2N 2T9, Canada. katie.lin@ahs.ca.; Department of Clinical Neurosciences, University of Calgary, Calgary, AB, Canada. katie.lin@ahs.ca.",CJEM,10.1007/s43678-022-00440-8,36624252.0,Prognostic association between d-dimer thresholds and 30-day pulmonary embolism diagnosis among emergency department patients with suspected SARS-CoV-2 infection: a Canadian COVID-19 Emergency Department Rapid Response Network study.,https://pubmed.ncbi.nlm.nih.gov/36624252,The primary objective was to quantify the prognostic association between various D-dimer thresholds and 30-day PE diagnosis among emergency department (ED) patients with suspected SARS-CoV-2 infection.,COVID-19; Computed tomography pulmonary angiogram; Coronavirus disease 2019; D-dimer; Pulmonary embolism; SARS-COV-2; Venous thromboembolism,,,,,2023-01-10,2023/01/10,2023/1/10,"Katie Lin; Ke Xu; Raoul Daoust; John Taylor; Rhonda J Rosychuk; Jeffrey P Hau; Phil Davis; Greg Clark; Andrew D McRae; Corinne M Hohl; Canadian COVID-19 Emergency Department Rapid Response Network (CCEDRRN) investigators for the Network of Canadian Emergency Researchers, the Canadian Critical Care Trials Group",,"; Department of Emergency Medicine, McGill University, Montreal, QC, Canada.; Department of Emergency Medicine, Room C231 Foothills Medical Centre, University of Calgary, 1403 29 St NW, Calgary, AB, T2N 2T9, Canada. katie.lin@ahs.ca.; Department of Clinical Neurosciences, University of Calgary, Calgary, AB, Canada. katie.lin@ahs.ca.; Department of Emergency Medicine, University of British Columbia, Vancouver, BC, Canada.; Department of Emergency Medicine, University of British Columbia, Vancouver, BC, Canada.; Centre for Clinical Epidemiology and Evaluation, Vancouver Coastal Health Research Institute, Vancouver, BC, Canada.; Department of Emergency Medicine, University of Calgary, Calgary, AB, Canada.; Department of Community Health Sciences, University of Calgary, Calgary, AB, Canada.; Department of Emergency Medicine, University of Saskatchewan, Saskatoon, SK, Canada.; Department of Family Medicine and Emergency Medicine, University of Montreal, Quebec, Canada.; Department of Pediatrics, University of Alberta, Edmonton, AB, Canada.","Katie Lin: Department of Emergency Medicine, Room C231 Foothills Medical Centre, University of Calgary, 1403 29 St NW, Calgary, AB, T2N 2T9, Canada. katie.lin@ahs.ca.; Department of Clinical Neurosciences, University of Calgary, Calgary, AB, Canada. katie.lin@ahs.ca.Ke Xu: Department of Emergency Medicine, University of British Columbia, Vancouver, BC, Canada.; Centre for Clinical Epidemiology and Evaluation, Vancouver Coastal Health Research Institute, Vancouver, BC, Canada.Raoul Daoust: Department of Family Medicine and Emergency Medicine, University of Montreal, Quebec, Canada.John Taylor: Department of Emergency Medicine, University of British Columbia, Vancouver, BC, Canada.Rhonda J Rosychuk: Department of Pediatrics, University of Alberta, Edmonton, AB, Canada.Jeffrey P Hau: Department of Emergency Medicine, University of British Columbia, Vancouver, BC, Canada.; Centre for Clinical Epidemiology and Evaluation, Vancouver Coastal Health Research Institute, Vancouver, BC, Canada.Phil Davis: Department of Emergency Medicine, University of Saskatchewan, Saskatoon, SK, Canada.Greg Clark: Department of Emergency Medicine, McGill University, Montreal, QC, Canada.Andrew D McRae: Department of Emergency Medicine, University of Calgary, Calgary, AB, Canada.; Department of Community Health Sciences, University of Calgary, Calgary, AB, Canada.Corinne M Hohl: Department of Emergency Medicine, University of British Columbia, Vancouver, BC, Canada.; Centre for Clinical Epidemiology and Evaluation, Vancouver Coastal Health Research Institute, Vancouver, BC, Canada.Canadian COVID-19 Emergency Department Rapid Response Network (CCEDRRN) investigators for the Network of Canadian Emergency Researchers, the Canadian Critical Care Trials Group: ",,,,,,0
10,2023-01-10,"Poon, A[da]",,,,,Nature medicine,10.1038/d41591-023-00002-0,36627341.0,An equitable route forward from China's 'zero COVID' policy.,https://pubmed.ncbi.nlm.nih.gov/36627341,,Infectious diseases; Public health; Vaccines; Virology,,,,,2023-01-11,2023/01/10,2023/1/11,Zhicheng Wang; Kit Chan; Adrienne N Poon; Yan Guo,,,Zhicheng Wang: Kit Chan: Adrienne N Poon: Yan Guo: ,,,,,,0
