record id,save datetime,biohub author,possible biohub author,format biohub author,corresponding author,corresponding author institution,journal,doi,pmid,title,url,abstract,keyword,pdf url,version,version number,type,date,epost date,publish date,authors,authors2,affiliations list,author - affiliations,published or not,confirm published doi,confirm preprint doi,possible match result,match id,record change number
5,2023-01-01,"Song, Yun",,"Song, Yun",,,Journal of surgical oncology,10.1002/jso.27100,36115028.0,Regional control after precision lymph node dissection for clinically evident melanoma metastasis.,https://pubmed.ncbi.nlm.nih.gov/36115028,"Completion lymph node dissection (CLND) for microscopic lymph node metastases has been replaced by observation; however, CLND is standard for clinically detectable nodal metastases (cLN). CLND has high morbidity, which may be reduced by excision of only the cLN (precision lymph node dissection [PLND]). We hypothesized that same-basin recurrence risk would be low after PLND.",melanoma; nodal metastases; precision nodal dissection,,,,,2022-09-18,2022/09/17,2022/9/18,Kevin T Lynch; Yinin Hu; Norma E Farrow; Yun Song; Max O Meneveau; Minyoung Kwak; Michael C Lowe; Edmund K Bartlett; Georgia M Beasley; Giorgos C Karakousis; Craig L Slingluff,,"Department of Surgery, Duke University, Durham, North Carolina, USA.; Department of Surgery, Emory University, Atlanta, Georgia, USA.; Department of Surgery, Memorial Sloan Kettering Cancer Center, New York City, New York, USA.; Department of Surgery, SUNY Downstate, Brooklyn, New York, USA.; Department of Surgery, University of Maryland, Baltimore, Maryland, USA.; Department of Surgery, University of Pennsylvania, Philadelphia, Pennsylvania, USA.; Department of Surgery, University of Virginia, Charlottesville, Virginia, USA.","Kevin T Lynch: Department of Surgery, University of Virginia, Charlottesville, Virginia, USA.Yinin Hu: Department of Surgery, University of Maryland, Baltimore, Maryland, USA.Norma E Farrow: Department of Surgery, Duke University, Durham, North Carolina, USA.Yun Song: Department of Surgery, University of Pennsylvania, Philadelphia, Pennsylvania, USA.Max O Meneveau: Department of Surgery, University of Virginia, Charlottesville, Virginia, USA.Minyoung Kwak: Department of Surgery, SUNY Downstate, Brooklyn, New York, USA.Michael C Lowe: Department of Surgery, Emory University, Atlanta, Georgia, USA.Edmund K Bartlett: Department of Surgery, Memorial Sloan Kettering Cancer Center, New York City, New York, USA.Georgia M Beasley: Department of Surgery, Duke University, Durham, North Carolina, USA.Giorgos C Karakousis: Department of Surgery, University of Pennsylvania, Philadelphia, Pennsylvania, USA.Craig L Slingluff: Department of Surgery, University of Virginia, Charlottesville, Virginia, USA.",,,,,,0
6,2023-01-01,"Kim, Peter",,"Kim, Peter",Cezar Iliescu,"Division of Cardiovascular Medicine, University of Texas, MD Anderson Cancer Center, Houston, TX. Electronic address: ciliescu@mdanderson.org.",Current problems in cardiology,10.1016/j.cpcardiol.2022.101435,36183977.0,The Year in Cardio-oncology 2022.,https://pubmed.ncbi.nlm.nih.gov/36183977,"Cardiovascular disease and cancer are the leading causes of death worldwide. With advent of novel and improved cancer therapies, a growing population of cancer patients with cardiac complications is seen. Taking this into consideration, the clinical studies have also shifted their focus from the study of a single disease to the interdisciplinary study of oncology and cardiology. This current review article provides a comprehensive review of all major articles and guidelines from the year 2021-2022 in the field of cardio-oncology.",,,,,,2022-10-03,2022/09/30,2022/10/3,Talha Ahmed; Konstantinos Marmagkiolis; Michelle Ploch; Jorge A Irizarry-Caro; Atia Amatullah; Shyam Desai; Moez K Aziz; Akshitha Yarrabothula; José Fossas-Espinosa; Efstratios Koutroumpakis; Saamir Hassan; Kaveh Karimzad; Peter Kim; Mehmet Cilingiroglu; Cezar Iliescu,,"Division of Cardiovascular Medicine, University of Texas Health Science Center at Houston, Houston, TX.; Division of Cardiovascular Medicine, University of Texas Health Science Center at Houston, Houston, TX; Division of Cardiovascular Medicine, University of Texas, MD Anderson Cancer Center, Houston, TX.; Division of Cardiovascular Medicine, University of Texas, MD Anderson Cancer Center, Houston, TX.; Division of Cardiovascular Medicine, University of Texas, MD Anderson Cancer Center, Houston, TX. Electronic address: ciliescu@mdanderson.org.","Talha Ahmed: Division of Cardiovascular Medicine, University of Texas Health Science Center at Houston, Houston, TX; Division of Cardiovascular Medicine, University of Texas, MD Anderson Cancer Center, Houston, TX.Konstantinos Marmagkiolis: Division of Cardiovascular Medicine, University of Texas, MD Anderson Cancer Center, Houston, TX.Michelle Ploch: Division of Cardiovascular Medicine, University of Texas Health Science Center at Houston, Houston, TX.Jorge A Irizarry-Caro: Division of Cardiovascular Medicine, University of Texas Health Science Center at Houston, Houston, TX.Atia Amatullah: Division of Cardiovascular Medicine, University of Texas Health Science Center at Houston, Houston, TX.Shyam Desai: Division of Cardiovascular Medicine, University of Texas Health Science Center at Houston, Houston, TX.Moez K Aziz: Division of Cardiovascular Medicine, University of Texas Health Science Center at Houston, Houston, TX; Division of Cardiovascular Medicine, University of Texas, MD Anderson Cancer Center, Houston, TX.Akshitha Yarrabothula: Division of Cardiovascular Medicine, University of Texas Health Science Center at Houston, Houston, TX.José Fossas-Espinosa: Division of Cardiovascular Medicine, University of Texas Health Science Center at Houston, Houston, TX.Efstratios Koutroumpakis: Division of Cardiovascular Medicine, University of Texas, MD Anderson Cancer Center, Houston, TX.Saamir Hassan: Division of Cardiovascular Medicine, University of Texas, MD Anderson Cancer Center, Houston, TX.Kaveh Karimzad: Division of Cardiovascular Medicine, University of Texas, MD Anderson Cancer Center, Houston, TX.Peter Kim: Division of Cardiovascular Medicine, University of Texas, MD Anderson Cancer Center, Houston, TX.Mehmet Cilingiroglu: Division of Cardiovascular Medicine, University of Texas, MD Anderson Cancer Center, Houston, TX.Cezar Iliescu: Division of Cardiovascular Medicine, University of Texas, MD Anderson Cancer Center, Houston, TX. Electronic address: ciliescu@mdanderson.org.",,,,,,0
7,2023-01-01,"Chiu, Wah",,"Chiu, Wah",Wah Chiu,"Department of Bioengineering, James H. Clark Center, Stanford University, Stanford, CA, USA. wahc@stanford.edu.; CryoEM and Bioimaging Division, Stanford Synchrotron Radiation Lightsource, SLAC National Accelerator Laboratory, Stanford University, Menlo Park, CA, USA. wahc@stanford.edu.","Methods in molecular biology (Clifton, N.J.)",10.1007/978-1-0716-2687-0_12,36227569.0,Near-Atomic Resolution Cryo-EM Image Reconstruction of RNA.,https://pubmed.ncbi.nlm.nih.gov/36227569,"The rapid development of cryogenic electron microscopy (cryo-EM) enables the structure determination of macromolecules without the need for crystallization. Protein, protein-lipid, and protein-nucleic acid complexes can now be routinely resolved by cryo-EM single-particle analysis (SPA) to near-atomic or atomic resolution. Here we describe the structure determination of pure RNAs by SPA, from cryo-specimen preparation to data collection and 3D reconstruction. This protocol is useful to yield many cryo-EM structures of RNA, here exemplified by the Tetrahymena L-21 ScaI ribozyme at 3.1-Å resolution.",Cryo-EM; Protocol; RNA; Ribozyme; Single-particle analysis,,,,,2022-10-14,,2022/10/14,Shanshan Li; Kaiming Zhang; Wah Chiu,,"Department of Bioengineering, James H. Clark Center, Stanford University, Stanford, CA, USA. wahc@stanford.edu.; CryoEM and Bioimaging Division, Stanford Synchrotron Radiation Lightsource, SLAC National Accelerator Laboratory, Stanford University, Menlo Park, CA, USA. wahc@stanford.edu.; MOE Key Laboratory for Cellular Dynamics and Division of Life Sciences and Medicine, University of Science and Technology of China, Hefei, China.; Department of Bioengineering, James H. Clark Center, Stanford University, Stanford, CA, USA.","Shanshan Li: MOE Key Laboratory for Cellular Dynamics and Division of Life Sciences and Medicine, University of Science and Technology of China, Hefei, China.; Department of Bioengineering, James H. Clark Center, Stanford University, Stanford, CA, USA.Kaiming Zhang: MOE Key Laboratory for Cellular Dynamics and Division of Life Sciences and Medicine, University of Science and Technology of China, Hefei, China.; Department of Bioengineering, James H. Clark Center, Stanford University, Stanford, CA, USA.Wah Chiu: Department of Bioengineering, James H. Clark Center, Stanford University, Stanford, CA, USA. wahc@stanford.edu.; CryoEM and Bioimaging Division, Stanford Synchrotron Radiation Lightsource, SLAC National Accelerator Laboratory, Stanford University, Menlo Park, CA, USA. wahc@stanford.edu.",,,,,,0
8,2023-01-01,Lei S Qi,,,Lei S Qi,"Department of Bioengineering, Stanford University, Stanford, CA, USA. stanley.qi@stanford.edu.; Sarafan ChEM-H, Stanford University, Stanford, CA, USA. stanley.qi@stanford.edu.; Chan Zuckerberg Biohub, San Francisco, CA, USA. stanley.qi@stanford.edu.",Nature reviews. Nephrology,10.1038/s41581-022-00636-2,36280707.0,Advances in CRISPR therapeutics.,https://pubmed.ncbi.nlm.nih.gov/36280707,"The clustered regularly interspaced short palindromic repeats (CRISPR) renaissance was catalysed by the discovery that RNA-guided prokaryotic CRISPR-associated (Cas) proteins can create targeted double-strand breaks in mammalian genomes. This finding led to the development of CRISPR systems that harness natural DNA repair mechanisms to repair deficient genes more easily and precisely than ever before. CRISPR has been used to knock out harmful mutant genes and to fix errors in coding sequences to rescue disease phenotypes in preclinical studies and in several clinical trials. However, most genetic disorders result from combinations of mutations, deletions and duplications in the coding and non-coding regions of the genome and therefore require sophisticated genome engineering strategies beyond simple gene knockout. To overcome this limitation, the toolbox of natural and engineered CRISPR-Cas systems has been dramatically expanded to include diverse tools that function in human cells for precise genome editing and epigenome engineering. The application of CRISPR technology to edit the non-coding genome, modulate gene regulation, make precise genetic changes and target infectious diseases has the potential to lead to curative therapies for many previously untreatable diseases.",,,,,,2022-10-26,2022/10/24,2022/10/26,Michael Chavez; Xinyi Chen; Paul B Finn; Lei S Qi,,"Department of Bioengineering, Stanford University, Stanford, CA, USA.; Department of Bioengineering, Stanford University, Stanford, CA, USA. stanley.qi@stanford.edu.; Sarafan ChEM-H, Stanford University, Stanford, CA, USA. stanley.qi@stanford.edu.; Chan Zuckerberg Biohub, San Francisco, CA, USA. stanley.qi@stanford.edu.","Michael Chavez: Department of Bioengineering, Stanford University, Stanford, CA, USA.Xinyi Chen: Department of Bioengineering, Stanford University, Stanford, CA, USA.Paul B Finn: Department of Bioengineering, Stanford University, Stanford, CA, USA.Lei S Qi: Department of Bioengineering, Stanford University, Stanford, CA, USA. stanley.qi@stanford.edu.; Sarafan ChEM-H, Stanford University, Stanford, CA, USA. stanley.qi@stanford.edu.; Chan Zuckerberg Biohub, San Francisco, CA, USA. stanley.qi@stanford.edu.",,,,,,0
9,2023-01-01,Chunyu Zhao; Katherine S Pollard,,"Pollard, Katie; Pollard, Katie; Pollard, Katie; Pollard, Katie; Pollard, Katie; Pollard, Katie; Pollard, Katie",,,"Bioinformatics (Oxford, England)",10.1093/bioinformatics/btac713,36321886.0,MIDAS2: Metagenomic Intra-species Diversity Analysis System.,https://pubmed.ncbi.nlm.nih.gov/36321886,"The Metagenomic Intra-Species Diversity Analysis System (MIDAS) is a scalable metagenomic pipeline that identifies single nucleotide variants (SNVs) and gene copy number variants in microbial populations. Here, we present MIDAS2, which addresses the computational challenges presented by increasingly large reference genome databases, while adding functionality for building custom databases and leveraging paired-end reads to improve SNV accuracy. This fast and scalable reengineering of the MIDAS pipeline enables thousands of metagenomic samples to be efficiently genotyped.",,,,,,2022-11-03,,2022/11/3,Chunyu Zhao; Boris Dimitrov; Miriam Goldman; Stephen Nayfach; Katherine S Pollard,,"Chan Zuckerberg Initiative, Redwood City, CA 94063, USA.; Data Science, Chan Zuckerberg Biohub, San Francisco, CA 94158, USA.; Gladstone Institute of Data Science and Biotechnology, Gladstone Institutes, San Francisco, CA 94158, USA.; Data Science, Chan Zuckerberg Biohub, San Francisco, CA 94158, USA.; Gladstone Institute of Data Science and Biotechnology, Gladstone Institutes, San Francisco, CA 94158, USA.; Department of Epidemiology and Biostatistics, University of California, San Francisco, CA 94158, USA.; Department of Energy, Joint Genome Institute, Berkeley, CA 94720, USA.; Environmental Genomics and Systems Biology Division, Lawrence Berkeley National Laboratory, Berkeley, CA 94720, USA.; Gladstone Institute of Data Science and Biotechnology, Gladstone Institutes, San Francisco, CA 94158, USA.; Biomedical Informatics Graduate Program, University of California San Francisco, San Francisco, CA 94158, USA.","Chunyu Zhao: Data Science, Chan Zuckerberg Biohub, San Francisco, CA 94158, USA.; Gladstone Institute of Data Science and Biotechnology, Gladstone Institutes, San Francisco, CA 94158, USA.Boris Dimitrov: Chan Zuckerberg Initiative, Redwood City, CA 94063, USA.Miriam Goldman: Gladstone Institute of Data Science and Biotechnology, Gladstone Institutes, San Francisco, CA 94158, USA.; Biomedical Informatics Graduate Program, University of California San Francisco, San Francisco, CA 94158, USA.Stephen Nayfach: Department of Energy, Joint Genome Institute, Berkeley, CA 94720, USA.; Environmental Genomics and Systems Biology Division, Lawrence Berkeley National Laboratory, Berkeley, CA 94720, USA.Katherine S Pollard: Data Science, Chan Zuckerberg Biohub, San Francisco, CA 94158, USA.; Gladstone Institute of Data Science and Biotechnology, Gladstone Institutes, San Francisco, CA 94158, USA.; Department of Epidemiology and Biostatistics, University of California, San Francisco, CA 94158, USA.",,,10.1101/2022.06.16.496510,,,0
10,2023-01-01,"Johnson, Alexander",,,Alexander J Johnson; Rachel M Frank,"Department of Orthopedic Surgery, St. Luke's University Health Network, Bethlehem, PA, USA. Electronic address: AJJ8952@gmail.com.Department of Orthopaedic Surgery, University of Colorado School of Medicine, Denver, CO, USA. Electronic address: https://twitter.com/@RachelFrankMD.",Clinics in sports medicine,10.1016/j.csm.2022.08.002,36375870.0,Use of Injections and Biologics for the Nonoperative Treatment of Rotator Cuff Pathology.,https://pubmed.ncbi.nlm.nih.gov/36375870,"Symptomatic rotator cuff pathology is a common musculoskeletal issue with evolving surgical indications. Most of the patients undergo some form of nonoperative treatment before considering surgical intervention. Understanding and optimizing nonoperative treatment modalities is an essential key to successful treatment. This article contains a review of the current literature regarding the risks, benefits, and alternatives of the most common injections used in the treatment of rotator cuff pathology. Injection options covered include corticosteroids, biologics including platelet-rich plasma and stem cells, hyaluronic acid, and nonsteroidal anti-inflammatory drugs.",Biologics; Corticosteroids; Injections; Nonoperative treatment; Platelet-rich plasma; Rotator cuff; Stem cells,,,,,2022-11-15,,2022/11/15,Alexander J Johnson; Hannah Bradsell; Rachel M Frank,,"Department of Orthopaedic Surgery, University of Colorado School of Medicine, Denver, CO, USA.; Department of Orthopaedic Surgery, University of Colorado School of Medicine, Denver, CO, USA. Electronic address: https://twitter.com/@RachelFrankMD.; Department of Orthopedic Surgery, St. Luke's University Health Network, Bethlehem, PA, USA. Electronic address: AJJ8952@gmail.com.","Alexander J Johnson: Department of Orthopedic Surgery, St. Luke's University Health Network, Bethlehem, PA, USA. Electronic address: AJJ8952@gmail.com.Hannah Bradsell: Department of Orthopaedic Surgery, University of Colorado School of Medicine, Denver, CO, USA.Rachel M Frank: Department of Orthopaedic Surgery, University of Colorado School of Medicine, Denver, CO, USA. Electronic address: https://twitter.com/@RachelFrankMD.",,,,,,0
11,2023-01-01,"Altman, Russ",,"Altman, Russ",,,"Bioinformatics (Oxford, England)",10.1093/bioinformatics/btac735,36394254.0,"Gene set proximity analysis: expanding gene set enrichment analysis through learned geometric embeddings, with drug-repurposing applications in COVID-19.",https://pubmed.ncbi.nlm.nih.gov/36394254,"Gene set analysis methods rely on knowledge-based representations of genetic interactions in the form of both gene set collections and protein-protein interaction (PPI) networks. However, explicit representations of genetic interactions often fail to capture complex interdependencies among genes, limiting the analytic power of such methods.",,,,,,2022-11-18,,2022/11/18,Henry Cousins; Taryn Hall; Yinglong Guo; Luke Tso; Kathy T H Tzeng; Le Cong; Russ B Altman,,"Department of Biomedical Data Science, Stanford University School of Medicine, Stanford, CA 94305, USA.; Department of Biomedical Data Science, Stanford University School of Medicine, Stanford, CA 94305, USA.; Department of Genetics, Stanford University School of Medicine, Stanford, CA 94305, USA.; Department of Medicine, Stanford University School of Medicine, Stanford, CA 94305, USA.; Department of Bioengineering, Stanford University, Stanford, CA 94305, USA.; Department of Genetics, Stanford University School of Medicine, Stanford, CA 94305, USA.; Department of Pathology, Stanford University School of Medicine, Stanford, CA 94305, USA.; Optum Labs at UnitedHealth Group, Minneapolis, MN 55343, USA.","Henry Cousins: Department of Biomedical Data Science, Stanford University School of Medicine, Stanford, CA 94305, USA.Taryn Hall: Optum Labs at UnitedHealth Group, Minneapolis, MN 55343, USA.Yinglong Guo: Optum Labs at UnitedHealth Group, Minneapolis, MN 55343, USA.Luke Tso: Optum Labs at UnitedHealth Group, Minneapolis, MN 55343, USA.Kathy T H Tzeng: Optum Labs at UnitedHealth Group, Minneapolis, MN 55343, USA.Le Cong: Department of Genetics, Stanford University School of Medicine, Stanford, CA 94305, USA.; Department of Pathology, Stanford University School of Medicine, Stanford, CA 94305, USA.Russ B Altman: Department of Biomedical Data Science, Stanford University School of Medicine, Stanford, CA 94305, USA.; Department of Genetics, Stanford University School of Medicine, Stanford, CA 94305, USA.; Department of Medicine, Stanford University School of Medicine, Stanford, CA 94305, USA.; Department of Bioengineering, Stanford University, Stanford, CA 94305, USA.",,,,,,0
12,2023-01-01,Jonathan Liu; Vanessa Tran; Venkata Naga Pranathi Vemuri; Ashley Byrne; Michael Borja; Yang Joon Kim; Snigdha Agarwal; Ruofan Wang; Kyle Awayan; John Haliburton; Angela Oliveira Pisco; Norma F Neff,,"Neff, Norma",Norma F Neff,"Chan Zuckerberg Biohub, San Francisco, CA, USA norma.neff@czbiohub.org.",Life science alliance,10.26508/lsa.202201701,36526371.0,Concordance of MERFISH spatial transcriptomics with bulk and single-cell RNA sequencing.,https://pubmed.ncbi.nlm.nih.gov/36526371,"Spatial transcriptomics extends single-cell RNA sequencing (scRNA-seq) by providing spatial context for cell type identification and analysis. Imaging-based spatial technologies such as multiplexed error-robust fluorescence in situ hybridization (MERFISH) can achieve single-cell resolution, directly mapping single-cell identities to spatial positions. MERFISH produces a different data type than scRNA-seq, and a technical comparison between the two modalities is necessary to ascertain how to best integrate them. We performed MERFISH on the mouse liver and kidney and compared the resulting bulk and single-cell RNA statistics with those from the Tabula Muris Senis cell atlas and from two Visium datasets. MERFISH quantitatively reproduced the bulk RNA-seq and scRNA-seq results with improvements in overall dropout rates and sensitivity. Finally, we found that MERFISH independently resolved distinct cell types and spatial structure in both the liver and kidney. Computational integration with the Tabula Muris Senis atlas did not enhance these results. We conclude that MERFISH provides a quantitatively comparable method for single-cell gene expression and can identify cell types without the need for computational integration with scRNA-seq atlases.",,,,,,2022-12-17,2022/12/16,2022/12/17,Jonathan Liu; Vanessa Tran; Venkata Naga Pranathi Vemuri; Ashley Byrne; Michael Borja; Yang Joon Kim; Snigdha Agarwal; Ruofan Wang; Kyle Awayan; Abhishek Murti; Aris Taychameekiatchai; Bruce Wang; George Emanuel; Jiang He; John Haliburton; Angela Oliveira Pisco; Norma F Neff,,"Chan Zuckerberg Biohub, San Francisco, CA, USA norma.neff@czbiohub.org.; Chan Zuckerberg Biohub, San Francisco, CA, USA.; School of Medicine, University of California, San Francisco, CA, USA.; Vizgen Inc., Cambridge, MA, USA.","Jonathan Liu: Chan Zuckerberg Biohub, San Francisco, CA, USA.Vanessa Tran: Chan Zuckerberg Biohub, San Francisco, CA, USA.Venkata Naga Pranathi Vemuri: Chan Zuckerberg Biohub, San Francisco, CA, USA.Ashley Byrne: Chan Zuckerberg Biohub, San Francisco, CA, USA.Michael Borja: Chan Zuckerberg Biohub, San Francisco, CA, USA.Yang Joon Kim: Chan Zuckerberg Biohub, San Francisco, CA, USA.Snigdha Agarwal: Chan Zuckerberg Biohub, San Francisco, CA, USA.Ruofan Wang: Chan Zuckerberg Biohub, San Francisco, CA, USA.Kyle Awayan: Chan Zuckerberg Biohub, San Francisco, CA, USA.Abhishek Murti: School of Medicine, University of California, San Francisco, CA, USA.Aris Taychameekiatchai: School of Medicine, University of California, San Francisco, CA, USA.Bruce Wang: School of Medicine, University of California, San Francisco, CA, USA.George Emanuel: Vizgen Inc., Cambridge, MA, USA.Jiang He: Vizgen Inc., Cambridge, MA, USA.John Haliburton: Chan Zuckerberg Biohub, San Francisco, CA, USA.Angela Oliveira Pisco: Chan Zuckerberg Biohub, San Francisco, CA, USA.Norma F Neff: Chan Zuckerberg Biohub, San Francisco, CA, USA norma.neff@czbiohub.org.",,,,,,0
